,song,year,album,genre,artist,lyric
107,Smoke Buddah,1996,Muddy Waters (1996),,Redman,"(Verse One)
Aiyyo, I got a slight problem I smoke weed too much
Knees buckle the -uck up when I'm splittin my dutch
Back up back up! Ain't nobody hittin for free
It's just E Doubl-E, Keith Murray, and me
It cost twenty if you're down with it
Aiyyo son I ride around with my hooptie tinted
To ride around blitted
'Cause I be feenin for that pookie
I smoke the good shhh, save the backyard boogie for all groupies
And I be, smokin' up the hotel lobby
Between mo' sheets than the Isleys, I'm high G
I'm holdin' it down for the B-Rrrah-I-C
K, blaze, tell you to get bluh politely
(Hit the funky if you're riding around gettin' blitz)
Ask me if I love the rap game -- I, I'm loving it
'Cause I can do what the OWW/-uck I feel is real
Blaze the poot with D. Don and tell UHH to get the dillz
(Chorus: repeat 2X)
I smoke on and on on, ya don't stop
I'm gettin' mad -ucked up and ya don't stop
To all my real dogs, all my real pals
Who ain't smokin', get the -uck owwwwt
(Verse Two)
I just love tokin, blackin out like Tame in the open
Of course I got the raw dog no need to stick your nose in
Gave you a straight up shotgun when we was smokin'
Froze you so fast -- you looked it like Madonna Vogue-in
AwwwwuhhhhH! I got the shhh to get your whole click high
We can get high, but act funny and I'ma whip out
And they gon' whip out, and blow notes like Michel'le
Cause you tried to jump the cipher and it goes THISSAWAY
(Singing) Smoke buddha, smoke buddha...
*Clang* The song you're about to hear, is sponsored by
NASssWIPP
Niggaz against smokin' weed in public places
A subdivision of *clang* IKSRFO
I'm knockin' somebody right the fuck out!"
108,So Ruff,1992,Whut? Thee Album (1992),,Redman,"Ah RedmaAnnotaten...
Do you feel that the blacks in your community
Are still mad at the racial situation?
[Red] Yeah they still mad
And if you don't take that funny smirk off your face
I'mma kick your...
Over three hundred ghetto-related crimes happened
In Newark, New Jersey alone -- still the saga continues
(Redman)
Stick 'em up, STICK EM UP! I got the jammie to your vest punk
Don't make a move! Before I choose to make your guts run
All over the block, cause my stomach's in a knot
And it growls twenty-four hours a day around the tick-tock
I got roaches and vats of the rats carryin bats and gats
So I *farting noise* 'fore I snack Jack
Because I'm not down with water from the hydrant
My moms takin' a bath and my brother's next arrivin
I gotta think of a plan so I can eat
I haven't had a cracker for weeks so my mouth leaks
I squat up, 'cause I'mma set up this kid, carryin loot out
From Burger King and what I'mma do is...
Run up on him, SNATCH the bag of money, then bust the dummy!
Cause my man when I think of a plan there's no shorts take
'Cause I pack jammies inside of my Nordface, coat
Had the black brother on scope
No joke's what I am cause the man's a pure pro
(Yo my man you got a light?
Yeah give me the effin money too G!) Yo STOP STOP STOP!
Took the money then I dipped with the quickness
The plan went well so I got down to the business
Opened up the bag it was filled with paper
I thought I freaked the funk but now starts the caper
'Cause I was set up, now I have to go head up with the cops
What they carryin? Black Glocks (shit's thick!)
What's the next move? My life's on the line
Bullets in their clips and none in mine
Sirens on, once again it's on
I fell (OW!) and then the black Glocks went POW!
I got snuffed and I got bust
Now the only thing I'm sniffin is dust, 'cause it's
(""It's so rough!"") 5X
Me and Erick Sermon takin' a trip Uptown
In the ? run a blast and my tape pumpin ganja
Since Erick got props
I step to this hottie with more damn body than a chop shop
Flexed the jewels then she chose to talk to me
It was no doubt that baby cakes was hawkin me
So I kicked it, upped the digits, terrific
Not knowin' she was scopin me 'cause I was MAD splifted
Later on that week honeydip freaked the funk
Playin' Redman and Erick out like two chumps
Callin him weekdays, callin me weeknights
(Who had her weekends?) Whichever man would freak right
Things got cozy one night like dynamite
We stripped to bare backs and took care of the bare facts
No hats? Went Funkadelic
Took a splash, you know how that go fellas
Two months later (see you later alligator)
She was pissed and, I ended up seein my physician
She took a blood test, she took a head check
Looked at me thinkin', ""Why the hell he isn't dead yet?""
Then I asked her, ""Why you lookin' at me?!""
She said, ""Redman because you have the HIV""
Called Erick and his set, that girl, don't mess around!
Too late, cause Erick already had his drawers down
'Cause it's
(""It's so rough!"") 3X
[R] 'Cause it's so rough!
To all my brothers wear your hats wear your hats
You can either get with this or you can either catch the claps
And to my sisters, make 'em wear they prophyl-lastic
'Cause it's drastic, havin' another ghetto bastard
Think I'm vyin for a piece of butt? Honey you must be nuts
You better settle for a wet kiss so pucker up
Cause you end up messin around catchin the heebie jeebies
Lookin' like WHODUNNIT? Witcha face up on the TV
So next time you want sex, get wreck, but protect
Cause you could be like sexin to your last death
And if you still don't know the time, press rewind
Cause the next thing you might hear is a flatline
(Beeeeeeeeeeeeeeeep)"
109,Soopaman Lova IV,2000,Doc's da Name 2000 (1998),,Redman,"(Feat. Dave Hollister)
Yo yo Yo Yo YO!
YO! Call me Soopaman Luva the rude bwoy
That nigga SWV loose they cool for
Ha ha ha, ha ha, ha hah!
Ah-hah Ah-HAH ah-hah Ah-HAH
Ah-hahahaha-hah-ha
Yo yo, I'm usually flyin through the motherfuckin air
But the utility belt on my underwear need repairs
So I be in back of the bus unwrappin a Dutch
Left court for child support, bitch attackin my bucks (WHY?)
They wanna fuck with certified private eye
Every week, check stubs to show the judge I got a job
Damn this; Soopaman used to stack them chips
Now I'm broke cause little kids riding Batman dick
I'm not a hater but the Caped Crusader blockin my dough
And I'll let off before I push broom on HBO for Mr. Show
I'm critically acclaimed; but the press'll fuck my name up
Police is lookin' for me, call the mayor he'a hang up
Nowhere to run to and Brownstone even know it
So I pack the fo'-fifth, and the ice on your wrist, forfeit
No game; slappin all hoes who got the fame
Then I rob 'em with chickens who got phone bills in they mama name
(You've been framed!) Yeah yeah I know I gotta go out
So I'm shuttin the game down like 30 nothin' blowout
I rip the flow out, from the ceiling, if I spot cash peel it
Soopaman Luva gon' switch to Soopaman Villain
(Dave Hollister)
Soopaman! Roll up a L for me
Know I got to pack the heat (sing that shit Dave)
Cause niggaz tryin' to fuck with me
(Who am I?)
Soopaman! Flyin through the air high
Smokin' on that bom-baa
I don't give a fuck if I die
(Who am I?)
(Redman)
Yo yo, I'm back on deck, I never lost the pep in my step
Ride in the cab, drunk as hell, weed and Beck's on my breath
I'm undercover so I'm dressed in turtleneck and the vest
Tec by the waist, yo cabbie make a left on the next
Corner, get out and let the 30-30 cock the loogie
Tryin' to set me up like Jim Kelly, MUY, MUY
Before I hit somebody they say, ""We ain't do it!""
I believe them these the same niggaz I grew up in the hood wit
Yo yo yo, what's today's date?
...
Shh, December 8th?
Man today my god damn day off
Yo I'm outta here
...
Yeah, yeah yeah yeah right papi
I'll slap the shit out you"
110,Soopaman Luva 3,1996,Muddy Waters (1996),,Redman,"Look, up in the sky (SOOP-soop...)
It's a bird (SOOP-soop...)
IT'S A PLANE! (SOOP-soop...)
Nah motherfuckers (SOOP-soop...)
Hahaha
Verse One:
I was, flyin through the motherfuckin sky
With my blunt full of lye, boom-ba-zee on five
Code name beez the Soopa-Man cock my Luger
Blast on state trooper, I'm on the run G
I've got these hoes spread, from Japanese to diabetics
Toes stay painted because of my foot fetish
You damn right, they had to ban me from eatin pussy all night
W-W-F and then just
Slammin' in the rope like Sean Mike
I can't be touched bitch, I disco in kryptonite
Shit I'm broke as hell
I had to buy all my girls fifty-fo'-eleven Reeboks at wholesale
Almost got caught boostin out of Bodell's
Bitches on my coattails like they coat rails
Can't even go in a jam without a bitch grabbin my hand
And squeezin my ass sayin' ""Youse the man!""
That's who the fuck I be
I got a, college degree, on bomb-zee and wreckin MC's
Makin' shit happen like Lil' Cease
I come from a land of fontum leaf, bark from trees
That stick in your hand, and lakes rollin' sea-weed
Criminals be up to no good
So I tuck a heater
Bulletproof suit still in the fuckin' cleaners, but anyways
I bumped into my neighbor Johnny Blaze
Told me there's a bitch up the block who got more cock than AK's
The bitch just moved in, in building 210
Right next door to the Fantastic Four, and the Penguin
Good lookin' Johnny, five-oh's right behind me
Let me act like I know and get ghost
Tuck in my Nina-Ross, get my cape and shades
Now I'm off with the Soopaman Three antidote
(""While the planets and the stars and the moons collapse"")
'Cause I am so cool
(""When I raise my trigger finger all y'all niggaz hit the deck"")
'Cause I am so cool
(""Cause ain't no need for that, hustlers and hardcore"")
'Cause I am so cool
(""Raw to the floor, raw like Resevoir Dogs"")
'Cause I am so cool...
Aiyyo word up *cough cough cough hack*
*Sniff* to make a long story short
*Cough cough cough* and shit, I went
To the bitch house, and this what the fuck happened
Verse Two:
Aiyyo, knock knock, ""Who is it?""
""It's the Soopa, here to pay that ass a visit
Heard you wasn't givin' up your pussy
So I got the right dick to get with
Where yo' man at bitch?"" ""He's out of town flippin biscuits""
""Well open up the do' den, before I start unloadin
On your pussy from here and leave it swollen""
""Aiyyo how I know it's you?"" ""Aiyyo check my credentials""
""I eat yo' gun lead and shit out number two pencils
I ate a ton of dog shit ain't never got sick
Bitch I even know how many keys your man flip
I'm low down and dirty, but not insane
I know all these pussy ass cops by their first name
Smoked a pound of Purple Rain and kept control
Bitch I was the third nigga on the grassy knoll
And you askin me, how you know it's the Soopa
Open the door, I just blast on state trooper""
She opened up the door, and I walked in
She grabbed the hammer, and nailed it till I'm locked in
I said, ""Yo whassup bitch? You must be trippin'
You must wanna see how this thirty-eight be spittin""
""Nah nah boo, it's my ex-boyfriend, he be buggin
He can't take it no more than I don't wanna fuck him
I was gonna get this nigga Faride to snuff him""
""Well if he come back through, I'm not talkin' I'm bustin'
Zip my zipper down bitch and start suckin
Get your anus wet for long dick fuckin""
""Ooh, I like the way you talk, just Put It In My Mouth""
""Yeah, and I'ma keep that shit in when I'm comin""
Fucked for thirty-six minutes and twelve seconds
""Hit it from the back yo"" oh yeah bitch no question
Turn that ass around, she had tattoos of names on her back
She said, ""I keep track""
I started readin her back I couldn't believe
I read one name it said EPMD
I turned her ass around I said no it couldn't be
It was the J-to-tha-A-to-tha-N-to-tha-E
Her pussy walls grabbed my dick so I'm stuck
So I burnt that ass from that blunt hash that I lit up
""Owwwww!"" She jumped up, puffed up, started yellin'
I smacked her, cracked her, put her in a full nelson
""Okay, okay, okay, okay, I give up
Besides Soopaman Luva, I think I hear my nigga""
Aiyyo car pulls up, he steps up *skreech* and stick his keys in
The door opened, I snatched him up for no reason
Gave him a two piece with a biscuit, laid him out
Oh shit, it was that nigga Parrish Smith!"
111,Soopaman Luva 5 (Part I),2001,Malpractice (2001),,Redman,"Somebody stole my mojo! Yo, once again...
Soopaman Luva flyin through the fuckin' sky
I'm lookin' for my mojo, I'm fried chinky-eyed
My cape is still tore up, but I make a lil' money
I'm like Ace Ventura, duckin my landlord
The land of the poor, where I handle my biz
I got a weed spot on the block Hannibal live
Pokemon on the pipe, Rudolph the deer Red-Nose
Glow in the night, when his nose gettin' right
I pimp Snow and Vanna White on the hoe stroll
Dr. Ruth on E, sippin Old Gold
Mr. T on crack, mohawk cornrow
In South Park with the Chef, in the stolen Ford
I'm lookin' for my mojo, where it at?
Got a APB on it dawg, where it at?
I ran into Cita, from BET
She said, ""Man is a nigga, that's fast on the trigger
I thought he was you, when we had the party for two
My girlfriend said the same, majority rules""
Damn! Who takin' my women?
Who takin' my chickens around Thanksgiving? Now that's pimpin'!
Called my man Meth and Bishop Don Juan
He smokin' a blunt, other sippin Sean Don
He said it ain't the game, but how you play it
So I can't hate the game, so I'm dyin' to play it
Now I'm back in the air, ready to put my smack down
I'm searchin for the impostor to pat down
I'm urgin to put the glock up and clap rounds
It's curtains like Jimmy Hoffa, he not found
So ride on me, try homey
Your plan'll fail like the Acme Kit from Coyote
Now I'ma find the bastard that stole my juice
Soopaman Part Five, in your archives
(Singers)
I'm yo Soopaman baby, that's who I am
Flyin through the air, without a care
I'm high as hell blazin', that Cali weed (Kryptonite for life)
That Kryptonite bud, that sticky green
I'm yo' Soopaman (he's yo' Soopaman) I'm yo' Soopaman
I'm yo' Soopaman (whoa yeah yeah yeah yeah) I'm yo' Soopaman
I'm yo' Soopaman (he's high as hell for life)
I'm yo' Soopaman (that Cali weed)
I'm yo' Soopaman (Kryptonite baller)
I'm yo' Soopaman (sticky green)
{*Needle drags across the record*}"
112,Soopaman Luva 5 (Part II),2001,Malpractice (2001),,Redman,"(Redman)
Aiyyo yo fuck that!
Aiyyo I gotta find my motherfuckin mojo
Aiyyo Reggie Noble, aiyyo Reggie Noble c'mere nigga!
Aiyyo start it off while I tell you how it went down
Yo, yo
Put the drop down, get your smoke on
Get your feel on, are you feeling?
Get your girl on, get your squeeze on
Get your bus on, are you chilling?
Are you wheeling, are you feeling?
How you feeling? And we gon' hoo-ooh-ooh
(Tell me what you doin')
C'mon, yo yo-yo yo, yo yo
I had to put the mash down, throw the cash around
Stay focused, on the case put the hash down
Jetted through the air about five miles per hour
My mojo gone I can't fly like I wanna
But this case is easy, find that motherfucker that
Couldn't wait to be me, put his face on TV
From the tec blow, I asked my ex-hoes
Pass off some info for a pair of X.O.'s
Write the check low, I don't do that
I told you that shit before when I boned your back
Now I'm back to square one, and everybody hatin'
So I popped the flare gun, now they all escapin
Ran into Gator, from Jungle Fever
He's my people and my neighbor, I said I need a favor
He said for ten dollars, and for ten Whoppers
From Burger King, I'll tell you the nigga who gotcha
Gave him what he wanted plus the extra large fry
He said blue eyes, blonde hair, a white guy
I said... what the fuck goin' on?
A white guy interruptin my fuck flowin on?
So I copped some new ammo, reloaded my flare gun
Stalkin like Rambo, mixed with Commando
Gator pushed the ten-speed bike, I'm on the handle
Crashed into somethin' 'cause he high off my man blow
I jumped up and backtracked myself
Who's the last hoe I fucked or throat I cut?
I said wait a minute, yo, that bitch Jane on the prowl again
I bet she up to no good, actin' foul again
Yeah, yeah, it ain't nuttin, I get her if I want her
Matter of fact I'm gonna 'cause she live around the corner
I walked up scared with my hands on my flares and my armor
'Cause she bring drama like Jeffrey Dahmer
But I heard fuckin' all the way from the bottom
I'm like, damn she yellin'! Kinda made me jealous
Knocked on the door enraged
Like a broke-ass rapper, at a label that ain't toured in days
Do it clown, before I count to four now
'Cause if I hit five them flares'll blow your door down
I heard the zipper zip up, and they was tryin' to run
So I re-clipped the clip up, and blew it before one
FREEZE MOTHERF**KERS, I jumped on Jane back
I WANT THE CHEESE MOTHERF**KERS, and my name back
We tusslin, fightin, bitin skin and rustlin
Slaps in the face, chokes with the belt buckle and
Her knees bucklin, I thought to myself
""Where's that motherfuckin white guy she was fuckin'?"" then
Right out the blue {*CLANG!*} Owww! {*birds chirpin*}
Who dat? Who dere?
... (This program will be continued)"
113,Soopaman Luva 6,2007,Red Gone Wild: Thee Album (2007),,Redman,"(Feat. E3, Hurricane G & Melanie Rutherford)
(Soopaman Luva Chorus)
Yo, yo, what up yo, I be the Soopaman luva
I'm about five minutes right out ya baby mother
I'm still broke, still gutter
Hit four chicks, then avenge like folk brothers
Then rob a bank teller
I'm sorta like old yella, call me for trouble
I got chop for bullets that spread out the umbrella
I'm advanced boy, da doc bigalow, the man whore
Got Ms. Incredible and cat women on amcord
When neighborhood or city in a drought
Fuck a boat I could fly there, 300 an ounce
Reup my account, wear and durag and I ain't got waves
I only got haze pumpin out the bat cave
So when I'm flyin through ya hood it's a hit nigga
Isabella I need that sour diesel quick nigga
-Call for soopman luva on line 3-
Well who the fuck is it?
-Her name is Hurricane G-
What up G?
(Hurricane G)
They tryin' to lock me up G
I can't do time cause my time is money
I just came from court for some bullshit charge
They tryin' to do me like kim, throw me behind bars
What am I gonna do?
Fuck that I'm comin'
With a gun like willis so you could feel drummin
I creep in when the lights out, sneak in to get you out
Lo jacks on my ears to tell me where your where abouts
'Cause I air 'em out, sneak in though the West wing
Laundromat, duffle bag thinking of the next thing
[G:] But I'm in the East wing
[R:] Damn my shit broke
[G:] Hurry up nigga, this water look piss cold
Hold tight for me, I'm already in
I'm in the kitchen corridor, climbin up the vent
I'm hot so hurricane so it might take me awhile
So when I get ya we gonna roll like mickey and loud
Here we go, Yo, Yo the Soopaman Luv
Crawlin through the vent like that dude in breakfast club
I made a pit stop, seen a freak in the shower
So I gotta quick pop, pimp slapped her with powder
And told her if somebody asks you, you seen nada
And every week I come fuck you with marijuana
[G:] Okay if you looking for Hurricane over there
[R:] Oh shit, Hurricane
[G:] Hey yo get me outta here
Hey yo C.O.'s watchin
Gotta move like grown men
Cause a distraction
Like the food gave you stomach pain
When the doctors come in, start the examining
I rush in with rubber gloves off the ambulance
Gun in one hand, the other palm around the nurse mouth
On the count of three this is how it's gonna work out
1, 2..."
114,Soopaman Luva 6 ,2007,Red Gone Wild: Thee Album (2007),,Redman,"(Feat. Hurricane G & Melanie Rutherford)
(Intro: Redman (Hurricane G))
One, two, three, yoo! (yoo!)
(Verse 1: Redman (Hurricane G))
Kick in the door, then I yell, ""DON'T MOVE!""
C.O.'s is like, ""yo, who the fuck is this dude?""
I give ya a little hint, it's the Soopamanluva
Took the shotgun from him, then I shot that fucker
Threw it to Hurricane, she like (""Yeah, let's do it!"")
Snatched up a reporter that was here to interview her
Raised up one of his hands, put a bullet through it
Took off his Franck Muller, so Daily News know the time it took to rescue her
We goin' out the front door
Hurricane shotgun, hand lettin' the pump off
Bitches see it, and started wylin' in the mess hall
(""Fuck the Warden! We gon' get you muhfucka!"")
Ayyo, told you I was comin'
(Verse 2: Hurricane G (Redman))
Nigga, I ain't never scared
I ain't givin' no state time for shit I didn't did (WOO!)
Give me some more ammo, the front door's near
We two barrels smoke (with a hostage in here)
(Verse 3: Redman (Hurricane G))
Yo G, you lock and LOAD? (Lock and load!)
Plan came together like the Eleven and Bellagio
We out the front door, Warden, shotty blow
I mash the gas till me and G is ""adis!"" (""Adis!"")
That's how that Soopamanluva get down
(Yeah, that's how that bitch Hurricane get down) Get down
[Outro: Melanie Rutherford] + (Redman)
Oh, oh oh oh oh oh (Gilla House niggas)
Oh oh, (Yo Hurricane G! Glad to have you back girl!)
Oh (yeah yeah yeah yeah yeah yeah)
Oh, oh (Gilla Gilla Gilla Gilla)
(Gilla House, Melanie, E3)
Oh, oh (Like I told you nigga)
(You already know what it is nigga)
Oh, oh oh oh oh oh (Gilla house)
Oh oh
(Continues to fade)"
115,Sooper Luver Interview,1992,Whut? Thee Album (1992),,Redman,"Lady:
So Redman the whole town is just buzzing why do they call you Sooperman Luver?
Redman:
I dunno, you know what I'm saying, every time I get finished hittin tha boots with some big butt female, she start acting strange (both laugh) ya know what I'm saying?
Lady:
Oh Really?
Redman:
Really
Lady:
That sounds very interesting
Redman:
Yeah sweetheart
Lady:
Ummm, what, what are your plans now that your off tour?
Redman:
I dunno since I'm off tour and shit I'll probably, you know, fly off to tha island somewhere and get a big stupid room with a crazy jacuzzi and mad izzum and just lounge for a whole week, ya know what I'm saying, nothing spectacular ya know what I'm saying doing tha wild thing.
Lady:
Uh huh well I just happen to have my own jacuzzi
Redman:
So what are you saying sweetheart?
Lady:
Well, I just thought maybe
Redman:
Oh my god, whoa chill chill sweetheart, slow down ya know what I'm sayin'."
116,Sooperman Luva II,1994,Dare Iz a Darkside (1994),,Redman,"(Hard enough that I can chew a whole bag of rocks)
Hyah! Attention to all you punk motherfuckers out there
(Uh-huh uh-huh, check it out, check it out)
Funky Noble Productions represent for the nine-four and nine-five area
Reggie Noble and Rockwilder in the house for the nizzow
If you don't know you might as well close your biz out
(To my peeps in Queens)
Yeah, oh shit, yo, it's a bird
(Nah I thought that shit was a fuckin' plane dude)
Nah nah nah, it's Soop, Soop, Soop-a-man
(It's on!)
Hah
Verse One: Redman
Well it's the Soopaman Lovah in your motherfuckin town
Get down go round and round like shocks on your G-spot
Honeydip, now all of y'all up in that funny shit
But I ain't switched, still a honeydip is a honeybitch
In the mix! So bitches be lookin' fly and I'll run in em
With they toes and nails done, hair wrapped up with pins in em
Fifty-four eleven Reebox bitch which you need not
To do is get fly, 'cause where I'm from, bitches get speed knots
Slow your monkey ass down and hold your horses
Don't wanna know your name don't wanna know none of your sources
Just fix me, with a quickie, I swear more Lake's than Ricki
So bad I use my X-Ray vision to give y'all clits a hickie
And plus the weed I puff is from the planet of Cheech and Chong
Where the earth is chronic, and How To Roll a Blunt is the theme song
Ooh you makin' me horny! Well uh, let me wipe that wetness for ya
Slurped and burped, got that bitch more open than my door do
Let's take a journey up in the stars where I live at
Where I fuck Jane, Judy Jetson, and that robot bitch-ah
Grab onto the cape and uh... I said before I took her
Don't choke me! And it's up up and away I took the hooker
And it's on
Verse Two: Redman
We landed on my planet, we smoked out like a fuck up
Bought a dime from Jabba the Hut and some uncut for the hooker
She said, ""I don't sniff blow I just smoke weed to get me horny.
So I'm nothin' like that bitch in your last Soopaman Lovah story.""
You go girl! But I didn't believe her, had to make sure
Where you from, the projects? ""Yeah, but I'm single.
You needed a quickie and I'm just that bitch to break you off, shit
My pussy's so good, it tickle my legs when I walk!""
Oh really, just show me a couple of ways how you'll thrill me
She lifted up her dress and the whole area got chilly
""So what you think of that?"" I threw that bitch back on my back
Shit I live ten miles away, but I made it fo' seconds flat
I lived in the same building with Mr. Spock and Captain Kirk
Got R2D2 and Mork from Ork puttin' in work
See I got the block sewn ""Ooh baby let's get it on!""
About time, I opened the door she had her ass and tits showin
She rushed me to the room and stripped me out of my attire
She tied me to the bedposts then she lit the room on fire
She took out a scarf wrapped it around my eyes till I was blind
But with my X-Ray vision I saw the icepick from behind
So I broke out the ropes, smacked the hoe, then suplexed her
She pulled out a Tec and wet my chest with the S1's
""Oh shit I'm shot!"" There was blood all over my finger!
I think I left my other bulletproof suit in the cleaner
She gave a whistle, they came in crews, word is bond
It was a bunch of Martian bitches with bodysuits and Platforms
""Damn, I gotta think of a plan, whatamIdo?
Did Superman have a gun?"" Nah, but the Soopaman Lovah do!
So I pulled out the fo'-fifth, left the bitches open
Had another clip in case some mo' bitches want mo' shit
And I saw that trick Bewitched flying on her broomstick
Pa-dow! Shot her down because I leave no witness
Job well done I cleaned myself in a hurry
Oops! Gotta catch this blunt session
With I Dream of Jeannie and Kieth Murray
Aiyyyo-yo-yo Keith aiyyo what's up?
Aiyyo"
