,song,year,album,genre,artist,lyric
37,Dopeman,2015,Mudface (2015),,Redman,"(StresMatic)
Hey mister Dopeman you're a star
I like your gold chain and your fancy car, I said
Hey mister Dopeman you're a star
I like your gold chain and your fancy car, I said
(Redman)
I said ""Dopeman Dopeman"" that's who I am
I got lyrics by the pounds and I sell 'em for grams
I don't sell crack or sell coke bitch I'm a star
The lyrics I sell is dope 10 thousand a bar
You can wrap me in saran make sure that I'm fresh
Put a stamp on your product right there on my chest
My transporter KRS-One let's chop it up
Cause this product killer nigga get you a tux
I got crack baby rap fans after the drug
The more they buy chi-ching the bigger my check stub
Call me Mr. Pusherman it's dope in your ears
More money I can cut it get DJ Premier
You can fly me overseas and the dogs won't smell
London and Paris (oooow) - ""you got mail""!
I'm the American Gangster I carry the weight
And when the Feds watching homie I put more on the plate
Let's Go!
(StresMatic)
Hey mister Dopeman you're a star
I like your gold chain and your fancy car, I said
Hey mister Dopeman you're a star
I like your gold chain and your fancy car, I said
Hey mister Dopeman you're a star
I like your gold chain and your fancy car, I said
Hey mister Dopeman you're a star
I like your gold chain and your fancy car, I said
(Redman)
It's like every hood waiting for my music to buy
And when I'm done ears ringing like package arrived!
Women strung out they copping 2 for 5
They get a half a metaphor and a piece of a punchline!
Now I'm off to Canada I'm high in demand
My passport not working - try it again!
I got drug dealers waiting like 5 in a van
They unloading my shit getting high from their hands
It's the raw, uncut Eddie Delirious
The underground recognize, In Red We Trust
Even your neighborhood saying ""Red you're tough""
Little kids idolizein' when I pull up!
You can call a hot-line Reggie ready for work
1-800-FuckWitANigga; this New Jerz
I'll take your credit, debit or Amex card
To cop the gold chain nigga and fancy car!
(StresMatic)
Hey mister Dopeman you're a star
I like your gold chain and your fancy car, I said
Hey mister Dopeman you're a star
I like your gold chain and your fancy car, I said
Hey mister Dopeman you're a star
I like your gold chain and your fancy car, I said
Hey mister Dopeman you're a star
I like your gold chain and your fancy car, I said"
38,Down South Funk,2000,Doc's da Name 2000 (1998),,Redman,"(Feat. Erick Sermon and Keith Murray)
(Redman)
All the way to motherfuckin Georgia
To Tennessee
To motherfuckin Texas
To North motherfuckin Carolina
Yeah, South fuckin' Carolina
Yeah, deep down, gritty Alabama
Funk for your funkin ass, nigga
Ha ha, barefoot walkin' motherfuckers
(Erick Sermon)
Yo, guess who's bout to stomp tonight?
Three seniors, rockin' the mic, catchin misdemeanors
So charge us with what-what-ever you feel
Balls of Steel, clappin those with rap deals
Fuck hot, I'm lukewarm and still perform like a champ
Battle bout, airing your ass out
So who's dropping shit on what day? My click's the greatest
Chill, or feel the effect of hi-atus
Shit shuts down when the Squad's around
It gets Thinner, it's hexed like white man from town
Three the hard way can't be touched
My style's too faraway, to capture, even with help from NASA
I'm what they call, a living legend, sha-POW
That's what they call, a Mac-11, sha-POW
There's two on the way down, BLAOW BLAOW
Here's two more, BLAOW BLAOW nigga!
(Keith Murray)
Is y'all niggaz down to ride? (Man listen)
Would you kill for your life? (Man listen)
Can you get busy all night? (Man listen)
(Hah hah..) (Man listen)
(Redman)
Yo-yo-yo yo, yo yo!
I got the Down South Funk when I clown out punk-ass
Police wanna call dogs and sound off pumps
I short your Blaupunkts if you thump my tape
Yo dial funk if you're mo' stiff than Riker's Isle bunks
Get out your seat, E, spit out the beat
The tracks plow underground concrete out the streets
From baldies to fades, when I rock MC's wave
More flags than Puerto Rican Day parade
And give up, I got the rare footage, of fiends walkin'
Barefooted off my rhyme don't dare cook it
You might fall in to intervene
And New Jacks and they girl become Pookie and that, PROM QUEEN
That bodybag won't fit you tonight
You wanna blow up? Drop the mic, stick to the pipe
Hand to hand my crew'll cripple your click in a fight
Take my tapes way Down South and triple the price
Step up on the scene like whazzup? Hey sugah
Before you cock-tease Doc, how that cash put up?
And only way I stop till your click say when
They had enough, 'cause I could bump to six A.M.
(Keith Murray)
Is y'all niggaz down to ride? (Man listen)
Would you kill for your life? (Man listen)
Can you get busy all night? (Man listen)
(Yo, yo-yo) (Man listen)
My life is a rap, each song is a flashback
Of antagonizing anxiety attacks
The beat hits the ground and the earth cracks
Niggaz be like, ""OH NO NOT THEM!"" Yeah we back
With rhythmatic articulation, God-forsaken
Sick manifestations, PUMP PUMP in your face then
The lyrical force that I put in a rhyme
Will hit you with more power than a molecule enzyme
No matter who what when where how I'll lay you down
With a sick illed out fictitious style
Yo, we all represent the hood -- the only difference
Between us is that we make the shit look good!
Programmable annual slammable
You Lyte as a Rock and I Cram to Understand You
So for niggaz on a mission kissin' ass and dissin
We get even like an ambixdeterous, man listen
Is y'all niggaz down to ride? (Man listen)
Would you kill for your life? (Man listen)
Can you get busy all night? (Man listen)
(Man listen)
Is y'all niggaz down to ride? (Man listen)
Would you kill for your life? (Man listen)
Can you get busy all night? (Man listen)
(Man listen)"
39,Dr. Trevis,1994,Dare Iz a Darkside (1994),,Redman,"(Press rewind if I haven't blown your mind)
(Dr. Trevis)
OK Redman, on the count of three I want you to
Completely forget how you did the first album
Erase data number four exhibit C-Y protanium
Now... what I want you to do is concentrate
Concentrate on how you will do the second album
No funk element too nucleus to the ninth power
Exhibit four-L-W
Now... when I count to three
I want you to fall into a deep mind of emotion
But before you do Redman, I want you to
Light this shit up high!
(Redman)
*Somebody whimpers*
Tired of burning, ah!
*Whispered* Kill that motherfucker
Yeah, help me get out of here
*Whispered voice cackles* Die nigga die!
I don't wanna die
*Whispered voice* Die! Hehehehehe
(Dr. Trevis)
I want you to concentrate very hard on how you will do the second album
I want you to take the funk where it has never gone
I want you to take this LP to where no other LP has risen
You son of a bitch!
Dr. Trevis signing off
(Redman) *beginning of Bobyahed2dis music*
Ah...
You are now about to enter the psychotic mind of Redman
Let's take a journey on a funk cosmic adventure
To where no other nigga or bitch has ever entered
Let me lick your funky emotions with my cosmic lyrics
From a place we call hell, and beyond..."
40,Dr. Trevis (Intro),2015,Mudface (2015),,Redman,"Hahaha, I waited a long time for this moment to come
Hey piece of shit, pass me the scalpel
Yes, master
It's almost done, check his vitals
I said, Piece of Shit, check his vitals
Yes, master
The vitals are dead, sir (Aww)
Oh wait, he's got a pulse (Yes)
I think you have to give him mouth to mouth, sir
Shit, that nigga'd died if I have to give him mouth to mouth
There's only one thing for us to do, Piece of Shit
We gonna have to hit this motherfucker with everything we got
Everything, master?
Yes
But that could kill him
I know but fuck it
On the count of nine, you ready?
1-2-3-4-5-6-7-8-9"
41,Dr. Trevis (Signs Off),1994,Dare Iz a Darkside (1994),,Redman,"Yo *echoes*
*Weird hearbeat like sounds*
(I can hear myself... *echoes*)
*Maniacal laughter*
*Bell rings, slowly, then faster, then slows again*
On the behalf of the knotty-headed nigga
And the Def Squad force
We'd like to thank you for purchasin the new Redman tape
And hope you show the same love for us next go 'round
*Bell rings*
*Short, phat beat is looped*
*Static*"
42,Enjoy da Ride,2001,Malpractice (2001),,Redman,"(Feat. Method Man, Saukrates and Streetlife)
(Adam F)
Welcome back ladies and gentlemen, to the Roller Coaster Malpractice
Please stay seated, yeah, and hold on even FUCKIN' tighter now
Cause this next section's, as big as the
FUCKIN' BLEEDIN Ti-FUCKIN-tanic!
And it's called the Heart Attack Mountain;
Which we feel is self-explanatory (""Stop stop stop stop!"")
(Streetlife)
Yo, I know the streets is watchin'
Dirty date niggas cock-blockin' and plottin'
Waitin' for my downfall, Street got options
Fuck y'all, y'all can ball, I'ma stay rockin'
All emcee's paused when they heard the album's droppin'
Nuttin but the hottest hip-hop rap concoction
Rap's in a state of emergency, it's shockin'
I produce, joints that loosen up the socket
Crowd surf through the mosh pit on some rock shit
Bang your head to this, pump your fist if you feelin' it
Wild the fuck out, bust a clip for the fuck of it
This is as good as it get, who you rollin' with? (You)
Who the ultimate? (Wu)
Stay committed, sold my soul to this rap shit (nigga)
Slow your roll, strike a bowl, you get clapped quick
I roll with, ghetto bastard with biscuits
And grab my dick and flick it, get the picture
Hold on...
{DT}: This is Dr. Trevis, comin' to y'all motherfunkers live
Hold on, hold on...
{Adam F}: The Roller Coaster Malpractice! (""Stop stop stop stop!"")
(Redman)
Yo, yo, yo
I cop a new Benz, crash the front
So hard the airbags use nasal pumps
Jump out, cock the shottie (raise 'em up!)
I stomp holes like the ground ain't paved enough
Inform the former the first step was a warm-up
The next step'll bomb on where your car alarm was
Chikens that'll run in, burn the barn up
Shots'll tear ya Sean John and Phat Farm up (nev-ah!)
I never got a Soul Train award (nev-ah!)
Never lost to emcee's as lame as y'all (nev-ah!)
Trick a bitch car payment off
I'm a orangutang when the chain is off nigga
I set-trip, and I slowly blas
With a axe, and a pump, and a goalie mask
Leavin', stains of blood on your Roley glass
When I'm, in your hood nigga throw me bags
Hold on...
{DT}: You've just been hit, with the ultimate hardcore shit
Hold on, hold on... {motherfucker}
{Adam F}: The Roller Coaster Malpractice! (""Stop stop stop stop!"")
(Method Man)
Let's trip the night fantastic
I'm flexible, they used to call me plastic
These big butt bitches get they ass kicked
It is what it is, shittin' on y'all kids
Couldn't live where we live
I can't be defeated like ""Nobody Beats the Wiz""
Like, when daddy's home can't nobody beat the kids
Right? You know the Clan and you know the fuckin' man
Meth rock a mic without a kickstand
Two blunts, and razors in his wristband
Slap you and your bitch man
Lookin' in your lobby, call me stick-man
When it's goin' down, call me quicksand
Zero to sixty in a second, pack a Smith and Weston
And if the price is right, you can be the next contestant
For this aggression, no question, M-E to the F
And be flexin as hard as my erection
Kid learn your lesson 'cause what if I decide to start testin
Your joint - end the motherfuckin session
Hold on...
{DT}: This is the final moment, where you motherfuckers bout to die
Hold on, hold on... {yo}
{Adam F}: The Roller Coaster Malpractice! (""Stop stop stop stop!"")
(Saukrates)
Yo, yo - let a nigga get into it
Lubricate y'all veins with this ""Do-It"" fluid
I Einstein the rymes, spit them thangs to prove it
Cross with the Mack, in fact, my game's the truest
Now I'm on the highway, doin' it my way
With Street, Illegal, Meth, Roc, and Doc Friday
Performin like the weather was warm
And drop heat on the streets through zero degree storms
And keep the ghetto, pop your metal
Smoke it like a cigarette till ya optic yellow
The addiction, ain't no friction
I got them rap heads fillin out a prescription, with diciton
Gettin' thick when I put fire to the steaks
And burn the odds, like a iron to your face
These long hard years spent Oxy-Cleanin
Make it clear - look out, Big 'Sauks is here, nigga what?
Hold on...
{DT}: This is Dr. Trevis, warnin y'all motherfuckers
Hold on, hold on...
{Adam F}: The Roller Coaster Malpractice! (""Stop stop stop stop!"")
Hold on, hold on...
{DT}: PPP Def Squad, we lock shit down
Hold on, hold on...
{Adam F}: The Roller Coaster Malpractice! (""Stop stop stop stop!"")"
43,Fire,2007,Red Gone Wild: Thee Album (2007),,Redman,"(Feat. Wendisue Hall, E3)
Yeah
(I can feel your fire)
When you niggas feel cold and your flows ain't got it no more nigga?!
(I can feel your fire)
Yeah nigga. You know what it is nigga, Gilla House nigga
Yo check me out yo yo yo
Red gone wild, more stunts than a fog I
A buncha wild drunk niggas yellin' raw ha!
While you tryna get your weight up, but we on fire
Gilla House don't die, leave da spot bone dry
I want it all, R and E-D-M-A
N, cock the semi
A little henny in me
It's like ya black hawk down
I blast like a skinny
Roll up ta the jam and party like little Penny
My watch ain't for showin' time, it's for show and tell
And I got it for sellin' dimes on AOL
I'm off the hook, lookin' young, you gray as hell
You off the hook cause punk you ain't pay your bills
Redman, a truth nigga, put my name on it
Gilla House, die harder than John McClane on it
I'm smokin' sour diesel, gettin' head on my couch
From a chick that resemble Rosie Perez in the mouth
Simon Says swallow it ma, *Knock* don't spit it out
Y'all got fat, I got a plan for y'all slimmin' down
I ain't playin' no games nigga, I'ma take it there
Break it there, Visine your block, till I make it clear, nigga?!
(I can feel your fire)
When you niggas gettin' cold and your flows ain't got it no more you like...
(I can feel your fire)
Brick city on my back, Doc Grizzley on the track, have ya hood sayin'
(I can feel your fire)
East coast, west coast, down south, world wide, everybody like...
(I can feel your fire)
Welcome me back like Carter, welcome back the father
Keep it gutta, your problems, Bitch!"
44,Freestyle Freestyle,2007,Red Gone Wild: Thee Album (2007),,Redman,"Redman in the house you don't stop
Gilla house in the house you don't stop
Def squad in the house you don't stop
Wu Tang in the house you don't stop
Hip hop in the house you don't stop
Yeah, yeah, yeah
Freestyle y'all
Redman got it like that green
People always say what the hell does that mean
What's up homeboy I'm a motherfucking rider
Custom made airs, and my shoes never tied up
Hardcore shit do it easier than wider
Why you sitting home getting baby mama drama
Jersey uptown go pick my weed up
Broke, I ain't turning yo seat to a d-cup
Bitch I'm a g I never did my keys up
Not even half if you didn't sign the three numb
Watch how we thump about my bidness
You about to go downtown like the shiznit
Witness, yeah boy, I get you dumb like white people looking for weird noise
Hood down, got b smallz on my white tee
And my chain look like an Italian icing
Redman nigga, grind like brakes
'Cause I'm after that cake like stat man nigga
Freestyle freestyle freestyle
Freestyle freestyle freestyle
And everywhere I go
I kick a freestyle
And every time I move
These women freestyle
Freestyle freestyle freestyle
Freestyle freestyle freestyle
Redman got it like that green
People always say what the hell does that mean
Yo I got bricks in da building
And young kids out here flipping like Wilson
Pilgrim, there it is, the block is teaner marie
I'm on my square biz
Turn up the kid like volume 10
And you can brown those meat to the album, and
You was hot when your style was in
Now you're looking at killa
I wish I was down with them
No time to turn back
I keep my eyes focused
Slow like I'm on the i95 smoking
Like ocean, 12 when I'm posting,
Smell my zip lock when my red line open
Fat girls like yo that's my hero
Enough of them to pull a 5 5 0
Hand cocked Negro after the cream
I make your hood like watch time magazine
I mean, for bullshit my nose keen
And It only take one hit to get in those jeans
It's not yo ass, girl its yo green
And when I hit it, I keep the chicken lil man
Back on the train like, who the hell are you,
I'm doc I bring heat, like number 32
Brick city niggas, yeah damn rider
Lalala, don't steal ma damn lighter
See I'm on point, never catch me slipping
Storch on the track watch how reggie rip it
Sniff it, you don't know it's on again
Walk in this mo'fucker like I own the bitch
I'm not in cancoon ma mouth ain't grandtoon
On one wheel throwing it up like man MOVE
Back on ma grizzly, yeah take that
You want yo crack I'll prepared it asap
Freestyle freestyle freestyle
Freestyle freestyle freestyle
And everywhere I go
I kick a freestyle
And every time I move
These women freestyle
Freestyle freestyle freestyle
Freestyle freestyle freestyle
Redman got it like that green
People always say what the hell does that mean
What's up home girl we the mo'fuckin' riders
Met her outside of the Copacabana
Far from a sucka, pull out the llama
And tell on myself like, yo well your honor
See I blast on site when I move
The battery pack on my back stays full
I ain't no joke I keep y'all stepping
Doc got next, nigga drop ya weapon
Screen on my mike, got hash tar resins
Engineer fucked up laughing on reckless
I'm like shut up gilla house got this
Arms grew long before my short pockets
Stop it, I wish I can I'm tryna be
Building green like MGM Grand get it
Redman who the fuck are you
Got weed? Let me busta you nigga
Freestyle freestyle freestyle
Freestyle freestyle freestyle
And everywhere I go
I kick a freestyle
And every time I move
These women freestyle
Freestyle freestyle freestyle
Freestyle freestyle freestyle
Redman got it like that green
People always say what the hell does that mean"
45,Full Nelson,2010,Reggie (2010),,Redman,"(Intro: Saukrates)
(Click) All I-yi-yi (oh, oh)
I-yi (oh) I-yiii (click)
(Chorus: Saukrates)
All I-yi-yi, all I-yi-yi
(I got that thang) Right by my side
(And when it go BANG) How I survive
Whoa yeah - how I survive
Whoa yeah - it's right by my side
Whoa yeah (yes sir) oh yeah
[Red] Let's go!
(Runt Dawg)
The moon full, the goon's ready to set it
Hoodrats drinkin' till 11 while they pregnant!
My hood look like the video for ""Thriller""
The fiends feedin they kids cereal for dinner
You ask ""Who dat?"" And they scream GILLA!
Tour bus roll up like an 18-wheeler
And who am I? Good question
This the blackout, make you niggaz tap out, full nelson!
(Chorus w/ ad libs)
(Redman)
Yo! I take over, yo, the game over
Hop off the sofa to hit it like Sosa
Big (Whale), tip the scale, call me Jonah
Closet got kicks like Pete Rock folder
Hold up, girl, how do that feel?
I'm nice with the mic like I'm from Catskills
A veteran, take a step back, get real
That's like Shaquille, lookin' for a rap deal!
Pop a Advil boy, this a headbanger
BIG TRUCK gotta park in airplane hangars
Yeah they wanna hate ya, when you're gettin' paper
I know, that's why I (Set it Off) like Jada
Generator, I'll shut your lights off
And sucker for love? Doc ain't the type y'all
HUH, it might turn to a fight club
And believe me, I'll survive like a lifer!
(Chorus w/ ad libs)
(Ready Roc)
Okay, yo (Gotti Click nigga)
Huh, like 2Pac (All Eyez on Me)
That's the reason my career on the rise slowly
I'm headed to the top, that's what God told me
So anybody think they better than this guy show me
So I can chew him up and spit him out
What else you figure from a nigga that's from Gilla House?
I come through coupe with the ceilin out
I'm on the road to success, steady peelin ouuuut
And nobody in my lane
Just a year ago man nobody knew my name
Now they get the picture like I put it in the frame
Cause my flow's so dope you can put it in your veins
Put this in your brain, I'll leave this bitch cookin
Blind to the fact but I still see you lookin'
I do it (Big) like March 9th in Brooklyn
Beast on the beat, call me Wolfman!
And that's why
(Chorus w/ ad libs)"
46,G.P.N.,2000,Doc's da Name 2000 (1998),,Redman,"Alota:
This is G.P.N the Ghetto Pyshic Network, I'm your host alota Vagina
Lady:
Who?
Alota:
Alota Vagina, Ho!
Now our Pyshic's have traveled tha world demonstrating there amazing pyshic powers. Tonight were in tha world famous Brick City, knocking on motherfucking doors showing what our experts have done for niggas lives.
Aight y'all right now were in ?Brandon Court? and ummm were creeping up on one of our satisfied viewers, lets see what she's got to say
(Knocks on door)
(Door squeaks open)
Alota:Girl it's the Ghetto Pyshic Network!
Girl:(Screams) Alota Vagina!
Alota:Hey girl, tell us what your personal pyshic has revealed to ya!
Girl:Well girl let me tell you what my G.P.N pyshic had done for me he told me that I was gon' be trippin' on TWO niggas and suckin TWO dicks at the same time and here they are Pop and Trev say hi mutherfuckers.
Pop and Trev:
Oh shit what up
Yeah what up
(Laughs)
Alota: See, whew, look what the Pyshic Network has done for this bitch live. Now lets go knock on the door of our next satisfied customer.
(Knocks on door)
Alota Vagina from the Ghetto Pyshic Network, open tha door.
Man:
Alota Vagina that bitch from...
Alota:
That's right it's me now open tha door were here to get your testimonial.
(Door opens)
Man:
Hey is this shit on TV?
Alota:
Tell us how the Ghetto Pyshic Network has worked for you?
Man:
Well my Pysic Network told me I was going to have some time off from my job (croud: ooh) but then I seen my girlfriend in McDonald's with this other mutherfucker so I had to smoke both of they asses, so you see I am going to have time off, 25 years off (croud:awww) Pyshic Network you was right again.
Alota:
Now need I say more, our Ghetto hotline is open for all calls, call 1-800-haul ass I said 1-800-haul ass, call now and get the first 15 minutes for free mutherfuckers!
Redman:
This message was sponsored and brought to you by mutherfuckers who smoke a lot of weed and will smack the shit out of you incorporated."
47,Get 'Em,2007,Red Gone Wild: Thee Album (2007),,Redman,"(Feat. Icadon, Saukrates)
(Intro: Redman)
Gilla House niggas
Check it out
('Cause I like it!)
(Verse 1: Redman)
Yo! I'm Ghetto Fab, hungry
Beastie Boy with ""Brass Monkey""
Humphey Bogartin' the whole country
Chunky women love Doc
""Projects"" pump me like Pat
My pen game is like rugby
Doctor, you know
New flow, new dough
Drunker than Woodrow, good time with a hood ho
Mutumbo, stack that bread tall
Two chromy things like the back of my red sauce
Redman, dog - something wrong, strong arm
If I don't get ""Chips"" like Ponch and John
You get slapped like Dee Barnes
""Doctor"", not Dre
And eating - but, I'm after the entree!
My watch got TV's in, CD in play
Wanna find D-O, I'm knee-deep in MJ
""Boy"", I'm ""Bad""
And You've Got Mail
And I need brain - she said ""Yes"" like he 112
(Chorus: Redman (Saukrates))
PICK UP - boogee women!
PICK UP - freaky women!
PICK UP - ghetto women!
PICK UP - classy women!
PICK UP - boogee women!
PICK UP - freaky women!
PICK UP - ghetto women!
PICK UP - classy women!
Gilla House in this bitch and we - GET 'EM!
Y'all know y'all can't fuck with us! GET 'EM!
When I see a big ass I go and - GET 'EM!
(Fuck the club, man!)
(I'mma fuck where I - GET 'EM!)
(Verse 2: Saukrates (Redman))
Saukrates, all action, less talk
I'm paid to make the muscle under your chest talk
GILLA! Attack like that pump he lets off
20 motherfuckers hittin' from the chest up!
Saukrates, worldwide name
God put me D, now worldwide game (GILLA!)
Niggas keep a burner by the flame
'Cause when shit get hot, we already came!
Saukrates, double vision, double incision
Double the pimpin' - takeover!
One of a kind, a stark reminder to any mark
Who wanna' stop the run of my cake over!
She ain't missin', she just kissin'
On my johnson, shit was out of the frame
Like ""D"" video, How Does It Feel?
That Gilla House chill
It's Saukrates season, better shoot to kill!
(Chorus: Redman (Saukrates))
PICK UP - boogee women!
PICK UP - freaky women!
PICK UP - ghetto women!
PICK UP - classy women!
PICK UP - boogee women!
PICK UP - freaky women!
PICK UP - ghetto women!
PICK UP - classy women!
Gilla House in this bitch and we - GET 'EM!
Y'all know y'all can't fuck with us! GET 'EM!
When I see a big ass I go and - GET 'EM!
(Fuck the club, man!)
(I'mma fuck where I - GET 'EM!)
(Verse 3: Icadon (Redman))
(Y'all knowwwww!)
If Ick tell you to give your cash up, move faster!
Or this ratchet gonna' blast ya!
(My flowwwwwww!)
Is like a natural disaster
Bricks the Brook-lon, the crack move faster!
(I blowwwwwwwwww!)
Backwards on the master
Dro' grown in the cold waters of Alaska
(Where I goooooooooo!)
I don't ever fold a map up
Wack, fuck ""Navigation"" in the black truck!
Icadon, I own the dick your chick's on
Gilla House! I'm clique strong, the fifth long
My name reign, from Bricks to Brick-ston
But I'm from Brook-lon, don't get flipped on!
I'm nice with my metal wear, ice in the ghetto
If I die - nigga, your wife is a widow!
I'll nice with the fiddle
I'll make the belly button a bulls-eye, nigga!
I'll put my nice in the middle!
(Chorus: Redman (Saukrates))
PICK UP - boogee women!
PICK UP - freaky women!
PICK UP - ghetto women!
PICK UP - classy women!
PICK UP - boogee women!
PICK UP - freaky women!
PICK UP - ghetto women!
PICK UP - classy women!
Gilla House in this bitch and we - GET 'EM!
Y'all know y'all can't fuck with us! GET 'EM!
When I see a big ass I go and - GET 'EM!
(Fuck the club, man!)
(I'mma fuck where I - GET 'EM!)
This is Nasty Nadj on WKYA Radio"
