,song,year,album,genre,artist,lyric
105,So Far to Go,2007,Finding Forever (2007),Hip Hop,Common,"(D'angelo)
I wanna get closer to you baby
Ooh...
You have come so far, you've got so far to go
You have come so far, you've got so far to go...
(Common)
Sweetheart, you know that you the most
Important, at least on the west coast, ha
I'm just trippin', there's something 'bout you though
You think different and understand how I flow
Got cribs on both coasts
But I'm a chicago getter
You get down, but you ain't a gold digger
You got the soul with the figure to match
Your girlfriend said ""yo that dude is a catch,
Creative with the gifts plus he hit it from the back""
In places we ain't supposed to
We makin' music baby, you on the vocals
International lover, I never stay local
Go to places that you've never been
Beautiful outside, even better when it's in
You have arrived girl, you can come again
Come on
(Chorus - d'angelo)
You have come so far, you've got so far to go
Say it again
You have come so far, you've got so far to go...
Hoo... yeah...
(Common)
You sexy, I know brothers try to spit to you
But I'm the only one that could get to you
Liftin' you, my drive is shiftin' you
I opened your freak, it's like a gift in you
I truly and thickly am thankful
Long as I'm in your town I'ma stay faithful
Ha, you know I can't escape you
No matter how far, you're still my star
You was there when lamar try to steal my car
Snappin' with me, that's just how real you are
Sophisticated woman, you understand a man
You don't call all the time just to see where I am
Put a g in your hand, make sure you're livin' all right
Makin' love is me and I'ma give it all night
Turn over in the mornin', make it warmer and better
Long as we can be, we can come together
Come on
(Chorus - d'angelo)
You have come so far, you've got so far to go
I don't believe you heard me baby,
You have come so far, you've got so far to go...
Go on, go on baby
Go on, go on girl
Go on, go on
Go on baby, go on baby
Go on baby, go on baby
Go on...
You have come so far, you've got so far to go
Know what I mean baby?
You have come so far, you've got so far to go...
You have come so far, you've got so far to go
You have come so far, you've got so far to go..."
106,Soul By the Pound,1992,Can I Borrow a Dollar? (1992),Hip Hop,Common,"""Gimme a pound, thank you man"" --> Tim Dog
(Repeat 2X, then 4X faster)
I'm as bad bad, as Leroy Brown Brown
Yo I'm a pro pro, but not a noun noun
If you got beef beef, then you'll get ground ground
Cut up in soul soul, by the pound pound
I'm going downtown like Julie Brown, I'm the round mound
Not a rebound, but like a hound, I get down down
Never wore a leash but I get loose
Producin somethin' fresher than fruits, got more soul than combat boots
Diggin two scoops of raisins for the troops out of some blazers
So amazin like Luther everyday Joe but not Bazooka
I used to be a hooper but now I troop to shoot a free flow
Me go with mi amigo, to see the Man named Chico
The legal alienaeno, I roll the instrumentals
Like Jack I be like Nimble never gentle to a bimbo
Not your sex symbol so save that soft stuff for the Care Bears
The way I freak funk Oh the Monkees sayin', ""Hell yeah""
Correction, ""Hell yes""; old folks wanna cuss
On how I walk talk and dress, they say my life's a mess
But I'm straight, are you straight, if you straight, then I'm straight
Rock me tonight, just for old time's sake
Back to our regularly scheduled program, program
I am so damn flam, I slam a slam, BAM, I slam
Like Conan the Barbarian, if you talk loud, I'll play librarian
Cause see I want it quiet in here...
I Mark a Markyiana a bunch of funky Uncle Thomases
Play like Christopher Williams 'cause I gotta keep my promises
To stick to my roots and not dilute cause G this ain't two colors
I'm tired of seein these non rappin' dancin motherfuckers
""Gimme a pound, thank you man"" --> Tim Dog
For a record sale a nigga'll sell his soul to go gold
And reach a large scale, sellin for the pale male
And I can't tell, why for a hoe you grow a tail
And stop drinkin' ale, the booty probably smell
Ain't no pussy worth a sale at least not for the kid to do a bid
Shit you musta flipped you lid, you was wit you slipped you slid
Got doodoo skids on my paper 'cause I got rhymes up the ass
If I pass gas, ducks fast or gets trimmed like a mustache
I must ask what's goin' on with rap, white kids actin' black
It's like McDonald's sellin fatback
Get back to your Mac, that stuff is wack with all these dancetracks
I'm hearin rap from Antrhax, my time the Caravan cracks
You're wack, that's the only thing that's black Scooter
When we was on the streets, you was at home on your computer
I'ma shoot a diss well like a fist to all these wack groups
Rhymes are wack as hell! And they sample wack loops
I'm wonderin how the hell they get a deal I still can't see that far
I feel like Cypress Hill, I could just kill an A&R
Or whoever's in Charge, it surely ain't Charles
But you ain't G-in hip-hop, 'cause it's ours
""Gimme a pound, thank you man"" --> Tim Dog
It's sick you sick I'm sicker, I flick a flea flicker
Think of thatI boa constrictor but the venom I inflicta
Is stricter, I stick I stick the stinkin to a stunk
If soda was a forty dog, then I would be like drunk
If if was a fifth I would lift the fifth and a spliff
It's not a myth about our dick width, I'm swift and I shoot the presents
In essence count your blessings I got a Wessun if you riff
I'm a nigga with SOULLLLLLLLLL, my last name should be Smith-sonian
I'm gassin girls heads, just like petroleum
Get 'em ready to bone me and, then I play custodian
And turn off the lights this is the likes of a
Ticketing wallowing high jumping radio rumping brother
Got Seoul like Korea gimme an inch I'll take a liter
A chick is a chick that's how I treat her
Never go pop I'm not a two liter
A true leader, don't choose to follow, choose what I swallow
Whether water or a beer bottle, of course I play the lotto
Wear em? No, share em? A hoe
I like the girls the girls I share a life with a bro
Cause U-A-C is family, much tighter than foundations
That holds up the walls, so you better proceed with caution
""Gimme a pound, thank you man""
""Gimme a pound"" (4X)"
107,Soul Power,2002,Electric Circus (2002),Hip Hop,Common,"Yeah, for the world!
Keep going so you can (yo you can rock on)
We keep going so you can (yo you can rock on)
We keep going so you can (yo you can rock on)
We keep going
Nigga breath can tell by how you rap you don't believe
Ain't hungry no mo' so off me you feed
I hustle at a speed between greed and need
On the streets where intuition and weed are breed
Shoot the gift and viff, at the myths uplift
My rhyme the clip it's like the boom bip to tip (q)
In gangways where cats that rhyme the same way
Spending nites over Egypt to learn a brave day
Paint a picture of the ghetto like JJ
You the Ray J Of this rap world
I travel the globe with a black girl name Becky
Grand like Auto Theft 3
Style so developed the law can't arrest me
You walk with blood on your shirt
Like Jesse Jackson trying to test the reaction of the people
See through trying to out act Don Cheadle
I speak to original Hebrew s you know how we do
And bleed through the needle with truth
That needs no preview to proof its in the people
And how they react still in the business of smacking
Rappers is wack you had a dope track I guess opposites
Attract my mind state is black
Black like bernie mack no cowards soul power in the words we rap
Picks with fist, thick grease, dark nipples
My guy buy ice I search for the dark crystal
Racing for paper these broads is starter pistols
I spit through gang wars and strange doors
Out the sky flames pour the beats claims war
I see niggaz with flags who they waving them for?
I'm the nigga that you put the chain on the door for
The nigga that you started changing the laws for
Orator of hard-core and more
My raps the portal for the blue collar
Than made a hit and came up on a few dollars
I'd rather listen to silence then you holla
Borrowed your persona from the late that made dear mama
My realness is my armor that I wear up in this boy
For truth you're a decoy
Common Sense is like the future of the Bee-boy
I fall down and get up like Don McClerken
Hit puss and listen to it whistle while I'm trerkin
Break it down like herb
The nympho of info I'm fucking what you heard
You ain't ready for war your stuck in the reserves
I mastered my high so I'm bucking at the birds
I been wanted to fly so now I do it with the words
For those in the fast-lane I show you how to merge
Get your own you see it's like home grown herb black economics
The people we serve with Soul Power"
108,Southside,2007,Finding Forever (2007),Hip Hop,Common,"La, la, la, la, la "" and e'rybody say
La, la, la, la, la "" I know you, I know you...
I know you're thinking, thinking that it must be
Armorall flow 'cause he never get rusty
I ain't gotta say it, man dawg trust me
Bust somebody head, T.L.C. where was we?
Still rock the prada 'fore that, rock the Starter
Niggas out in Georgetown, the Magic way harder
Thinking back to the projects, and they way they tore 'em all up
Like when I do a project, and come back and tear the mall up
We coming from the...
South (side), South (side)
South (side), South (side)
South (side), South (side)
South (side), Side of the Chi
The broads, the cars, the half moon, the stars
I'm like Jeff Fort the way I get behind bars
Burn CD's with no regard for the stars
Come to the grip with conflict, diamonds and the arts
Back in '94 they call me Chi-town's Nas
Now them niggas know I'm one of Chi-town's gods
We even yo, you're still talking no cause
A conscious nigga with Mac like Steven Jobs
Your fly is open, McFly
The crowd is open I think I know why
I'm back from the future seen it with my own eyes
And yep, I'm still the future of the Chi
Back in college I had to get my back up off the futon
I knew that I couldn't cop a coup with no coupons
Look at that neutron on his green like two dimes
People asking him, Do you have any grey poupon?
You in the building but the buildings falling
You wouldn't be ballin' if your name is Spalding
My mind get flooded I think about New Orleans
Back in school, y'all niggas you should call in August
Summer sun it goes down but I'm still revolving
Southside 'bout to walk it out, I still get crawling
If rap was Harlem, I be James Baldwin
With money in the bank like G. Rap, we're calling
With niggas masked up like Phantom of the Opera
Dreaming of the day they push a phantom to the operas
Can't wait till they say, Yeah, he ran up at the Oscars.
Poppa, I heard his life is like a movie
Like when Em' played him and Mekhi played a rasta
Mexican don't love it like it was for La Raza
But this is for the mobsters, Holla
We some true chi-town legends, accept no imposters
Uh, the un-American idol, tower like the Eiffel
Lean wit it, rock wit it, back like the disciples
Know when to use a bible, and when to use a rifle
You rap like you should be on the back of a motorcycle
Caught a case of robbery, and 'Beat It' like Michael
Your career is a typo, mine was written like a haiku
I write to 'Do the Right Thing' like Spike do
Through conflict that's crucial and drama that's psycho
La, la, la, la, la, la, la-la
La, la, la, la, la, la
La, la, la, la, la, la, la
La, la, la, la, la, la, la
We're coming from the... Hey!
*Scratches*.. spice it up (la, la, la..)
Ya might have to spice it up
Spice it up, spice it up,
Take your life and...
Yo, we're coming from the... Hey!
We're coming from the... Hey!
...And this concludes our Chicago show
Please stay tuned"
109,Speak My Piece,2014,Nobody's Smiling (2014),Hip Hop,Common,"I just, speak my piece, keep my peace
Cubans with the Jesus piece, with my peeps
Packing, my piece, Jesus
Packing, my piece, Jesus
I just, speak my piece, keep my peace
Cubans with the Jesus piece, with my peeps
Packing, my piece, Jesus
Packing, my piece, Jesus
I just, speak my piece, keep my peace
Cubans with the Jesus piece, with my peeps
Packing, my piece, Jesus
Packing, my piece, Jesus
I'm iller than most, sick with it, feeling the dose
In a butter soft leather but I'm still with the toast
Toast to bros, you know the millions is close
Feel the ghost of Notorious, tell me who the naughtiest
She get live like an audience
I do what I do, no need to state the obvious
Poli' with girls with bodies, uh
Poli' in hotel lobbies
Light a J, it's just me and Marley, look at the poster
Do what I supposed to for the culture
Early b-boy, down with d-boys, build and destroy
My pride and joy is my daughter named Omoy
'Ye, that's my nigga from back in the day
All that whoop-de-wah-whoop, man fuck what they say
Played the lotto for my gram with a bottle in hand
Lay it down for the world, for Chicago I stand, and
I just, speak my piece, keep my peace
Cubans with the Jesus piece, with my peeps
Packing, my piece, Jesus
Packing, my piece, Jesus
I just, speak my piece, keep my peace
Cubans with the Jesus piece, with my peeps
Packing, my piece, Jesus
Packing, my piece, Jesus
Yeah, yeah, they like that, I write raps from on top of the world
Popular girls always wanna pop in my world
I pop out in the boroughs and go to L.A. to get hay
In the middle of the barn with a princess I laid
Yo, this type of shit happens every um, once in a while
You know I won't front with the style
Bring life to the party like a woman and child
From the land of the humble and proud, summers is wild
Ah! Made the unmade-able
Ah! Go to parties I'm paid to go
Me and cuzzo talked the hustle
About doing good business like Rick and Russell
You I know I guzzle red wine till it's bed time
On my paper like headlines, she want the head shine e'ry time
My time, the streets is watching like a Rollie
Do it for the hometown and the homies, uh
I just, speak my piece, keep my peace
Cubans with the Jesus piece, with my peeps
Packing, my piece, Jesus
Packing, my piece, Jesus
I just, speak my piece, keep my peace
Cubans with the Jesus piece, with my peeps
Packing, my piece, Jesus
Packing, my piece, Jesus
I just, speak my piece, keep my peace
Cubans with the Jesus piece, with my peeps
Packing, my piece, Jesus
Packing, my piece, Jesus
I just, speak my piece, keep my peace
Cubans with the Jesus piece, with my peeps
Packing, my piece, Jesus
Packing, my piece, Jesus
I just, speak my piece, keep my peace
Cubans with the Jesus piece, with my peeps
Packing, my piece, Jesus
Packing, my piece, Jesus
I just, speak my piece, keep my peace
Cubans with the Jesus piece, with my peeps
Packing, my piece, Jesus
Packing, my piece, Jesus
I just, speak my piece, keep my peace
Cubans with the Jesus piece, with my peeps
Packing, my piece, Jesus
Packing, my piece, Jesus
I just, speak my piece, keep my peace
Cubans with the Jesus piece, with my peeps
Packing, my piece, Jesus
Packing, my piece, Jesus
I just, speak my piece, keep my peace
Cubans with the Jesus piece, with my peeps
Packing, my piece, Jesus
Packing, my piece, Jesus
I just, speak my piece, keep my peace
Cubans with the Jesus piece, with my peeps
Packing, my piece, Jesus
Packing, my piece, Jesus"
110,Star *69 (PS With Love),2002,Electric Circus (2002),Hip Hop,Common,"Let's do it now, it's me and you
Close my eyes Erotica, I'm seein' you
Listen to me wishin' I could be with you
To share my love and ecstasy with you
Are you alone? Is your shorty sleep?
Hold on. That's okay, ignore the beep
For you, my love is immortal deep
You are my queen but I can't ignore the freak
Let's let our bodies talk and our auras speak
Hold on, gotta get the toiletries
As our waters reach distances unheard of
I'm in the room nestled sweet and I observe love
Only for you, I ask God to show me the truth
What he showed me was you
Wherever I go, my soul leads to you
Days gone, nights lonely for you
Erotica - Wet dreams are on my mind
Erotica - Can I come in your mind?
Erotica - Oh yes, our love must shine
Erotica - Wish on star 69
Erotica - Wish on star 69
Erotica-ca-ca - Wish on star 69
Erotica-ca-ca
Wish on star 69, erotica...
So much I wish you were here with me now
My bad, I just hit redial
I want you to come and never leave now
Is your mind and your right hand free now?
Our love-reach deep down inside of it
As the candle burns
Where desire's lit
Makin' love knows no distance or environment
When we (ah), feel the most high in it
I feel you touchin' me and I begin to rise from it
Your love is stuck in me
Our minds are so alive and thick
Picture my hands on your waist
As I stare in your face
Your mouth half open
Your love I can taste
Embracin' you
Life: I let go
Gotta switch phones 'cause this one is ghetto
Another level of love we create when we take it to
And when it's made, Erotica, it's made for you
Erotica - Wet dreams are on my mind
Erotica - Can I come in your mind?
Erotica - Oh yes, our love must shine
Erotica - Wish on star 69
Erotica - Wish on star 69
Erotica-ca-ca - Wish on star 69
Erotica-ca-ca
Slave to your loneliness
""Slave to your loneliness...""
Inside of loneliness
""Inside this (alt we bear)""
With love of loneliness
""With thoughts of loneliness""
Enslaved by loneliness
I want you to come
Inside your mind
And find a place
Nasty and kind
This is where
Our desires grind
And where they peak
Is most divine
A place and time
I hope we reach together
You are my queen
And freak forever
I feel you in-side my stomach
My body shakes...
Erotica - Wet dreams are on my mind
Erotica - Can I come in your mind?
Erotica - Oh yes, our love must shine
Erotica - Wish on star 69
Erotica - Wish on star 69
Erotica-ca-ca - Wish on star 69
Erotica-ca-ca
(*Repeats and fades out*)"
111,Start the Show,2007,Finding Forever (2007),Hip Hop,Common,"Life isn't funny when your working yourself out
Get in or get out
I'm standing by myself
In your room, It's so crowded
Just let me out:
Just let me out
Been through it a thousand times before
(Been through it a thousand times before)
I won't regret this anymore
All the songs have been sung
All the wrongs have been done
Time now for
Me to go
Time now for
Start the show
Last Night I had a dream that I did not wake up
I lied in bed all night until my eyes would shut
I dreamed of you
(I dreamed of you [x3])
But I'm so different from the person that you once knew
Just let me out
Been through it a thousand times before
(Been through it a thousand times before)
I won't regret this anymore
Start The Show!..
Been through it a thousand times before
(Been through it a thousand times before)
I won't regret this anymore
Start The Show!"
112,Stolen Moments Pt. I,1997,One Day It'll All Make Sense (1997),Hip Hop,Common,"Common:
Down da down da down down down what (x3)
Down da down check it check it
There was a Hardy boy mystery I was tryin' to solve
Can't understand who the fuck was involved
Back from a show I had came hopped off the plane
In my mind home was pictured and rest was the frame
My God came and grabbed in something less than a Caddy
Go buy them gas and food was less than a cabby
As we approach my tilt, paranoia in my bones had built
By the lock on the door, a hole was drilled
I opened it to the kitchen floor my heart nailed
In my shit, somebody had broke in like a mitt
My mind started swingin' and who I thought the glove fit
As usual, niggaz is suspects
Who did I tell I was going out of town
Not too many people, I guess the word got around
The people upstairs should have been disturbed by the sound
Must have came during the day when at work, they was found
At the mount I stand folded than tie
Askin who done it
Fuck Hitchcock, I got the fifth cocked
About to go wild hunted
Whoever did it had the nerve to chill and get blunted
And left a roach in the ash tray, I had cleaned out the last day
Before I left, this thief decided to play chef
With the beef in the fridge to cook chicken breast
I'm kickin what shit was left all around the house
Thinkin' whoever came in on me is out
It's a frantic situation
It's a frantic situation, yes it is
(What can I do?)
It's a frantic situation
It's a frantic situation, hear me now
(What can I do?)
It's a frantic situation
It's a frantic situation, yes it is
(What can I do?)
It's a frantic situation
It's a frantic situation, hear me y'all
(What can I do?)"
113,Stolen Moments Pt. II,1997,One Day It'll All Make Sense (1997),Hip Hop,Common,"Black Thought:
It's a frantic situation (x7)
Common:
Extra salty 'cause whoever beat me, got me for this 31-inch
And this Alpha Bailey jacket I had just bought me
Out of snappin, my God tried to talk me
But what could get me half way calm was this Donny Hathaway song
The tape that it was on I had wanted while I was gone
But forgot to pack it, in fact it was in that jacket
This demo, it's time to track it and lay it down
Either it's somebody I know or somebody I stay around
Day before I broke out, niggaz was over my crib gettin' smoked out
No tellin' who had the place scoped out
Donnie brought over some niggaz I didn't know
I'm askin, who are you, they said I'm with the Mo
If it was them, soon I will collide with them
And they better not be rockin' no new Iversons
Then it could have been this hype that usually shovel my snow
If I'm out of town or not, by my car, he would know
Now, it might have been this stripper I met at Pinkhouse party
Thick, but my furniture wasn't worth her body
What if it was this nigga I let sleep in my crib
To have the set of keys but that I wasn't tryin' to believe
But I could have put it past him or those other bastards
It would be assed backwards for me to ask if they did it
'Cause whoever did ain't gon admit it
The blunted dirty dishes is my only exhibit
Wondering if I should give it a rest and through the wind it might surface
'Cause tellin' Allah, Joe is worthless (uh)
Chorus (x2): Black Thought
Hey sucka nigga, whoever you are (x3)
Wherever you are, whoever you are
Check it out"
114,Stolen Moments Pt. III,1997,One Day It'll All Make Sense (1997),Hip Hop,Common,"(Feat. Q-Tip)
Q-Tip:
Hey, hey, hey, hey,
Hey, who dat? Hey, who dat?
Hey, who dat? Check it, what
Hey sucka nigga, whoever you are (x2)
Hey sucka nigga, hey sucka nigga
Whoever you are, whoever you are
Common:
Fuck waitin under my skin, the situation is scrapin
Somewhat like the girl X-ratin
It's hard to be patient with no VCR or PlayStation
Knowing your Rockports, somebody may be lacin
Make me wanna leave the city when I can't take a vacation
Without somebody breakin in my demonstration
For some South side information, I search the Nigga-net
It certain things about this I ain't figure yet
Dirt, the guy who stayed with me and had a set of keys
Because his job had been stopped smokin' weed
Thursdays is off days, he usually watch his seed
For him to have done it, a babysitter and a car he would need
The stripper broad, my TV and couch, she couldn't carry it
Unless some nigga helped and that's who she'll get buried with
She was vegeterian and she wouldn't have cooked chicken
I confronted her with it, to her story, she was stickin
The plot thickens, as we drove in search of this hype
Who I ain't know by name, but I knew by bike
Chances of him breakin in, chillin' and eatin
Are about as slim as he is though I knew where he lived
In his house with three kids, one I was cool with
As we roll, I told the guy, turn on the music
Just as I thought I closed in on one suspect
The nigga who did it popped the tape in the deck
(Excerpt from a movie)
Just tell me why. Don't lie to me man, just tell me why
It's the money, all right?
Just tell me why
It's the fuckin' money, all right?
(Fighting)
Reynoldo, shoot that piece of shit
Q-Tip:
Know what I'm sayin'. Word up
It ain't sweet when you do that shit (x7)"
