,song,year,album,genre,artist,lyric
67,Love Is...,2005,Be (2005),Hip Hop,Common,"(Yeah, Love is Love.
God is Love.) 3X
How beautiful Love can be
On the streets love is hard to see
It's a place I got to be
Loving You is Loving Me.
How beautiful Love can be
On the streets love is hard to see
Gotta reach that frequency
Loving You is Loving Me.
1st Verse:
Yeah, you know what love is
Even found it on the ground where the thugs live
My man had to dig deep to find his
Couldn't sleep cause on the real he had 5 kids
Live nigs, real niccas express and chase it
In crap games, black dames and big faces
Cases in court, Fam showing loving support
You and your baby's mom thought that Love was a sport
As men we were taught to hold it in
That's why we don't know how till we older men
If Love is a place, Ima go again
At least now, now I know to go within
At times it can take ya for a spin
Heartbreak hotel then you're home again
I seen Love make a nicca soul pretend
Like a story that he don't want to end
2nd Verse:
It's all Love where we come from
In the hood Loved we was told to run from
That same hood where the gun sung
We holla Love hoping it become one
Crack got so many lives undone
From lack of Love many hide, some run
I knew this girl with a son who dreamt of acting in plays
Demonstration with a man had her trapped in a maze
Tryin' to find herself to regain much of that she had gave
Love can free us to which some react as a slave
Funny, we love 'em more when they relaxed in a grave
Wonder if a thug is raw, or is he acting afraid?
Everybody loves somebody but I attract shade
Heard of the love of money, but compassionate pays
Talk about it with my youth so she understand
What it is to be loved by a man. (Unnh!)
3rd Verse:
Some say that I'm a dreamer 'cause I talk about it often
Seen the hardest niccas soften with his homie in a coffin
We walk in, stand and fall in it
With the right companion, we all in it
Mary sang a song about it
Having broad limits in the game of life
It's the scrimmage
Reminiscing on letters I wrote in my small days
A letter to the people... ""Love always""!
Outtro 4X
Love is Love
Love your Mother.
Love your Sister
God is Love
Love your Father
Love your Brother
God is Love.
Love is Love."
68,Love Star,2016,Black America Again (2016),Hip Hop,Common,"You're my lovestar
What we gonna do, baby?
You're my lovestar
What we gonna do, baby?
I'm on what? What you on to?
I'm the sun god, let me warm you
Out of my sides the Lord formed you
Pull your dress up, ain't nothin' formal
Our fragrance is patience
We can major in communication
Relatin' like cousins, though we kissin' though
Love can be sick or medicinal
A doctor of it, you gots to love it
God body language I be spittin' while we fuckin'
In your ear with somethin' it ain't clear
On your inside it appear, so somehow you're here
I'm sayin' I wanna stay inside
They say I'm a deep nigga, I'ma go way inside
Of everything you are
Cause everything you are is my lovestar
You're my lovestar
What we gonna do, baby?
You're my lovestar
What we gonna do, baby?
I ain't the type to be all up on your social
I'm in your face vocal the way a man supposed to
A choosy lover, I chose you
God's most beautiful creation, let me mold you
You already in shape, that's more love to make
Feel free when I'm with you, it's hard to escape
When we need a break
We take it
When two souls connect you can't fake it
TV shows and cakes, I know your favorite
Cut from the same cloth, let's wear it
This ain't about labels, this about fit
Since God designed, we can start our own line
Our offspring will be you, me, and He combined
We walk the runway like blaow
Bein' in love is never out of style
You're my lovestar
What we gonna do, baby?
You're my lovestar
What we gonna do, baby?
Heaven agrees you are all that I need down here
Cause you make it all worth it
We do this on purpose
The love we make is certain
I'm so caught in your arm
If you're lost in your thoughts
I want to be your everything forever
You're my lovestar
What we gonna do, baby?
You're my lovestar
What we gonna do, baby?
Forever, I wanna be forever
Forever, star
Lovestar, lovestar"
69,Lovin' I Lost,2011,The Dreamer/The Believer (2011),Hip Hop,Common,"I remember (REPEATS)
I remember she sit there with her thickness
Never played a game but I heard about them sisters
A wise mister said love is ""gonna get'cha""
But that ain't what I read in the scriptures, God be with us
It was hard for me to take down the pictures
I was tripping, I even called her sister
I could be someone you could talk to, each and every day
But you were 'bout to marry, be on your merry way
I'm singing through the pain like I was Mary J
'Cause we break up to make up like Mary Kay
Rumors leaving tumors on my heart now
We fell in love huh just to fall apart now
I get your calls and I try to disregard now
What was easy for us now is hard now
Huh? Who do it better, we used to move together
Now we not together, is this our new forever?
Hell nah, I'm waiting on your call
Told you be I'll be back, had to break down some walls
Issues that I had
Some say it comes from not seeing my dad
Keep moving on
Hard for me to stay away and stay in touch
Girl, my heart is broke and I need a crutch
Thought I was okay but nights that I stayed up
Ass got me laid up, girl I never gave up
On you and us, I tried to take it day by day, and whew its tough
I know your young and you gotta live your life ma
I thought it was the right time for me to wife ya
I must confess, I miss the days of you laying on my chest
So confusing losing love, I'm saying god bless
Who do it better, we used to move together
Now we not together, is this our new forever?"
70,Maintaining,1994,Resurrection (1994),Hip Hop,Common,"Gotta watch out for them critters
I get the party live, Common Sense will get the party live huh (x4)
I was born in Chicago raised on Planet Rock talking zsa zsa zsa zsa,
Catch knock my tape like beats (uh), I'm fresh as fruits,
You pussy MC, it's you I rebuke, repent
You burn up you got me bit, I'm coming as ebit
Got on big hoes at Freaknit, frequently your telling me
Won and worn your rockets, so, he ain't put no scratch in my pocket
Yo heard, with my head I cock it, and rock it like that brother in
Colors
'Cause I want y'all to live, my crew is 2 Live, we sneakin' to the rear
But I can't get us all in free (what?) it's just another case of that
2
Dollar MC
I rock the same clothes 3 days straight to you they wrinkled but to my
They
Straight
Now I'm straight are you straight? I'm straight as long as I got beer
I thought about it jack, and now I'm out of here
""Maintain the rock""
I get the party live, Common Sense will get the party live, huh ""Don't
Stop
The rock"" (X4)
I need me some new socks, I need me some new drawers
I draws attention, like a letter to a sargent
There's A Few Good MC's the wack I'm giving code red
Slim say I got nobody but when they see me at the party they be like
""Go head, go head"", 'cause I gots the cuts like Bobby, rappers are
Dickheads
Choppin' they demo, I do it like Big Red
My office hours are from 9 to 5, while you avoid the party I make it
Live
The fellas nod and the chicks dance
While I'm coolin' in my jumpers and my big pants
I'm as dope as PCP, MC's see me and start having flashbacks
I don't flash scratch, I gotta watch my back
Now a days blacks don't know how to act, besides Larry Fishburn
Charles Jug and Wesly Snipes, marks wanna test me because I test the
Mics
I check 'em like sound, and like loose I'm down
Plus I done got better since Soul By the Pound, I maintain
I fall fresh apon the spirit, with the lyric that's overwhelming
And house more hoes then Spellman, worse unwelcome like James Johnston
My brains sponcering speech on the mic, I'm like a Jackson
Rappers I'm fondaling, they try to settle out of court
But I, could never be bought, what type of rebel eats pork?
I'll take the cat and never get caught, you wack together we fought
'Cause I can't see my melons boxing if he's not boxin' with 'em
I don't care who started it, I'm gonna be apart of it
Regardless of the odds of how hard
It's been many times we was outnumbered and we still got with them
I got rhythm from some boogers and some foxes
But if I becomes a 10 then some brothers all some gin
And I got juice, and this niggas scared
I'll F your head up, like the L.A. 4, when I flow for cash I got for
Broke
Like Mel for Moore
Why should a male with a B8 get more then me?
When Rashid got an MC degree, and a doctorine in rockin' shit I go to
Docs
To get
A fishwish with cheese, I don't mix with MCs, 'cause I just don't like
The
Mother
But I'm still maintaining"
71,Make My Day,2008,Universal Mind Control (2008),Hip Hop,Common,"(Chorus: Cee-Lo)
Ah, the sun is shining brighter
'Cause you really make my day
Yeah, you really make my day
Ah-oh-oh...
Yeah, I think I like her
'Cause she really makes my day
Yeah, she really makes my day
Ah-haah-oh... Oh-oh-oh
(Common - Verse 1)
Seen her on the beach, she was wrapped in a towel
Her body's so endowed, seen her ass cracked a smile
Enjoyin the Nile, take it, the breeze in
On some cat and mouse and she was, just cheesein
The sun eased in our conversation
""California Dreamin'"" now ""Californication""
Said she had some drinks in the cooler and I had an invitation
If I wanted I could brew up, this is just an indication
Of how cool she was
A couple chicks came up with the groupie love
They ain't want no pictures, only to be hugged
I'm thinkin' DAMN, damn, that's really cool because
Sometimes I wanna chill
Sometimes the best things in life are not in ya plans
You came to the sand and got, more than a tan
Baby girl, I'm a man and we can do this my way
Take a ride on the highway and pretend like it's Friday and it is
(Common - Verse 2)
She was at a barbecue
Pretty painted nails, she took off her shoes
She was 'show and tell' like it was grammar school
Sippin on some L, I'm thinkin', ""Man, she cool!""
Sun smilin' on her hair
Hey, they playin' spades and we can be a pair
She had a spread on her, I can see it from her chair
I love it when it's sunny/Sonny, girl you could be my Cher
It's, Independence Day and free is in the air
We danced and danced away yo
Showed her how to step, it's like a tango
From her body angle, I can tell she like me
She got me a flav, girl you're sweet as Icee
Spicy talk, the sauce drip from my lips
Take tricks and let's dip, we can do somethin' hip
Take a trip around the world in a day, play Fiona A.
Let your worries blow away like it's all okay, and it is!"
72,Making a Name for Ourselves,1997,One Day It'll All Make Sense (1997),Hip Hop,Common,"(Feat. Canibus)
Canibus:
Yeah, yeah
Me and my man Com Sense
Rallyin troops like Joseph Stalin
Where you at yo?
Common:
I'm bout to make the name Com Sense a name you fear
Y'all niggaz is scared, I'm your worst nightmare squared
Canibus:
And I'ma make the name Canibus a name you fear
Y'all niggaz is scared, I'm your worst nightmare squared
Canibus and Common:
That's double for niggaz who ain't mathematically aware
(Rakim from ""My Melody""(To catch another sucka duck MC out there)
Common:
I can tell by how you write, you the type to run in a fight
I hold mics while you hold spite
Like a broken hearted bitch
Don't give no fuck who yo team or who you startin with
Cameoed or charted with, I house niggaz like apartments with
Mic mechanisms, I dissect a rhythm
Move crowds with kinetic wisdom
It's like a Malcolm X-orcisim, fuck the rhythm, I hit him
I want him got not get him, auction his wack ass off, then bid him
Canibus:
I'm creatin' the ultimate verses with perfect lines
Puttin' together them whether my rhyme one threat at a time
So you niggaz need to stop testin me
'Cause you know you can't ""F"" with me
Steppin to me with insuperior weaponry
Exposin yourself to the verbal radiations
Sayin' you can defeat me is nothin' but speculation
Lyrics unravel, faster than bullets travel through barrels
Niggaz be diggin my styles like fossils and pterodactyls
Who wanna battle?
I'm bad to the bone marrow
The Earth got one sun but I walk with three shadows
With Allah, my supernatural bodyguard
Niggaz couldn't touch me if they gave me a massage
MCs will compete with lyrics and beats get crushed
I'll hit you in your chest so hard, your shoulders will touch
What!
(Scratching)
Common, steppin to me is like going to the county being a neutron
Common, I ain't scared of no nigga
Common:
I pursue sound fairs, relaxed like Dru Down's hair
Other nigga's rhymes are like gang signs, I throw down theirs
On knots, I landed, players get played like Hamlet
Supposedly nice, taken for granted like life
I write twice and drop singles in record pools
Niggaz I'm dunkin like when cops mingle
Fuck hip hop jingles, rhymin big words and not sayin' shit
The click that you came in with accent your flavor wit
Like moose, I go to the caves and get niggaz off all fours
I'm the shit that's uncalled for, the shit that you fall for
Far more advanced than a rapper who's career
You could only take a glance, couldn't make the transition
>From B-boy to C-note stance
I stand in a circumference, the humbleness
But in the Chi, bumbleless
Was thinkin' as a weakness were poetrys in motion
Like a bitch, I'm the main feature
Amongst hard working teachers and corrupt preachers
I make my living off of singles like Latifah
In between sheets like reefer with blunted senses
You couldn't make a statement if you was from a sentence
I'm cold with numb intentions
(Scratching) Fuck with Canibus (x4)
Canibus:
Yo, the Canibus is an animal with a mechanical mandible
Comin' to damage you, spittin' understandable slang at you
I be the all seeing lyrical, hammerhead sharp peripheral
With 360 degree visual
When the signal was given, MCs get biten with venom
>From a poisonous algorithm liable to kill 'em
My style will get in 'em, way up in 'em
My face don't belong in The Source
It belongs on the shroud of turan, for certain
I grab mics and murder shit
It's wickeder than Satan worshippers going to Catholic church services
You heard of this
The lyrical verbalist, trash herbalist
The wrath of my cold-blooded verses is merciless
Rap snap, get your ass cracked like bear traps
Contaminate your air sacs like tear gas
And I swear black, try to battle me, you won't last
I'll turn your ass into the artist formerly known as, you gay ass fag
I'll blow you to ashes with tactics
Strip you naked, then make you hug a cactus, you bastard
So phat to be a rap star, takin' pictures at music seminars
People know who you are
Now I got mad shorties that wanna call me
Because they saw me, up in The Source chillin' on page 40
Put this in your CD-ROM
Www dot Canibus dot com
You can find me on the internet talkin' to chicks
That was sweatin me off the Music Makes Me High remix
I be talkin' mad trash tryin' to get 'em to laugh
See, if I click and drag long enough, I'll get the ass
Bring it bag to the lab on Mount Prospect Ave.
Let your chicken suck me off and send her home in a cab
You know how we do, liquid aluminum like the T2
Beast from the East part 2, comin' to see you
Common:
It's time I made the name Com Sense a name y'all fear
Y'all niggaz is scared, I'm your worst nightmare squared
Canibus:
Now that I made the name Canibus a name you fear
You still scared, I'm your worst nightmare squared
Common and Canibus:
That's double for niggaz who ain't mathematically aware
(To catch another sucka duck MC out there)
Common:
Since I made the name Com Sense a name y'all fear
Y'all niggaz is scared, I'm your worst nightmare squared
Canibus:
And since I made the name Canibus a name you fear
You stay scared, I'm still your worst nightmare squared
Common and Canibus:
That's double for niggaz who ain't mathematically aware
(To catch another sucka duck MC out there)"
73,Misunderstood,2007,Finding Forever (2007),Hip Hop,Common,"Intro (Sample):Baby, you understand me now (applause)
Sometimes you see that I'm mad
No one can always be an angel
When everything goes wrong you see something bad
I'm just a soul who's intention's are good
O' lord, please don't let me be misunderstood
(Common): Yeah... uh...
We do this... for the people that walk that path
Try'na get to they dream... yeah... uh...
Verse 1: He stood on the corner with the rest of them
Though he knew that this corner wasn't the best of them
Hard streets and the life that carrested him
Dirt police domestic beefs that's festerin'
He Knew that the president wasn't addressin' him
Though dead presidents was addressin' him
Two kids from hot sex no protection and
People don't see how aids is affectin' him
He get hard you get to get to god questionin'
Can't find a job so ya robbin' and hustlin'
He killed Marx and sold dope for cousin em'
Can't believe that they would be the ones buckin' him
He on the ground he could feel god touchin' him
He heard the sound of his mom sayin' trust in him
And heaven's gates sayin' lord please let me in
Or send me back to tell my people to be better man
Chorus: Misunderstood ('Cause we are)
Don't let me be misunderstood, don't
Misunderstood, don't
Don't let me be misunderstood, don't (uh... yeah)
I'm just human, o
Verse 2: She dance and she dance she dance for them
Her body move but her mind was manickin'
Thinkin' I don't know where they hands had been
Relationships with men have been so damagin'
She thought back to when she was in howard and
Dreams of doing scenes with Terence Howard and
Broadway plays and dancin' with Alv and them
The ones that make it always ain't the talented
Some dreams get lost never to be found again
At first strippin' seemed so empowerin'
Most every girl wanna do it now and then
But bein' meat everyday is devourin'
Cats put paper where she put powder in
Life would break up now she powderin'
She was high when she fell down and then
Crowd surroundin' and heart was poundin' and
She fell into a deep sleep, the siren sounded and
Seein bright lights in the mist of clouds and then
Talk to god feelin' like his child again
Said lord let me live so I can make you proud again
Chorus: Misunderstood ('Cause we are)
Don't let me be misunderstood, don't
Misunderstood, don't
Don't let me be misunderstood, don't
I'm just human
Break: The life we lead, will always lead us
And we pray that he will never leave us
It's the price we pay, I guess that's the reason
Why my grandma say, we all need Jesus (X2)
Chorus: Misunderstood, don't
Don't let me be misunderstood, don't
Misunderstood, don't
Don't let me be misunderstood, don't
I'm just human"
74,My City,1997,One Day It'll All Make Sense (1997),Hip Hop,Common,"(Featuring Mylik Yusef)
This the city of Chicago
The state of confusion
The style I'm using is free
Or at least it would be if my mind was
Peep I'm behind cause
I didn't handle my function while in high school
Although I was cool
The hood I live in ain't that proper
Cause a cop a stop ya
And have you at a hundred and eleventh before you can say not guilty
I'm not filthy
Nor am I rich
Ain't that a bitch
Like life is
Not your wife is
See that your better halve
Do your math
And peep that two halves make a whole
And all I have to hold
Is my self pride
So these streets I strive
Like a Black Panther
Asking can the
Situation get much worst
All I do is try to appeal to the masses
As the phrase keep it real passes
The teeth of too many phoney individuals
Snakes, that smooth like criminals
They create chemicals
That the Earth hate
Doing their damndest to decrease my birth rate
I'd settle for lesser knowing I'm worth wait
Or at least my weight in precious gems
So I'm steadily steadly steadly
Trying to lose my religion, like R E M
Created in His own image so are we him?
And through all this crises
Shid (Shit) I wonder where Christ is
Well he damn sure not in K town or the wild hundreds
Where they broadcast G.D. till the world blow-up
And Stone run it
Hunted by police for display in state vile cages
Come out to make minimum wages
And with a desiese that are contagious
It is fucking outrages
The amounts of Black and Brown they lock up
But the Most High encourages me to put the glock up
And Stock up on do for self knowledge
A brother couldn't afford to go to collage
So I had to learn form the school of hard knock
On the hard blocks of the Chi
Even I, think about moving out to River Oaks
As my liver soaks
In mad Hennesy
'Cause I got a bad tendency
To do a lot of drinking
Now I do a lot of thinking
Blinking, was your third eye
When you heard I
Was one of the chosen one
Industry doors keep closing
(Sing) Watch the closing doors
Niggas want a record deal
But can they deal with a record?
Cause once they get rich
They tend to switch
Like a sissy
Please miss me
With all that bullshit you popping
This knowledge I'm gonna keep dropping
Even if you had one of them red octagon
Motherfuckers say Mylik how you make your living?
I say by breathing oxygen"
75,Nag Champa (Afrodisiac for the World),2000,Like Water for Chocolate (2000),Hip Hop,Common,"(Common)
Yeah baby boy
In the place (for you and yours) to be
Da uh da uh, we got the uh y'all
We bout to rock y'all, we got the uh baby...
Yo yo yo check it
Excite-ting, enlight-ning, invite-ting
I'm writin shit that I feel
Raps are Black Steel In the Hour of commotion, the motion of Com
Is like that of a ocean, devotion 'cause I'm
The Earth, Wind, and Fire of hip hop
By Rakim and Short I been inspired
My shit knocks environ---ments
Of cats wit seventeen's tint, time is money
The mind is funny, how it's spent on gettin' it
It's sittin' wit descendants of Abraham
Who say the jam is ""Money, Cash, Hoes""
I went from bashful to asshole to international
Lover-self, word to the mother on my last record cover it's felt
Now deal wit it
(Bilal)
I wanna get into it
Let's do this
I wanna see you move it
So move it
So let's just get into it
Let's do this
Can you feel the music?
The music oh ah, can you feel the music, the music
(Common)
Yo check it yo
In this never-ending battle to please
Niggas, magazine writers, MC's
Who request hot shit, I freeze
And tell 'em where I was rose, we always said cold
Hold your Horses and ya Carriages, this never-went-gold nigga
Rocks shows care-less
You not gon' respect self, at least respect the heritage
Affect the lives, the spread of wealth and the merit is
I realize what I portray day to day, I gotta carry this
And beats, rhymes and life is where the marriage is
Had Dreams of Fuckin' R&B broads, it came true
Journalist I wreck, shared the same view
Picked up a fallen angel on the path that I MC
Familiar voice, come to find out the angel was me
Some say ""You changin, Rashid""
Times are, we still close
I rhyme far, away away away
From what you accustomed to hearin everyday, uh-ah
You know the dope-choppin, gun-poppin', homies dyin'
I'm amongst it, save the war stories for Private Ryan, INI
(Bilal)
I wanna get into it
Let's do this
I wanna see you move it
So move it
So let's just get into it
Let's do this
Can you feel the music?
The music oh ah, can you feel the music, the music
(Common)
Yo check it yo
Women cry, children laugh, men dance
I refuse to lose self and try to win fans over
Weight on my shoulder fluctuates like Oprah's
My refrigerator poetry's magnetic like ultra
You couldn't hang if you was a poster
Posin like a bitch for exposure
It's rumors of gay MC's, just don't come around me wit it
You still rockin' hickies, don't let me find out he did it
Got My Eyes on the Tiger, Eyes on the Prize
Eyes on the thighs of Mary J. Blige, imagine on how good the cat must be
Stop eatin meat, lost weight, but I still rap husky
My verse depth is that of a baby's first step
Or the old lady who died and the nurse wept
I flow like cursive writing, invitin you and yours to my openness
Shows allow me to cop Range/range like a vocalist
But man does not live on bread alone
What good is a Range/range when it's time to head home?
(Bilal)
I wanna get into it
Let's do this
I wanna see you move it
So move it
So let's just get into it
Let's do this
Can you feel the music?
The music oh ah, can you feel the music, the music
(Bilal)
I wanna get into it
Let's do this
I wanna see you move it
So move it
So let's just get into it
Let's do this
Can you feel the music?
The music oh ah, can you feel the music, the music
[Common] *during chorus on the second time*
We be that, we be that
Afrodisiac, disiac
We be that, we be that
Afrodisiac, disiac
We be that, we be that
Afrodisiac, disiac
We be that, we be that
Afrodisiac, disiac
We be that, we be that
Afrodisiac, disiac
We be that, we be that
Afrodisiac, disiac yeah"
