,song,year,album,genre,artist,lyric
31,Dooinit,2000,Like Water for Chocolate (2000),Hip Hop,Common,"Ah keep on, chcka chcka chcka (Repeat 6x)
Mo'fucker move back, I pursue rap at the pace of a New Jack
Miscellaneous numbers and shoes stack grooves
Rap I deliver for the hungry and underprivileged
Something different from these hollow and grunting niggas
This is business strictly, step to my business is risky
'Specially when you as bitch as Missy
Back to back LP's that sound the same, I surround the game
With a four-pounded brainstorm
To make niggas dance in the rain, scared to take a chance in the game
Used to breakdance, it's a shame
What money do to a nigga brain
If he lose his soul what did a nigga gain?
""Doin' it, doin' it, I am doin' it""
""C O double M O to the N"" (cut and scratched 4x)
My train of thought is that of a hustler, or a nigga with his shirt off
Trying to get his work off to customers
I rap with a chip on my shoulder, squeezing Coronas
See shirts that say ""We gotta get over""
That juggy shit is over, the war is on
I on;y want to be a soldier, I'm holding on, to a culture
Focused like Gordon Parks when it's sorta dark
For niggas that's flooded with ice, my thought's the ark
Performing warming arts with some shit for the heart
Don't fuck with radio, ignoring the charts
I could give a FUCK what you made in a year, nigga, you wack
A soft nigga on a hard track, in this new rap
Generation I ""X"" cats like a Muslim
He fell off 'cause I pushed him
Let his Bently and his weak crew be his cushion
I catch him on the streets, in front of the bodyguards and rush him
""Doin' it, doin' it, I am doin' it""
""C O double M O to the N"" (cut and scratched 4x)
You wasn't saying you was a thug before Pac came
Ten years ago you had a high top trying to be like Kane
Then Snoop released and it became a G thang
Claim sets, your city ain't got gangs
Niggas hate you, they ain't paying you no attention
In a circle of faggots, your name is mentioned
With six degrees, I separate MC's, from a business man that's good
From a nigga that was raised or just lived in the hood
From what a nigga says to what's understood
Keep my shit tight like them boys in ""The Wood""
Dick is always hard like the ""Boyz in the Hood""
Peace to Dug Inf, No I, Sean Lett, the whole Chi
At the crib some cats give me the cold eye
I'm a bitch slap the next one
Let him know the world is my section for taking
You got to reduce aggression
""Doin' it, doin' it, I am doin' it""
""C O double M O to the N"" (cut and scratched 4x)"
32,Drivin' Me Wild,2007,Finding Forever (2007),Hip Hop,Common,"It's this thing now, that's drivin' me wild
I gotta see what's up before it gets me down
It's this thing now, that's drivin' me wild
I gotta see what's up before it gets me down
It's this thing now, that's drivin' me wild
I gotta see what's up before it gets me down
No it's not a mystery, it's everything
She was the type to watch Oprah and the Today Show
Be on the treadmill, uh, like ""Okay, go""
Had a body, A body that you can't pay fo'
That mean she had some Ds on her but they wasn't fake though
Had a drive for a drive for Rodeo
She spent pesos on those Lebeaus
Spin class at the gym, strip tease on a pole
She was so obsessed with her body and clothes
To every party she goes, tryin' hard to be chose
They say it's hard for a pimp but extra hard for these (hoes)
Readin Us and People Mag, tryna get the scoop
Chasin a actor for a Bentley Coupe
She been through the ball player from the Clippers, then came the pumps
All thinkin' she number one where she was just a jumpoff
Doin' all she can for a man and a baby
Drivin' herself crazy like the astronaut lady
It's this thing now, that's drivin' me wild
I gotta see what's up before it gets me down
It's this thing now, that's drivin' me wild
I gotta see what's up before it gets me down
It's this thing now, that's drivin' me wild
I gotta see what's up before it gets me down
No it's not a mystery, it's everything
He had paper since we was in we was in high school
Pop was a doc, mom taught at my school
Lock with the rocks, in his ears he kept jewels
One of the Diddy types, da D-D-Dame Dash dudes
Pushed a Maserati Sport, readin the Robb Report
Wanted to be Mike but he was never live at sports
Since golf is in he was on the drivin' course
To live the rap life is what he was strivin for
Spendin cash at the bar to get credit
Drinkin' Chaundon just because Big said it
They say Ye is but dude was big headed
Rocked the fur in the summer so somebody'd pet it
He had a fetish for shoes that's athletic
Pathetic on his MySpace page half nekkid
It's a shame what they do for fame and to be respected
Joe, you coulda got it if you never woulda stressed it
It's this thing now, that's drivin' me wild
I gotta see what's up before it gets me down
It's this thing now, that's drivin' me wild
I gotta see what's up before it gets me down
It's this thing now, that's drivin' me wild
I gotta see what's up before it gets me down
No it's not a mystery, it's everything
They was one of them couples, people said they were the it
Unbreakable, like Bobby and Whit
Or Ryan and Reese, or Kimora and Russ
Relationships can be dead but look live to us
I guess we all been through it where we try too much
Losin yourself and you're lyin' and stuff
Wishin for the diamond cuffs, in search of a ring
Where love is not a mystery it's everything
It's this thing now, that's drivin' me wild
I gotta see what's up before it gets me down
It's this thing now, that's drivin' me wild
I gotta see what's up before it gets me down
It's this thing now, that's drivin' me wild
I gotta see what's up before it gets me down
No it's not a mystery, it's everything
Gets me down
Gets me down
Gets me down
Gets me down
Gets me down
Gets me
No it's not a mystery, it's everything"
33,Electric Wire Hustler Flower,2002,Electric Circus (2002),Hip Hop,Common,"(Common)
Electric! Wire! Hustle! Flower
Electric! Wire! Hustle! Flower
Electric! Wire! Hustle! Flower
Electric! Wire! Hustle! Flower
Electric! Wire! Hustle! Flower
Electric! Wire! Hustle! Flower
Electric! Wire! Hustle! Flower
Electric! Wire! Hustle! Flower
(Common)
Blood and magic dripping from me
True thugs and addicts I grip an entry
Enter this game with tricks and envy
I forget game to remain an emcee
Rooms in this mind that's still empty, only fulfilled through prophecy
You stoppin' me, you see I'm tryin' to catch this plane
You must be slow nigga, catch your brain
It's fresh, but it is some stress and pain
Got hos?, Ho nigga respect the game
I talked to cab drivers about the fast lane
And Islam, masters and shakras? and beyond
Think about the hustle and somehow I see by
But what led it to the concrete, BS be strong
You was at your hardest when you didn't even try
Live like a bitch, to bitch you gonna die
Electric! Wire! Hustle! Flower
Electric! Wire! Hustle! Flower
Electric! Wire! Hustle! Flower
Electric! Wire! Hustle! Flower
(Common)
Mercury and retrograde, I'm trying to get niggas in the ghetto paid
While they watch pornos and Escalades, away from floats and the dope in sex parades
Somebody screamin in my mind, I'm tryin' to find if it's me
Or voices on the master, they desgin to be free
Same revolt, can't be found on TV, or radio, its livin' in me
Hey lady, that smoke is bothering me
If I put it in your eye, ashes you would cry
All this rap talk is blowing my high
I just came to chill and build with my guy
I try to walk but I stumble off the humble path
This story of a pimp stick that became a staff
You got it, you gotta know where to aim the Mag
Art and oppinions are made to clash
Electric! Wire! Hustle! Flower
Electric! Wire! Hustle! Flower
Electric! Wire! Hustle! Flower
Electric! Wire! Hustle! Flower
(Common)
Out of body hard to explain, like the pyramids and gods I remain
I know pain, like Kurt Cobain, or ain't I playin' hurt the whole game
Dig it to the Earth's brain for worst gain
Focused like young blood on his first chain
I used to write shit to please niggas
Now I write shit to freeze niggas
Whether iced out, or American Pie sliced out
I sit in the room with the lights out
Whether diced out, or with their hair spliced out
I sit alone in the room with the lights out screamin
Electric! Wire! Hustle! Flower
Electric! Wire! Hustle! Flower
Electric! Wire! Hustle! Flower
Electric! Wire! Hustle! Flower
Electric! Wire! Hustle! Flower
Electric! Wire! Hustle! Flower
Electric! Wire! Hustle! Flower
Electric! Wire! Hustle! Flower"
34,Everywhere,2008,Universal Mind Control (2008),Hip Hop,Common,"(Chorus: Martina Topley-Bird)
How did you know I've been waiting for this time to come?
And though it tastes like forever
It may not stay long
Everywhere is summer. (4x)
(Verse 1: Martina Topley-Bird)
A shaman since before my birth
And I came down to rock the Earth
My misson condition:
I give you, you listen
I'm syncing in time in parallel
In binary, no 3rd return
I'm planning intention
With all the redemption
(Verse 2: Common)
No pop, no pop, no pop, no pop
We gon'do this thang till the sky just drop
Lock in to ya mind away we rock,
In a rocket is the 87 astronaut
Top of the soul, dove and I got in a hole
At the moment they were sayin'
""It was outta control""
Strap in to your mind
Why eyes see some recline
You'll see in time your season to shine
When the stadium is dark
MCs are defined
Get ready, on your mark, put your feet on the line
The race is on to space beyond
You gon'get there by doin' what you want
Sometimes the most famous feel all alone
So we drift to a place that we call our home
I was known as being spaced and outta my dome
Now I know, it's all I've know"
35,Faithful,2005,Be (2005),Hip Hop,Common,"(Feat. Bilal and John Legend)
(Sample) Faithful to the end
(Common) We got to be
(Sample) Faithful to the end
(Common) I want to be
(Sample) Faithful to the end
(Common) Yes, its for the people, God moves, yeah
I was rollin' around, in my mind it occurred
What if God was a her?
Would I treat her the same? Would I still be runnin' game on her?
In what type of ways would I want her?
Would I want her for her mind or her heavenly body?
Couldn't be out gettin' bogus with someone so godly
If I was wit' her would I still be wantin' my ex?
The lies, the greed, the weed, the sex
Wouldn't be ashamed to give her part of my check
Wearin' her cross, I mean the heart on my neck
Her I would reflect on the streets of the Chi'
Ride wit' her, 'cause I know for me she'd die
Through good and bad call on her like I'm chirpin' her
Couldn't be jealous 'cause other brothers worship her
Walk this earth for her, glory, I'm grateful
To be in her presence I try to stay faithful
(Sample) Faithful to the end
(Sample) Faithful to the end
(Sample) Faithful to the end
(Sample) I'd like to be her very best friend
He worked with her, she was his lady's best friend
Even if they don't try some ladies test men
And this was a test that was bigger than him
Some believe it's the nature that is given to men
He had a good gig, a wife, a kid, a decent home
One reason or another couldn't find peace at home
She asked, ""Why do men always have to stray?""
He said, ""I'm bad, not as bad as Eric Benet""
""I used to take 'em out to eat but they wasn't really eatin'
Mighta got a little head but I wasn't really cheatin'""
It's hard when your lady don't believe what you say
And what you did in the past you gotta live with today
She asked if they could spend the night together
He thought, and said, ""I'm tryin' to get my life together""
Went home to his lady, these were his confessions
""Baby you a blessin' and my best friend""
(Bilal with his voice overlapping) Faithful to the end
(Bilal) Faithful to the end
(John Legend singing)
(John Legend and Bilal) I'm gonna be, I'm gonna be, I'm gonna be so faithful
(John Legend and Bilal) I'm gonna be, I'm gonna be so faithful
(Bilal) So
(Bilal) So
(Bilal) So
(John Legend) So
(John Legend) So
(John Legend) So
(John Legend and Bilal) So faithful
(Bilal) So
(Bilal) So
(Bilal) So
(John Legend) So
(John Legend) So
(John Legend and Bilal) That's what I'm gonna do
(John Legend) Faithful to the end
(John Legend) That's what I'm gonna do
(John Legend) Faithful to the end
(John Legend) That's what I'm gonna do
(John Legend) Faithful to the end
(John Legend) Yeah, yeah, yeah, yeah"
36,Food for Funk,1997,One Day It'll All Make Sense (1997),Hip Hop,Common,"Common:
What, yo, yo, yo, yo, yo
Yo, yo yo yo, yo, yo, yo, yo
Check it, yo
You say a one for the trouble, two for the time
Come on y'all, let's rock that, uh
(I can feel the funk) (x4)
Check it
I come to grips with mics
I come to grips that a lot of mic users is dikes
I come to grips with the likes of Fred Hampton
Cold, so I'm lampin, with no need for spotlight
When I got light like an intersection, you talk
But you came to my town with protection
Election year, had the block hot
I scream ""fuck the world"" for having a baby girl sorta cock block
I write rhymes like I come from the windy city
With my crew, I click like simply, stand midi with reality
Casually, I walk through these war games
Some claim say but then they take on whore names
If that's the way your sex drives, stay in your lane
If you're a man, I can't tell like if the door rang now
Now, to the ladies in the house when you come in the place
It ain't a bunch of niggaz all up in your face
The music is thumpin and you're feelin' the bass
What you wanna do girl (wanna shout)
To the brothas when you come in a jam, it ain't a bunch of niggaz
It ain't high tech and ain't got free liquor
You jackin his name and stick to make you jones get thicker
What you wanna do man?(let go)
Yo, check it
Some niggaz be on the mic, sounding like dikes
Allow me to get on and bust like Spike (uh)
Lee, I'm in the majors with no rotation
Through stations of bullshit, I see through like a pager
In the age of Aquarius, various things
Is gonna carry us in intellect and what have you
Street astrologists interpret point stars and half moons
Then end up on garages or walls in bathrooms
Every black moon, a rap tune move me
The rap sun, I rain more than Rudy, that unruly shit is played
It don't stop
It's time to get it, get it made
I got my mind made up like Foxy Brown's face
I know how the underground tastes
I want a crib from the ground up, rooms spin at a round pace
Get down based on true story, through Corey, came close to the teachers
Colder as the Iceman, posted before it start wrinklin
Linkin with cats, who don't react to change in the years
Fulfill prophesies in rooms full of emptiness, now
I can feel the funk (x8)
Yo, check it, check it
I came through the corridor, with the aura
Raw Chicago mora, scope the horror
Read between the lines and know the border
Some pop wines for juice, I wait in the water
Waitin for you Big Willie niggaz to have a show at The Crib
We gon get with your glamour, long as we know where it is
Tell you ain't a player by your sweater doused with wack feather
The Crib got the gangsta playa shit patent like black leather
I rap better than you, you, or maybe him
But I am like a tree and every lyric is a timb
Spilled brews and greasy foods got my car smelly
Some be so high, they believe they fly like R. Kelly
But then they fall off, dusted niggaz is gettin' sawed off
They fall soft, my mental lift is for me to haul off
I kick ass
(Scratching)
I can feel the funk (x16) (makes me wanna shout, wanna shout) (x4)
(Scratching) Wanna shout"
37,Forever Begins,2007,Finding Forever (2007),Hip Hop,Common,"Victory won
In a world of Henessey and guns
Too young for the marches
But I remember these drums
To start reality
Wars and battles
We fought for ours
Caught in ghetto tragedy
I talk to my aunt named Mattie Lee
And recognize the importance of family
Hand me the joint
Good music and room to breathe
Those that doubt
Com' will soon believe
Can't judge the weave
My lady had one
I'm more like a fool
For soul and passion
The price of gas rises
Street life is pumpin' fast
Lives is
I'm watch crash
And realize that we all survivors
No religion or race
Whatever describe us
My guys do dirt do dirt
But never really talk about it
Forever begins
Just because I thought about it
Living
Once Again
We
Living
Then you go (x4)
Ashes and snowfalls
I wonder when the roll call for heaven gon' come
Forever gon come
It's a cold world
And I can never go numb
Look
Fear in the eyes
Say I never gon run
Sooner or later
I know the cheddar gon' come
For now I write the world letters
To better the young
On tree by jury
Together we hung
Now we let our chains hang
And gang bang to maintain
Ghanastan goin' through the same thing
It trickles down
At each other we aim pain
I shoot for stars, peace and exclusive cars
Through the while I learned to earn hard
Watch gangstas turn God in the mist of war
No matter how much I elevate,
I kiss the floor
It was in the ?? when she said Dilla was gone
That's when I knew we'd live forever
Through song
***
Origin
Is forever
Well, well well,
We are back in the studio again
Look at that
Hey I don' need no cue cards
They got the engineers holdin' up the cue cards
What that say
Oh they say, just talk, don't sing
Son, I bet you and I feel like you and I've been here forever
30 years old red eyes,
Beholding red eyes
I see my world's tears
Yeah, origin is forever
Every peak will have 2 values
Hopeful eyes in the comfort
Of true protection and admiration of the chime
That's forever
Forever is to strive
A place of endearment
Forever is what I leave
My I-self contribution
Damn, what I gon' leave?
Ok...
I leave my one and only grain of spiritual sand
To universal scales of humanity, all humanity
Forever is finding a solution to a solution
Tsunamis, hurricanes,
Following the trails of the African slave ships
War, war, and more war
Floods, Columbine, Global Warming, Earthquakes
Another somebody done me wrong, son
Virginia Tech, is not an, ""Oh, What the heck.""
We're still, did you place your one grain
Of spiritual sand forever?
Confusion need a solution
Blend and stir, stir and blend
The part of humanity; sift the ingredients
Of acknowledgment, apology, amendment, atone
We gonna work with the four A's here
Forever part
Common good is forever
God's memory is forever"
38,Funky for You,2000,Like Water for Chocolate (2000),Hip Hop,Common,"(Feat. Bilal, Jill Scott)
Chorus: Bilal, Jill Scott
All right... Okay [4X']
All right... We'll make it funky for you now
(Common)
I'm a child of the ah - The 87 ah
From the streets - Get on a beat and go ah
I could break it down like whatever ya ah
On some K-R-S be here forever type unh
You-you-you-you know you shouldn't rhyme like unh
Let them pussy niggas get in your mind like unh
Baby boy you could do it take your time do it...
If you get the chance
To be a man in a b-boy stance and advanced from the go
I'll trace outer space with a unh
The baby-sitter of styles - I've traveled miles with
Bitches and... I've traveled miles with...
I've traveled miles with bitches and brew the ritual
Of the real unh
Your platinum but real unh's don't feel you
You sampled real unh's and then filtered
I'm built to last - at last I'm free
The Roots and SV be the family tree
SV and the Roots be the family tree
The Roots and SV and the tree is unh
Come on
As long as it's funky... all right... okay [yeah]
As long as it's funky... all right
As long as it's funky... all right... okay
As long as it's funky... funky for you now
I style for the oh - wild for the oh
Baby girl let's go half on a child for the oh
Lick shot's pop lock and blaow for the ooh
Like Ra-I'll move a crowd for the oh
You talkin' loud but ain't sayin' oh
Trickin' paper on a unh... Captain Save-a-oh
I've never been... the type of nigga...
To take... a broad to the courts
As a shorty I was always into sports
Now I talk to drums and walk in slums and thoughts that's oh
Instinct to hustle-divided by the struggle
Plus a couple of scuffle's and up to high shuffle
Even when it sound muffled...
I bust through... narrow gates...
With king-sized thoughts that's sparrow shaped
Before I came up I had to elevate
Let a nigga move where he wanna move up to
You don't like how I'm livin'... well fuck oh
I stuck to what I was on... a star is born on a cusp
Many angel's fell to the dust
Leavin' me to trust... only a oh
Leavin' me to trust y'all only a oh
Leavin' me to trust in a - ah oh oh oh
Oh
Yo
Chorus: repeat 4X
As long as it's funky [yeah]
All right... okay
Let your... imagination... dance to the...
Dance to the... dance to the hey
Like nobody's watchin in a b-boy stance to the hey
I'm funky like Africans in France to the hey
Yo hey... kick in the bass you...
Chasin paper like a bitch in a race
Spit on or death, I still ain't picked up the ace
The hundred... styles I run with thick in the race
So let's oh... yeah unh hunh"
39,G.O.D. (Gaining One's Definition),1997,One Day It'll All Make Sense (1997),Hip Hop,Common,"After bein' 25, you know, just trying to survive in the world 
'Bout to have a little boy or baby girl. Who knows? 
Anyway, just when you start gettin that little age and experience to you
You start thinkin about stuff, tryin to make the right moves
So bust it out, this is what I was thinkin, check it
Yo, the education of the Lon-chicka-Lonnie Lynn 
Began, began with time
Bein' my bloodline is one with the divine 
In time brotha, you will discover the light
Some say that God is Black and the Devil's White
Well, the Devil is wrong and God is what's right
I fight with myself in the ring of doubt and fear
The rain ain't gone, but I can still see clear
As a child, given religion with no answer to why?
Just told believe in Jesus 'cause for me he did die 
Curiosity killed the catechism
Understanding and wisdom became the rhythm that I played to
And became a slave to master self
A rich man is one with knowledge, happiness and his health
My mind had dealt with the books of Zen, Tao the lessons
Koran and the Bible, to me they all vital
And got truth within 'em, gotta read them boys
You just can't skim 'em, different branches of belief
But one root that stem 'em, but people of the venom try to trim 'em 
And use religion as an emblem
When it should be a natural way of life
Who am I or they to say to whom you pray ain't right
That's who got you doin right and got you this far
Whether you say ""in Jesus name"" or ""Al hum du'Allah""
Long as you know it's a bein' that's supreme to you
You let that show towards others in the things you do
'Cause when the trumpets blowin, 24 elders surround the throne
Only 144,000 gon get home
Only 144,000 gon get home
Only 144,000 gon get it baby
I've lived and I've learned 
I have taken and I've earned 
I have laughed, I've cried 
I have failed and I have tried 
Sunshine, pouring rain 
I found joy through all my pain 
I just wanna be
Happy with being me 
Let me voice my concern 
So many of my fellow brothers have given themselves a title 
That their actions didn't earn 
Our ignorance is in the same breath as our innocence 
Subconciously, seeking to find an impressionable mind to convince 
I've finally come to the realization why Black people in the worse place 
'Cause it's hard to correct yourself when you don't know 
Who you are in the first place 
So I try to find the clue in you 
But evidently, White folks know more Black history than we do
Why're we bein' lied to? I ain't know our history was purposely hidden
Damn, somethin' in me wanna know who I am 
So I began my search, my journey started in church 
It gave my heartache relief when I started to understand belief
Hustlin' was like a gift spent my share of time in the streets 
Taught me survival from this evil I'm just gonna have to deal with 
And I felt like a fool when I tried to learn it in school 
It almost seemed like a rehearsal when the only 
Science and math are universal
Takin elder advice, read the Bible, the Koran 
Searched scrolls from the Hebrew Israelites 
Hold on, this ain't right, Jesus wasn't White 
Some leads were granted with insight 
And it's all in the plan, but it took me some time to overstand
He still created with the imperfection of man
So, with followin' I disagree 
By no means have I forgotten or forgiven what's been done to me
But I do know the Devil ain't no White man, the Devil's a spiritual mind 
That's color blind, there's evil White folk and evil niggas you gon' surely find
There's no positivity without negativity
But one side you gonna have to choose 
Any chance to speak I refuse to misuse
So how can you call yourself God when you let a worldly possession 
Become an obsession and the way you write your rhymes and can't follow your lesson 
If a seed's sown, you make sure it's known, you make sure it's grown 
If you God, then save your own, don't mentally enslave your own 
If you God, then save your own, don't mentally enslave your own 
If you God, then save your own, don't mentally enslave your own 
Well, I've lived and I've learned 
I've taken and I've earned 
I have laughed, I have cried 
I failed and I have tried 
Sunshine, pourin rain 
I found joy through my pain 
Just wanna be
Happy bein' me 
Bein' me"
