,song,year,album,genre,artist,lyric
85,Limelight,2004,Urban Legend (2004),Hip Hop,T.I.,"Look girl you sexy as you wanna be
But you just a wanna be
I can't help ya
I don't love ya
I just met ya I might shove ya
Will I plug ya to some niggas that'll drop some change in yo purse
Hoe what I look like I ain't no trick bitch you gone chose big pimpin' first
On God's green earth I shall not hurt
For money food shelter or work
Louie, Henny, Remy, or Urp
Chicken, dimes, hoes in skirts
I'm in my truck smokin' purt
Tryna see how many flirt
Ridin' round the A.T.L. on the baddest bitch search
Yeah I did a concert but I don't wanna talk about it
You say like that freaky shit well freaky bitch be about it
Or candy truck you jumped bitch you can jump up out it
I ain't yo man so I ain't gone shout wit ya
I'm headed to yo crib and its straight lights out wit cha
Hey we the hype now the limelight is ours now
Broads comin' at us like they wanna fuck us right now
[2x] Sexy, Goregous, Beautiful
Would you do something real freaky tonight
Now call me Bruce Lee or that pimp I got that glow I'm limelight
How can life go wrong when I got a brainiac that swallows pipe
She roam the streets like its halloween so tricks can trick or treat all night
My pimpin' keep them hoes hooked like I had them jays on that white
Ridin' out in a Hummer which I call a lunch box
Standin on 26s which I call 'em hightops
Candy red paint on that yeah that thang a cherry pop
All peanut butter seats always leather never cloth
Hoe you couldn't wipe my pimpin' off if you had a rag
Yeah she knows her pops but I'm the one she calls dad
Straight swurvin in the whip passin blunts takin' drags
Watchin dvds in the truck while she out there sellin ass
Peanut butter, Royal Chocolate
Caramel Jazzebell
I offer dick you offer ass for sell
Now you ask a player
See me shining getting right
Finally coming up call me pimp tight
What you'll do for the limelight
Them bisexuals I call 'em klinedikes
Vanilla want a nut on Sunday
Fill hot fudge in the middle of her tummy
Butter pecan white chocolate love day
Niggas lookin' fly so remember where the hershay
Hoes at Davana of the scanna
Pussy split on my bannana
Take they pic on who they gone sample
To Michigan back down to Alabama
Poped hypontic be the flava
That water their jaws for the milk they shake up
Captain save em
A.K. just gone lace up the beat
To be a suckas favorite
Top it off for the celebration
After I bang her I'll let you cake her
You were too seet she needed a banga
Make her melt let it drip through her fangers
Sexy, Goregous, Beautiful
Would you do something real freaky tonight
Now I'm in the limelight
This rose gold bring plenty dikes
They come around to service me because they know I lay the pipe
I'm running wit the king we in different cities every night
Broads strippin out they clothes before the D.J. pass the mic
Puerto Rican mama citas, Asian bitches mixed wit white
They come to see the P$C in many skirts and see threw tops
I love this life
That's main reason I ain't settle down ain't got no wife
I'm down wit the squad
Done wit the hard
I be pimpin' these hoes for the rest of my life
Sexy women freaky ladies
Squeezin T.I.P.'s Mercedes
Kissin' women, eatin ladies, lick 'em till they drikin babies
Like Rick James was in the 80s young and rich and livin' crazy
Kisha, Kim, Mari, and Kayla
Love to keep the reefa blazin'
And the new and imitated
Lou that's hollow point fim that's playin'
Actually they demonstratin
Orally Administratin
Conversation here 'em sayin'
Pills'll make you fill amazing
Wish I could do this everday
Anticipaten this occaision"
86,Live Your Life,2008,Paper Trail (2008),Hip Hop,T.I.,"(T.I.)
Ay, this a special what's happenin' to all my
All my soldiers over there in Iraq
Everybody right here
What you need to do is to be thankful for the life you got
You know what I'm sayin'?
Stop lookin' at what you ain't got, start bein' thankful for what you do got
Let's give it to 'em, baby girl, hey
You're gonna be a shining star
With fancy clothes and fancy cars
And then you see, you're gonna go far
'Cause everyone knows who you are 
So live your life 
 Ay-ay-ay
You steady chasin' that paper
Just live your life 
 Ay-ay-ay
Ain't got no time for no haters
Just live your life 
 Ay-ay-ay
No telling where it'll take ya
Just live your life 
 Ay-ay-ay
'Cause I'm a paper chaser
Just livin' my life, my life, my life
Just livin' my life, my life, my life
Nevermind what haters say, ignore 'em 'til they fade away
Amazing they ungrateful after all the game I gave away
Safe to say, I paved the way for you cats to get paid today
You still be wastin' days away now had I never saved the day
Consider them my protégé, homage I think they should pay
Instead of being gracious, they violate in a major way
I never been a hater, still I love 'em in a crazy way
Some say they sold the yay, and no, they couldn't get work on Labor Day
It ain't that black or white, it has an area the shade of gray
I'm West Side anyway, even if I left today and stayed away
Some move away to make a way, not move away 'cause they afraid
I brought back to the hood, and all you ever did was take away
I pray for patience but they make me wanna melt they face away
Like I once made 'em spray, now I could make them put the K's away
Been thuggin' all my life, can't say I don't deserve to take a break
You rather see me catch a case, then watch my future fade away
You're gonna be a shining star
With fancy clothes and fancy cars
And then you see, you're gonna go far
'Cause everyone knows who you are
So live your life 
 Ay-ay-ay
You steady chasin' that paper
Just live your life 
 Ay-ay-ay
Ain't got no time for no haters
Just live your life 
 Ay-ay-ay
No telling where it'll take ya
Just live your life 
 Ay-ay-ay
'Cause I'm a paper chaser
Just livin' my life, my life, my life
Just livin' my life, my life, my life
(T.I.)
I'm the opposite of moderate, immaculately polished with
The spirit of a hustler and the swagga of a college kid
Allergic to the counterfeit, impartial to the politics
Articulate but still'd grab a nigga by the collar quick
Whoever havin' problems with they record sales, just holla T.I.P.
If that don't work and all else fails, then turn around and follow T.I.P.
I got love for the game, but ay, I'm not in love with all of it
Could do without the fame and rappers nowadays are comical
The hootin' and the hollerin', back and forth with the arguin'
""Where you from? Who you know? What you makin'? What kind of car you in?""
Seems as though you lost sight of what's important when depositin'
Them checks into ya bank account, and you've up out of poverty
Your values is in disarrayed, prioritizin' horribly
Unhappy with the riches 'cause you're piss-poor morally
Ignorin' all prior advice and forewarnin'
And we mighty full of ourselves all of a sudden, aren't we?
You're gonna be a shining star
With fancy clothes and fancy cars
And then you see, you're gonna go far
'Cause everyone knows who you are
So live your life 
 Ay-ay-ay
You steady chasin' that paper
Just live your life 
 Ay-ay-ay
Ain't got no time for no haters
Just live your life 
 Ay-ay-ay
No telling where it'll take ya
Just live your life 
 Ay-ay-ay
'Cause I'm a paper chaser
Just livin' my life, 
 my life, 
 my life 
Just livin' my life, 
 my life, 
 my life 
Got everybody watchin' what I do
Come walk in my shoes
And see the way I'm livin,' if you really want to
Got my mind on my money, and I'm not goin' nowhere
So keep on gettin' your paper, and keep on climbin'
And look in the mirror, and keep on shinin'
'Til the game end, 'til the clock stop
We gon' post up on the top spot
Livin' the life, my life
In a brand new city, got my whole team wit' me
The life, my life, I do what I wanna do
I'm livin' my life, my life, I will never lose
I'm livin' my life, my life and I'm not stopping
So live your life"
87,Live in the Sky,2006,King (2006),Hip Hop,T.I.,"What's happenin', man
It's T.I.P., you know
I'd like to dedicate this song to anyone who done ever lost somebody
To the grave, to the streets, or to the jail cell
I done been in situations when I had to cope with all three, you know what I'm sayin'?
I feel like the only thing I ain't done yet is die, you know
But it ain't how I live while I'm here
It's how I live when I leave, you dig?
Life's ups and downs, they come and go
But when I die, I hope I live in the sky
All my folk who ain't alive, I hope they live in the sky
Pray to God when I die that I live in the sky
It's true, what goes around comes back, you know
So when I die, I hope I live in the sky
All my folk who ain't survive, may they live in the sky
Tell God I wanna fly, let me live in the sky
My cousin Toot ain't have to die, right in front of his son
And his wife, he lost his life strugglin' over a gun
Give a damn what he done, it's my motherfuckin' fault
And I loved that nigga to death, no motherfuckin' joke
I can fell my eyes fillin', the Lord is my witness
If I catch 'im, I'ma kill 'im, I made it my business
Back in the day, you stayed in my business
Taught me I ain't have to incorporate yay in my business
Coincidentally, that's why today you're not with me
My cousin died over some yay and I miss him
Plus he had his family out, let's say she the eyewitness
But her boyfriend did the shootin', judge gave a light sentence
I heard that, now I'm dressed up in all black
Shot up the whole 'partments, and still ain't brought back
The best friend I had in Tremell, I lost that
Guess your death was a lesson in life, it taught me that
Life's ups and downs, they come and go
But when I die, I hope I live in the sky
All my folk who ain't alive, I hope they live in the sky
Pray to God when I die that I live in the sky
It's true, what goes around comes back, you know
So when I die, I hope I live in the sky
All my folk who ain't survive, may they live in the sky
Tell God I wanna fly, let me live in the sky
You ain't never seen a nigga ago to jail and sleep till day 2?
Well, that's how sick I was when J-Rue
Found out the hard way that was powder that they were tootin'
Overdosed on herion, died at 22
If ya ain't heard about your daughter, she smiles just like you
So cute, even resorts to violence like you
You know your baby mama loose, but ha, what can you do?
And I got for myself, yep, it's been a few
Now everything I do is for King, Messiah, Deyjah, Domani
Tell the Lord, they all I got, so please don't take them from me
From me standin' in the trap with Curran and Sir Cap
Laughin' at the niggas who serve with no strap
Tell 'em niggas, man, y'all trippin' with no maps
Get robbed and that's the part where my pistol ain't no help
Me, you, the crew just fell out over dough and a li'l crack
Never could apologize 'cause you died, that's why they say that
Life's ups and downs, they come and go
But when I die, I hope I live in the sky
All my folk who ain't alive, I hope they live in the sky
Pray to God when I die that I live in the sky
It's true, what goes around comes back, you know
So when I die, I hope I live in the sky
All my folk who ain't survive, may they live in the sky
Tell God I wanna fly, let me live in the sky
I bet you niggas think I'm livin' it up
Till you see polices laughin' as they pickin' me up
Went from seein' how many bitches I could fit in the truck
To three hots and a cot, is you kiddin' or what?
Fuck how many millions I got, nigga, so what if I'm hot
When I got prices on my head, feds rushin' my spot?
A million haters want me dead, forced to carry a gat
""But you is a seven time felon, what you doin' with that?""
It's a catch-22, either you lose or you lose
That's the way the game's structured, for real niggas to suffer
And I ain't never been a buster, always stood on my feet
Like a man, prepared to take whatever comin' for me
A pussy nigga or polices with a warrant for me
I'm a G prepared to die for what's important to me
Look anybody in the eye who say he want it from me
Put up the house and bet the odds if it's coming from me
O.G.'s say I need to learn to be patient
You tellin' me with these seven years of probation?
Pistol charges and a host of other open cases
If niggas only knew the kind of time I was facin'
I try to keep it to myself, but sometimes I couldn't it
Got four kids, the smiles on they faces
Mean more to me than my crown and my bracelet
Take that away from me and my life is butt naked
Life's ups and downs, they come and go
But when I die, I hope I live in the sky
All my folk who ain't alive, I hope they live in the sky
Pray to God when I die that I live in the sky
It's true, what goes around comes back, you know
So when I die, I hope I live in the sky
All my folk who ain't survive, may they live in the sky
Tell God I wanna fly, let me live in the sky
Ay, man, I'd like to dedicate this song to my cousin Toot
Alejandro Tremell Morgan, man, I miss the shit out you, my nigga
I'd also like to dedicate this to my homeboy J-Rue
Jamal Hendrix, what's happenin'
Also my partner Bankhead, (??), what it is, nigga
P$C for life and death
And my li'l homeboy Poncho, and my li'l homeboy Rico
I shed tears writin' this song, homeboy, that was real talk, man
Ay, I wanna live in the sky
Hey, let me live in the sky
Pray to God that I live in the sky"
88,Live on Tonight,2012,Trouble Man: Heavy is the Head (2012),Hip Hop,T.I.,"I'm on the road the day I die
That unchangeable surprise
No waking up but don't you cry
Let your dreams live on tonight
Uuuuh Uuuuh
Uuuuh Uuuuh
Uuuuh Uuuuh
Live on tonight
Yeah
Yeah
Hustle Gang nigga!
Aye
Leggo!
We do it big, going hard, get it in
I tell make my hustle full fittin in
I'll catch a fair cake, go to prison then
Turn around, do the same shit again
Down back, countin' rack
A hundred kilo champagne, hey I drown that
Loud pack, burnt up
Do the iMAX bid, shorty turnt up
The American dream, I'm livin' in it
To Trayvon get some Jesses, I kill a bitch every minute
Yeah talk, give a damn about the sentence
You ain't down to die for something
Your life ain't worth living
I'm on the road the day I die
That unchangeable surprise
No waking up but don't you cry
Let your dreams live on tonight
Uuuuh Uuuuh
Uuuuh Uuuuh
Uuuuh Uuuuh
Live on tonight
Yeah
That right
Family Hustle nigga
I'm livin' so my sons and daughters never see martyr
Get it, spend it today, save something tomorrow
A young king's Arthur, learned from my father
Tomorrow 50-50, today is our hour
Damn right, 24 hours, 365
Push it to the limit, switchin lanes on the highway
Like fuck it, if I diw today I die in pain
I'm straight nigga, straight bullets in your driveway
Man the game, man the game, why should I play?
For my fam, my life, damn alley
Put it on the line, never mind the consequences
You ain't down to die for something your life ain't worth living
I'm on the road the day I die
That unchangeable surprise
No waking up but don't you cry
Let your dreams live on tonight
Uuuuh Uuuuh
Uuuuh Uuuuh
Uuuuh Uuuuh
Live on tonight
Ahuh
I ain't finish, leggo
You know a trouble man ride with a hundred band
Bet it all, win or lose, it ain't nothing man
Modern day, near perfect, I'm the son of man
Every summer kill shit, call me Son of Sam
Big chain, big car
I could buy a big house on my black card
Them other suckers only wanna act hard
Hustle Gang, we jump off, flow stunt hard
So respected, I don't even need a bodyguard
But if it fully automatic then it probably hours
Real talk, give a fuck about the sentence
If you ain't down to die for something your life ain't worth living
I'm on the road the day I die
That unchangeable surprise
No waking up but don't you cry
Let your dreams live on tonight
Uuuuh Uuuuh
Uuuuh Uuuuh
Uuuuh Uuuuh
Live on tonight"
89,Long Live da Game,2003,Trap Muzik (2003),Hip Hop,T.I.,"YEA...
Dis for all my niggaz who think dey hard...
(Laughing)
You wanna know what's hard (what's hard pimp?)
Goin' about yo day nigga losin yo life at the end of it
Now dats what's hard...(MINDING MY MUTHAFUCKING BUSINESS)
Let me tell y'all 'bout the last day I lived nigga
I'm in the 96 Impala with the gat in my lap
Annihilating any nigga tryin' to work in my trap
Now see the feds got me tap'd
So to keep 'em off of my bac
I got a crib in the trap and a crib to relax
Now my indictment was a secret and that's the way that they keep it
If I ain't have a hoe givin' head to the feds
Comin' bac tellin' me exactly what they said
I'm a dead man walkin'...
Waitin on time in jail
But I'll die before I let 'em stop my mail
Long as I got another ounce to sell
What the hell I'ma bail? a grap my scale
Get another key and I'ma slang my yayo
Niggaz on the westside can't re-up becuz it's a drought
So I check the crack house...
DAMN it sold out
So back to the crib so I can check this stash
Ain't sure about how much dope I had
Got a couple keyz in the safe right now
Weigh it up cook it up then chop it down
Now I'm ready to go and pick up my fetti
But before I leave the house I can't dip without grabbin my G'z
And my keyz to my brand new V put 'em in pocket with the gat to see
Niggaz pleeze nigga you holla bout freeze
Put this red dot to ya ass and squeeze
Now I'm dippin bac to the swats
With the 4-4 and a plastic glock
Turned around and I had to stop
Couldn't trap swarn it wuz cops
Standin there and I still ain't scared
Mac Boney nem must have fled
Only cops is I fear is the feds
On my car flashin blue and red
Damn there dey go now its time to dip
Got the 4-4 right my hip
9 millimeter wit a extra clip
Dats what y'all niggaz get fuckin' round wit TIP
Bustin' at 'em
N cussin at 'em but ain't no shakin 'em
Them bullets dat they wuz bustin' at me my vest wuz takin' 'em
Makin' dem pigs fall in pain
Turned around 'cause one call my name
Took a hot one to the brain
Yeah I died but LONG LIVE THA GAME..."
90,Look What I Got,2003,Trap Muzik (2003),Hip Hop,T.I.,"(Ad lib)
Ay, ay, ay, ay, ay
You think them niggaz is hot
Well shawty look what I got
(Nigga look what I got)
You think I'm lying nigga
Look what I got
Ay, ay, ay, ay, ay
Shawty look what I got
Ay, pimpin' look what I got
Look what I got
My nigga look what I got
(Verse One)
Big wheels still spin when I stop
Presidential roll, gold rolex watch
With no rocks
I save them for the pinky
Keep you niggaz blinkin'
He ain't wearin' platinum, Naw
But I keep you niggaz thinking
Mink seats sure to keep a nigga sinkin'
Swear he ain't slangin'
But I know that nigga creepin'
Got a condo, in Orlando
For the weekend
Homes be so crunk in the club
We gotta sneak in
No more room in the V.I.P
They payin' just to peek in
When they leave
They be lookin' in a car
They can't even see in
And that's just the
Be-gin-ning
In the city that he in
He was rappin' in the cafeteria
But now that nigga serious
Heard he got a CL, a EXT on Spreewells
Several Chevy's on 24's
(Hold up), ""how many records he sell?""
Man I don't know
But he got a label now
Them boys, the PSC (hell)
I heard Atlantic gave 'em a deal for
2 or 3 mill. (ay, shawty)
(For real nigga?)
Look what I got
A old school, a truck and a drop
So next time you think them niggaz is hot
Shawty, look what I got
The respect of the niggaz and G's
So next time you say them niggaz is G's
You probably lookin' at me
A what, we ballin'
Bought the bar for the broads
So next time you think them niggaz is hard
Shawty, look at the squad
I'm buyin' yachts, have the streets on lock
So next time you think yo' peeps on top
Pimpin', look what I got
(Verse Two)
I'm well known in the hood
Like the dope man phone number
Roll anything I can throw some 24's under
Nigga talk bad 'bout the man
But I shole wonder
Why the dope boys fuck with 'em
And the hoes love 'em
Very little promotions on this album
Never heard of 'em
But it's jammin' like the fuck
Was jumpin' out the stores
'Cause I was born in the raid
And I'm made in the streets
I done played in the days
In the shade in the streets
I say I rapped in the trap
With the best in the streets
Shot craps in the back
You know the rest, nigga please
You doin' business with me
You best invest in some skills
I sell slopes of snow
I don't fuck with little blow nigga
Got 80 k's, it's gone take a little more (to what?)
To double up and bring it back
And make a little more (You movin' slow)
And movin slow, now what you take a nigga for?
I'ma cock hammers and 44's
And nail yo ass to the floor
And I ain't braggin', I'm just letting niggaz know
'Cause the media and radio can get a nigga so
Fucked up
Comparin' me to these niggaz little flow
I do a song
Fuck up they whole little show (so shawty)"
91,Love This Life,2012,Trouble Man: Heavy is the Head (2012),Hip Hop,T.I.,"I know it can get kinda tough sometimes you know
I know you can kinda get carried away with yourself
But err, why don't you be real with me and be real with you at the same time
You can't get what you get here nowhere else ma
Keep it real now
You know, You know (you know you love this)
You know you love this life
Don't nobody do you like me
You know, you love
You-you know you love this life
Don't nobody do you like me
You know
Cavalli dress and high heels
And drop tops on hot wheels
We live how we wanna live 'cause we got mills
Them other barely barely buy a hot meal
In VIP dem bottle poppin' do it B.I.G.
Come get with T.I.P. be ballin' till you D-I-E
Invisible set bracelet, see clearly
Take away your stress mean that sincerely
Problem solve 'em, nevermind that
Girlfriend see your bag, be like ""Where you find that?""
Plus, what's a what's a pre-nup you ain't got to sign that
You up take half, imma make it right back
I'm a hustla hustla to the heart
What's the sense in leaving me and be back with them with-them busters
Bentley for your birthday, Goyard Purse day
Deal with them stacks know you gotta love that
Man of Respect on a big jet
With a big big and a big check
I pop big shit, how good does it get
Ya leave me, where else you think you could get this?
Yeah, you could get another guy to beat that beat that for ya
Them busters cowards though, and I'll take a bullet for you
Mansions, jewelry all I need is for you and me to have some understanding
Have a couple candid conversations
Your frustrations I take in consideration
I'm rough around the edges, don't bat with me and be patient
And you're sadly mistaken if you think I'm into chasing
My heart is RSVP I've extended an invitation
And don't go wasting your time with what they saying online
Your positions divine, don't believe look around
I got a strong mind and kind heart
With a soft kiss but I love hard
Don't you love this life like I love you
Anything you could ask, do it for you
Drop Jags, Berkin bags, Louboutin heels
Summer homes in Miami, Hollywood hills
Vacation in Monaco, Ibiza
On the French Riviera with our feet up
Our lifestyles so rare, you know you ain't going nowhere"
