,song,year,album,genre,artist,lyric
122,Sorry,2012,Trouble Man: Heavy is the Head (2012),Hip Hop,T.I.,"My cup runneth over with Pinot Grigio, hold up
You bogus in the lambo if you ain't lifting the door up
You bogus poppin' pills if you ain't pickin' the ho up
You bogus running out on your kids my nigga grow up
For God's sake, like a wedding, cutting large cake
For large stakes let the hammer bang broad day
Ay, nevermind what the blogs say
This what my mind and my heart say
My philosophy profit off of my properties
Get it, flip it, we got to be rich, that broke shit is obsolete
Possibly off of my rocker, watch how you watching me
Sophisticated, psychotic, fly as a pilot
Officially silent, all you wish you could get I got it
Unlimited titanium nigga, what's in yo wallet?
Out of gladiator college, I made it summa cum laude
While you clowns couldn't have got a cap and gown if you bought it
I parlay with Saudis, buying crude oil and diamonds
Hustle January, July, fly to Dubai
A broke nigga telling me 'bout how I'm dividing the pies
Like a blind nigga telling me it's an eye for an eye
Bullheaded and stubborn I be that way until I die
But find a nigga with more hustle than me I dare you to try
And according to the hand on my Audemar
It's my time to shine so fuck y'all
What should I be sorry for
Who should I be sorry to
What should I be sorry for
Who should I be sorry to
The fact is you can't please everybody
You can't please everybody
What should I be sorry for
Who should I be sorry to
I grew up in the gutter, life a motherfucker
I get that why I don't trust a motherfucker
Seen a nigga snitch on they mom, shoot at they brother
Go to prison in love with a bitch and a nigga fuck her
I seen real G's destroyed by real suckers
Innocent ladies raped and defenseless babies abducted
Such a horrible truth, but you see it over and over
It's nothing, you numb to it and your heart grow colder
Pacify your pain with a chain and a Rover
Fuck it, justify your action by stacking your dough up
You show up with a brick of cocaine and baking soda
Just enough for me to blow up, nigga hold up
Switch the flow up, cause these niggas be snitchin' so much
I promise all they missing's the badge, coffee, and donut
Go to jail so what, never see my integrity perish
That ain't the Harris' way, study my pedigree
Promise I'm one of the only ones who keep it 100
Probably why I think they all out to get me, you can't convince me
Large money and fame will plant seeds of envy
To make my partners resent me enough to come and get me
Catch me slippin' and hit me, just like they did 50
'Cause I'm in the position that he think he should be given
Listen, dawg, the fact of the matter is
I'm on a narrow path and we all can't travel
What should I be sorry for
Who should I be sorry to
What should I be sorry for
Who should I be sorry to
The fact is you can't please everybody
You can't please everybody
What should I be sorry for
Who should I be sorry to
What it ain't, what it is?
Even if you gotta live
I learned that apartment is way more exciting than a big ass house on a hill
I used to be a way better writer and a rapper
When I used to want a black Karmann Ghia
Now a nigga speeding in a Porsche
Feeling like I'm going off a course
Cut these fuck niggas off
Nigga Tip in my life, scream that till I'm hoarse
Duck these get the fuck off me projectiles,
Bitch you ain't really got a choice
I'm living my life live yours
I don't even like rapping fast, but that's how the word come to me
Talk to me sideways nigga that's your ass
Slow it down, this that shit that'll make you call your momma
Say hey I'm sorry for begging for all them clothes you couldn't afford
And this the type of shit that'll make you call your rap partner
And say I'm sorry I'm awkward, my fault for fuckin' up the tours
I hated all the attention so I ran from it
Fuck it if we did, but I hope we ain't lose no fans from it
I'm a grown-ass kid, you know ain't never cared about no damn money
Why do we try so hard to be stars, just to dodge comments
And this that shit that'll make you call your baby mama
When you gone on half a pill, don't know why but that I did
Then you take a flight back to the crib, y'all make love like college kids
And you say all the shit you gon' do better, we can try this shit again
'Round the time the dope wear off, you feel stupid, she feel lost
That's that dope, I mean, I mean dopamine you think Cupid done worn off
Waiting in the hallway with her arms crossed
Her baby boy face full of applesauce
Maybe should have stayed but it ain't yo fault
Too much pressure, I fell off, I'm sorry
Was young and had to choose between you
And what the rest of the world might offer me, shit what would you do
Well I'd probably do it differently if second the chance
Only if some cool ass older man would've let me know in advance
This, this quarry, that is dug so deep in a father's chest
When he feel that he's broken up his nest
And he figured shit he was just doing the best that he could
Which end up being the worst that he could
And all some pussy nigga on the internet can say is that verse ain't good
It's boring - boring?
Really?
When I'm disgusted with this world and I can hardly breathe and
Told so many lies, don't know what to believe
I discussed it with this girl, and this is what she said
She said lay down baby, baby, rest your weary head up
I love these distractions but my mind don't wanna rest
But my body disagree so I laid up on her breasts, yes
Ooh, you are so fucking fine
I woke up the next morning with new purpose on my mind
Ooh, who pulls your ponytail
Who knows your body well
What should I be sorry for?
Who should I be sorry to?"
123,Stand Up,2004,Urban Legend (2004),Hip Hop,T.I.,"(Lil Jon)
Check this out my nigga (what's up) theirs a lot of niggas out here
That got a lot of shit to motherfuckin say (yeah)
But when a nigga bring it to them niggas (what's up)
They can't stand up for what they motherfuckin said
(Naw I ain't say that, he said that) Stand Up
If you got something to say my nigga, stand up for what you said... my nigga
Tell them niggas bring it to the square nigga
Stand up... If you don't like what I'm saying then buck
Swang when you see me, we can throw them hands sucker
Stand up... If you ain't notice nigga, I don't give a fuck
If I said it, then I meant it, and what fuck nigga
Stand up... You don't wanna see the triggerman man buss
Hit you and your man's up, make it hard for a nigga to... stand up
Tell your crew they don't want it with us dudes
And if the motherfucka do, bust a motherfuckin move... stand up
(T.I)
You got a alligator mouth and a hummingbird ass
Your mouth writin' checks that ya ass can't cash
One forty-five and I'm outta ya weight class
Wanna survive... better scramble like eggs and break fast
'Cause I know how to handle ya fake ass
I'm ride on ya, and hide ya in yesterday's trash
Pull up in the chevy spraying rounds through the glass
See you laying face down in the grass and I laugh
Ha... that's the end of the soga
The end of my problems, nigga mash the impala
Go lay up with a model and watch the news tomorrow
And that's the end, checkmate, game over, I'll holla
Now I'm telling ya potna, you don't know whatcha doing
Don't recognize the trouble ya getting into, and ya ruined
Dig this man... I spent my childhod in a wild hood
And all that gangsta shit ya talking, yeah it sound good
But make it understood, you gonna have to show me
I'm a OG, you wanna overthrow me
(Trick Daddy)
Dearly beloved, we gathered here today to marry this young nigga
In his own special thug way
Do you promise to love and respect, all of the real niggas
And when the problem come, learn to deal with'em
Do you swear to turn the chopper on any motherfucker in ya path
Or any bitch, that's tryin' to stop ya
And do you promise to keep'em handy, and don't hand'em
To nobody, nobody except family and keep'em cocked and loaded
And don't expose'em to nobody unless somebody want'em in his body
To love and cherish'em from his trigger to his barrel
From the bottom of ya heart, to death do you fuckin' part
Do you understand to live the life by him, is to sell ya soul
And Lord knows you gonna die by him
I know you heard gun stories about John Wayne and Billy the Kid
Sheed... all them motherfuckers dead
And did you know that every other bitch from the wild wild west
End up dying from hollow points to they fuckin' chest
'Cause they ain't never seen or cocked beamed a milli fourteen
Or tommy gun, with a hundred round fucking gun
(Lil Wayne)
Sheed... I'm talking about riding out tonight
Only way I die first, gotta kill me in this verse
Weezy F, middle finger to life
So nothing seem critical, in the hood I'm typical
Yeah I'm feeling good and spiritual
Healing hoods with shit up outta my kitchen
I'm pitching it, it's really good
Smoking, drinking I'm like a fish and I'll probably
Shit on ya bitch, probably piss on her lips
And she'll probably give you a kiss, nasty
Holly grove classic, parley with a nigga, prolly rob the same bastard
Ask him, we don't give a fuck about a casket
Nigga this the murder cappy, niggas just murder happy
Twelve years old, I jumped off the pot
I started selling rocks, right after I got shot
I had to hold my weight down
Pussy nigga stand up or lay down"
124,Stand Up Guy,2006,King (2006),Hip Hop,T.I.,"Ay, I know you done kicked it with a lot of niggas before
But ye ain't never kicked it with a nigga like me, though
(Hey, Hey)
I see ya baby, throw ya hands up high
If you wanna come and kick it with a stand up guy
Because the rocks gon' glisten and the drop's on 20's
Bend it over, let it drop if you wanna roll wit me
I say all my sexy ladies throw ya hands up high
If you wanna come and kick it with a stand up guy
Because it don't get better, niggas don't gett cheddar
Like that fella in the yellow Purple Label silk sweater
Bitch, stones keep glowin' on my wrist like whoa
And she can't stop lookin,' I know ya bitch like those
And she chose, ain't no question if the bitch might blow
Just get her to the crib, get her whole back sore
I'ma blow my dro, I'ma pop my pill
Ask anybody, ""Wanna take a shot? I will""
Might see me in a different color drop hot wheel
With the top down low and the Glock concealed
I got mine high up, boostin,' racin' up the block, one mil
If the police try to chase me, you know they a done deal
I got skills, anybody wanna come test
Bet what's in this .45 be up in your chest
Yeah, I know ladies wanna kick it with a nigga so fresh
Who could spend 100k any day, no stress
The watch's insane, the chains is grotesque
Stay still if you wanna, like he ain't earn cash
I see ya baby, throw ya hands up high
If you wanna come and kick it with a stand up guy
Because the rocks gon' glisten and the drop's on 20's
Bend it over, let it drop if you wanna roll wit me
I say all my sexy ladies throw ya hands up high
If you wanna come and kick it with a stand up guy
Because it don't get better, niggas don't get cheddar
Like that fella in the yellow Purple Label silk sweater
If you got a man and you're tired of being there
And done gave him too many chances and tired of being fair
I offer you the opportunity to ride with a playa
You, me and a couple of freaks in the ride with a playa
Nevermind those outside when they stare
'Cause the chrome 24's on the ride give a glare
Because it's one guy and you decided to share
As long as you having the time of your life, who cares?
Man, we all sinners, what matters is in the center
I know God see my heart and I'm a stand up nigga
You can't beat me 'cause ye ain't man enough nigga
I look him in the eye and tell him, ""Man up, nigga!""
You really getting money? Throw a grand up, nigga
Wanna fight? You should've hit me when you ran up, nigga
This Smith & Wesson hammer 'bout to slam, fuck niggas
Go and kick it with the hoes, throw ya hands up with 'em
I see ya baby, throw ya hands up high
If you wanna come and kick it with a stand up guy
Because the rocks gon' glisten and the drop's on 20's
Bend it over, let it drop if you wanna roll wit me
I say all my sexy ladies throw ya hands up high
If you wanna come and kick it with a stand up guy
Because it don't get better, niggas don't get cheddar
Like that fella in the yellow Purple Label silk sweater
Niggas ain't know me 'cause I live so special
Try to stay low key but I'm still so special
Flat screen's in the floor, quarter mil' in the dresser
Jewelry box glowing like a long lost treasure
I'm chillin' with Vanessa, met a girl named Heather
Told her ""Hi, how ya doin'? Buy a drink? My pleasure""
Told her if she got a homegirl, go tell her
That I got a hard rug, I could go for whatever
She said that if Vanessa wanna touch it, just let her
She laughed out loud, shocked 'cause just met her
Bought the dro', get low, and its only one-fifth
And it's four pills left, do you wanna come with?
I see ya baby, throw ya hands up high
If you wanna come and kick it with a stand up guy
Because the rocks gon' glisten and the drop's on 20's
Bend it over, let it drop if you wanna roll wit me
I say all my sexy ladies throw ya hands up high
If you wanna come and kick it with a stand up guy
Because it don't get better, niggas don't get cheddar
Like that fella in the yellow Purple Label silk sweater"
125,Stay,2014,Paperwork (2014),Hip Hop,T.I.,"I love you and I know you love me too
(I love you shawty)
I love you and I ain't ashamed to beg you to stay
(I know you love me)
So that we can be together forever
(So high, I get what I need from you
Shawty I get on my knees for you
And I get what I need from you
I get on my knees for you
You wanna go to war, wanna live in peace
Wanna be right or be with me
You wanna go to war, wanna live in peace
Wanna be right or be with me
Who? Me! Who? Me
Wanna be right or be with me
Who? Me! Who? Me
That's not rhetorical, answer it, please)
I wonder would it matter much
If I never fucked and I just fell in love
Or maybe if I never fell in love and I just fucked
I swear, man, shit was simpler when I was sellin' drugs
You ain't know me then though, ain't that what ya think
You was in the bed, I was trafficking the thing
Man after everything we will never be the same
Man I'm tired of tellin' lies, know you sick of playin' games
I remember you got a tattoo, put my name on it
Put you in a wedding dress with a train on it
I went and spent a whole mil just to go chill
In Miami, and I be damned if she don't know my love real
How dare you compare me to dude, girl chill
My piece so close up on it, you don't see what it is
Shawty, I die, kill, for you if you keep it real
Go to jail, even if I gotta kneel I will
I love you and I know you love me too
(I love you shawty)
I love you and I ain't ashamed to beg you to stay
(I know you love me)
So that we can be together forever
(So high, I get what I need from you
Shawty I get on my knees for you
And I get what I need from you
I get on my knees for you
You wanna go to war, wanna live in peace
Wanna be right or be with me
You wanna go to war, wanna live in peace
Wanna be right or be with me
Who? Me! Who? Me
Wanna be right or be with me
Who? Me! Who? Me
That's not rhetorical, answer it, please)
I can't see you with no me
But, you left me and I'm just me
So, I'm gon' be what they gon' be
And I know he want you but they want me
Girl, together or apart
But you be forever in my heart, I swear
And even if we end up here, I know it hard
I never love that way again, I swear to God
I be breaking down, you be playing hard
She chose to bid it all, watch how you play your cards
Now you runnin' 'round town with education hatin' broads
Going at me, got me hot, but hold up, how is they involved?
And you can't say that I ain't changed
Your whole life since we met that day
And when we get it right, God bless that day
But until then, shawty, I just pray
And I just say
I love you and I know you love me too
(I love you shawty)
I love you and I ain't ashamed to beg you to stay
(I know you love me)
So that we can be together forever
(So high, I get what I need from you
Shawty I get on my knees for you
And I get what I need from you
I get on my knees for you
You wanna go to war, wanna live in peace
Wanna be right or be with me
You wanna go to war, wanna live in peace
Wanna be right or be with me
Who? Me! Who? Me
Wanna be right or be with me
Who? Me! Who? Me
That's not rhetorical, answer it, please)"
126,Still Ain't Forgave Myself,2001,I'm Serious (2001),Hip Hop,T.I.,"(Singing)
[T.I. Talking:] Still ain't forgave myself... damn
It's a lotta fucked up shit that go down man...
You don't even know the half...
Man I been in and outta trouble since an adolescents
Spoiled rotten, dead fresh, wit no daddy present
I got two uncles, Quint and Man and they keep me straight
7 and 8, I'm countin' money while they movin weight
My daddy send me clothes and always tell me come and see him
I say aiight but still I feelin' like my momma need him
They sendin letters home from school, nobody read mines
And plus my uncles, doin' 10 years F.E.D. time
Then I started rebellin, began crack sellin
Tha littlest thang on the corner wit a Mac 11
After school I hear my momma holla homework
I say aiight ma, but look I got my own work
Started interactin wit fiends at the age of 13
Now my momma findin rocks in my socks, glocks in my toy box
Like damn, why do trouble come to me like this
But on the real, it ain't even have to be like this (fuck)
Mistakes made on this road to wealth
I still ain't forgave myself
Ay, what I am today
I made myself but I still ain't forgave myself
For runnin' to the grave getting closer to death
I still ain't forgave my self
For anyone who ever wondered how I felt
I still ain't forgave myself
At 14 man, thought I knew everything
I'm slangin slabs, trappin hard, movin heavy Cain
I bought an '85 cutlass on some dane-a-danes
Now I'm the shit, huh, the motor blew in 30 days
Hardheaded man I ain't listen to anything
I'm getting money so, I'm right and I got plenty game
Besides why I need school, I'm'ma be rappin' momma
If that don't work, then I guess I'm'ma be trappin momma
But hey I promise I'm'ma make it 'cause I'm damn good
I'm'ma get us out this hood and off these can goods
School just a white man game, and it's ran good
At 16, here's my introduction to manhood
Blue lights behind me, damn what I'm gonna do
'Cause I got 2 pounds of weed and a 3.80 too
I guess everything'll be aiight if I just keep it cool
How ya doin' officer, what ya mean why I ain't in school
Can you search the car?? Yeah but, I rather that you didn't
Besides it's just a waste of yo time cause ain't nutthin in it
[Laugh] I guess that's when I seen, that I ain't know shit
When stuck in a place wit freedom I ain't gone get... (Damn!)
Mistakes made on this road to wealth
I still ain't forgave myself
Ay, what I am today, I made myself
But I still ain't forgave myself
Guess these the chances ya take, when dealt the cards I was dealt
But I still ain't forgave myself
For anyone who ever wondered how I felt
I still ain't forgave myself
Outta all the niggaz I was wit when I was doin' wrong
3 in the fed, 1 doin' life, and 2 dead and gone
Knew there was more to life than sellin blow and chopper bustin'
But what's the good in knowin' better if I ain't tell 'em nutthin
I knew I coulda told Cap not to kill shawty
Put down the gun, get in the car let 'em live shawty
You'll probably get locked up, and I'll probably have a deal shawty
Naw, I ain't scared, I'm just telling ya like it is shawty
Coulda told Endae, Quint, and Kern, man ya covers blow
Leave that country town alone, y'all needa come back home
Bankhead and J-Rue, I just feel like if I was wit 'em
They woulda never got killed that night if I was 'em
Seem like I coulda done mo', said mo'
Why all my partners gotta be dead or in the fed fo'??
All the time, I just wish that y'all could ball wit me
Sometimes at night I close my eyes, and dream that y'all wit me (damn.)
And even though they say I can't blame myself
I still ain't forgave myself
For all the mistakes made on this road to wealth
I still ain't forgave myself
What I am today, I made myself
But I still ain't forgave myself
For anybody who ever wondered how I felt
I still ain't forgave myself
And yeah they say I can't blame myself
But I still ain't forgave myself
Fo the mistakes made on this road to wealth
I still ain't forgave myself
Guess this the chance that you take, when dealt the cards I was dealt
But I still ain't forgave myself
For anybody who ever wondered how I felt
I still ain't forgave myself (Ain't Forgave myself)
(Talking)
Yeah, for anybody who ever wondered how I felt
Anybody who ever wondered what's wrong wit me, here it is...
3 16's of what's in the heart of T.I.P.
This song is dedicated to everybody who ain't here wit me
Cap, damn... you fucked up shawty, but when you get out
If I live to see it, its gone be on again ya know what I'm sayin'
And we ain't gotta worry bout goin' to jail shawty we legit now
Ya know what I'm sayin'... Cern, Quint, Endae, y'all gone get out man
And when you do I'll be there shawty... always
Bankhead, J-rue, I'm sorry man, some shit I can't change
When I get up there, we gone ball again, open the gates shawty let me in...
We gone ball. J-Rue man I know money ain't worth a friend shawty...
I fucked up bad man... I still ain't forgave myself
My momma, sorry I ain't graduate but
Hell we rich now it don't matter. My uncles shit,
It don't matter either... y'all back.
Well hell... My Lil' boy (music stops)
You betta not do the same shit I did
Or I'm'ma whoop yo muthafuckin ass..."
127,Strip,2010,No Mercy (2010),Hip Hop,T.I.,"(Trey Songz - Chorus)
After the club... strip
When I get you home... strip
We on that grown shit baby hop up on this
You ain't neva meet guy like me
And when the valet pull up shorty ride with me...
And Imma take your clothes all off (strip) take your clothes all off (strip) clothes off (strip) clothes off clothes all off (strip) Imma take your clothes all off (strip) take your clothes all off take your clothes (strip) your clothes clothes all off
(T.I.)
Ayee we can buy the whole bar but when the club close off we Immediately rode off... to the old loft
You know what I told y'all we pull up your clothes off pussy fill the whole house they trippin' drop them hoes off... and no panty no bra no shoes no socks see how good your toes are the going good so far... they driping striping going in drinking striping rolling pussy with it old shit spray trey say put your nose in... first round going down pop another go again panty to the floor again fuck her till she soar again pimpin' in motion I'm sexing no emotion I don't love err one of you I fuck who's ever closest... we be on the grown shit that gangster alcopone shit you know what you gonna get... strong back long dick you say no that's the wrong shit that wont get you home with us you hear this song bit know if its us you going home with
(Trey Songz - Chorus)
After the club... strip
When I get you home... strip
We on that grown shit baby hop up on this
You ain't neva meet guy like me
And when the valet pull up shorty ride with me...
And Imma take your clothes all off (strip) take your clothes all off (strip) clothes off (strip) clothes off clothes all off (strip) Imma take your clothes all off (strip) take your clothes all off take your clothes (strip) your clothes clothes all off
(Young Dro)
Aye look aye check this
Ayee shortys pocket fat rodger that beside your coat beside your hat parda bag shorty bad ATL model ass Dro soon as she proceed to strip I'm on top of that doogy style splash arch your bac ooh gurl holla bac we up (up) in the club ain't to much that we can do in here but pop a couple bottles and see who I wanna screw in here I'm ryan bently cope tonight I can't be number 2 in here... your gurl was on that red bull I think that boy a fool in here... bubble gum game tell that chick I want some tru in here if all these brods strip in here I might just find my boo in here... Imma leave from the club show up at the house pig gonna say shorty realier than a mouth Imma show her what I'm about when I push her head south tell ha go head blow a nigga out... I'm showing out watching my behavior I got flavor... these skills I have I'm always waiting on my neighbor and every time I see them hoes I shock them like a taser and when I leave this club only dick is what I gave her
(Trey Songz - Chorus)
After the club... strip
When I get you home... strip
We on that grown shit baby hop up on this
You ain't neva meet guy like me
And when the valet pull up shorty ride with me...
And Imma take your clothes all off (strip) take your clothes all off (strip) clothes off (strip) clothes off clothes all off (strip) Imma take your clothes all off (strip) take your clothes all off take your clothes (strip) your clothes clothes all off
Unn hunn... come hereee
Unn hunn... come hereee
After the club... strip
When I get you home... strip
We on that grown shit baby hop up on this
You ain't neva meet guy like me
And when the valet pull up shorty ride with me...
And Imma take your clothes all off (strip) take your clothes all off (strip) clothes off (strip) clothes off clothes all off (strip) Imma take your clothes all off (strip) take your clothes all off take your clothes (strip) your clothes clothes all off"
