,song,year,album,genre,artist,lyric
66,Pass da Blunt,1997,Supa Dupa Fly (1997),Hip Hop|R&B,Missy Elliott,"(Feat. Timbaland)
Bitches
I never wanna hang with bitches
Since I turn Missy
Every bitch I meet be booty lickin'
My ass they kissin'
But I feel like they way to picky
I use to know a guy name Ricky
Oh really?
Don't piss me off and
Son, better let y'all know you lucky
'Cause if I come out buckin
The whole world better be duckin
'Cause I roll with Puffy
No Doubt
Shit turned out get lucky
No matter what you still love me
You whack, you buggin
Pass da blunts on the left hand side
Pass da blunts on the left hand side
We got the beats
You got the beats that make me jump, jump, jump
We got the beats
You got the beats that make me rocky dodi dum
Pass da blunts on the left hand side
Pass da blunts on the left hand side
I got the rhymes
I got the rhymes to make you jump, jump, jump
I got the rhymes
I got the rhymes to make you rocky dodi dum
Niggas
I always keep a good nigga
I get him for his figures
I A-K-A gold digga
See me with him
In a jewelry store
Buyin glitta
Should I not or should I?
I'm a get em, I'm a get em
Bitches
They mad 'cause I be flossin
Yeah this pussy costin
Tired and we tossin
You know I'm rockin'
Cause there will be no stoppin'
All that shit you poppin'
What that shit you talkin'
Welcome y'all
To Timbaland and Missy hit factory
A lot of people try and sneak in
And get the ingredients
But I am da man behind the ingredients
So please come to me with the recipe baby
You see me on the videos
And then you want to go and play me on the stereo
Mic check 1-2-1-2
Here I go
My style is supa dupa fly and yours is so so
You see me on the videos
And then you want to go and play me on the stereo
Mic check 1-2-1-2
Here I go
My style is supa dupa fly and yours is so so"
67,Play That Beat,2002,Under Construction (2002),Hip Hop|R&B,Missy Elliott,"To the beat y'all, play that beat (5x)
(This is a Missy Elliott exclusive)
(1st Verse)
When you wanna go around the world (I'm ready)
And if you want me to fight your ex-girl for you (I'm ready 2x)
If you need me to cook you meals (I'm ready)
And if you want me to come and chill with you boy (Suga' I'm ready)
You don't know how you got me
I've never been in so, but not me
I was always told not to be
Givin' up the [cat] easy
Something you do reminds me
Friends be tryin' to stop me
They can't believe you got me
Givin' up the [cat] easy
(2nd Verse)
When you need a backrub from working all day (I'm ready)
Uh when you need a chick to come over right away (I'm ready) (Like this)
When you need me to wash your clothes boy (I'm ready)
When you need me on the phone to curse out the hoes (Suga' I'm ready)
Boy there ain't none quite like you
Ask me and I'll always do
'Cause I got this thing for you
You know what a little [cat] can do
(Repeat)
I'm ready when your baby momma trips
So just call me come in doin' backwards flips
My darling
Would you like me bust her lips
'Cause I'm ready, show you I'm the realest chick
And I love you
I'll do what you want me to do
I said I love you
For you I'm more than a crew
I'm Mrs. Do-right
Can't go wrong with me
I said R-E-D-Y
Always on time
Uh, come on"
68,Pump It Up,2003,This Is Not a Test! (2003),Hip Hop|R&B,Missy Elliott,"(Missy) hey yo, Nelly, this is fire,
(Nelly) what ya talkin' bout girl?
(Missy) let's make it hot for da clubs
(Nelly) missy...
Woo! this is fire...
Down south girls got them real big butts,
Real big butts make ya man wanna look,
Back it up, flip it up, skinny girls ICK!
Love my gut so fuck a tummy tuck, OH Yeah!
Yup, I shakes my butt, shakes my gut like 'yeah bitch, what?'
Yeah I likes it rough, tough ask ya man how I'm good in handcuffs,
Me and Nelly came to rock the club, pack the place, don't push and shove,
I'm from the club straight to the crub, I'll let ya know if the sex was good...
(Chorus) pump it up! show me love, chick
Let me see what you workin wit,
Let me see those big ass hips, big booty, pump it up,
(This is how me and nelly pump it up)
Show me love, chick,
Let me see what you workin wit,
Let me see those big ass hips, big booty, pump it up...
Down south playas, we got that fire, mayne!
Get up on my booty, tootie fruite on the rudy
I'm a thick chick, skinny girls act snooty,
No matter what the size, my big thighs, I do my duty,
Look at the way my rump like shake like a movie (?)
See my tight jeans and the coochie,
Spend a little loochie, gotta work for the booty,
Me and Nelly hot on the track, Nelly, can't no one ever top that,
'Cause we came to rock the club, DJ's betta pump it up,
Muthafuckas need to back it up, 'cause we gon tear the roof off the club,
(Missy talks) you know down south chicks got big asses, and we a little heavy sometimes, but when you from the south, we don't call that 'fat', we call that 'big-boneded', fo' sho'
(Nelly)
Yeah ma, I heard you like the magic stick,
Me I got that gadget stick, it's like go-go gadget dick,
You know, make her climb the walls shit,
I make her wanna press pause and shit,
Walk up in the party, girls swingin' they panties,
You see they was doin' that before I had them grammy's,
I get a little baby when I'm in Miami, I may act a little fresh but I still got mannies
It's Nelly phelony, and Missy, Misdemeanor,
Both goin' down, ????
I got records, that got records that broke records in record time and I ain't talkin' 'bout them records they buyin,
Lyin', see ya need to keep up wit me,
You see I'm still spendin (?), stackin the ride wit me,
You struggle to recoup, I struggle on which coupe to ride in,
(Missy) SEE HOW WE BE STYLIN'
This is fire..."
69,Pussycat,2002,Under Construction (2002),Hip Hop|R&B,Missy Elliott,"This is another Missy Elliott exclusive
It's all for the love
But there is more things that keep a man satisfied
And I know the remedy just to cure him from
Cheating even if he tried hey
Pussy don't fail me now
I gotta turn this nigga out
So he don't want nobody else
But me and only me
Pussy don't fail me now
I gotta turn this nigga out
So he don't want nobody else
But me and only me
I know hes a man and men have intentions
To sleep with someone else
But that's why when I make love to him
I'm ruling
Try to give him my best hey
As long as the pussy good
Its all right
Ain't gotta worry about my man
'Cause he knows ma's
Is one of a kind
And that's why he keeps staying
The pussy good
Its all right
Ain't gotta worry about my man
'Cause he knows ma's
Is one of a kind
And that's why he keeps staying
Look ma
Yeah you got the bomb and work
That prissy stuff
Glad it ain't the gushy stuff
That gushy stuff?
I don't like the mushy butts
I wish we was
Like comfy over Jennifer
Him and her
Too much like I and we
And what that mean?
We just love the booty
All we see in 3D is um
Booty booty booty booty
Oh really
Do me, do me, do me, do me
Run through me like flood go through an IV
That's good ill make sure you never will leave
Can I put my booty booty
Up in your spaghetti?
Daddy
Are you ready for sacary from me
Pussy gushy mushy what more you want from me
'Cause my feelins hit the ceiling
What you want me to be?
Oh, please, pussy don't mess it up for me"
70,Religious Blessings (outro),1999,Da Real World (1999),Hip Hop|R&B,Missy Elliott,"Being caught up in the fame
A part of the glamour and glitz
Platinum rings and different things
How easy we forget
For it is him, the Lord Almighty
Who allows us our success
When you on top above the charts
How easy we forget
Do you think without him
You would be who you are?
For if he made Heaven and earth
He also made you a star
So as we reach the year two thousand
You know there's one higher than us
And I come to be that tool to tell you
In God we must trust
Love you"
71,Remember When,2005,The Cookbook (2005),Hip Hop|R&B,Missy Elliott,"I know I may act stubborn boy
But that don't mean I don't love you boy
Please forgive me for my attitude
When it seems like I'm takin' all my shit out on you
I know I never said this here
Lemme make myself loud and clear
I appreciate the way you treat me
I've done a lot of things you still don't hate me
Remember when you caught me cheatin' (cheatin')
You said I stopped your heart from breathin [stopped ya hearttt](breathin)
But you loved me so you forgave me (gave me)
When you coulda ran out and played me (played me)
Am I a dissappointment- to ya baby
Most of the time I'm wrong
Makin' excuses for the abusesive donestepping out on the lawn?
But ya never let me baby, say I'm sorry all the time
Any other guy would be gone but you stay hear right by my side
And the love like this
I can't play no games
'Cause its hard to forgive it
But you didn't neva complain
Neva rub it in my face- juss lemme slide on by
I know every girl- wish she had you as a guy
No no no no- no no no
'Cause a love like thi
Can't play no games
And its hard to forgive I did to you
Lemme slide on by
Yeah
(Rap)...
When I cheated you said you couldn't breathe (said you couldn't breathe)
Now I'm sitting here beggin on my knees
Take me back, I'll do anything including please
I didn't mean to burn a bridge third degree
Like fantasia said let yourself be free
The truth be, without me you'll succeed
I'm sorry baby please believe in you and me
C'mon
Ain't no love better than you
With all the pain I put you through
?
Without you here what would I do (x2)"
72,Scream a.k.a. Itchin',2001,Miss E... So Addictive (2001),Hip Hop|R&B,Missy Elliott,"Music...
Huh, huh... oh...
Huh, huh... oh...
Huh, huh... oh...
I met him in the Bahamas, I love that nigga per-sona
Smoke that nigga marijuana, get freaky call me Madonna
Lay on the bed he follow, bone him until to-morrah
Make him sing high sopran-ah, Ah!
Fifty-fo'-fifty-fifty, Mr. Act-Super-Kinky
Baby what you gon' get me, is some rings for my lil' pinkie
Money will multiply, 'fore you run up inside
Make me all weak and tired, mmhmmm...
(Chorus: Timbaland + Missy)
You got ta... (scream)
If you up in the club, you think you tearin it up
You got ta, got ta... (scream)
Well pour most of the liquor, then you watchin people buzz
You got ta, got ta... (scream)
If you from out of town, you think you're holdin' it down
You got ta, got ta... (scream)
You got ta... you got ta...
(Missy)
He say he from Puerto Rico, he told me to call him Chico
Freakin up in the Nico, my ego got really negro
Throw the heat throw heat be bold, though I'm like dice in cee-lo
Makin' heads scream and moan, Ah! Send 'em back home
Boy is really worth it, just to get dirty dirty
Give me that liquor liquor, make me talk slurry slurry
Money will multiply, 'fore you run up inside
Get me all weak and tired, mmhmmm...
(Missy)
He asked could he rock my body, he also asked could he buy me
A drink six-oh Ferrari, then ride up in my safari
Shit what a deal word up, how much it cost now
Shit what the deal word up how much it cost
Play your position listen, where is your pot to piss in
'Fore we start really kissin', hot as freaky kitchen
Hey what the deal word up how much it cost now
Hey what the deal word up how much it cost now"
73,She's a Bitch,1999,Da Real World (1999),Hip Hop|R&B,Missy Elliott,"To the M-I prrrrrrrr, cat like a semi
Nigga stole my car, why'nt you get my
Give yo' ass a black eye
Oh, say bye-bye
I'mma give your body to the sky
Run through your clique
Nigga, you pissed on trip
I'mma have to bust you in your lips
And the whips better have a whole lotta chips
'Cause I ain't for no nigga givin' tips
She's a bitch
When you say my name
Talk mo' junk but won't look my way
She's a bitch
See I got more cheese
So back on up while I roll up my sleeves
She's a bitch
You can't see me, Joe
Get on down while I shoot my flow
She's a bitch
When I do my thing
Got the place on fire, burn it down to flame
Roll up in my car, don't stop, won't stop
I'mma keep in rockin' till the clock don't tock
I'mma keep it hot, light my ass on fire
I'mma grab a philly, go and roll it at the bar
Whatcha talk? Whatcha say? Huh?
Gotta flow, gotta move it slow, huh?
Better you runnin' out the door, huh?
You gon' be a long lost soul, whacha say?
Yippe yi yo, yippe yi yi yay
Put me on stage, watchin' niggas feel me
Put my shit on wax, watch it blaze like May
Go yippe yi yo yippe yi yi yay
55, 65, hike
75, 85, test the mic
95, Missy wild for the night
105, I'mma keep the crowd hyped
She's a bitch
When they say my name
Talk mo' junk but won't look my way
She's a bitch
See I got mo' cheese
Back on up while I roll up my sleeve
She's a...
What? What? What? What?
What? What? What? What?
Whatchu know about Timothy, lemme know
Eat an MC like Cease, lemme know
If he get drunk lean on me, lemme know
I'm about to bust like pee, feel me now
Anybody know my skills, what the deal
Anybody feel my skills, it's the real
Anybody wanna come fuck wit us still
Anybody gotta get the hoe by they pill
She's a bitch
When you say my name
Talk mo' junk but won't look my way
She's a bitch
See I got more cheese
So back on up while I roll up my sleeves
She's a bitch
You can't see me, Joe
Get on down while I shoot my flow
She's a bitch
When I do my thing
Got the place on fire, burn it down to flame"
74,Slap! Slap! Slap!,2001,Miss E... So Addictive (2001),Hip Hop|R&B,Missy Elliott,"Me and my clique
Run thrugh the gutter breakin down shutter
As the beat goes, dun dun dun duda
Ain't nothing better than these favorite buttas
It's like freakin wit your lova tryin' bust his rubba
Have him have him undercover like he thought he neva
How the hell a bitch like me become so celva
Y'all wack MC's, y'all never never
Talkin' hard as a cock but is light as a feather
Y'all suspect hoe's y'all suspect hoe's
Takin' off your clothe y'all reject hoe's
Feel the rhythm, I'm bout to kill em
Slap! Slap! Slap!
Right across your melon, easy
Nigga Slap! Slap!
Right across your melon, easy
Y'all lil'
Tryin' act bigga don't y'all get the picture
Every freakin year I come wit something sicka
Fan's takin' flick's wanna get my picture
Freak's only speak ""Do you know Jigga""
Strange muthafucka's wanna be my nigga
Turn your man to a ass-licker
Cheatin' ass men means, cheatin' as men
Time to stop gamin and stay the fuck in
Feel the rhythm, I'm bout to kill em
Slap! Slap! Slap!
Right across your melon, pronto
I said Slap! Slap! Slap!
Right across your melon, pronto
You don't wanna get smacked right quick
Wit a upper cut like this
I don't give a fuck if you don't like this
Still get paid to bust the right shit
Still get paid to hop on the dick
I'm a prostitute, I gotta a lot of loot
But if you knock the boots, but at lease cop the coup
What I'm post to do, starve for you
This ain't far fa u, I can't crawl for you
That's impossible
I make the rule
I pay the dues
I wear the pants
Bought the shoes, they Prada too
Fuck wit me you lose
Step to me and get brused
Your chances are not few, they none
So what I'm bitchy
Roll a phat blunt wit Missy
In the front wit me
Tim hit OWW, wit the bang to the boggada beat
Burnin 'em wit the heat
It don't conser me, when nigga talk shit
They just wanna learn me
When they see me, I permentaly
Damage they shit internally
And Slap! Slap!
Slap! 'em right across the melon
Nigga, Slap! Slap!
Right across your melon, easy
I'm the M-S-J-A-D-E
Toes and lows, bling like I'm B.G.
I don't know nigga help, shit, I write my own
Just gimme a beat and a muthafuckin microphone
Picture this shit me, Missy and Timbaland
We bout to take it to the streets, but they chicken ran
Oh shit, It's gettin' kinda hot in here
Oh shit, Make niggas stop and stare
Talk dirty, rock-a-bye a birdy
Smack the shit out the Clyde
Cause Bonnie should have pay me
Get old heads for they checks that sign right
And I get lil' boys for they doe on prom night
'Cause I do my thing, knots in a pocket
Smack! Smack! Smack!
All up in your knogen, early
I said Smack! Smack! Smack!
All up in your knogen
Nigga, Slap! Slap! Slap!
Right across your melon, easy"
75,Slide,2002,Under Construction (2002),Hip Hop|R&B,Missy Elliott,"My twinkies looks stanky on the benz
And don't I gotta look shweet for my mens
I make 'em think I got a whole bunch of paper
And even date a ball player from the lakers
Now faker taker maker holla at cha later
Shake and wake up tell 'em what to get my ass from Jacobs
That's the way a real diva like to floss it
Buy a car no matter what it costess
Of course it's my rolls royce's made dem nosses
Tell you who the muthafuckin' boss is
I'ma drive and you walkin' that's why you talkin'
See the chrome spinning on the wheel stop jockin'
I'ma let you know real nice and slow I'll be broke as a joke
If I had to be your ho so po'
Missy on the rise like the sun if you think
That I'm done I ain't even begun
Slide slide dip (dip) shake (shake)
Move it all around, move it all around
Slide slide dip (dip) shake (shake)
Move it all around, move it all around
Feel the boom bass to get you bad kit
15's putting holes in you back kit
Bo bo boom, bo bo boom, bo bo boom, bo bo boom
Don't it sound so fantastic
My lamborghini disappear like houdini
2 20 can't see me in a bottle like a genie
Teenie, Weenie
Now hate me like you hate to eat your wheaties.
Now here's a freebie
I'ma let you see my on TV
Acceptin' my emmy or da grammy in miami
I hit you with the 1-2 whammie
Your no tooth granny with a hole in her panties
And I don't give a shit if you can't stan' me cause
I is what I is and what I am is like my mamey
And I don't mean to sound to peti
But they used to call me fatty
Till I got with puff daddy
Slide slide dip (dip) shake (shake)
Move it all around, move it all around
Slide slide dip (dip) shake (shake)
Move it all around move it all around
My rims keep turnin' and turnin'
Tires burnin through queens and mt. vernon
And yes it's my concern that
You chain platinum or is it really sterlin'?
I'm old school, I rock da sherlin
From new jers. heard all the way to berlin
And as for certain behind every curtain
Is a snake bitch lerkin and she about to catch a hurtin'
Mr. moles on da beats
And missy be the beats behind the beats
My record sales gon jump and do leaps and
While you sleep I'm on the grind as a creep
Sho-creep!
I got puma's on my feet
Fresh gear, eryday all week
You know I keep a high from a peeps never cheap
Underground like the streets (oh-oh)
Slide slide dip (dip) shake (shake)
Move it all around, move it all around
Slide slide dip (dip) shake (shake)
Move it all around move it all around"
76,Smooth Chick,1999,Da Real World (1999),Hip Hop|R&B,Missy Elliott,"Party Time (Uh uh)
Uh (Say what?)
Uh huh (Yo)
Uh (Say what)
Uh huh, uh huh
Uh Uh (What)
Uh huh (One more)
Uh (Yo, yo bring it to me)
Come here baby, let me blow your mind
I'mma spit shine like turpentine
I love niggas, all different kinds
I'mma show you all how to work the spine
If you a playa then you sure ain't mine
I'mma cut you off like circumcise
I'm a real chick and it no surprise
If you dialin' me then you must realize
1 - I'm a smooth chick, I'm a cool chick
I got gats but don't make me use it
I'm quick to lose it, I'm bout to do it
Shake my ass down to the music
I'm a smooth chick, I'm a cool chick
I got gats but don't make me use it
I'm quick to lose it, I'm bout to do it
Imma shake my ass down to the music
Come on baby let's do the bump
Keep drinking up till you get me drunk
Don't front, smoke a pound of funk
Something real quick like uuuh, uuuh
Got tens in the back of the jeep
If you got a friend and he all on me
Could it be hes a fan of me?
Or could it be he see that I'm missy?
Repeat 1
Eh baby, why you trippin' for?
'Cause I'm on top and you're down below
You want me or you want my dough?
'Cause if it's my dough, then you hit the do
Eh yo boo, I think you know
That I got gats and they crack the floor
Missy take shit no more
So all that talk is no, no, no
Repeat 1
Repeat 1
Music
Repeat 1
Repeat 1
Music
Yo
Misdemeanor, uh
Timothy, uh
And aaliya uh
Motherfucker now, uh
Ginuwine, uh
Maganoo, uh
Drop, play it
One two, motherfucker"
77,Sock It 2 Me,1997,Supa Dupa Fly (1997),Hip Hop|R&B,Missy Elliott,"Do it, do it, do it, do it
No
I was lookin' for affection
So I decided to go
Swing that up in my direction
I'll be outta control
Let's take it to perfection
Just you and me
Let's see if you can bring, bring, bring
The nasty out of me
Na-na-na-na, sock it
Ooh, ah
Sock it 2 me like you want to-ooh
I can take it like a pro you know
Do a long throw with the backstroke
My hormones jumpin' like a disco
I be poppin' mess like some Crisco
All you gotta say is where Missy go
And when you say go, I say move slow
I'm at your house around midnight
Don't fall asleep
It'll just be me, me, me
On a late night creep
I'm gonna show you thangs
That you can't believe
Jump in this be-e-beat
Won't you sock it 2 me
Oh-whoa, sock it 2 me
Ooh, ah
Sock it 2 me like you want to-ooh
I can take it like a pro you know
Do a long throw with the backstroke
My hormones jumpin' like a disco
I be poppin' mess like some Crisco
All you gotta say is where Missy go
And when you say go, I say move slow
Ooh, ah
Sock it 2 me like you want to-ooh
I can take it like a pro you know
Do a long throw with the backstroke
My hormones jumpin' like a disco
I be poppin' ish like some Crisco
And all you gotta say is where Missy go
And when you say go, I say move slow, uh-huh
Sock it 2 me
Ooh, ah
Sock it 2 me like you want to ooh
I can take it like a pro you know
Do a long throw with the backstroke
My hormones jumpin' like a disco
I be poppin' mess like some Crisco
All you gotta say is where Missy go
And when you say go, I say move slow
(Da Brat):
Why Missy be sockin it to niggaz like ReRe
The baddest industry bitches of the century
Hit hard, like penetentiary bars
Finnaly admitted that we the shit combination on the see-through
Poppin' patron with Missy on the 600 with no see-through
Suffer the repercussion, fuckin' with shit like this
We partay puffin constantly makin' niggaz suffer the consequence
Gotta get that ass bitch
House in the Chi with a Candy in Atlanta with a Benz
Niggaz been huffin and puffin but ain't try shit
Got cream motherfuckers steady ride quick besides kids wanna bust
But you shouldn't forget ends when you fuckin' with me
You jealous 'cause I live more flushed
Me and Missy been livin' with the (unknown)
Harrass bein ruckest plus (unknown)
When I'm sellin, never gonna stop it
Sockin it 2 niggaz, droppin' 'em on the spot
Get up in the block around the shop, knockin' you off of yo socks
Guaranteed platinum, watch two of the coldest bitches get hot
I be the B-R-A-T, her be Missy
We be the bad bitches who be fuckin' it up
I be the B-R-A-T, her be Missy
We be the bad bitches who be fuckin' it up
I'm yo' nigga for life ba-by
Listen to ya we drive all these motherfuckers crazy
You know what I'm sayin', yeah Timbaland
I see you baby, I feel you
Sock it 2 'em goddamnit
It's 9-7, this the motherfuckin bitch era
What y'all niggaz wanna do
The rat-tat-tat on that ass once more
I'm out the door motherfucker, yeah"
78,Spelling Bee Interlude / Spelling Bee,2003,This Is Not a Test! (2003),Hip Hop|R&B,Missy Elliott,"I hope you can S P E L L
Nigga please, you don't know me that well
I got a truck sittin' on sprewells
My flow tight as H E L L
If you is a H O E get a J O B
I'm H O T on the T O P
Mister Mosely get the B A T
Don't copy this here 'cause I done D I D
It could get H E C T I C
F I S T in your F A C E
Y'all don't know how crazy Missy be
Don't T O Y me, I'm outta y'all leauge
And yes, I'm bulletproof
Bitches, I ain't foolin' you
You better learn a thing or two
You don't really want it, boo
I hope you can S P E L L
Nigga please, you don't know me that well
I got a truck sittin' on sprewells
My flow tight as H E L L
S P E L L, nigga please, you don't know me that well
I got a truck sittin' on sprewells
My flow tight as H E double L
You just crazy if you think you Jay-Z
Sure ain't me 'cause I R A P
I'm V I P, not we that's me
Timmy this beat is a H I T
Listen to the T R A C K
On the M I say from the motherfuckin' VA
Y'all know K I G E Rty
If y'all ask me, y'all style booty
I hope you can S P E double L
I'm double XL, y'all can all kiss tail
Y'all motherfuckers don't know me that well
My level came next and I'm not R L
And yes, I'm bulletproof
Bitches, I ain't foolin' you
You better learn a thing or two
You don't really want, it boo
I hope you can S P E L L
Nigga please, you don't know me that well
I got a truck sittin' on sprewells
My flow tight as H E L L
S P E L L, nigga please, you don't know me that well
I got a truck sittin' on sprewells
My flow tight as H E L L
I run yo block, I run them block
Crack your windows 'cause I'm just that hot
That you forgot I got a big knot
Cha ching, I must've hit the jackpot
I must've hit the jackpot 'cause my purse don't lie
The checks don't stop till they get writers block
Besta call the cops 'cause it'll put you in shock
Like the mind of Tupac, I'ma rock till I drop
A b c d e f g
H I j k l m n o p
U S S Y that's pussy
For the fake MC who test M E
And yes, I'm bulletproof
Bitches, I ain't foolin' you
You better learn a thing or two
You don't really want it, boo
I hope you can S P E L L
Nigga please, you don't know me that well
I got a truck sittin' on sprewells
My flow tight as H E L L
S P E L L, nigga please, you don't know me that well
I got a truck sittin' on sprewells
My flow tight as H E double L"
