,song,year,album,genre,artist,lyric
44,It's Real,2003,This Is Not a Test! (2003),Hip Hop|R&B,Missy Elliott,"Yeah, oh-oh
Yeah, yeaaa
I love you more then my mouth can say
I'll take a flight to kingston, anyplace
Just to be in yo face
From new york city to Japan
I'll be there ba-by
Just call my phone and I'll come flying
On the next plane to you
Never worry 'cause I'm ya woman
And I promise ba-by
I promise you will be my man
Cause baby it's real (real)
So real (so real)
Can't you tell by the look in my face, yeah
Oh baby it's real (it's real)
So real (so real)
I hope your feeling the same
Cause baby it's real
I'll follow you right to the moon
It could happen yeah
Just so we can be close as cousins
With my heart out to you
I love you more then words can offer
Pay attention ba-by
I hope this never ends my lover
Cause baby it's real (it's real)
So real (so real)
Can't you tell by the look in my face, yeah
Oh baby it's real (it's real)
So real (so real)
I hope your feeling the same
Cause baby it's real
I don't wanna spend a day without you
I don't get tired of being by you
I don't care 'bout the things about you
Boy it's real
So real, so real (so real)
Can you tell by the look in my face, yeah
Oh baby it's real (it's real)
So real (so real)
I hope your feeling the same
Cause baby it's real"
45,Izzy Izzy Ahh,1997,Supa Dupa Fly (1997),Hip Hop|R&B,Missy Elliott,"Verse One:
I pulls up in my strech, I let my homegirls flex my 9-8
Close and closer they follow in my Limo, playin' CD's
Of when I used to HeeeHee totally in my ass cheecks
They sweat these beets, for any kinda jeeps, you know how
I is, so freakin' hot that I siz, Geewiz, get my clothes tailored
Like I'm Liz, Miz, I'm commin' for your ass in a min, seconds or
Hours
Everything I do seem to bloom like flowers, I cruise these beats
Like I'm
Drivin' Eddie Bauer, some of y'all MC's mad I got the power, I hit
You
With the Pllllll pmm uh, take that, niggaz wanna step well um UHH
Take
That, what mmm uh uh take that, yeah yeah yeah yeah yeah yeah yeah
Izzy Izzy ah zizah zizah zizah
Hard bitches be talkin' like they all rah rah
Blizzy Blizzy blahzah blahzah blahzay
None of y'all fools ain't got shit on me
*Repeat*
Verse two:
M-A to the G double O my man Moe, smooth like Joe
Timberland where you get the doe
I'ma get my niggaz
Niggaz go and get ya hoes
Flows to come so natural
I'ma take a stroll role this high droll
I'ma take my ass to Pazzaz and Essoh
Slow oh down diggy diggy doh
Bridge: (Missy singin')
You never heard beats like this before
When me and Timberland walk through the door
Our style be tighter then before
You like our steelo
(Repeat 2x)
<Chorus till end>"
46,Joy,2005,The Cookbook (2005),Hip Hop|R&B,Missy Elliott,"(1:36 long skit precedes the actual song)
[Elliott] Joy
[Scratch] Oh-oh, oh-oh-oh, oh-oh-oh
[Elliott] Joy
(Speak'n'Spell - vowel sounds)
[Elliott] Joy
[Scratch] Oh-oh, oh-oh-oh, oh-oh-oh - so sick!
[Elliott] Joy
[Scratch] Oh-oh, oh-oh-oh, oh-oh-oh
(Speak'n'Spell - vowel sounds)
(Missy)
Timbo, what they do
They try to be like Missy but they have no clue
On how I'm spittin' over beats the way I move
I move so smooth in my shell toe shoes
Now put the needle on the record, show'n'prove
Since ninety-two I came to win and never lose
They try to stop a chubby chick from comin' through
My belly out and sellin out these venues
My skills, will fulfill, those who drink booze
My attitude is super cool like I'm subdued
And those who fake I take on you and your dudes
I rule the streets I break 'em down with no tools
And Misdemeanor give the finger to y'all fools (HOLLA!)
Whoever doubted that I'm 'bout it check the news
And if you snooze on me this year your ass will lose
'Cause I will bruise, my loose screws is like ooh
When I come out get your release dates moved
(Chorus: Missy)
This year y'all gon' all lose sleep
I break 'em off somethin', break 'em off somethin'
[Scratched] This year y'all gon' all lose sleep
This year y'all gon' all lose sleep, when I
Break 'em off somethin', break 'em off somethin' (BIG SHOUT OUT TO TIMBERLAND)
This year you hear a real MC, when I
[Slowed up] break break b-b-break break break...
(Missy)
I flow over a beat that make a chick weave blow
And those who try to compete to the wall I throw
So I drop it low, 808 kick low
Like oh oh-oh oh, oh oh-oh-oh, oh-oh-oh
Mr. Mos', this beat he compose
While I kill the track, leave your ears decomposed
Fake rappers, this year your lies will be exposed
Like oh oh-oh oh, oh Missy steal the show-ow-ow
Spit on breakbeats, make rappers lose sleep
Make labels unable drop they artists on leak
I keep 'em knee deep, need me, be me
Hardly, and basically, I do it nice and slow-ow-ow
(Slowed)
I'm slowin, the track down, so you don't miss the shit
That Misdemeanor talkin' like that chronic get you super high
(Chorus: Missy + (Mike Jones))
This year y'all gon' all lose sleep
I break 'em off somethin', break 'em off somethin'
This year you hear a real MC
[Scratch] Oh-oh, oh-oh-oh, oh-oh-oh
This year y'all gon' all lose sleep, when I (MIKE JONES! WHO?)
Break 'em off somethin', break 'em off somethin' (MIKE JONES! WHO? MIKE JONES!)
This year you hear a real MC (GEYEAH!)
Break 'em off somethin', break 'em off somethin'
(Mike Jones)
See I'm a pimp that's on my grind, I hustle like all the time
I speak what's on my mind, my teeth'll make you blind
My heat'll lay you down, whenever you come around
Forsaken out there mistreated your life'll be deleted
'Cause I don't play dat, you know I don't play dat
Wherever you talkin' noise is where you gon' lay at
I'm ""Supa Dupa Fly"" like Missy Missy
Before the fame majors used to diss me
But now I'm on top, I'm hot I can't stop
Before my deal came my shows was sold out
House been on the hill, diamonds been in my grill
I'm trill like U.G.K., you know I keep it real
I'm who, Mike Jones, WHO? Mike Jones
WHO? Mike Jones and I can't be cloned
2-8-1, 3-3-oh, 8-zero-zero-fo'
That's my cell phone number, hit me on the low
I got
(Missy)
Hold up, I see a lot of folks in here sittin' 'round like your shoes too tight
If you wear a size 10, don't cram yo' shit up in a size 6 ladies
Be proud of yo' big-ass feet
We came to party up in this bitch"
47,Keep It Movin,2003,This Is Not a Test! (2003),Hip Hop|R&B,Missy Elliott,"(Missy Elliott)
Eh yo Timb, you know
Niggas like Dr Dre and the Neptunes and Just Blaze
They should be so hot they be keepin' us workin yah feel me
But but that nigga R. Kelly
He got one of the illest lines when he say
""Is anybody feelin' freaky""
(Elephant Man (Missy Elliott))
Man up... yep, good to go
Ele-phant Man and Missy Elliott (yeah)
Ladies keep it movin (uh)
Gi dem di dance now
(It's like butter baby, it's like butter)
Buss di dance now
(It's like butter baby, it's like butter [x3])
Missy, Elliot
Ladies windin around
Tweet show dem kindly how fi do it
(Whoo) Come on
(Verse 1 Missy Elliott)
When you hear the song, role down yah window
Let the music thump yeah, thump thump thump thump
Take a walk in the club, that's how I role
You look so so down, so so so so
Now when you step out on the scene, so fresh so clean
Lookin' like a wet dream, yo know what I mean
Its about that, what time would that be?
Wind yah waist line to the base line
Slow it down now get the beat right
Keep it (oh) movin (oh), keep it (oh) movin (oh)
Buss yah (oh) grove (oh) n we gon' (oh) keep it (oh) movin (oh)
Keep it (oh) movin (oh), keep it (oh) movin (oh)
Shake shake (oh) yah body (oh) we gon' (oh) keep it (oh) movin (oh)
Keep it (oh) movin (oh), keep it (oh) movin (oh)
Shake shake (oh) yah body (oh) they gon' (oh) keep it (oh) movin (oh)
Keep it (oh) movin (oh), keep it (oh) movin (oh)
Buss yah (oh) grove (oh) n we gon' (oh) keep it (oh) movin (oh)
(Verse 2 Missy Elliott)
If you know you look good, say so say so
And you don't give a [ding], hell no hell no
Put yah hands in the air yeah, get yo hands up
Baby bounce baby bounce, get low get low
2 shots in yah club, yep just what's up
Get Timb to fill it up, yep just what's up
Its about that time, what time would that be
Wind yah waist line to the base line
Slow it down now get the beat right
Keep it (oh) movin (oh), keep it (oh) movin (oh)
Buss yah (oh) grove (oh) n we gon' (oh) keep it (oh) movin (oh)
Keep it (oh) movin (oh), keep it (oh) movin (oh)
Shake shake (oh) yah body (oh) we gon' (oh) keep it (oh) movin (oh)
Keep it (oh) movin (oh), keep it (oh) movin (oh)
Shake shake (oh) yah body (oh) they gon' (oh) keep it (oh) movin (oh)
Keep it (oh) movin (oh), keep it (oh) movin (oh)
Buss yah (oh) grove (oh) n we gon' (oh) keep it (oh) movin (oh)
(Verse 3 Elephant Man)
Keep it movin love the way yah body groovin
Watch yah groovin, perspire sweat you losin
Put yah shoes in, dis ya dance a keep you movin
Its soodin, like dis yah ina di humma crusin
Take! di! dance! floor!, stop pretend like you nu hear
Mi see booty hear booty there booty shakin everywhere
Ina di club, ina di bar, ina di pool, ina di square
At di afta party mi see shakin booty I'll be der
Make! way!, move!, when big mamma appear
Just a back it up cock it up jock it up like she nuh care
Sai she was one a di chear leada fi Chigaco here
Everyting a disappear when she appear
Come on
Keep it (oh) movin (oh), keep it (oh) movin (oh)
Buss yah (oh) grove (oh) n we gon' (oh) keep it (oh) movin (oh)
Keep it (oh) movin (oh), keep it (oh) movin (oh)
Shake shake (oh) yah body (oh) we gon' (oh) keep it (oh) movin (oh)
Keep it (oh) movin (oh), keep it (oh) movin (oh)
Shake shake (oh) yah body (oh) they gon' (oh) keep it (oh) movin (oh)
Keep it (oh) movin (oh), keep it (oh) movin (oh)
(Elephant Man)"
48,Let It Bump,2003,This Is Not a Test! (2003),Hip Hop|R&B,Missy Elliott,"I'm, I'm, I'm m-m-m-missy...
Radio play me all the time, write my own rhymes, and I swear I'm fine,
This flow here from '83, from A to Z you can't fuck wit me,
Me and Timbaland man, I'll be damned,
Remember when Light was in love wit Sam?
(I used to be in love with guy named Sam, but to me, oh mah god)
She was one in a million,
I came through 'cause I rock the show, whack MC's get kicked in the throat,
Keep on sleepin' 'cause ya think ima joke,
Mm, mmm, uh, let it bump
I'm missy, (let it bump)
I'm missy, (let it bump)
I'm missy... I'm missy on the microphone,
I'm missy, (let it bump)
I'm missy, (let it bump)
I'm missy... I'm missy on the microphone...
I'm missy on the microphone, I'm stupid fresh, that's the shit I'm on,
Sucka MC's come new in the game, swear ya hip-hop, ya jus New Jack swing,
Remember when Shante was live on stage? (Shante was live on stage)
Let me back that shit up, for y'all no hip-hoppers
I'm missy on the microphone, I'm stupid fresh, that's the shit I'm on,
Sucka MC's come new in the game,
Swear ya hip-hop, but don't know Daddy Kane,
This time Missy ride crazy though, haters wanna know my antidote,
Try to catch up 'cause ya mind is slow,
Uh, uh, uh, let it bump...
Me and Timbaland... me and Timbaland, man, I'll be damned...
(Timbaland)
Me and Missy come fresh on tracks, 5 hours deep can ya handle that?
We came from basement to platinum plaques,
We sittin' on somethin' that's black-on-black,
Jimmy D, he's the engineer, that nigga been down for about 10 years,
Mixin that stuff that make ya sound so clear,
Mm, mmm, mmm, let it bump"
49,Let Me Fix My Weave,2003,This Is Not a Test! (2003),Hip Hop|R&B,Missy Elliott,"What's up motherfuckers?
I need to know is V-A up in this bitch?
New York, St. Louis, Chicago, Philly, LA, Atlanta
I'm diggin' that
But how about the ladies that got a head full of fake weave or braids
Holla at ya peoples
Oh! C'mon
Ooh baby let me fix my weave
Touch me up and let me fix my weave
You could pick me up about a quarter to 3
Before I walk in the club I gotta fix my weave
(Oh) Baby fix my weave
Baby baby let me fix my weave
On the highway I do above 90
(Woo-woo) pull me over get the fake ID
I met a guy named Tommy
Very charming
He was on me like cheese be on macaroni
His game real tight making me so horny
Fine enough for us to fuck and be his baby mommy
You really don't know me
So I moves it slowly
Brush up and let him hold me
Let me spit some baloney
Baby you could call me
If you go down on me
But you got to back up off me
Wearing cubic zirconia
I told him, ""Baby let me fix my weave
I got a hair out of place and use a fake ID.""
Pepe LePew voulez vous ooh oui
You want to misdemeanor me
You gotta spend more G's (ohhwee)
Ooh baby let me fix my weave
Touch me up and let me fix my weave
You could pick me up about a quarter to 3
Before I walk in the club I gotta fix my weave
(Oohwee) Baby fix my weave
Baby baby let me fix my weave
On the highway I do above 90
(Woo-woo) pull me over get the fake ID
I used to date a guy named Chris
Sloppy with his kiss
But he was good with his tongue
I called him Mr. Young One
Mr. Young One had a big ding-dong
Balls the size of ping-pong
I had him souped like won-ton
I put the beat on
And on my ass he skeet on
I put the heat on young gun
Fresh meat he season
Yes, yes we used to creep down the beach
He was insane like Rick James
And with a mask he's Superfreak
I told him, ""Gimme cash to fix my weave
And I don't want no excuses 'bout your baby mommy
'Cause your child support money don't fix my weave
And you know nigga please me no fuck for free.""
Ooh baby let me fix my weave
Touch me up and let me fix my weave
You could pick me up about a quarter to 3
Before I walk in the club I gotta fix my weave
(Oh) Baby fix my weave
Baby baby let me fix my weave
On the highway I do above 90
(Woo-woo) pull me over get the fake ID
I got a call from Joe
He used to call me J.Lo
Hey-lo, how you doing?
Used to ask who I was screwing
Joe was pursuing
Sex was good all ""ooh-in""
Moan he was grown
He would fuck me till the mo'nin'
I used to get vex when he would sex another bitch
Said ""Baby don't trip, just like Ben I'm rich""
Jen don't bitch, then Miss don't bitch
Lopez get rich, call me Miss Affleck
I tell him, ""Baby I need a new weave
Because my tracks feel whack, I want to hit the party
You want to play like Ben then give me your keys
'Cause even Jen drive a Benz to go fix a weave.""
Ooh baby let me fix my weave
Touch me up and let me fix my weave
You could pick me up about a quarter to 3
Before I walk in the club I gotta fix my weave
(Oh) Baby fix my weave
Baby baby let me fix my weave
On the highway I do above 90
(Woo-woo) pull me over get the fake ID
To the heavy weave cities
Miami, Jersey, D.C., the Carolinas, Detroit, Louisville, Ohio, to all the
Projects
To the beauty salons, and curling irons stitching in that ? hair
Okay, oohwee yeah fix your weave
Straight up like a perm you heard"
50,Lick Shots,2001,Miss E... So Addictive (2001),Hip Hop|R&B,Missy Elliott,"You don't want to speak my name
Mess around and get that ass blown away
Blaaah!
Full gon' away
I neva like ya tail anyway
Missy got somethin' to say
I ride down the block in an Escalade
Bling, bling all in ya face
I think you might need to put on ya shades
RAH!
I know you feel me though
Ya hatin' on me but you hear me though
20 inch rims sittin' crazy low
Ah! I'ma crazy hoe
I'ma keep the party live
Me and Timbaland gonna flip it tonight
Keep ya hands in the sky
Wave 'em round like ya crazy high
Hah time to lick shots time to see you dance hey you why you frontinnnn
You don't know who I be
Ya mammy neva told you not to fuck wit' me
If I give ya head you'll neva leave
RAH!
Stop sweatin' me
Flip it on the black hand side
Looka here boy don't you even try
Make me dislocate ya spine
Me rings put the shine like turpentine
What you comin' round here now fo'
Baby hell no you just want my dough
Get ya black ass on the flo'
Fool touch me that's a no, no
RAH!
Mr. DJ won't you play that song
Tell them freaks shake they nasty thongs
Hey boys won't you sing along
'Cause we gon' rock the party till the early morn."
51,Lose Control,2005,The Cookbook (2005),Hip Hop|R&B,Missy Elliott,"(Hot Streak - Body Work Sample)
Music make you lose control,
Music make you lose control.
(Fatman Scoop)
Let's go.
Hey, yeah, yeah, yeah, yeah, yeah.
Here we go now, Here we go now, Here we go now, Here we go now.
One time now.
Misdemeanor's in the house.
Ciara's in the house.
Misdemeanor's in the house.
Fatman Scoop, Man Scoop, Man Scoop.
(Verse 1: Missy Elliott)
I've got a cute face,
Chubby waist,
Thick legs in shape.
Rump shakin' both ways,
Make you do a double-take.
Planet Rocker,
Show stopper,
Flow proper,
Head knocker.
Beat scholar,
Tail dropper.
Do my thang, motherfuckers.
My Rolls Royce,
Lamborghini,
Blue madina,
Always beamin'.
Ragtop,
Chrome pipes,
Blue lights,
Outta sight.
Long weave,
Sow it in.
Say it again,
Sow it in.
Make that money,
Throw it in.
Booty bouncin',
Gon' head.
Everybody here gettin' out of control,
Get your backs off the wall, cause Misdemeanor said so.
Everybody,
Everybody,
Everybody,
Everybody.
(Verse 2: Ciara)
Well my name is Ciara,
For all you fly fellas,
No one can do it better.
(She'll sing on A Cappella)
Boy the music makes me lose control.
(We gon' make ya lose control and let it go, before ya know, you gon' hit the floor)
(Verse 3: Missy Elliott)
I rock to the beat till I'm (tired!).
Walk in the club it's (fire!).
Get it crunk and wired.
Wave yo hands, scream (louder!).
If you smoke, then fire it up.
Bring the roof down and (holler!).
If you tipsy, stand up.
DJ, turn it (louder!).
Take somebody by the waist and uh!
Now, throw it in their face like uh!
Hypnotic, robotic, this here will rock your bodies.
Take somebody by the waist and uh!
Now, throw it in their face like uh!
Systematic, it's static. This hit be automatic.
(Breakdown)
(Missy Elliott)
Work me. Work, work.
Work me. Work, work.
Work me. Work, work.
Work me, Do it right.
(Fatman Scoop)
(Repeat x6)
Hit the floor.
(Fatman Scoop)
Now, put your back on the wall.
Put your back on the wall.
Put your back on the wall.
Put your back on the wall.
Let's go.
Misdemeanor's in the house.
Ciara's in the house.
Misdemeanor's in the house.
(Hot Streak - Body Work Sample)
Music make you lose control.
(Fatman Scoop)
We on fire.
We on fire.
We on fire.
We on fire.
Now, throw it girl.
Throw it girl.
Throw it girl.
Yeah!
Now, move your arm to the left girl.
Now, move your arm to the left girl.
Now, move your arm to the right girl.
Now, move your arm to the right girl.
Let's go now, let's go now, let's go now. Whoo! Let's go.
Should I bring it back right now? Now bring it back now!
Whoo! Oh!
Oh I see you C.
Now, see I'ma, I'ma do it like C do it.
Now, shake it girl.
C'mon 'n' just shake it girl.
C'mon 'n' let it pop right girl.
C'mon 'n' let it pop right girl.
Now, yo!
Now, back it up girl.
Back it up girl.
Back it up girl.
Back it up girl.
Whoo! Whoo! Whoo! Yo! Yo!
Bring it to the front girl.
Go! Go!
Bring it to the front girl.
Go! Go!
Bring it to the front girl.
Go! Go!
Bring it to the front girl.
Let's go! Let's go!"
52,Meltdown,2005,The Cookbook (2005),Hip Hop|R&B,Missy Elliott,"Bet it, bet it taste like candy x3
I broke up wit my ex I couldn't take his sarcasm, every time we bone I had to fake an orgasm
Moanin and groanin tried to make him feel manly id rather use my toys, plus my hands come in handy I finally told him that my heart was somewhere else whenever we sexed I wished that he was somone else that dude that approached me at the bar the other night that be the mister right and hot enough to melt some ice I think I'm in love like beyonce be with jigga it's not his major figure that want him to be my nigga he got that magic stick that make my little pussy quiver juices runnin' like a river slowly down my kitty litter boy I'm so glad I found a nigga like you a thug like you to make a girl say oh hope he feel as strong as my poor heart do wit you by my side it's like I'm drunk off boo
(Chorus) If you be my man only my man I wouldn't mind tastin your magic stick, magic stick.
If you don't cheat or sleep around ain't nothin' wrong wit tastin your magic stick, I bet it taste like candy, made to melt in my mouth I know you got plenty, baby you the shit now what you workin wit candy made to melt in my mouth I know you got plenty.
I like the way I like the way I like the way. I like the way, you work ya stick boo the way you work it like voo doo the way you wind and you wind and you grind don't stop the way you work you're stick baby the way you work you're stick baby keep on and keep on and keep on keep goin'.
My ex boyfriend had to go, he didn't know how to work that magic stick but I found a guy that sure do love is so true his love is cla-hassic yeah ooh
I could play janet and you could play j.d if you like beyonce you could play jay-z check for them other chicks 'cause they not me they're just some copy cats there's only one missy m-to the I double ss don't test I'm hard as the cushion on a bullet proof vest but you got me whipped like slaves in the days you're cool as the shade and ice and lemonade think I wanna marry you baby I will carry this is necessary and on the contrary you be mister right and mister legendary the more I fall in love the more it gets scary"
53,Missy's Finale,1997,Supa Dupa Fly (1997),Hip Hop|R&B,Missy Elliott,"Yo, you have come almost to the close of my album
But before I go I just wanna thank God for staying with me
Through my ups and downs and through my whole period
Of doing this album, I want to thank Timbaland who came up with
The beats and all the people who appeared on my album
Make it hot, aight, I'm out"
54,Mommy,2005,The Cookbook (2005),Hip Hop|R&B,Missy Elliott,"Please Stand Up!
In 2005 the industry will be pussy whipped
It Wont be easy!
They like mommy with the cute face can I get a date, Mommy got a cute shape mommy make 'em wait, papi havin' trouble trying to keep up the pace, mommy got the faith I let my pussy be the bait,
Mommy got the good shit that really good shit, the type of chick you get with that really good shit, mommy got them niggas goin' crazy for the ass call me fast make a dash get a nigga for his cash, mommy knock an buck wit a quick upper cut mommy sport shelltoes I put my nikes up, I use to dress b-boy now I dress girlie wake up real early wit my brais lookin' curly mommy let 'em know who she is what she bout, yeah she bout money mommy turning niggas out, mommy got bills cars sit on big wheels, in the club mommy chill while them haters ice grill
Mommy cute rock FENDI suites
Mommy fresh these my real breast
Mommy sex cause mommy grown, mommy be that good shit at home
Mommy mommy mommy mommy, damn mommy roll like armies, mommy ass like a cadillac, mommy give 'em heart attacks
They call me lil mama lookin' big in my hummer
Mama on the corner, lil mama be a stunna, fly to the hummer quick faster then a runner, foot on the gas ruuuuuum hender gunna, mommy look good yeah mommy look right, mommy stay hood mommy be yo type, mommy get excited mommy ask you to bite it, mommy know you like it tell papi don't fight it,
Capitol M.O.M.M.Y
Mommy got a pus take any chick guy, mommy gotta deal mommy spit shit real, mommy give 'em chills whenshe wear high heels,
Mommy get the money, get the money, get the money, mommy find a man who can go an get it for me, mommy look fresh and respect me sweats, stay best dressed showin off my breast,
Mommy cute rock FENDI suites
Mommy fresh these my real breast
Mommy sex cause mommy grown, mommy be that good shit at home
Mommy mommy mommy mommy, damn mommy roll like armies, mommy ass like a cadillac, mommy give 'em heart attacks
Mommy get the money get the money get the money,
Yeah mommy get buck like whoa lil mama, back it up like whoa lil mama, once she shake it like whoa lil mama, she get naked like hold up mama, mommy be a freak mommy let the world know, mommy want 'em to lick her from her head to her toe, if papi say no then lil papi gotta go, if he broke no no mommy kcik him out the door,"
