,song,year,album,genre,artist,lyric
29,It's Goin' Down Tonight,1998,G-Funk Classics (1998),,Nate Dogg,"(Intro/Chorus x2 - Nate Dogg, Isaac Reese)
It's goin' down tonight
I'll do your body right
If you have the time
It's goin' down tonight
(Nate Dogg)
You must be a special lady, I know
'Cause everywhere we go
You always bring attention to me
You gotta be a special lady, fo' sho'
I know, I love the way you makin' me tweek (Ooh baby)
Love the outfit you're wearin, that's dope
Just as sure as chronic makes me choke
Girl I never ever want you to leave (Heeehay lady)
Would you like to go and see a movie? Let's go
I hope we can make another movie tonight (Ooh baby)
First we'll get in the jacuzzi, no clothes
I know, in a minute I'll be lickin' you dry (Heeeeey)
The next scene is really amazing, no joke
You prone, girl it's on
(Chorus w/ ad lib variations x2)
(Isaac Reese)
The love I'm tryin' to give
Is better than a one night stand
They say you're a hell of a woman
Well I can be a hell of a man
The way you stole my heart
I'd even cook you breakfast in bed
And you don't have to move a muscle
Just lay back and relax, chill
(Chorus w/ ad-lib variations x2)
(Danny ""Butch"" Means)
It seems like only yesterday
I first met you
Grey skies turned blue
I wish I knew
Why do you always hesitate?
What did I do?
All I wanna do is be with you
Baby can it go down
(Chorus w/ ad-lib variations to fade)"
30,Just Another Day,1998,G-Funk Classics (1998),,Nate Dogg,"Just another day
Just another day
Just another day
Just another day
Wake up early in the mornin' man
Runnin' kinda' late I gotta' catch my plane
Feelin' kinda' funny from the weed and thangs'
Kinda' glad I woke up so I can't complain
I really need a break from this paper chase
But my girl ain't gonna' wait for the diamond ring
My son ain't got to wait for no proper clothes
So I'm gone take a trip and do a couple of shows
So many different things be runnin' through my head
It's mandatory that I keep my family fed
On come the stompin' boots and I'm out there again
Seems like this crazy pace is never gonna' end.
Just another day
Just another day
Just another day
Just another day
I'm on a mission man, I'm fired up
They let me taste it man
And now I'm hooked
Ain't nobody standin' on the wall
I bust the way I bust because the feel it y'all
People got opinions all about me y'all
Got a lot of girls so they call me dogg
Constantly around me is friends and foes
Say the wrong thing bet I bust your nose
I gotta' give give it up to niggaroes
Even thought at times we fuck the same hoes
All the other niggas I'ma let you know
Ain't no player hatin' go for what you know
And if you see a girl that I'd like to lay
Feel free to send her my way
Just another day
Just another day
Just another day
Just another day
If I call you baby would you swing my way tonight
I got somethin' for you that I'm sure you're gonna' like.
If I call you baby would you swing my way tonight
I got somethin' for you that I'm sure you're gonna' like.
And we can do it all night
I bet I hit it just right
Just another day
Just another day
Just another day
Just another day"
31,Keep It G.A.N.G.S.T.A.,2001,Music & Me (2001),,Nate Dogg,"(Feat. Lil Mo)
(Chorus - Lil' Mo and Nate Dogg w/ variations)
(Both) A gangsta's for every day
(Mo) So make sure that you keep it, G-A-N-G-S-T-A
(Both) And now that I know the game
(Mo) I'll make sure that I keep it, G-A-N-G-S-T-A
(Nate Dogg)
Deep in the ghetto where the poor people hang
Please pay attention they do ghettoish thangs
One out of three, yep a third of 'em bang
The other motherfuckers they be slanging that cane
Always out for money 'cause the money's the game
Eastside homey it's a Long Beach thang
You heard me right nigga this is DPG
With the superwoman standin' claimin' CPT
(Lil' Mo)
I-I, promise I'ma keep it G
Rep my south team, hands in the street
Recognise game, and they recognise me
'Cause a G like me comes naturally
Tho-ose, haters try to hate on me
But they got no choice but to do right by me
There's no way o' dividin' me
'Cause my OG's in the streets gon' ride for me
I-I, promise to do ghetto things
'Cause I'm the closest thing to ghetto in this industry
That's why I be chillin' when it's 90 degrees
While ya keep shit poppin' how I ride this beat
And people always saying to me
How can I tell I'm really a G?
'Cause an OG told a gangsta
A gangsta told a playa
A playa told Nate
And Nate just said to me
(Xzibit)
Nate Dogg reppin'
(Look!) X to the Z
I'm shifty, versus runnin' a buck 50
Tryin' to get large enough bank to get Britney
I'ma do Britney like Bobby did Whitney
Fuck her whole life off, donate my kidney (Yeah!)
Wake up to vodka, crash with the whiskey
My name holdin' to much weight, you can't lift me
Came from my first out ghetto with King Tipsy
Hold a torch over my city, you can't miss me
Niggas say fuck me but can't fuck wit' me
Twist this shit, make your finger tips sticky
I need me a wify, shit I mean wifey
I'm so fucked up I couldn't read my own writin' (Heh)
Clash of the titan, (Yeah!) no propaganda
Big (?) hummin' for you Tony Montana
T-shirt, khakis, tucked in bandanas
Livin' amongst the most scandalous on the planet (Yo!)"
32,Keep It Real,2003,Nate Dogg (2003),,Nate Dogg,"(Intro: Fabolous)
Yeah, recognize and realize
This is serious pimpin' goin' on
The game ain't ready, for Nate D-O-double-G
Lil' M-O, Fabolous
We 'bout to pimp the damn thing
Like it's never been pimped before, you feel me?
Yeah, uh
From the Westside, to the Eastside
To the Dirty South, to the Midwest
C'mon, let's ride, peep game
Yell at 'em Mo!
(Chorus: Lil' Mo (Nate Dogg))
I'm gon' treat this game like a hoe
And this trick better have my money fo' sho'
I'm a player, gangster, pimp and a rolling stone
And I ain't gonna let it go, that's why
(I'm gon' treat this game like one of my pros)
(Wanna be number one so anything goes)
(But my tactics they just can't be exposed)
(Can't be exposed)
(Fabolous)
Yeah yeah uh yeah uh yeah ghetto
This kid was enforced by strict parents
Don't flow for nuttin less than a cross and sick earrings
A Porsche with sick steering
Never mind the cost to get clearance
For me, if you ask what I cost an appearance
I'm a pimp, of course your chick's sharin
I got lawyers, who never lost in fixed hearings
I need seven figure offers to sign
Come out your pockets like your needs will be officer blinds
I send the Street Family and your offer's for mine
With blocks, that look like police officer Conn
Islip's a author of mine, once these slugs is in your head
Doctors won't be able, to get 'em off of your mind
How they gon' take me off of my grind
These yellow and white stones glowin' somethin' awful in mine
Even if they don't understand the flow, they understand the dough
Tell 'em I said they don't get a hundred grand then go!
(Icarus)
Uh-huh, uh, Icarus, Bushwick, GMG, yo
Nate got all the chickenheads from Medina on the weiner
'Cause I hide the nina, inside the Beamer
I'ma treat this game like a hoe on Hunt's Point
They don't have my dough I'ma snipe 'em gunpoint
My name Icarus, game ridiculous
Get in your house quicker than St. Nicklaus
Me rockin' Nate like we need bitches
Come through lookin' evil, three 6's
GMG, king of the remixes
And music pah is broke we fix it
And we equipped with (what) heat that if we squeeze
It'll bring police from three districts
N.Y. to L.A. we get chicks
That smoke haze and drink Ih liquid
Y'all know the flows I be sick with
Ica the Don, trick I be pimpin'
(Lil' Mo)
'Cause I got this game, right where I want it
And it better have my money
Or it's gonna get ugly
Yes it's gonna get ugly, that's why
(Nate Dogg)
The game is to be sold, not told
The tattletale will always be broke
You live and learn, just live by the code
If you, don't already know
That's what it takes now
Raise the stakes now
Don't be fake now
Keep it real (keep it real)
(Outro: Nate Dogg (Lil' Mo))
I'm gon' treat this game (you better have my money)
Like I beat this game (you better have my money)
Won't leave this game (I'm a player...)"
33,Last Prayer (comm. 2),1998,G-Funk Classics (1998),,Nate Dogg,"Nate Dogg
G-Funk Classics Vol. 1 ""Ghetto Preacher""
Last Prayer (Comm. 2)
Heavenly Father, I bow before you today to ask you to forgive this man for his sins, for it
Was you who said, Father, ""For all have sinned and come short of the glory of God."" Oh Lord,
Grant him a pass into your kingdom, into your kingdom, Father. Give him the strength to walk
Through The Valley of Death, directly into your arms. In Jesus name pray, Amen.
Amen.
All right, let's go.
Hey dog, that's fucked up what you doin' to Nate, man. Y'all ass will never get me like that.
You ain't seen nothin' yet.
Hey Nate, stay up dogg.
Yeah.
I'll see you soon.
You sure will
Save me a spot up there Nate.
Right
Be sure to smile for the camera. Excuse me, move to the side, move to the side. Right this
Way, come on, move out, move out, move out. All right, hold on, let's get these chains off of
Him. Have a seat. Yeah, you ain't got One More Day no more, do ya? Just sit on back and
Relax. It'll be over real soon. Well son, nothin' left to do now. You got any last words?
Yeah, I got some last words."
34,Leave Her Alone,2003,Nate Dogg (2003),,Nate Dogg,"(Nate Dogg)
One to the other, other two to the three
On the mic is N-A-T-E D-O-double-G
Still chasin paper, still runnin' them streets
I never trust a hoe because I know what they be
One to the two to the three to the fo'
Baby when you need let me come in the back do'
She's still a bad bitch but I don't love her though
Once I hit it once I'd rather leave her alone
(Memphis Bleek)
Uh! Aiyyo I'm worldwide respected
You know the G4 flies international, niggaz flyin domestic
I been around the world, seent many faces
But better yet I got head from difference races
And I don't trust 'em as far as I can throw 'em
I murder with no motive, I hit 'em and don't know 'em
I just, sneak, and send 'em right back home
That's Bleek, not your hubby ma, I'm not like home
But dig it, the truth hurt, they be addicted to the didick
I dig in it, they one shot and live with it
But mami vacate premises
The head straight chiller man invite all my niggaz in
Nate and Free, I might make you my lil'
Drug hoe if you can take a D
Mami, and run with it 'cause I had my fun with it
It's S-P, D-G-L and Nate we done with it
One to the other, other two to the three
On the mic is N-A-T-E D-O-double-G
Still chasin paper, still runnin' them streets
I never trust a hoe because I know what they be
One to the two to the three to the fo'
Baby when you need let me come in the back do'
She's still a bad bitch but I don't love her though
Once I hit it once I'd rather leave her alone
(Freeway)
Yeah, me and Nate Dogg just skate off
With two chicks and they both freaks eager to bone, yeah
I'm tryin' to scrape one and split, she tryin' to get to my home
She got a thing for rap stars and athletes
She tryin' to chill with the clique, wantin to hop on the phone
All in her men's truck, callin her friends up
But Free don't go for that, or go for chicks
That hang at clubs, ball games and track meets
Free don't like no groupie-ass bitches
So if you got your eyes on my digits better keep goin'
Keep mo'n, and if you tryin' to with Freeway
Keep paper, and when you give met, keep goin'
We smokin', backwoods keep rollin'
That's why a nigga higher than the skyscraper
One to the two and three to the four
If you fuck with the raw I'll tie your neighbors up
One to the other, other two to the three
On the mic is N-A-T-E D-O-double-G
Still chasin paper, still runnin' them streets
I never trust a hoe because I know what they be
One to the two to the three to the fo'
Baby when you need let me come in the back do'
She's still a bad bitch but I don't love her though
Once I hit it once I'd rather leave her alone
(Young Chris)
Yeah, you rockin' with with the R-O-C
What you coppin ma it's all on C
You can call on me when you havin' hard times
I hustle at all times, you welcome to all mine
That's only wifey though, the rest of y'all triflin hoes
Don't get a dime, get your mind right your mic and go
One to the two to the three to the four
Mami it's one to the two to the three in my Porsche
And me, we tryin' to see if you can take on us all at once
And stay P ma, you breakin us off for free
I holla back ma, it's Free, Weezy, easy
Young gunna, Nate Dogg a wild on track
My niggaz is skeetin, we hittin we leavin'
Y'all, love 'em and hug we forget 'em and flee 'em (that's right)
We don't need 'em if they ain't breakin with the team
'Cause they ain't nothin' fuck 'em relationship a misdemeanor
One to the other, other two to the three
On the mic is N-A-T-E D-O-double-G
Still chasin paper, still runnin' them streets
I never trust a hoe because I know what they be
One to the two to the three to the fo'
Baby when you need let me come in the back do'
She's still a bad bitch but I don't love her though
Once I hit it once I'd rather leave her alone
One to the other, other two to the three
On the mic is N-A-T-E D-O-double-G
Still chasin paper, still runnin' them streets
I never trust a hoe because I know what they be
One to the two to the three to the fo'
Baby when you need let me come in the back do'
She's still a bad bitch but I don't love her though
Once I hit it once I'd rather leave her alone"
35,Me & My Homies,1998,G-Funk Classics (1998),,Nate Dogg,"(Feat. Tupac Shakur)
Me and my homies tho
You know we kick it like everyday
Me and my homies, kick it like everyday
(Nate Dogg)
But I'm alone in my room
And I don't have no one to talk to
I catch a girl with my phone
And cause some folks who know what I go through
After I smoke a joint, come on
To keep my temper low
I parlay with my friends
There's really no where else to go
Me and my homies though
You know we kick it like everyday
Me and my homies, kick it like everyday
(2 Pac)
I ain't shit without my homeboys
Rather be buried, then see us party
Keep it close to my heart
'Cause we the ones that got the shit started
You recollect, we used to bust on snithces
Nobody come before my niggaz, fuck all y'all bitches
All my homeboys are self sufficient
So be suspicious of your scandalous tricks
Got the police takin' our pictures
Love to hang out on the corner but we known to ride
Me and my muthafuckin homeboys down to die
For each other, 'cause we closer than brothers
It's like you came in, no forgettin the party poppin'
When my squad walks in
Throw up your hands baby buy me a drink, stop actin' phony
Don't forget tto bring something for all my homies
To know me is to love a thug nigga to the fullest, duckin bullets,
Snatchin guns when these trick niggaz pull it
Handle my business like a professional, the whole world knows me
But I ain't shit without my fuckin' homies
Me and my fuckin' homies
Me and my homies though
You know we kick it like everyday
Me and my homies
Kick it like everyday
(Me and my homies)
Constantly we mash
(Me and my homies)
Gotta make that cash
(Me and my homies)
There's no need to ask
(Me and my homies)
We are still the best
(Breakdown) x8
(That's my homeys)
That's my homeys
DPGC homeys
Me and my homies tho
You know we kick it like everyday
Me and my homies, kick it like everyday"
36,Music & Me,2001,Music & Me (2001),,Nate Dogg,"Nate Dogg)
Hey OG, could you tell me how to find some good weed
I need it homie oh so bad
That last bag was the best weed I've ever had
Bass so deep, I can't even seem to feel my feet
Girls so fine, I can't help it got to make this one mine
I hit 'em with my, gangsta lean
They can't separate my music from me
Music and me (3x)
Music, my music and me
(Nate Dogg)
Time does change, but the music it remains the same
I hit 'em with the music from the slaves
Oh my goodness, what my ancestors gave
I don't want you to think I don't know
They tought me how to reach deep down and touch the soul
Without my music, where would I be
You tought me how to cry and still remain a G
You keep a lot of soldiers at ease
And together the next level proceed
My music and me
Music and me (4x)
My music and me
(Nate Dogg)
Music and me, go together perfect harmony
Soft and mellow, or so hard it will make your speakers explode
Stay with me, and together we will live out this dream
My music and me
Music and me (4x)
My music and me
Music and me (4x)
My music and me"
37,My Money,1998,G-Funk Classics (1998),,Nate Dogg,"I gonna make
I'm gonna make my money (money)
From the time that I was only seventeen
I knew I loved to write, I knew I loved to sing, I've seen
I've seen about my friends and all the gangsta things we did, we did
Back in those days there was some who always said
You'll never make it no, you'll never get ahead of time
I guess I'm going for mine, contrary to what they said and I did
This is just to let you know
I gonna make
I'm gonna make my money (money)
No matter what they say to me, I'm gonna make my money
And anyone who don't believe, best stay away from me
Been on a mash for currency, since 1993
There ain't no way you stopping me
I'm determined as I can be
And if my funds get low again one thing I can guarantee
You catch me by the corner store sellin badass bags of weed
Not because I think it's cool, or because I think it's neat
It boils down to one simple fact, me and mines have got to eat
I gonna make
I'm gonna make my money (money)
(x4)
Tell me have you ever heard G-Funk
Tell me have you ever heard
Nate Dogg and Warren G had to regulate
(Repeats through chorus)
Tell me have you ever heard G-Funk
Tell me have you ever heard
I gonna make
I'm gonna make my money (money)"
38,My World,1998,G-Funk Classics (1998),,Nate Dogg,"If this were my world (If this were my world) My world
If this were my world (If this were my world) My world
If this were my world (If this were my world) My world
If this were my world (If this were my world) My world
If this were my world you know what I'd do
Take a million dollars out the bank, would you
Give a half a million to the chronic man
Yes I would do it, 'cause I can
If this were my world you know who I'd screw
All the motherfuckers that be screwin you
Not that I'm trying to get elected man
I would set trip because I can
If this were my world the holidays would be
One for famous black folk and one for me
Just in case you don't know who I be
Make a holiday for the G-Funk king
If this were my world things would go my way
Every single day I'd have one more day
And if ever anybody got in my way
All I can say is first we pray - first we pray
If this were my world (If this were my world) My world
If this were my world (If this were my world) My world
If this were my world (If this were my world) My world
If this were my world (If this were my world) My world
If this were my world you could bet I'd clown
Have a mini mansion in every town
Fan mail comin' in from all around
Asking me where did I get that gangsta sound
If this were my world it would only be me
Standin on the top of the industry
Bouncin' like a baller over tight-ass beats
Remind yourself that can't nobody can bust like me
If this were my world everyday there'd be
Another young brother claimin D.P.G.
Raised from the gutter taught to make money
Why do niggaz talk about what they can't see
If this were my world I'd take my gangsta name
Set it at the top right next to fortune and fame
Finally I got myself up out of them chains
If they lock you up don't let 'em capture your brain
If this were my world (If this were my world) My world
If this were my world (If this were my world) My world
If this were my world (If this were my world) My world
If this were my world (If this were my world) My world
If this were my world, you now what I'd do
Buy me a spaceship and a condo on the moon
If this were my world, I'd have a low low crew
We'd go roll your hood and do what gangstas do
If this were my world
If this were my world (If this were my world) My world
If this were my world (If this were my world) My world
If this were my world (If this were my world) My world
If this were my world (If this were my world) My world"
39,Never Leave Me Alone,1998,G-Funk Classics (1998),,Nate Dogg,"(Feat. Snoop Doggy Dogg)
Chorus (Nate):
Never Leave me alone (never leave me alone)
Leave me alone (never leave me alone)
Never leave me alone (Never leave me aloooone)
Leave me alone (Never leave me alone)
Never leave Me alone
Verse 1 (Nate Dogg):
They tell me that temptation... ooh, is very hard to resist
You tell me that you want me... I tried to hide my feelings, D-O-G's
Ain't supposed to feel like this
You can call it what you want to... But I don't even know what it is
You've got me singin' in the morning... you bring me breakfast in my bed
And when it hurts you rub my head
I'll ask you one time only... baby, won't you be there when it's hectic
When I don't have a hit record (Never leave me alone)
Verse 2 (Nate Dogg):
I've traveled so many places... I've seen so many faces
There were times I didn't think I'd make it through (alone)
I went through so many phases... that got me so many cases
Three strikes you're gonna' then what you gonna do
I guess I'll call my lady... and tell her to kiss my baby
They tell me that crime is all I know how to do
Tell him his daddy's sorry... let him know all about me
There's one more thing I'd really like for you to do
Verse 3 (Snoop Dogg)
Somebody was naughty when they snitched on me
And the judge just sentenced me to do about a century
I'm mobbin' through the county mainline
Back in 9500 just tryin' to handle mine
Spittin' game at the homies about the good ol' days
As we try to pass time waiting for the chain to Chino
I see no reason to cry but I miss my baby boo
And my nigga Spanky too
It's true that the dirt I did from an O.G. to a snotty nose kid
Got me caught up in the rapture like maze days gone by
And real G's gon cry
But I try to walk the yard with my head to the sky
And hope my baby boo ain't fuckin' niggas on the outside
But what's the chance it ain't crackin'
If I was out and she was in I'd probably be mackin
I can't lie
So I say I would now my girl in a world of playahood
A playa should show a nigga love and look our
But the niggas I know would probably turn your ass out
So keep away better yet stay away
And hope I get out one day, OK
But if I don't I guess this is home
My girl is trippin' she got a block on the phone"
40,Never Too Late,1998,G-Funk Classics (1998),,Nate Dogg,"(Nate Dogg) (Barbara Wilson)
Homey it's rainin
Ten below zero
Kinda cold outside (Kinda cold outside)
Yes it is cold (Kinda cold outside)
Tornado, hurricane, and high tide
(And a high tide, and a high high tide)
I tell you why homey
Had a homeboy, down with me
Or so he said (Or so he said, that's what he said)
Yes he did homey
But as it turned out
He wasn't down with Nate Dogg (No, no)
He was down with bread (He was down with bread, all for himself)
You know what's wrong
You, need to take your bad ass home
It's never too late, to go back, to where you come from, oh homey
It's never too late, to go back, to where you come from, mmm
Do you remember home? (Do you remember home?)
Has it been that long (Has it been that long?)
Since you been gone? (Since you been gone)
Won't you come back home
Seems like it was yesterday (Yesterday)
When you lost your way (When you lost your way)
And let your homies hang (Let your homies hang)
All the while you got paid
Do you respect family?
Do you know what that mean?
To give everythang and not expect to receive
I gave all I had (All I had)
It really makes me mad (Makes me mad)
To think I've been had (I've been had)
Let's forget about the past
But you know what's wrong
You, need to take your bad ass home
It's never too late, to go back, to where you come from, oh homey
It's never too late, to go back, to where you come from, mmm
(Nate Dogg)
I will lift my voice
And forever sing
Music gives me joy
May we always reign
And if I lose my way
May my family place
A foot where I can taste
A bitter sweet embrace
You know what's wrong
You, need to take your bad ass home
It's never too late, to go back, to where you come from, oh homey
It's never too late, to go back, to where you come from, mmm"
