,song,year,album,genre,artist,lyric
0,All Night Long,2003,Nate Dogg (2003),,Nate Dogg,"(Intro/Chorus)
It's a party y'all, tear the roof right off
Bounce with the double O-G
Alllllllll night looooong
Get off the wall, all of y'all
Wake up all the people who sleep
Alllllllll night looooong
Let's grooooooove lady
I don't wanna sleep with you, but maybe later on I do
Too smoooooooth baby
C'mon let me dance with you, girl I like the way you move
Home after a hard day's work
I wanna see the mini skirt
Tonight I wanna take you out
I wanna know what you about
I need to grab some juice and gin
I need to call a couple friends
I want to see you shake it and
I hope this party never ends
Where else would I go? What else would I do baby?
It's a party with you lady, ah
I know you want to, it's all up to you baby
We can party all night baby, ah
This party won't stop (all night long)
Let's take it to the top, all night long (all night long, all night long)
This is where I wanna be, my loved ones and me
All night long (all night long, all niiiiight)
Go ahead get off the wall, tear the roof right off
All night long (all night long, allllll, all night)
Welcome one, and welcome all, to the city by the deep blue sea
Where they party all night long, all night long
All night [5X]"
1,Almost in Love,1998,G-Funk Classics (1998),,Nate Dogg,"I was almost head over heels
I was almeost the man of your dreams
And you almost had me sprung
You were almost my only one
Just about had me hooked, till I had to take a second look
Almost in love
Just about had me hooked, till I had to take a second look
Almost in love
Girl you almost made me change my code
And you almost made my pockets grow hoes
Not only did you almost
Make me buy you gold
Downtown you almost make me go
Just about had me hooked, till I had to take a second look
Almost in love
Just about had me hooked, till I had to take a second look
Almost in love
The roses we picked just yesterday
Seemed to have wiltered away
And we've been on the ground
Looking for a four-leaf clover but there's been no luck
Baby I guess it's over
But we almost make it to the finished line called love
Almost and there's no need to raise our voices
Unless we're singing in harmony
But we're not 'cause there's no harmony
But we almost make it almost
Almost in love
Almost in love
Almost in love
Almost in love"
2,Another Short Story,2001,Music & Me (2001),,Nate Dogg,"(Nate Dogg)
Another short story
When he be acting bad, don't he make you mad
Wanna kick his ass, when he already showed ya
He ain't no good and that's a fact
Another sad story
She constatly says she adores me
Girl I'm all dog in love don't leave here anymore
Another short story
Her love was beginning to bore me
It does't take long for my love to fade
Another sad story
I only call when I'm horny
But she acts like we kick all day
It's a quarter pass midnight
Don't he make you mad, you can't find his ass
Seven hours past, since he called you last
Only to you he can do no wrong
Funny how time flies
Especially when you live a whole life
Looking for love is already gone
Another short story
Already gave you a warning
A one night stand homie look what I done
Another sad story
This girl was so soft that's so lovely
I cannot stay 'cause she's to strong
I keep my mind on my monay
And everything else is just find someone else to play her game
I like new skirts yeah like bees like honey (honey)
You can have some if you want, hey no kissing
Ooh no, another short story
Her love was beginning to bore me
It doesn't take long for my love to fade
Another sad story
I only call when I'm horny
But she acts like we kick all day
Another short story
Already gave you a warning
A one night stand homie look what I've done"
3,Backdoor,2001,Music & Me (2001),,Nate Dogg,"When your days get lonely (Days get lonely)
When your nights get cold (Nights get cold)
When the rains starts poring (Rains starts pouring)
When your man ain't home (Man ain't home)
You can call me baby (Call me baby)
You can let me know (Let me know)
You ain't had none lately (Had none lately)
Let me in the backdoor (Let me in your backdoor)
When he walks out the door
When he acts like he don't want you no more
You can do the same thang
You can play at this game
With this love in forehold
He got you doing his chores
Might as well be with me
You ain't nobody's slave
He ain't never gone change
He still be palying his game
You can do the same thang
Girl I won't say a thang
If you won't tell I won't tell
We living life, what the hell
We both want the same thang
Ain't no raison to complain"
4,Bad Girls,2003,Nate Dogg (2003),,Nate Dogg,"I react like a dog when ya move his food
I'll turn your blocks upside down like Rubik's Cube
I need a bad girl to make a nigga lose his cool
But in the heat of the battle she'll pull his tool
I take 'em - skinny, dumb, blind, crippled and crazy
Or even five-hundred pounds sweatin' gravy
You know, she cooks cover, not with Maybelline
So ""Next Friday"" she hunt you like Baby D
I told her I'm not big, I'm tight with money
Tight nigga, stay shittin' with a diaper on me
Niggaz throw on your gators, I'm the type that's bummy
Stayin' around the hood keep me nice and hungry
She said ""I like your style"", I complimented
Her ass like a garden, I gotta dig it
Niggaz better duck when baby squeeze
Bad girl, bad girl from L.A.P.D. nigga
(Nate Dogg)
I, I know that I shouldn't, I
Shouldn't buy into this lie
I know that she got 2 or 3/4 guys
I, I know that these girls all fly
And they know that I'm that guy
Who can make all these girls come alive
Why? Because I got my eye
Got my eyes on them thighs
And she got her eyes on this bad guy
(Chorus: Nate Dogg)
Bad Girls (bad, bad girls)
Bad Girls (bad, bad girls)
Bad Girls (bad, bad girls)
Bad Girls (bad, bad girls)
(Nate Dogg)
I, I got a nasty mind
And she got a big behind
I gotta make that bad girl mine
Why? She likes to play all night
Knows how to move just right
I better slow down before she pass me by
Tonight, I'ma show her tonight
Won't let her go tonight
Look at her shake it, my-my-my
(Redman)
Ey yo Nate, that bad girl ain't Platinum, she a Diamond to me
She got a car door that open, ninety degrees
Or how 'bout them women, that's outdoor till the mail come
First of the month, they toes and nails done
Workin' three jobs just to feed her children
And to fuck me on the beach at Hedonism
She smoke like I do, ride like I ride
She's that bad girl that'll ride till I die
Fool, nigga, say ya seen what?
Bad girls all gettin' stuck in here
Yo, bad girls, they gettin' stuck in here
Yo, these bad girls gettin' stuck in here
(Chorus: Nate Dogg)
Bad Girls (bad, bad girls)
Bad Girls (bad, bad girls)
Bad Girls (bad, bad girls)
Bad Girls (bad, bad girls)"
5,Bag o'Weed,1998,G-Funk Classics (1998),,Nate Dogg,"I'll bring the bag of weed
You can bring the bottle of wine
Call me whenever, we can get together
And have us a real good time
(Nate Dogg)
Its still morning
I'm still yawning
Outside my window
Someone's calling
Her name was Micky
Habits freaky
She liked to do me
Her and her homeys
Did I mention
That I'm balling
Rollin' on gold ones
That's right, crawling
That's why she's jocking
Early this morning
I'm feeling under the weather
I'll soon be feeling better
Don't forget the paper this time
(Somebody's calling)
I'll bring the bag of weed
(Outside my window)
You can bring the bottle of wine
(Somebody's calling)
Call me whenever, we can get together
(Outside my window)
And have us a real good time
(Tray Dee)
Call me whenever, but never ever after 10
'Cause I got to be at home with my bitch and my kids
I hit the skin flip the twin lips of love apart
Get to diggin in ya ligaments then bust ya heart
'Cause from the start, soon as we sparked the bag I brought
I seen you chokin through the smoke noticed your titties was taut
You caught, up in the game that I came to spit
I cracked the hennessey and entered DP gangsta shit
You wanna get with this, or is you in to twist
The game up and make me cum just to say you came up
And gained what another strike on your rap
When you coulda kept your mouth shut and right on the step
With the program knowin' damn well you wrong girl
'Cause I shook you and took two of your homegirls
You played yourselves so I had to leave
Baby shoulda just chilled off this bag of weed
(Somebody's calling)
I'll bring the bag of weed
(Outside my window)
You can bring the bottle of wine
(Somebody's calling)
Call me whenever, we can get together
(Outside my window)
And have us a real good time
I can bring the fat ass bag of weed
I just now left the spot
You can bring the cold ass bottle of wine
And make that your first spot
(Somebody's calling)
I'll bring the bag of weed
(Outside my window)
You can bring the bottle of wine
(Somebody's calling)
Call me whenever, we can get together
(Outside my window)
And have us a real good time"
6,Because I Got a Girl,1998,G-Funk Classics (1998),,Nate Dogg,"When the cats, awake
The mice will play
That's what the people say
All I know is doggs play anyways
'Cause I play everyday
You do it too don't lie
Soon as you're out my site
I seen you creepin' by
While I was creepin' mine
While I was checkin' out
I saw you checkin' in
I shoulda knocked you out
But I was with your friend
x2
Because I got a girl, don't mean we can't talk
Because I got a girl, don't mean I won't break you off
x4
(Come On) Come on girl let me heed it
(Come on) Meet me at the deli that's if you're weeded
Back in the days I used to like bitches
But I tell you nowadays bitches ain't shit
And if you wonder why I say this
I've had a few bitches and bitches think they slick
Runnin' around, playin' all my niggaz
Trying to split a brother from his grip
Got all these bustaz watchin me
But I tell you right now hoe, I don't slip
I'd like to give a shout out to my favorite girl
But I won't you know why, because she's a trick
And if I give a shout out to a sneaky bitch
I got to give a shout to the nigga she's sneakin with
(And all my homeys say)
Because I got a girl, don't mean we can't talk
(Come on girl let me heed it)
Because I got a girl, don't mean I won't break you off
(Meet me at the deli that's if you're weeded)
(x4)
Come on girl let me heed it
Meet me at the deli that's if you're weeded
'Cause I have never met a girl
That I love in the whole wide world"
7,Can't Nobody,2001,Music & Me (2001),,Nate Dogg,"(Feat. Kurupt)
Can't nobody
Do you like we do
Can't nobody
Do you like we do
(Kurupt)
Pistols and penitentiaries
Gangstas on a worldwide hunt for head huntin
Spead dumpin lead bustin'
Tell me you wanna be done
It's so many thangs on these streets
Gang bang on these streets
Heat holders
That hug wit slugs
And it's the thang to be either crips or bloods
Nate show these niggas how it was
And how nobody do it like we does 'cause
(Nate Dogg)
Something about the west coast
Makes me bang the beats
Something about the west coast
Makes me run them streets
Somethin' about the music
Makes me wanna sing
Something about this chronic
Knocks me off my feet
That's real chronic baby
I know you never thought these niggas could be this good
We'd be bumpin in your system from hood to hood
I know you never even though we would last this long
You were dead wrong
Homie this is Nate he's a double O.G.
All up in the place Kurupt
Better ask your girl why she starin' at me
Leave me alone
(Kurupt)
Calicos
We ready for the get down
You ready to have sit-down
Bitch nigga sit-down
Runnin' in and out ya house
Runnin' in and out ya spouse
Don't say shit or I'll be running in and out your mouth
Gangstas get the party crackin'
Hit a land and get it crunk
Nate Dogg and Kurupt
Yeah nigga that's wussup
Now I gotta show y'all how the west coast rock shit
Concoct and plot shit
Dogg pound oxes
(Kurupt)
DPGC
The greatest on this earth
Gangsta that was taught shoot before you converse
Go against the grain and we convert to the worst
Take flight like eagles
Puncture like needles
Touch him without even bein present
The greatest on this earth west coast presents
The Dogg Pound muthafuckin gangsta nigga
On all gold feet
Yeah them all gold D's
We double O.G.'s
(Nate Dogg)
Something about the west coast
Make me bang the beats
Something about the music
Makes me wanna sing
Something about the chronic
Knocks me off my feet
That's real chronic baby"
8,Concrete Streets,2001,Music & Me (2001),,Nate Dogg,"I'm from the jungle with the concrete streets
You don't wanna rumble wit the real O.G.'s
Man I'll plant ya like a chronic seed
And ya girl done ran away wit me
I can show you how to catch these freaks
I can show you how to beat these streets
I can show you how to crack the safe
Let me show you how to break that bank
(Nate Dogg)
Ain't a damn thang changed
Still rollin' on Dana Danes
Still packin steel claimin DPG
I always keep my thang
Always got weed on my brain
Always got a dime piece wit me
I'm gone let yo roll call
I'm gone ball till I fall
Keep it gangsta just for all of y'all
Nate D, O, double G
Bangin' from the west to the east
(Nate Dogg)
No need to fight it baby
I know you want it lady
I can tell by the way you watch me
I like the way that you walk
I like the way that you talk
Ooh what that accent does to me
Yeah I still claim 213
Yeah I still bang DPG
Hang wit Nate, Snoop, and Warren G
Yeah I got hoes that love me
Got gangstas bangin' my beats
I got hoes from here to overseas
(Nate Dogg)
I need a gangsta lady
One from around the way
I need a girl that likes to play everyday
She said her friend wants to see
She said her friend is nasty
I say you get your friend and come right away"
9,"Crazy, Dangerous",1998,G-Funk Classics (1998),,Nate Dogg,"(Nate Dogg) (Nancy Fletcher)
Now life for me (Life for me)
Livin' on the streets (On the streets)
Used to be, hectic, scandalous (Scandalous)
The people I meet (people I meet)
When I'm on these streets (On these streets)
They can be, crazy, and dangerous (And dangerous)
When you're broke as you can be
And you're on them streets
You have to be, cunning, homey
Keep your hand (Keep your hand)
On the Hardest Man (Hardest man)
Or you may be, a dead man"
10,Dedication,1998,G-Funk Classics (1998),,Nate Dogg,This is deddicated to the niggas that was really down from day one... So much for Death Row
11,Dirty Hoe's Draws,1998,G-Funk Classics (1998),,Nate Dogg,"(Feat. Big Chuck)
(Daryl)
Kevin, this is Daryl from Long Beach
Man uh, I was wondering if you could uh, play a song for me
Me and my lady goin' through a few thangs, see
And I'm not feelin' very well right now
(Kevin)
Yeah, I hear ya, I know how you feel
I've been there, hell we've all been there
For you and all you playaz who got bumped off the playin' field
This is the song for you
187.4 on your FM dizzal, WBALLZ
A dirty ho's drawls
That was the cause of it all
Pimpin' hustlin playin' hoes is all I know
With my homeys on the mash and a pocket full of cash
What more can a nigga ask for
With my strap in my lap and my niggaz back to back
A muthafucka didn't wanna see me
Then along came his girl, finest woman in the world
That broad been to my knees
A dirty ho's drawls
That was the cause of it all
(Now I, don't trust no hoe
And do you, know that's how it goes)
I never thought you were the one
That would try to get a nigga like Ms Spunk
A dirty ho's drawls
That was the cause of it all
I know you're all in big ones from the start
I really didn't need to, play your heart
But you still have the good looks, DPG blood
You're the only one that, I love
(x3)
Make me wanna climb up DPG
Make me wanna moan make me wanna scream
(Big Pimpin' Delemond)
See as I say it, something about the power of the pussy
It even breaks gangstaz down
Bitch tricked me out of my playaz license
A dirty hoe's drawls
That was the cause of it all
(Bridge plays to fade)
I'll get over you
I gotta get over you
Before I've been a fool
I gotta get over you
(Dirty ho's drawls)"
12,Ditty Dum Ditty Doo,2001,Music & Me (2001),,Nate Dogg,"(Snoop Dogg)
Nate Dizzle, Fred Rizzle
Put the pieces to the Pizzle!
(Chorus: Nate Dogg)
All the ladies who like sex like I do
Come up to my room
I'm gon' give it to you
All my homies who make chips like I do
This ones for you
Ditty Dum, Ditty Doo
(Verse 1: Snoop Dogg)
Yeah, got the freak on it
Freak, freak on it
Yeah, I speak on it
Last week on it, Snoop D-O-double-G
I'm on the mic, doggone it, you want it
Here we go again, bout to flow again
Take you out, 'cause I'm bout to bust a hoe again
Got the flow again, throw it in
Mix it, cook it, gumbo, jumbo
It just don't quit, get them chips
Mac that bitch, keep it on the under
Make 'em wonder, do it wit no blunder
Snoop D-O-double-G gets the job done
No matter what they say about me
They doubt me, they can't fuck with the
D-0-double, yes indeed that's I
The fizzi, I do it till the day I dizie!
(Verse 2: Goldie Loc)
We keep this popping
Still hit droppin'
Comin' strong just as long
As the beat knockin'
Lookin' at the clock wont do no good now
Everybody party 'cause we out of the hood now
Fred Red, hick, Goldie on the 2-way
Tell me what's crackin'
And see what Snoop say
The coupe lay boomin in the parkin lot
And I'm pullin dime pieces off of the top
Eshine, Evine, Candy Pam
Maisha, Tisha, Sandra, Ann
So man's call for alcohol
Close the door, we dogghouse deep
And we rollin' hard
(Bridge: Nate Dogg)
All through the night
Better hit it all day
Every girl in the car
Gonna get it same way
You say you wanna turn me on
Well you did, lets play
You wanna share it wit a friend
Just admit it, 3-way
Ooh, 3-way, on the freeway
The G way, fuck what he say
(Verse 3: Tray Deee)
Do I like it? (Yes)
Do I mean it? (No)
Let me hook this double thing up
Real quick, ""ILUVIT""
Pussy always make my day flows move
If I don't get me done
I have a fucked up attitude
Back off a jack off, we far
From playin' games
We some pimps, pardon bitch
No need to explain
Now look at little mama right there
She strain, suck dick and she don't even care
Man, I'm all about breaking these hoes
Shaking these hoes, make a trick
Take off here clothes
Shoot it in her nose
Money fingling, and jingling toes
Me and peep game, ""I Got Pros""
Cunt love cock, and cock love cunt
I be feeling like its sex in my blunt
Hey Casey! Where Tracy at?
She said ""Daddy she in the front washin up the 'lac""
Jumped in my shit, hit the switch, start smashin
Headed to another spot to fuck some more asses
All my niggas like doin' the damn thing
Happy beat it up like my nigga Pootietang
Hell yeah, I love sex
Because after I'm done I'm like ""NEXT!""
With my dick on hard, church to them hoes
That be fuckin' superstars!
(Snoop Dogg)
Dum ditty dum da dum
Ditty dum ditty dum
Dum ditty dum da dum
Ditty dum ditty dum
Dum ditty dum da dum
Ditty dum ditty dum
(Nate Dogg)
Ditty Dum Ditty Doo
(Snoop Dogg)
Say it, Say it
Say it brothers
Say it, say it brothers
Wessyde!
(Nate Dogg)
Ditty Dum Ditty Doo
(Snoop Dogg)
Say it bubba
Yeah, yeah yeah
Nate Dizzle, Fred Rizzle
Put the pieces to the pizzle!"
13,Dogg Pound Gangstaville,1998,G-Funk Classics (1998),,Nate Dogg,"(Feat. Kurupt, Snoop Doggy Dogg)
(Snoop Doggy Dogg)
All I know and all I do is
D-P-G with the rest of my crew
We through with Milken Milli Vanilli
Silly Niggaz who be rappin' but they really be actin'
I'm smackin' niggaz in they face
For the 9-8
My DJ Warren G and my homeboy Nate
The game won't wait
So we paper chase
And watch out for them suckas who paper-hate
Try to drop some shit to keep you straight
Keep my niggaz on a mission
But my success, oh yes it's fresh
Here's a toast to my LB for life
You can call me when you wanna
Or can catch me in the Navigator bendin' in the corner
I representin', just like Billy Clinton
I smack a bitch for my chips and dip
For Dogg Pound Gangsta Click
Don't you wanna come with me to Dogg Pound Gangstaville
We can give you what you need in Dogg Pound Gangstaville
(Nate Dogg)
Once upon a time in the land of the foolish man
There lived a man who claimed to be foldin' aces in hand
He played wrong once and played 'em twice
And played 'em wrong again
Now it's my turn to play the game
And I guarantee I win
Very best I have to be and I hope you understand
I got my game from Gangstaville
Eastside of Gangsta Land
(Kurupt)
Well you can give me half your loot, nigga
Or else I'ma shoot, nigga
I do what Gz do- I ride
I slide, I drips double 4's fool
Where's the clips
You'll find I hit your spine
And shake your hips with hollow tips
It's the modern day me
With the state of art modern day heat
Mutherfuckin' modern day G
No good for for sho good
Put this nigga on the hood
And let me put him back the fuck off
Like that, you fuckin' with the Kobe Bryant of rap
With a Mack 11 cocked back ready for sure, ready for war
For real enter if you will
In the land we call Dogg Pound Gangstaville
All we do is smoke and just so you know
My motto is fuck you bitch and fuck a hoe"
14,First We Pray,1998,G-Funk Classics (1998),,Nate Dogg,"(Feat. Kurupt the Kingpin)
Black people don't have no, no where to go
You know, all we got to do is kick it
We gonna kick it in our hood, you know
What we gonna do, we might
We might go kill a couple of niggaz mane
You know, go in they hood and do a drive-by
Then come back in the hood and laugh about that stuff
You know, its just a thing
Only how you really gonna get deep into it
Is when one of your homeys die
Just like when my partnaz died
(We got some problems)
First we pray, then we ride
First we pray, then we ride
He was my brother
Loved him like no other
To top it off
I introduced him to this game
I knew his mother
Loved her like my mother
Part of me is gone
Bout take my brother home
(What're ya gonna do)
When the trials come
(Are ya gonna run?)
Are you gonna run?
(What're ya gonna do)
First I'm gonna pray
(Are ya gonna run?)
You muthafuckin right
First we pray, then we ride
First we pray, then we ride
(Kurupt)
I ain't got nothin' but love for you loccs and hogs
And I ain't got nothin' but love for my muthafuckin dogs
In the mist of the war zone, its on on site
Daylight tonight the heat held close and tight
Beware here I come with the DPG on my chest
Heat gonna spit like Elliot Ness
In the darkest zone you feel alone and on your own
And after I bust, niggaz call me Kurupt Coleone
All I'm about is money, loot and cash
Homeys in the DPG Nate, Snoop and Daz
Now with these emotions how you approach yourself
Knowin' you all about your wealth and as it is to health
First I pray, get my thoughts intact
Ask for forgiveness 'cause I'm bout to lay this nigga flat
Can you adapt, can you feel me, I doubt it
'Cause the closest you see it, is when niggaz write about it
I can't live without it and it ain't shit I could do
But stay down with the homeys in grey and blue
So just keep the heat close in hand
'Cause I done see niggaz get shit while they homeboys ran
(Nate Dogg)
Heavenly father shine your light on me
I know I promise to slow down on this weed
Seems I remember someone used to say
One life gets taken, if you take one life away
(What're ya gonna do)
When the trials come
(Are ya gonna run?)
Are you gonna run?
(What're ya gonna do?)
First I'm gonna pray
(Are ya gonna run?)
You muthafuckin right
First we pray, then we ride
First we pray, then we ride"
15,Friends,1998,G-Funk Classics (1998),,Nate Dogg,"(Nate Dogg)
Friends, how many of us have them
Friends, how many of us have them
Friends, how many of us have them
Friends, how many of us have them
(Snoop Doggy Dogg)
Every since I could remember
I had friends I could depend on
Clothes to lend 'em
But as time went by
My life got a little strange
And the rules of the game seem to change
Trust, honesty and devotion
And money, money, money is the poison potion
There's no way that I can even say
That this game has been good to me
Or even bad to me it had to be
Cause tragically the way this shit
Cracked off for Doggy Dogg was magically
And now I'm gettin' everything I'm supposed to get
But my friendship with niggaz always ends up as bulshit
I listen to my momma though
She always tried to prepare me
Byt how could she do what I
I mean I'm do or die
But my life on the streets
That shit is suicide
So to cope I got a dogg and a locc
And keep my heat close in case these jokes go for broke
I'm mashin' with the click 2-1-3 that is
They my homeboys ever since kids-
Real friends to the end
Chorus (Nate Dogg):
Hangin' out with my homies and I'm feelin' just fine
I've been ponderin' lately, lately
A lot of different things on my mind
It seems lately my friends list
Done took a slight decline
And if you wanna know the truth man, man
Them wasn't no friends of mine
(Warren G)
You jackin' me up, you takin' my cash
All my life L-B-C, for my city I mash
All those OGs and BGs and wannabies and L-O-Cs
The only friends I got is my 2-1-3s
That's my nigga Snoop D Woop and my nigga N-A-T-E
I can't forget about my nigga H to the Deezy
Pressure and strikes
Don't wann take no lives
But these jaws, cracks and hood cracks
Will make you break bizacks
""Whussup homie, can I borrow some cash?""
Last week I gave you 500, so kiss my ass
I got a baby to feed
A familly to see through
And shake busta snitches tweekin' like you
Homies and friends that's what they for
Stayin' tight and money right
And bustin' with a 44."
