,song,year,album,genre,artist,lyric
16,G-Funk,1998,G-Funk Classics (1998),,Nate Dogg,"G is for the gang of money I make
F is for the gang of fools I break
U is for the undisputed champ
N is 'cause you never gonna get the mic back
K is for the niggaz that I knock on they back
Damn is feels good to see Long Beach on the map
Till the day I'm dead I'm gonna keep that shit real
Now you niggaz know G-Funk's for real
To those people who don't believe in G-funk
Tried to take my style and make a quik buck
Here's a message to one and all
Your pass is revoked
Now I'm havin' a ball
Any questions come and see me
The king of G-Funk the one and only
Congratulations you sound like Nate
You took my old hook
And got me paid
Some people are nothin' but clones
Some people have styles of their owm
Some people are copycats
These people can't get the mic back
Can you feel me one-hitter quitters
You can't copy me - I'm one in a million
Call any expert and you can ask him
Copy machines can't copy platinum
When you feel like some cavy G-Funk
You need some music to bumb in your trunk
I got a baseline, a gangsta tune
Put on the classics and your head will be movin' soon"
17,Get Up,2003,Nate Dogg (2003),,Nate Dogg,"(Eve)
Can never claim to be a gangsta nigga
Just gangsta
Now take a sip of something
Let me entertain you
The smoke is for them rowdy niggas
Like they want to shank ya
I cock back and blast with no questions asked
So just hold tight
Don't let the liquor run your whole night
Don't let a second of courage fuck up your whole life
I play the color analyze the view
Push up my glass to acknowledge just a chosen few
'Cause I don't fuck with many
Especially the tough ones off a glass of henny
Specialy the ones always frontin that don't have a penny
I run with niggas that demand respect
And I'm a boss bitch most y'all can't handle that
All you can do is watch and glide
And take a special type nigga to stop a stride
'Cause I can't respect a nigga that soft
And I bet y'all never seen it commin
Me and my nigga Nate dogg
(Nate)
All the girls get up
Take it too the floor
Nate just bout to flow
Turn it up some more
All my dogs get down
Let me see ya move
All the girls get up
Get up and get down
I'm on my way to the liquor store
With E-V-E and my nigga rose
Got too much game to be slippin though
I let you know if you didn't know
Never will you be able to fuck with me
Never will I ever stop bustin' I'm makin' G's
Whenever I retire I'm gonna still be beats
Shit that keep ya head bobbin
People move your feet
Shake that baby
Driving me crazy
I want that thing
No ifs, ands, or maybes
I might just keep it
If you can keep a secret
Best believe I know how to please it
Twist and turn and got my body burning
She ain't broke yet but homie she learnin
Get up and get down
Its for a glock but its letting out
Met in the club now we playin' house
I'm drunk as hell so I'm showin out
Put on my glove and I knocked it out
I'm so cold
Way too smooth
Girls they know
What to do
Shake that baby
Driving me crazy
I want that thing
No ifs, ands, or maybes
I might just keep it
If you can keep a secret
Best believe I know how to please it
Twist and turn and got my body burning
She ain't broke yet but homie she learnin
I know, you came to have a fuckin' party
I know it about time to get shit started
You know, that I'm a b-aaaaa-d man
Nobody can do this like I can
Ain't no makin' it up"
18,Gott Damn Shame,2003,Nate Dogg (2003),,Nate Dogg,"(Timbaland ad libs for the first 18 seconds)
(Nate Dogg (Timbaland) {both})
When I stepped off in the club (when you stepped off in the club)
My system full of bud {nigga what?}
They say the big Dogg's in the house (the big dog's in the how-house)
Nate Dogg 'bout to turn this part out (c'mon, c'mon)
When I crept up on the scene (when you crept up on the scene)
Lookin' real fresh and clean, know what I mean? (I know what you mean boy)
Girls just cain't resist (naw, naw, naw)
They wish they had a baller just like this (f'real)
(Chorus 2X: Nate Dogg)
I ain't slept for two days
That's right, day befo' yesterday
I got caught all up in this game
And I never will be the same - it's a gott damn shame
(Nate Dogg (Timbaland))
While I'm livin' this ghetto life, livin' this ghetto life (this ghetto life)
While I'm livin' this ghetto dream, this ghetto dream (ge-ge-ghetto dream)
I'm lookin' fo' a ghetto wife (huh, ghetto, ghetto wife)
I'm lookin' fo' a ghetto queen, you know what I mean?
Now her friend told her I'm the mayne - her friend told her I'm the mayne
She lookin' at my platinum chain, it's a shame - a God damn shame
She got her eyes all on the prize, I wonder why (I wonder why)
She wanna soak up some of this game (some of this game)
It's a God damn shame
(Nate Dogg (Timbaland))
We about to have a ball (have a ball) have a ball
She's gotta have it y'all (have it y'all) don't stall
Come and get it if you want - come and get if you want
I know you fine but I'm the boss, take it off (take it off girl)
I'm gonna say it one more time (one, mo', time)
Take it off or I can find another dime (another dime)
She's lookin' at my Gucci watch (my Gucci watch, my Gucci watch)
While her friend is lookin' at the bulge all in my crotch
It's a God damn shame
(Nate Dogg (Timbaland))
You know we do it just 'cause we can - just 'cause we can
Nate Dogg and Timbaland (Timbaland) God damn!
Smooth like Silky Slim (yeah, c'mon)
Twenty-fo' inch rims, they still spin - it's a God damn shame
It's the only way to roll; only way to roll (say what, say what)
Strapped up and 'bout to go - way too cold (what'd you say boy?)
Nobody does it like we does (naw, nope!)
But it's gon be what it is, what it was (know what it was)
I don't care what those other people say (naw, naw)
(I don't care)
I shall remain a Dogg Pound Gangster the rest of my days
(I don't care)
And when them silly-ass women get to standin in my face
(Naw) They all in my face
I give 'em what they came here for and send 'em on their way
(Beat it girl, beat it girl)
It's a God damn shame!
(Just leave me alone, and let me be to myself)
(Just leave me alone, and let me be to myself)
(C'mon, you know what I'm sayin' girl?)
(Beat it, Nate Dogg, Timbaland)"
19,Hardest Man in Town,1998,G-Funk Classics (1998),,Nate Dogg,"Will the hardest man please stand, the homie stood right up
Saggin pants, gat in hand, the nigga was a nut
Looney low key, O.G., been bangin' from the jump
Dressed in all black, ready to jack, and he still don't give a fuck
A friend of of mine, he used to be, before I got caught up
He used to roll with me, way back in '93, when I was broke as fuck
Be prepared to blast, that's all that he ask, if he's to ride wit you
We gonna make some cash, and dash, you can toss him when ya through
The hardest man in town
The hardest man in town
The hardest man in town
The hardest man around
Little big man, don't you see me lyin' here; pick me up, if you dare
I'll make you're life easier, 'cause I'll be pumpin fear
Disrespect, you don't have to take
If you see him comin', just wave me in his face
But you ain't the only one that got a friend like me
So hurry up, let's go, I'm kind of tired of being broke
I know you gotta get paid, I can show you the way
So take me home, polish the chrome
Load me up, and put me to his dome
I got a lot work to do, so toss me and be gone
You're a big man now
You're a big man now
You're a big man now
You're a big man now
I told you once before I'm pumpin fear
Nobody's gonna step to you, let them know I'm here
And if you have questions in the corner of your mind
Pull the trigger, and leave your questions behind
(Chorus) until fade"
20,Hide It,2003,Nate Dogg (2003),,Nate Dogg,"Nate Dogg (echo)
(Chorus: Nate Dogg)
I think she's tryin' to hide it
I know she's so excited
Time for some bump and grindin'
I think she wants to ride it
(Chorus: Girl)
You think I'm tryin' to hide it
You think I'm so excited
Well boy I can't deny it
Allthough I'm tryin' to fight it (She can't deny it)
(Rob Stricklong)
This chick is thick
She got a fat ass rub it back and forth from the tip of my dick
Head, horse and thick with real big titties
The finest one I done seen in three cities (I know)
She's a pro, lovin' this bomb diggy
Got plans of makin' her my kiddie
But she don't understand, I come from a land
There's program to show bitches no pitty
(Nate Dogg)
Everytime I walk down the street
A bunch of women lookin' at me
Could it be my F-A-C-E
Or could it be my fuckin' money
Everytime I open my door
Man I swear I see another hoe
I didn't see them hoes when I was broke
I'm really glad I got some indo
(Chorus: Nate Dogg)
I think she's tryin' to hide it
I know she's so excited
Time for some bump and grindin'
I think she wants to ride it
(Chorus: Girl)
You think I'm tryin' to hide it
You think I'm so excited
Well boy I can't deny it
Allthough I'm tryin' to fight it (She can't deny it)
(Rob Stricklong)
Don't fight the feelin'
My stick ain't to short, I be in there like a Newport
Givin' me sky cap, don't try to hide that
Deep though, bust a no got my gym hat
Armed Rob in the swiftlah of slim cat
You can catch me in the spot we're the tens at
Pull the tightest one, before the night is done
I'll be back, where here friends at
(Nate Dogg)
Fuck Halloween main this ain't no prank
Show me your way to make me some bank
Militarian she got no rank
She in control, yeah that's what she thank
She thank she tight but she ain't
She act like a coochie, don't stank
I keep it real 'cause I ain't no fake
Give me a bad girl, drank and some dank
(Chorus: Nate Dogg)
I think she's tryin' to hide it
I know she's so excited
Time for some bump and grindin'
I think she wants to ride it
(Chorus: Girl)
You think I'm tryin' to hide it
You think I'm so excited
Well boy I can't deny it
Allthough I'm tryin' to fight it (She can't deny it)
(Rob Stricklong)
Listen up baby, I'm a lieutenant
And me and Nate Dogg will shake y'all in a minute
If we ain't gettin' in it, it's a done deal
Another spot to feel, runnin' the mill
I keep my rubber, you stay on a pill
Rockin', non stoppin', keep lockin'
In the bed got the headboard knockin'
I like a chick that'll do what she feel
(Nate Dogg)
Whatever you do girl don't get drunk
Already used a bad excuse once
She fillin' up better grab her damn cup
She gonna find Hennessy ain't no punk
Showin' out just to get what she wants
Don't even drink girl hear it this one
I know you smoke so you don't need to front
Nate dogg about to beat this thang up
(Chorus: Nate Dogg)
I think she's tryin' to hide it
I know she's so excited
Time for some bump and grindin'
I think she wants to ride it
(Chorus: Girl)
You think I'm tryin' to hide it
You think I'm so excited
Well boy I can't deny it
Allthough I'm tryin' to fight it (She can't deny it)
(Nate Dogg and Girl)
I think she's tryin' to hide it (She can't deny it)
You think I'm tryin' to hide it (She can't deny it)
I know she's so excited (She can't deny it)
Allthough I'm tryin' to fight it (She can't deny it)"
21,I Don't Wanna Hurt No More,1998,G-Funk Classics (1998),,Nate Dogg,(Chorus - Nate Dogg x2)
22,I Got Game,2003,Nate Dogg (2003),,Nate Dogg,"(Chorus: Nate Dogg)
I got game, more game then you can ever conceive
I don't play, better not be playing with me
I got hoes (From sea to sea) all around the world (In different area codes)
I'm so tight, just pass me the Hennessy
(Nate Dogg)
Up jump the boogie to the bang bang boogie to the rhythm of the boogie dee beat
I can't imagine all these other motherfuckers think that they got more game than me
I been all around the world, had every kind of girl, it takes a lot to impress me
Up jump the boogie to the bang bang boogie, hope you know you're going home with me
I got pro's from East to West, when I flow I flow the best
Ask the first motherfucker you see
(Chorus: Nate Dogg)
I got game, more game then you can ever conceive
I don't play, better not be playing with me
I got hoes (From sea to sea) all around the world (In different area codes)
I'm so tight, just pass me the Hennessy
(Snoop Dogg)
Pass me the Henn dogg... yeah
G-A-M-E that's my thang, and it ain't no rules when you in this game
Fo real, like Shaquille, cause you know the deal, 213 in your motherfuckin grill
It's still, D.P.G. now I'm living well off
Despite a few homies fell off
I'm on the right track 'cause I'm the foefather
Bite you on your ass like a motherfuckin Rottweiler
Flip a new style and reshape and refolder
Hold easy 'cause it's that ea-sy, believe me
Snoop D-O-Double-Gee-zee, fall off in the party
Going solo and then I leave 'em four bree-zee
Let's take 'em back to the spee-zee
The honey come hide out off the church for the evening
Good Evening, ladies and gents, players and pimps
Shame on a nigga I run game on a bitch
(Chorus: Nate Dogg)
I got game, more game then you can ever conceive
I don't play, better not be playing with me
I got hoes (From sea to sea) all around the world (In different area codes)
I'm so tight, just pass me the Hennessy
(Rob Stricklong)
Niggaz be talking shit like they got the gift
Trying to keep up with the Jones's the Yester Smith
Like a stick shift switch fast on a fag, rucate rap, style ran up the ass
I'm a give you a pass 'cause I now that you'sa bitch
But next time you trip I'm a prepare the big ditch
And you and a punk should call you're team
I ran the machine named you off the team
You live in a dream nigga picking you to pieces
One tech shot leave your crop in love pieces
So recognize royalty, poetry in motion, roast MC's like chronic bud leafs
Nothing but thugs and G's when I come around
Mess around put you in a hospital gown
You'sa clown, you're sound you're whole shit's plain
It all sound the same, nigga you need game
(Chorus 2X: Nate Dogg)
I got game, more game then you can ever conceive
I don't play, better not be playing with me
I got hoes (From sea to sea) all around the world (In different area codes)
I'm so tight, just pass me the Hennessy"
23,I Got Love,2001,Music & Me (2001),,Nate Dogg,"(Nate Dogg)
I got love... I got love...
I got love... I got love...
I got love - I, got, love, for, my homies who be rollin' wit me
They know game - play, no, games, cause, ain't nobody playin' wit me
I got love - I, got, love, for my niggaz on my family tree
I got love - love for the ghetto, down for whatever
If you was down before, you gon' still gon' be down wit me
I got game - I, got, game, cause, the game was given to me
Say my name - say, my, name, cause, ain't nobody tighter than me
Give it up - give, it, up, if, you like the way I'm rhymin this beat
I don't know - know nuttin better, chasin my chedder
If you in love with a whore -- you ain't never listened to me
Wah-ooh, ooh, ooh, ooh ooh ooh ooh ooh
Wah-ooh, ooh, ooh, ooh ooh ooh ooh ooh
Wah-ooh, ooh, ooh, ooh ooh ooh ooh ooh
Wah-ooh
Captain save - cap-tain, save, a, hooker 'cause she hangin' on me
She can't hang - she, can't, hang, 'cause I ain't lookin' fo' a wifey
Just in case - just, in, case, I, better take a weapon wit me
And these hoes - keep cover, down for whatever
If she stress me some more, I have to leave her dead in the street
Run me how? Run, me, how? Cause, haters they be all in the mix
And they know - where, they, go-in, ain't gon' get no better than this
Can't they see? Can't, they, see, we, ain't some niggaz they wanna diss?
D.P.G. - though I'll love a trick never, treat a bitch never
I told you before, so you better not be fuckin' wit me
Wah-ooh, ooh, ooh, ooh ooh ooh ooh ooh
Wah-ooh, ooh, ooh, ooh ooh ooh ooh ooh
Wah-ooh, ooh, ooh, ooh ooh ooh ooh ooh
Platinum chains - plat-inum, chains, is, all you ever see on my neck
Diamond ring - dia-mond, ring, as, long as I can keep every check
All the same - all, the, same, as, long as you don't ever forget
I was taught in the ghetto, wear the tight bellow
If she head for the stash, I always got this pistol wit me
Cap-tain, say, we, bustin' to a hell of a beat
Then we came - then, we, came, cause, they base'll knock you off of your feet
Just that deep - just, that, deep, I, betcha we be movin ya feet
Voice kinda mellow, place, from the ghetto
If you still want some more, go and get the fuckin' CD
I got love... I got love...
I got love... I got love...
I got love... I got love..."
24,I Got Love (remix),2001,Music & Me (2001),,Nate Dogg,"(Feat. Fabolous, B.R.E.T.T., Kurupt)
Intro: Nate Dogg (Kurupt)
I got love
(Yeah for all y'all unaware)
(Kurupt!) Fab-u-lous
(Smash through, do whatcha do, and whatcha want to)
Gang-sta Nate
(Nate Dogg, remix with Bink)
(Doin' what we wanna...)
Young Got-ti
(Fabolous)
Ok, that's right, Ghetto! (F-A-B)
With the D-O double G, three fo' bubblies
Three fo dubs and trees
Chinky eyes, B-Low double G's
Hit three fo' clubs and breeze
The tree flow double trees
Don't speak, the deez host publicly
Dee low rubber knees, ski-o's double D's
Don't know what these broads trouble grief
For these roll double V's, please no slugs to squeeze
(F-A-B) Told you I'm a rider, but you can thank the green
For the gangsta lean, when I roll through in a rider
You lookin' at a ""coast to coast G""
I got love, but I still stash the toaster closely
We bailin on police rides, 'cause Nate
Got some sticky so strong you could smell it on the Eastside
Please believe it, believe it please
You gon' see arms come out, like sleeveless T's
(Nate Dogg)
I got love
I got love for, my homies who be rollin' with me
Play no games
Play no games 'cause, ain't nobody playin' with me
I got love
I got love for, my niggaz on my family tree
Down with the ghetto, down for whatever
If you was down before then you still gon' be down with me
(Kurupt)
Format ya doormat
Stomp and stampede on emcees like doormats (Yeah)
Contriceptic, unload and get swallowed like anestheptic
Step up and accept it
You wanna see the shells shift
Wiggle ya torso or make ya bottom or ya hips slip
Like a slick disc and twist
Buster boy Bobby, sockin all y'all is a hobby
Got 'em loungin in the lobby
Automatic tacts automatically cause tragedies and catastrophies
Suckers! (I got love)
And all the homies round up, throw the pound up
Kurupt out to show y'all how to strut like what (I got love)
Pros - they adore me, I keep all pros lookin' for me
Alive to tell this story, and I
And who am I, be the agostra Gotti
Sinatra sloss sling, soldiers
(Nate Dogg)
Cap-tain Save
Captain Save A, Hooker 'cause she hangin' on me
She can't hang
She can't hang 'cause, I ain't lookin' for a wifey
Just in-case
Just incase I, better take a weapon with me
When these hoes
When these hoes get clever, down for whatever
If she stress me some more
I'll leave the heffer down in the street
(B.R.E.T.T.)
(I got love) For chucktailors and Converse
C'mere let's con-verse, I mean where you heard those words first
(I got blunts) ... My niggaz put in hard work
Twenty four hours and packs go like front work
(I got love) Crips and Bloods, chick who'll split'cha mugs
Same bitches that strip for bucks
(Got no love) For half these dudes spittin'
Other half don't live it see... I talk about it bitch
(I got slugs) Play Brutus, Popeye your ass, reach for my spinach
You see how I'm eatin contenders
(I'm grown up) Y'all children, I'm more original
More lyrical, plus dogg...
(I got hugs) For fans wavin they hands, repeatin my sentence
My times now, eat when I'm finished
(As for y'all) You?? You oppose no threat
Got your chick hollering B.R.E.T.T.!
(Nate Dogg)
I got love
I got game 'cause, the game was given to me
Say my name
Say my name 'cause, ain't nobody tighter than me
Give it up
Give it up if, you like the way I'm rockin' this beat
I don't know
Know nothin' better, chasin my cheddar
If you ain't lovin' the boy, you ain't never listened to me"
25,I Need a Bitch,2003,Nate Dogg (2003),,Nate Dogg,"(Nate Dogg)
I need me a bitch, with some big old thighs
I need me a fine ass mothafuckin' bitch with some pretty ass eyes
I need me a bitch, like I need some cash
I need me a bitch so I can floss that hoe and make my ex mad
I need me a bitch, ain't no need to lie
I need me a bitch so when I do some dirt she be my alibi
I need me a bitch, like I need a 6-4
I need me a bitch that'll shine my rims up and open my door
I need me a bitch, who is all of that
I need me a bitch 'cause I'm a fly ass mothafuckin' nigga who was born to mac
I need me a bitch, like neva before
I need me a bitch and I couldn't care less if the bitch is yours
I need me a bitch
(Rob Stricklong)
I gotta fuck wit cheeks, got a house up on the beach
Everyweek she call me just to beat up the peach
Till she reach a climax, scratches on my back
Hit it from the back, baby told me she like that
Infact, you the first one to make it feel right
I knew she wasn't lyin', knew the cat was real tight
And afta tonight, you gone remember me
Armed Robbery, put my love up there where your liver be (Haha)
I told her never speak on me (Damn)
'Less ya want your burnt out friends ta creep wit' me, go ta sleep wit me
I hit her frequently, take them women off the chain
Can duck game, eva see the bitches run the train (Uh-uh)
It ain't the same (Uh-uh), afta I knock it out the frame
You wonder why just now ya start gettin' brain
I knock 'em out, pull chickens wit'out a doubt, fo' clout
Ask Nate Dizzal what I'm all about
(Nate Dogg)
I need me a bitch (Ah, ah, ah, ah, ah, ah)
I need me a bitch (Ah, ah, ah, ah, ah, ah)
I need me a bitch, who ain't hard ta please
I need me a fine ass mothafuckin' bitch with some sored up knees
I need me a bitch, who ain't scared ta flirt
I need me a bitch in the middle of the grocery store she'll lift up her skirt
I need me a bitch, like I need my crew
I need me a bitch to pass on to my boys soon as I get through
I need me a bitch, this I can't deny (I can't deny)
I need me a bitch I love when she wallin' out 'cause she still look fly (Fly)
I need me a bitch, and a Coup Deville
I need me a bitch a car with a big back seat so I can make her squeal
I need me a bitch, like I need a drink
Bitch who can hold her breathe real good, its either swim or sink bitch
I, I, I, I need a bitch
I, I, I, I need a bitch
I, I, I, I need a bitch
I, I, I, I need a bitch"
26,I Pledge Allegiance,2001,Music & Me (2001),,Nate Dogg,"I, pledge alle-giance
To all my hom-ies who may ne-ver
Lo-ove a ho and ne-ver will...
I, give my bo-dy
And I give my so-ulll to the funk
May the funk, never end
(Verse 1: Nate Dogg)
I pledge allegiance, to paper chasers
To hustlers who be steady pullin capers
Peace and blessing, may the sun always shine on you
I'm servin' paper, see ya later
I guess that's one mo' thing, I can't be faited
You can test me, get discombobulated
Ain't no question I'm gon' fuck with this
I do it for the funk of it
(Verse 2: Nate Dogg)
I pledge allegiance to my - homies who keep it gangsta
Fuck all the haters they can't stop this groove
I pledge allegiance to the - game cause it got me ballin
Game don't wait so I'm not stallin
I'm still dissin, she's still callin
(Verse 3: Pharoahe Monch)
Uh, what, what, yeah
Uh, check it out now, uh
See this is front line, no turnin' back now
I'm about to score, this is war on the track now (woo!)
Give me my vest and my ammo and my mac now
I'm 'bout to spit it, and Lord I'ma get it
In the worst WAYYY, slay - competition
Move the opposition, back wake the fuck up! (uh-huh)
'Cause when I get beyond enemy lines
I might snipe that ass like John Kennedy's mind
Thou shall not get caught, that's the remedy
Disinfect gun wounds on my last bottle of Hennessy
Bleed to let the seeds remember my memories
It's killed or be killed here son that's the penalty
RIDE for the funk, CRY for the funk
In the heat of night, I DIE for the funk
Pharoahe, when I'm six feet deep there's no greivin
Salute the noblest troop and pledge allegiance cause
(1st half alone, 2nd half mixes with Nate Dogg's (Verse 2))"
27,I Pledge Allegiance (intro),2001,Music & Me (2001),,Nate Dogg,"I pledge allegiance, to all my homies
Who may never love a hoe, and never will
I give my body and I give my soul
To the funk may the funk never end"
28,Intro to G-Funk (Comm. 1),1998,G-Funk Classics (1998),,Nate Dogg,"Right this way, ma'am. Lockdowns on the other side of this cafeteria here. Just stick with
Me. Anybody looks at you strange, you just let me know, OK?
OK
Hold on a second. Y'all just shut the Hell up. You want a 115 be a lockdown all week?
Yeah, that's what I thought. Right this way, ma'am. It's right this way. Welcome to Death
Row. This is thelast stop for all the scum of the Earth. These people ain't worth a damn in
Here. Oh, here's your guys vacation spot right here. Step right in.
By myself?
Aww, don't worry about it, we always keep chains on these Death Row boys and plus I'll be
Right outside here.
Mr. Nate Dogg, may I call you Nate? I just wanna ask you a few questions, do you mind if I
Record this converstaion?
No, I don't mind at all.
I don't know if you're aware of this or not, but I'm a pretty big fan of yours and I've been
Following your carrer since you were sentenced to Death Row.
Right
And I've noticed a lot of people trying to jump on the G-Funk bandwagon, um...
Haha, that's right
...Proclaiming to be from the G-Funk generation. How would you like to address that?
Well, you gotta do what you gotta do to eat.
Hehe, Nate, I hope no offense is takin' by this next statement, but it doesn't look like you'll
Be around much longer and in my opinion when you're gone, it's going to be very difficult to
Ever get the true meaning of G-Funk. So as a last request for the millions of people who love
And respect your music, could you please give us the true definition of G-Funk."
