,song,year,album,genre,artist,lyric
17,Crash Your Crew,1999,Beneath the Surface (1999),Hip Hop,GZA,"(RZA)
Eh yo...
Turn my shit up son too
Yo
(GZA)
You know exactly what I'm talking about,
Y'know?
(Ol' Dirty Bastard)
I'm gonna crash your crew (x8)
(GZA)
Left drink wine, from the purist grapevine
An' rhyme out the mutherfucking mind
Metal shine, light blind, cut the mic line
Catch juice from the ?land fo?
15 twenty inch woofers blow the manhole
Made the street crack, master feedback
?Allah masters the beat back?
The crowd look, while the stage shook
Carpenters made errors
Craftsmen had his head severed
Pyroclastic flow, heavy like tonnes of snow
Broke this rhymin' video
Verbal assassin, blastin
Exploit your break through explosively
Echo chamber ate that rap up ferociously
Game controlled, optimize the input channel
I set it relatively high for those on a panel
CD with the durable, long-life cover
Very similar to no other
I seen a million tryin' to set a flow
Thousands that show
Observe with the patience of watching a flower grow
But one individual thing forgot the ?fri show?
Now his pursuit is not for digress
A special note, thanks for being flank
While journalist's stay runnin' in front of tanks
Blew out first class, came back close cash
Ruff class, surfaces with no math
Military campaign, while shots cause information of the brain
Beat Crazy Eddie insane
*Cra-cra-cra-cra-cra-cra...*
Filled with pain -- niggaz reign
(ODB)
I'm gonna crash your crew (x16)
I'm gonna crash your crew
I'm gonna crash your crew
""You never use those shoes, you can't have platinum authority inject me, bitch I inject you, with the shit that made you say, yo dirt doggchew-chew-chew...""
I'm gonna crash your crew"
18,Destruction of a Guard,2005,Grandmasters (2005),Hip Hop,GZA,"(Feat. Raekwon, RZA)
(Intro: RZA (Raekwon))
At the holy city of Mecca, great fan of Colon
Crazy ammo get blown, wherever I sit, son
That is my throne (you know how we do it)
(Chorus: Raekwon)
Aiyo, POP POP POP, when it shots, whose to blame?
Three get dropped and removed from the game
One get knocked, now his whole life is changed
'Cause he's so far from freeing the world, that seem strange
(GZA)
I come from a place where they say, death comes too soon
Where the hoods on the block, dance to a different tune
Every night and every day, hotels of foul play
Turns fatal, when this hostile land of AK's
On any date, not wait to pump them rounds
The reminder; it's a murderer stomping ground
With one less witness, gunned down in the staircase
Who had led his crew, but he was moving at a snail's pace
Many suspects, many possible motives
Just kept coming with unstoppable explosives
The weak fold in these most extreme conditions
While the rivals quickly strengthen their position
The mission was to move in, with sheer brute force
And lives, they get lost, on a collision course
The streets are fascinating, so they gotta explore it more
But not without walking through some hurricane corridors
Become the most wanted, life can seem haunted
Thugs and agents who work closely up on it
Patriotic hustlers that kill for presidents
Conceal the truth, but can't hide the evidence
A man died holding some dice that he was shaking
Like a bank stop, but no valuables was taken
Shot at 8:45, but he died at 9
A video was the most precise witness to the crime
(GZA)
The story had a familiar ring of truth
But it needed, a little more tangible proof
He was blown off the map, behind the aggravated kidnaps
Shrap' metal everywhere, the bomb was gift wrapped
The problem had became increasingly urgent
Since the product was nothing but bags of detergent
In all the years of war, this was the most
Vicious battle and mainly fought from up close
A bundle burglary, with no surprise
Just another sloppy murder that was in disguise
Now they can do nothing but hope and pray
That the boys don't come through with the scope and spray
Valuable time comes with a price to pay
Smoke on a deserted street, just a mile away
Tusslin' with those cannibals, right from the start
That'll rip out your heart, and consume the fattest part
Better watch from the eye of federal agents
Selecting cams, while they was disguised as vagrants
Not knowing that a prisoner had held the key
Of a co-defendant, he was so far from free
Detectives search into a distant past
Of a young gun who made the block grow fast
Narrow ducks who were cooked and came home to roast
The suspects would seek refuge off the coast
(Outro: Raekwon (chess sample))
Word up, holding it down
Holding the fort, nigga, youknowhatisayin?
All we need is a bunch of red coats coming through
Stayin' official on some gangster shit
Bloodhounds, thirsty, lurking in the bushes
Yeah... (B4 - now at six - C4)"
19,Did Ya Say That,2002,Legend of the Liquid Sword (2002),Hip Hop,GZA,"I keep your heart is PZA-pumping, the beat is GZA-jumping
The crowd get wild off my style, they want something
The herds start stomping the promoters that be fronting
They sue for Cash Rule but the courts they give 'em nothing
Your soundman came with the feedback like ""we need that""
Security's shining flashlights like ""where the weed at?""
Stay in your place, see you guys smoke blowing in your face
And it's hard to stop it, once we came to drop it
Who bold enough to challenge this deadly reportation
Of keeping MC's in a hopeless situation
No comparison, if you put the darts side by side
One will weigh out the other, like friend next to brother
Try to take cover as the battle comes to a closion
That structure that supported your rap started implosion
Your whole chest and your world caved in
They completely gave in, they just sparks and brave men
Did ya say that? Record execs wanna push the album way back?
And hold out on my advance? They didn't pay that
Producers want seven points? He didn't play that
Yo did they say that?
Did ya say that? Record execs wanna push the album way back?
And hold back my advance? They didn't pay that
Producers want seven points? He didn't play that
Yo did he say that?
Yo did he say that?
Raindrops keep falling on your head
So heavy that it's tearing what you're wearing ain't caring, so you're hearing what I said
I'm making sure it stick like a stamp you don't lick
Or a snare with no kick
So you know it be authentic like the hand-made works of a carpenter
The 64 squares make 'em use a sharpener
Kept a fine point with the lead, then it's thread
On the paper like cancer it would rapidly spread
This music is addictive but can't live without it
At times you hear shout it ""The Wu, they be about it""
A strong following with the die-hard supportedly
The loyalty came from the songs that went accordingly
I couldn't be more wrong if I changed the format
Did something different from the most explored rap
Did ya say that? Record execs wanna push the album way back?
And hold out on my advance? They didn't pay that
Producers want seven points? He didn't play that
Yo did they say that?
Yo, did he say that? Record execs wanna push the album way back?
And hold back my advance? They didn't pay that
Producers want seven points? He didn't play that
Yo did he say that?
Yo did he say that?
Positive Elevation Always Correct Errors
That's the fire till my Clansmen starts to spread terror
Spin your wig back like we DJ'ing, he ain't playing
My songs set a trap, catch 'em laying
Now we stuck but he's overwhelmed by what he came across
Not to play it is a terrible loss at whose cost?
People wait like never before for the ball to drop
At the gate lined up for a tape to cop
I still run into students banging my first joint
Wrote a essay off the second LP to prove a point
That a rhyme is a terrible thing to waste
Gimmicks and radio the God don't chase
But I replace your wackness, it shows in your flows
Immaturenesses, all of your hoes, case closed
Most of your strength is in the pocket of you clothes
That you endorse in every rhyme like it's Garbeson robes (echo)
Did ya say that? Record execs wanna push the album way back?
And hold out on my advance? They didn't pay that
Producers want seven points? He didn't play that
Yo did they say that?
Yo, did he say that? Record execs wanna push the album way back?
And hold back my advance? They didn't pay that
Producers want seven points? He didn't play that
Yo did he say that?
Yo did he say that?"
20,Drama,1991,Words From the Genius (1991),Hip Hop,GZA,"Talkin' bout drama
I met a young brother, how young about eight
He seemed intelligent and rather quite straight
I greeted him, and struck a conversation
To see if the youngster had some self-motivation
Peace brother, what's your name, and how ya be
He said I be soon coming off the currency
I said gettin' paid, he said yeah like my man's brother
Who has a condo he shares with his baby's mother
He said a condo beats my apartment
With no lights and no gas and much backed up rent
No hot water or heat, and invaded by plenty rats
That'll eat up the average alleycat
He said yeah boyyyeee, that's poverty
I said word, I know and it bothers me
'Cause we are the victims, of a situation
How wicked man, separated
A nation and got us cold-killin' off one another
(Word-word, to the mother)
It's getting hot, how hot, hotter than July
'Cause the murder and crime rate is rising very high
For example, in my neighborhood, it's so hot
I'm often woke up, from the alarming sound of a shot
So I'm thinking what, is my neighborhood a trap
Could this be the place marked X on the map?
Now I'm spotted like a target, in the shooting gallery
So I start to seek for a better salary
So I can escape from where, from this ghetto life area
Cause everyday you're getting scarier
*Blam blam* and scarier and scarier
Causing mass hysteria, it's drama
Talkin' bout drama
Not to be bold and disrespect the homeless
'Cause I can see that they suffer from a long list
From not having shelter, and out on the street
Without a job and days without a bite to eat
Yo I feel for those, but here's another side
About some more people that's living on the outside
Because of the fact that they chose the wrong way
And it took 'em on a trip for a long day
Got to the point you started stealing from your house
Stalking the rooms late at night like a mouse
Your family's upset and you've got to go
When it's, five, below and we're ex-pecting snow
And then you're on the train with a cup in your hand
Kicking dirt, and making it look like sand
Then after you run that game for a while
You start sucking up tokens from out the turnstile
Are you that desperate, just to get a hit
Is it so effective that you won't quit, and yo
Why do you come to me crying the blues?
About you can't get a job well go sell some street news
Then you can get straight and be real
But you'd rather rob and steal
And that's drama
Talkin' bout drama
Not wonderama
But I'm talkin' bout drama
Here what I'm sayin'?
I'm not talkin' bout your mama
Nah, but I'm talkin' bout drama
Shaolin fist versus the llama
Talkin' bout drama"
21,Duel of the Iron Mic,1995,Liquid Swords (1995),Hip Hop,GZA,"Oh mad one
We see your trap
You can never escape, your fate
Submit with honor to a duel, with my son
I agree
I see you using an old style, I wondered where you had learned it from
You know very well, it's yours too
[Yo god, it's a duel, it's a duel] heh, by the gods, will you show me?
[Buck buck buck buck buck buck ] and where do you come for?
[Duel of the iron mic ] you come here, since you're so interested
[Duel of the iron mic ] fight me
(In the moonlight niggaz I will strike)
(What, what? bring it!)
Verse one: the genius
Yo
Picture bloodbaths and elevator shafts
Like these murderous rhymes tight from genuine craft
Check the print, it's where veterans spark the letterings
Slow moving MC's is waitin for the editin
The liquid soluble that made up the chemistry
A gaseous element, that burned down your ministry
Herbal vapors, and biblical papers
Smokin' exodus, every square yard is plush
Fuck the screw-faced photo sessions facial expression
Leaves impressions, try to keep a shark nigga guessin
Give crazy shouts son here's the outcome
Cut across the semi-gloss rhymes you floss
Shit is outdated, just like neckloads of sterlings
Suede-fronts, bell-bottoms, and tri-colored shearlings
I ain't particular, I bang like vehicular homicides
On July 4th in bed-stuy
Where money don't grown on trees and there's thievin MC's
Who cut-throat to rake leaves
They can't breathe, blood splash, rushin fast
Like runnin' rivers, I be that whiskey in your liver
Chorus: ol dirty bastard
Duel of the iron mic!
It's the fifty-two fatal strikes!
Verse two: master killer
This is not a eighty-five affair, made clear
When the gods get on to perform storms blew up
Wu's up, causin the crowd to self-destruct
Killer bees are stingin somethin' while I reveal
Science, that's heavily guarded by the culprit
Bombin your barracks, with aerodynamic
Swordplay, poison darts by the doorway
Minds that's laced with explosive doses
Damagin lyrical launcher
Lunge at the youthful offender then injure
Any contender, testin the murderous master
Could lead to disaster, dynamite thoughts
Explode through your barrier, rips the retina
Who can withstand the astonishing punishing
Stings to the sternum, shocked in the hip-hop livestock
Seekin' for a serum, to cure em
Verse three: inspector deck
Adults kill for drugs plus the young bucks bust
Duckin handcuffs, throats get cut when dough rush
Out of town foes look shook but still pose
We move lioke real pros through the streets we stroll
Bullet holes lace the windows in one-six oh
So control the avenues that's the dream that's sold
Bulding lobbies are graveyards for small-timers
Bitches caught in airports, keys in they vaginas
No peace, yo the police mad corrupt
You get bagged up, dependin if you're passin the cut
Plus shorty's not a shorty no more, he's livin' heartless
Regardless of the charges, claims to be the hardest
Individual, critical thoughts, criminal minded
Blinded by illusion, findin it confusin
Outro: ol dirty bastard
Duel of the iron mics [the master, he must be dreaming, heh]
It's that fifty-two fatal strikes [well, if he is dreaming...]
Duel of the iron mics [...then he must be asleep]
It's that fifty-two fatal strikes, nuh [and if he is asleep]
(Then I will wake him up!)
(Weahhhhaah-hah-hah!)
At the height of their fame and glory, they turned on one another
Each struggling in vain for ultimate supremacy
In the passion and depth of their struggle
They very art, that had raised them through such rapiant heights was lost
Their techniques, vanished"
22,Exploitation of Mistakes,2005,Grandmasters (2005),Hip Hop,GZA,"(GZA)
Two individuals, pulled from a lake
Inside a vehicle, one had his foot on the break
The windows was fully up and the doors was locked
The news made the headline, and the town was shocked
The driver was clutching a can of Hi-C
His jacket was tied, to a near by tree
His jeans had dye in them, and a usual tattoo
Was the only hope, to identifying them
The autopsies revealed gun shot wounds
Dental records matched to a newlywed groom
This accident, was a cover up for homicide
Two who might of, stayed alive from paying bribes
Sheets investigators, had relied on the media
For help, and to track down the perpetrated
They canvassed the neighborhood, with standard procedure
And visited the home, of a topless skeezer
Who was at the bar, when he was last seen alive
Left with him, just ten minutes after they arrived
Despite the police efforts, they turned up nothing
Just an ex-hooker, try'nna get a rep from bluffing
But the wide publicity, had just paid off
From a hard rock inmate, who was just made soft
He said he knew a man who killed the pop star
And almost got caught by a passing cop car
The inmate said probably, the motive was robbery
And knowing if he keeping it a secret, it bothers me
He said this individual killed for low billings
And purchased a murder kit, blocks from the killing
The sheriff's office, had no time to waste
Plus the inmate never deal, to avoid the case
So he co-operated fully, and snitched on his
Chop shop mechanic, who used to move bodies on the pulley
An extortionist, involved in similar incidents
Payments that came in thousand dollar increments
Suspicious activities that flooded the place
So they subpoenaed phone records for the calls was traced
The hair that was taken from his car interior
Was that of a young girl, who felt inferior
She died fighting and probably aroused his anger
Holding off her life, as she faced the strangler
The crime seemed to be sexual from nature
It was substantial evidence, that the nigga raped her
The suspects had marks on his face and chest
But it just wasn't enough, to get an arrest
Asked of his whereabouts, on the third of July
Said he partied with his friends, and had a solid alibi
But it was really something left at the scene, on a small scale
Was the microscopic traces of blood, under her fingernails"
23,Fam (Members Only),2002,Legend of the Liquid Sword (2002),Hip Hop,GZA,"(RZA)
Yo, yeah check it... yo, yo yo yo
Yo, if you think you can fuck wit the Wu Clan
Get ya nose swolled up like Toucan
If you think you can fuck wit the Wu Clan
You get ya nose swolen up like Toucan
If you think you can fuck wit the wu clan
You get ya nose swolen up like Toucan
Sam, and we don't give a damn
Bullets soaked in oil so the Tec can't jam
Sippin on Caribbean RUM, coconut juice
Smokin' on that chocolate stick
Open up two bottles of that brass monkey on some drunkie shit
You R&B fake rappers suck a monkey dick
I'm from back in the days
With the Christmas for haze
On my back, stripped out black
You like that?
Seven braids in my head
My girl stays in the bed and she love to lay the eggs
(Masta Killa)
Prepare for the mic onslaught swift with the sword
Slick Lord, holdin' my weight homing abroad
The crowd roared for the peeps playing for the streets
I reeped and sewed, scriptures weeved and woved
Behold gold for the people equal
Fresh on the weekend
Wu-Tang, Biggie smalls live at the beacon
Backstage drinks on the house the show was bangin'
Brothers Grey Goosin, Wu was Tanquerayin
Allah teaching schools in session
The Gods speakin'
I'm just knowledging
Snake handshakes and fake hugs
Waiting for the hour to devour
And splatter ya heads of powder
I'm a slave to the rhythm
But never to a mental deaf and power
The hour has come
We got y'all eleven to one son
You done off, too late to break off
Tactics are hazardous to the health, bomb stealth
Rifle stay M-16, know what I mean?
Know what I mean?
(Break: Masta Killa (both))
Yo just what we (stand for?) Loyalty
What we strive for? Righteousness
What we live and (die for?)
Strictly fam members only
Yo (strictly fam members only)
Yo, yo just what we (stand for?) Loyalty
What we strive for? Righteousness
What we live and (die for?)
(Strictly fam members only)
(Strictly fam members only)
(RZA)
Ayo ayo
Great minds think alike
We used to drink all night
Think about things that's wrong and how to make it right
Ice cold bottles of brass, time flashes
A hundred blunts passes
Before the God asked us
What's the square miles of the planet?
Why is the axis slanted?
How much is covered by water?
How much is granite?
True-I-Master-Equality
God body be flowing like the chi energy inside your artery
Faithful as a polished rock against a tank
The force of my wheel still kill shooting blanks
Just from the sound alone ya heads blown
Still scorin in the red zone you best of head home
Or get thrown to the dead zone
Son we need to ill, interrupt the Grammy show and teach the kids
(Break: RZA)
Yo Just', what we stand for?
What we strive for?
What we live for?
What we give for?
What we die for?
Strictly fam members only
Strictly fam members only
(GZA)
I grew up around block parties ready to rock
Behind a roll nigga wit my rhyme on cock
First shot first nigga who had shit to pop
My bad weather blew the feathers off a hundred flocks
Seventy precent goose, thirty duck
Get stuck if each link in ya chain is truck
Can't come in this rhyme cypha wit nine snipers
Charged off the juice from the pied pipers
Walk around B-Boys, DJ's, MC's
Through rap, never thinkin' their ways of TV
It was strictly all about about magnificent rhyme clout
The R.E.C. Room, two dollars with the flyer, three without
Now his wigs pushed back, name's removed off the plaque
Too wild to reanact, with tax
That's the price to pay, my goal is to aim and spray
My night is the same as day
(Chorus x2: RZA)
Yo Just', what we stand for?
What we strive for?
What we live for?
What we give for?
What we die for?
Strictly fam members only
Strictly fam members only"
24,Fame,2002,Legend of the Liquid Sword (2002),Hip Hop,GZA,"They was told not to ride in Patty's hearse
And stay out of Charles' mansion
Took Abraham's Lincoln through the Todd bridge expansion
Willis Reid's a map that marks the spot showin
On his left George Burns a blunt William's holdin
Tara banked the money that Chaka Khan'd the poor
Alicia Key'd his car for givin Melbourne Moore
For the Redd Foxx who bought off the block, but though twice as
Debora Cox the gun 'cause she beat Kelly's price when
Rosa Park'd the truck on the farm that Kim Fields
Linda Tripp'd for tryin to walk in Lauryn's hills
Water dripped outta Farrah's faucet in the glass
She was Superfly, Curtis Mayfield her ass
Chris Tucker to a show, Ted Turner to a hoe
Robert Diggs the beat, but ain't feelin the flow
But he signed too fast, for half of Johnny's cash
Nia Long'd for the album to drop, cameras flashed
Tom Sawyer at the Lucille Ball up at the foyer
He confronted Richard Pryor to hirin his lawyer
Suge's knight removed the rook off the board
Donna King was checked and Al Sharpton the sword
""Wettin cream, I ain't wettin fame""
""Fame is the measure""
""Rap celebs""
""The place where stars are born""
The saints marched in, Kurtis blowing his horn
Tom Cruise'd the boulevard, Chris Rock'd the song
For the hundredth time, they pressed rewind to the beginning
They toast to the rhyme, The Juice spilt on John's Lennon
They took her to Elizabeth Taylor to dry clean
The known seamstress, who was schemin on Al's green
You know they shoot for the stars and buckwild
Like the kids in the yard who play with Jane's child
A beautician laced Erykah's Badu
Sean Comb'd through the evidence, just to get a clue
The needle in the haystack, from outta Eartha's kit
The tiger would kill him once thrown in Brad's pit
Jesse Owen the money from the weed Bubba spark
Baby's journey seemed far as he walked in Dick Clark's
Jeffery's lion stuck with a thorn from George Bush
Paul Pierce'd in the heart as the crowd pushed
Acting alone, Drew Barrymore bones
Of the victims, three blocks from Jim's brownstone
They shared the same bowl, he caught Natalie's cold
The producer threw the butter on Esther's roll
Dempsey Russel'd him down, got his jaw wide
In a instant, Brooke Shields him from the gunfire
Angie Stone'd him to death with those vocals
Keith Sweat from the workout, just from runnin local
""With CREAM I ain't with the fame""
""Fame is the measure""
""Rap celebs""
""The place where stars are born""
Larry's bird flew outta Nicholas Cage
Joe Tex messages from Satchel's page
Betty Wright letters with ink from Sean's pen
Infinite bars, you couldn't tell where the song end
Glenn Close enough to quickly dub the tapes
Richard Gere ripped while he was climbin Bill Gates
He was a southerner posin as a native New Yorker
Where Jason Kidd took his first steps in Jimmy's walker
He stayed online chattin with rap celebs
Used Bernie's Mac to search Veronica's web
It cost them their life for the advice you gave
Now Pete Rose lay on Vanessa's red grave
""With CREAM I ain't with the fame""
""Fame is the measure""
""Rap celebs""
""The place where stars are born""
""With CREAM I ain't with the fame""
""Fame is the measure""
""Rap celebs""
""The place where stars are born"""
