,song,year,album,genre,artist,lyric
53,Pencil,2007,Pro Tools (2007),Hip Hop,GZA,"(GZA)
The echo chamber enhance the flow wit the block party
Keep an MC head spinning like Dark Bacardi
This B.A.C. is 2.3
Now the liver's damaged, but his lungs are joint free
So inhale, exhale, breathe and get well
Kick something live stop chirping like Nextel
I'm All In Together, a swordsman forever
I paint the town red, with many heads are severed
R-A-W, I still bring trouble to
Throw your raps in the sleephold, quick to snuggle you
Dart heat your breastplate, meet ya death date
Rook down a E4, look, it's checkmate
No other way to describe a catastrophe
The plan was drawing blood and displayed it graphically
Direct order, hit the border, then slaughter
Horrific torture, by prolific authors
Shape and mold MC's, like I'm playing the skelly top
It's getting 'hot in here' like the single that Nelly dropped
So take ya clothes off, the track is so soft
A little rock'll turn 'em into Ivan Koloff
Why do the Gods make MC's study from
Thirty five, and fifty year, then try to become
Under the study with the sword above the head
So he would keep in mind under the open pledge
(Masta Killa)
Fierce glisten, something so sharp
Piercing, swords cling, the vigilante intimate
Close combat, this is MC'ing at it's best
But there is no contest, sent I'm this
Speaking of a test, this and try to question this
He so different with the swiftness, godfather civilization
Shell casing, universal nation
Could he be the one predicted, presidential sent in
Old school soul to war us, be the growlest
Asiatic arctic flow is so frigid
(RZA)
Is it, the Zig Zag, I'mma pay you a visit
Somehow mistake me as an old wise wizard
World, I'm not the same
I go somewhere, don't remember how I came
Is it the weed, the hash or the 'caine?
Or the Digi being stained on my brain
Appear from a cloud of smoke, the voter's on choke
If surrounded, seven men drop from one stroke
Even if my feet was shackled down to one handcuff
To defeat me, ten demons wouldn't be enough
I sleep in the lion's den, without the steel iron
Ascended like Wu, so coming down from Mt. Zion
Superlogical this, superlogical that
Digital, take it back with superlogical rap
Have a shootout, at midnight, the sequel's quicker
Forty four colt jolt, all you seen was the flicker
You distressed like the damsal, lost like little Hansel
Your flame couldn't generate the heat of a candle
Me, I be a Killa Bee, keeping exilery
Gold-plated desert e, shoot ten millime'
Master the millipede, you try to end the sea
Your body being found in the neighbor yard artillery
A black blind governor, a rich white mayor
Man, this whole city ain't got a prayer
Bobby has invaded, now the whole town's slated
Your decapitated head is being took and operated
Up and down the avenue, I drive a shatterproof
Benz, and all my men's are tattle proof
My mic is a dyke, my life is a light
A Day to God is a Thousand Years, how long is a night?
You get trapped in my shadow of dark, ark, who goes there?
Power-U smells like carp, don't put your nose there
Drop you to a tank of sharks, your wound's bleeding
And it's been two weeks since they had their last feeding
Ain't nothing but bones, we plotted the sand
And spread it out, over 20 acres of land
Some call me Steels, 'cause it's hard to bend me
C-Cypher Pigs, can't apprehend me
In a no smoking zone, I smoke bones of hash
Niggas see me, then I disappear in the flash
Next time I'm spotted, I got the fatter wallet
Moving with a click that stick like dry porridge
Someone's been sitting in my chair, who goes there?
To sub zero cold, your words can't flow here
Glaciers of ice, plus layers of spice
Say your prayers at night, 'fore you touch that mic"
54,Phony as Ya Wanna Be,1991,Words From the Genius (1991),Hip Hop,GZA,"When I hold a mic in my hand, it's devotion
Then I began flowing in a smooth steady motion
'Cause I'm contented to know that I've invented
Poetry which has been highly complimented
Thus how I rhyme is what I feel on stage
And from a fraction of a thought I can write a whole page
I'll just pull a notebook from off the shelf
And like Salt-N-Pepa I express myself
To make most of you know me, and some of you don't
But when it comes to cold challenging, I bet none of you won't
Arrange a battle, improve your style
Against a brother with a totally different profile
Most of you flake cold front ya flex
And hesitate on rhymes that should've been Memorex
But you forgot I remember you're an amateur
Mystery worshipper, now I prefer
That I remind you or tease ya on who's the boss
'Cause you suffer amnesia, that's memory loss
Well get this, just as quiet as it's kept
MC's on the chart from the start has slept
Let's shake them, wake them, they should be woke
For what? They take MC'ing for a practical joke
You don't have what it takes to be an MC
Ya just as phony as ya wanna be
You present yourself to be the quiet storm
You're a sneaky little snake in a devilish form
But as they say, yo, to each its own
And to each one who plays with a microphone
Abbreviate microphone and M.I.C.
Meaning what, myself, I, you see
I invite those to battle me, then they're through
Bust it, I'm not prejudiced, you're invited too
The rap convention or the MC show
I have rhymes to block those who hit below
The belt, that means biting a rhyme
Yes, I'll wax you, tax you and plus save time
Now who is known to uphold his own
And words are heard like a strong baritone
Freestyle techniques that's wild and bold
That'll smile in your face and still come so cold
That I'll freeze you to the point of non-defrost
Now you're trapped in the Land Of The Lost
Should I, could I, would I lose
When it's a selfish sore loser like you I choose
To roll your big eyes and suck your buck teeth
Because you're upset that you ever caused beef
Yo homeboy, I never meant to tease
But it's a slaughter, can someone help him please
Feeling uncomfortable, then loosen your belt
Once The Genius gets heated up, suckers will melt
Then after ya melt, ya start dripping like water
Then you can say this was a Goddamn slaughter
You don't have what it takes to be an MC
Ya just phony as ya wanna be
Ain't no rhymes like the one I got
They put competitors in a trance, y'all
Radio stations ran them a lot
They made children play and dance y'all
How dare ya mention you're an MC
When the crowd disagrees on who claim to be
'Cause your battle piece are the rhymes you release
And that only make the crowd boos increase
Hey, may I say I'll stay a DJ
MC who try to defeat me or portray
One who claims he gain much respect
But in a battle, straight up and down, ya getting wrecked
'Cause getting with me is definitely a slaughter
Or diving in a pool head first without water
So don't set yourself up to get brutalized
That only happens when you're not energized
Bit I'm so damn energized, I'm energetic
That I can wreck a microphone 'til it's pathetic
Okay, got it in your head, correct
That I'm victorious on any subject
You disbelieve, then huh, call the title
Then after one rhyme, you'll be calling me your idol
It's like... zap... another one on my jock strap
Now you walk around praising my name
'Cause I'm slamming and I make you feel the pain
You don't have what it takes to be an MC
Ya just phony as ya wanna be"
55,Publicity,1999,Beneath the Surface (1999),Hip Hop,GZA,"Who be first to catch this beat down? My rappages be the source
Ego trip remain victory, and no loss
Rap sheet show you details of wars in streets
Where the most live, catch vibe and blaze heat
Double XL kings who rush through, got right on
Quick to stress ya, sound crew to get a mic on
Math lets the plates spin consecutive hits,
Promoters' face grin the dawn catch fist,
Keep the paper direct wire see them jake be tire
Unlike the story that echoes out with chronic liars
Like those who feast on hogs, eat murder dogs
A village voice kid with his heart and soul calm
Killa bees produce the honey, that fortify the platinum
Plus the DJ claws fiend to scratch them
Thus street team takes shots of criticism
Promotional vehicles wiffin wit mad rhythm
With the lockout of one of our source sports
We spice the stand and launch the stage on the ball court
During the first half, number one draft rap lords,
Swing swords, slam microphone, shatter billboards
Forty-eight in sight, after inhalin the herb
Vision impaired, when the silhouette emerged
One nut out the clan get your whole click banned
From radio pd's cut your raps man
Forcin me to move on from one world to another
On the gulf, from the fuel jet to hover
Take cover wit the radical, urban latino
No hip-hop connection wit us and Janet Reno
I do an interview and they aim to trace my essence
To know more than is necessary blunts your weapon
My group's nova, remain unsober
And serve high times wit king cobras I shoulder
Low-post MC's, your whole style ?lafeast?
Second to get your word up, then the troops unleash
Creative ?low fling? to the grand opening
Wit my ray gun scoping, you're hoping
Uniforms be fridged when they walk the black beat
In the heat, of razors exposin fresh meat
In bedrock and gambling - rolling stone, out of zone
Where they can't monitor my 'xact poem
Collide wit the tiger beat, rappin' raga
Ebony eyes, folks see the saga"
56,Queen's Gambit,2005,Grandmasters (2005),Hip Hop,GZA,"(GZA)
She dated jolly green GIANTS, that, flew on JETS
An A-list actress, who was never walked off sets
She loved stuffed animals, especially BEARS
Was a role model, like a CARDINAL to our peers
A PATRIOTIC tomboy, like Mary Ellen from The Waltons
A former lifeguard, who had the skills of a DOLPHIN
When I met her, she was in drama school and wore BENGALS
Drove a BRONCO, and she was far from star spangled
Had basic skills, and worked part time in mills
Raised buffalo's, 'cause she was behind them BILLS
Had a man who always roared like LION
A domestic violent cat, tackled the girl and kept her crying
Couldn't care, she was losing her hair, from depression
She was in the air, and there was some room for interceptions
I told her to stay strong, not to be ashamed
You're a ""ten-i-see"", you just need to TITAN your game
Her ancestors were CHIEFS, who ran with running deer
On the sail with the SEAHAWKS, who battled the BUCCANEERS
The REDSKIN garments, was suede coat liners
Held rare coins, frequently sought from gold miners
They were hard working warriors, we call over timers
Shot plenty arrows at COWBOYS and 49ERS
Her interesting background, but quite unusual
A great force grip, but out of bounds for a musical
She told me to call her, if I came to town
I started TEXAN her, soon as my plane had touchdown
Holding my luggage, in the hand that revealed the bad scars
She pulled up at arrivals, driving the JAGUAR
Her BROWN skin was soft, her legs beautifully shaven
Her house was fly, sitting on the roof, was a RAVEN
As we entered, I heard laughter
She walked into a large living room, I went after her
There was two of her, girlfriends, playing chess like they were VIKINGS
Militant as PANTHERS, they're resemblance was striking
Had on thongs, high heels, and belts that was garter
Energized like phones that just came off the CHARGER
I introduced myself to gain yardage
'Cause anything less then smooth, would have been straight up garbage
The shorter one met me, when I had a sky pager
Thought I rolled with robbers, STEELERS and panty RAIDERS
She took fruit from the orange bowl, it was in season
One of them said she loved the juice and kept squeezing
I knew that I was gonna get, wined and dined
It would have been a penalty, not to pass the scrimmage line
Now I laid back and relaxed, waiting for the kick-off
One removed the lip gloss, like she was bout to lick all
She caressed me, with fingertips soft as velvet
Dying for me to PACKER, as she stroked my helmet
And I was thinking these girls was SAINTS
But it was first and ten, and there was extra walls to paint
Before you know it, I had all three in a huddle
Buckin' like a COLT, before I released them puddles
They spread EAGLES like wide receivers
As I RAM them in the endzone, and they became true believers
(Outro: movie sample)
I be liking chess
'Cause chess is crazy, right there, that's the ultimate
It's like a great hobby right there, playing chess
The board, the pieces, the squares, the movement
You know, war, capturing, thinking, strategy
Planning, music, it's hip-hop, and sports
It's life, it's reality"
57,Rough Cut,2002,Legend of the Liquid Sword (2002),Hip Hop,GZA,"(Intro: Armel)
Uh-huh, GZA, uh, RZA, uh
(Armel)
Listen, if y'all can spit, we can spit, please get it together
'Cause anything you can do, I can do better
Your imagine material looks, hotter behind looks
Raise the fear, no one, but self, who's shook?
Bring the plague like the revelations in the holy book
Who's spot you took? Duke off the hook
I'm from the land of the crook, life quit the end
Better known as the Brook, rather tape then lend
There's a lot of wack records, but this ain't one of them
DJ's off the books, go 'head put the gun at them
All groupie M.C.'s, I'm bout to start stunnin' 'em
Don't matter what crew, every last one of 'em
It's gettin' crowded in here, some acts got to go
Let's start by eliminatin' groups that can't flow
I better meal my deal, my career with no fear
That none of y'all group can touch what's over here
(Chorus: GZA)
These rough cut metal tapes
Quick to break your label mates, won't hesitate
Negotiate your table stakes, you can't flow right
Or fuck with me on no night
Fuck the slow light, you need to get your show right
(Prodigal Sunn)
Yo Justice, how many M.C.'s must get pistol whipped?
Crack faces with bottles of Crys', hollow tips gobble lips
That's the penalty for poppin' that shit
Vanish in a colorless whip, bags of grip
Doo-rags and clips, tag the strip
You had the chance to advance, I'm sorry for the holes in
Your hip
Son, It's the way of the street merchant, live by the laws,
Die by the rules
My gleam play the part of a fool
Now hear these jewels from a wise king, see what my eyes seen
Ten year supreme, the theme, we sizzle-line and triple CREAM
My grip'll off that digital bream, visual scene
Roll footage on your video screen
Globe patrol, Two On The Road, we never fold
Snub react, GZA mack eliminate tracks
Stimulate phat, Sunzini, nigga, gifted and black
Now watch me mack to the kingdom of rap
(12 O'Clock)
Give me a beat, nigga dealin' battles like a thief
Done killed more niggas than Jason in part 3
Stay Wu, on the graveyard and this label
Dum dums, that battle 12 O'Clock, now it's able
So what, looked up and made the bitches clap
That was because my style's clothes, not the raps
Ain't that shit, props for the clothing
Should of brought a mirror, 'cause lyric wasn't rollin'
My rhymes is all that and yours ain't shit
And at a party, your bitch takin' crazy flicks of me
She said I was nigga celebrity
But I'm from the slums, with the bums drinkin' Hennesey
Take a sip of some Jamaican rum
Put fire to my lung, tongue, teeth and gums
When it comes out my mouth, shit's hot and it burns
Make fools out of bitches like I'm Howard Stern"
58,Shadowboxin',1995,Liquid Swords (1995),Hip Hop,GZA,"Intro: Method Man/Johnny Blaze
(Special technique) Fuck that
(Special technique of shadowboxing) God damn
(The GZA, god damn!)
(The GZA, god damn!) Pledge allegiance to the hip-hop!
(Method, god damn!) I pledge allegiance to the hip-hop
(Maximilli-on, Maximilli-on)
(Uh, yeah, ah, uh) Johnny Blaze
I pledge allegiance to the hip-hop
(Johnny Blaze) Maximilli-on
Maximilli-on
Verse One: Method Man/Johnny Blaze
I breaks it down to the bone gristle
Ill speaking Scud missile heat seeking Johnny Blazing,
Nightmares like Wes Craven niggaz gunning,
My third eye seen it coming Before it happen
You know about them fucking Staten Kids they smashing
Everything huh, in any shape form or fashion
Now everybody talking bout they blasting, hmmm
Is you busting steel or is you flashing? Hmmm
Talking out your assHOLE
You shoulda learnt about the flow and peasy afro
Ticallion stallion, chinky eye and snot nosed
From my naps to the bunion on my big toe I keeps it moving,
Know just what the fuck I'm doing - rap insomniac,
Fiend to catch a nigga snoozing, slip the cardiac
Arrest me, exorcist Hip Hop posses me
Crunch a nigga like a Nestle, you know my STEEZ
Burning to the third degree, sneaky ass
Alley cat top pedigree, the head toucher,
Industry party bum rusher
You don't like a dick up in ya, fuck ya
(Allow me to demonstrate) That's right, you corny-ass
(The skill of Shaolin) rap motherfuckers
(The special technique) Better go back and check
(Of shadowboxing) your fucking stacks
(Shadowboxing) Cause your naps ain't nappy enough
And your reefs ain't rugged enough
Bitch
Verse Two: The Genius/Maximillion
I slayed MC's back in the rec room era
My style broke motherfucking backs like Ken Patera
Most rap niggaz came loud but unheard
Once I pulled out, round 'em off to the nearest third
Check these non visual niggaz, with tapes and a portrait
Flood the seminar, trying to orbit this corporate
Industry, but what them niggaz can't see
Must break through like the Wu, unexpectedly
Protect Ya Neck, my sword still remain imperial
Before I blast the mic, RZA scratch off the serial
We reign all year round from June to June
While niggaz bite immediately if not soon
Set the lynching and form the execution date
As this two thousand beyond slang suffocate
Amplify sample through vacuum tubes compressions
Cause RZA, to charge niggaz twenty G's a session
Verse Three: Method Man/Johnny Blaze
When my mind start to clicking, and the strategy
Is mastered the plot thickens, this be that Wu shit
I don't give a cotten-picking FUCK
About a brother trying to size a nigga up, I hold my own
Hard-hat protect your dome
Look at mama baby boy acting like he grown
No time for sleep, I gets deep as a baritone
Killa Bee, that be holding down his honeycomb, lounging son
Wu brother number one, 'Protect Ya Neck'
Flying guillotines here they come, bloody bastards
Hard times and killer tactics, spitting words plus
Semi-automatic slurs, peep the graphic
Novel from the genie bottle, hit the clutch
Shift the gear now, full throttle, time to bungee
To the next episode, I keeps it grungy
Hand on my nutsac, and spitting lung-ghies
At a wack nigga that, don't understand the fact
When it come to RZA tracks I don't know how to act
Real rap from the Stat, Killa Hill projects
How to be exact, break it down
All and Together Now
Things are getting good looking better now
(Allow me to demonstrate the skill of Shaolin)
(Sha-shadowboxing, the special technique of shadowboxing)
(Shadowboxing)"
59,Short Race,2007,Pro Tools (2007),Hip Hop,GZA,"(GZA)
He's running in a short race, shoelace untied
Head down, facial expression he can't hide
Kid with no direction, seems confused
A victim who spent years, being abused
His moms a drug addict, she has a bug habit
Was a seven day event, since she celebrated the Sabbath
But she back slid, or that's what the crack did
She used to shoot up, under her sleeves, the track hid
A long time ago, the father left the picture
And as time went on, he was erased from the scripture
The son, he don't have much to treasure
And these kids that be getting on him, they do it for pleasure
Demons are gradually growing inside him
Way before he ever knew the courts would divide him
A wall around himself had became a shell
Was a whole new person, by the time the bricks fell
(Chorus: Rock Marcy)
It's a short race, duck the court dates
The pork gave chase, we had to walk straight
You know the forte, nigga it's a portrait
Or should I say a poor trait
You want to store very short cake
Estate, behind the gate
N.Y. State, why wait?
You trying to get paid by the lake
In each state, and do the shit at high pace
(GZA)
Under the dirt, there was nothing left but bones
A lot of tall grass around his tombstone
His mother left alone, her heart felt sorrow
No time to play with the precious time we borrow
They live next door, but he was worlds away
In reality, but such a high price to pay
He was easy to recognize from his dress code
Nothing but a firework about to explode
A short fuse, who was bound to lose in the struggle
His grandparents went through a great deal of trouble
To keep him out of jail, they even put they house on sale
To post bail, but the kid still failed
I remember when he called collect from behind bars
Suffering from two injuries and nine scars
He said he'd give anything to be out the pen
But it would be his permanent home until the end
(Rock Marcy)
Wait, I got to get mines
With a side of French fries, not kid sized
Sixes fives, I give off a pimp's vibe
Is it the vines? Watch like a sitcom
Throwing rocks with my pitching arm
More bricks than when the Knicks is on, I'm sitting on
Shitting on your boss, been written off
Shots I'm licking off, the top like a different source
Ripping this raw like a kitchen chore
That's a block not chicken broth
Hold the pot with your mittens on
Dicks kicking in the door, and went to pick me off like a lintball
Jumped out the fifth floor it's a pit fall
When I hit the lawn, shit it fell like a jigsaw
Rather get hit at the board, then to get tossed
Went to court, got shipped off like a brick of soft"
60,Silent,2002,Legend of the Liquid Sword (2002),Hip Hop,GZA,"(Intro: Ghostface Killah)
Yeah, six o'clock in the morning
That's right, you gotta get your darts right
Spray y'all niggas on some marksman shit
(Ghostface Killah)
Yo, I set 'em up, I got ready to graze
Took my hat off and the crowd went crazy bitches threw their panties,
The sound man was fannin' me the whole place was standin', G
What they chant, we was family
Jumped in the crowd and I swam to sea
Threw me to the back, surprise, I still had my chains on me
Dana Dane, front row bitches, I bang all three
Say, yo, Meth, fuck it, throw a Jim Brownski
Versace, banana color robes and my socks be
Them Billie Jean shits and they real Rocky
The fans can't knock me
I bench Coliseums while Genius spot me, plus I'm cocky, bitch
(Streetlife)
Once I, took off the hoodie, revealed the face
Cop patrol couldn't control the place
I got groupies backstage, lined up at the gate
The signs up, yellin', ""We love your tape!""
I'm sorry I took so long, didn't mean to make y'all wait
But good things take time to create
You can find me, in your studio, half baked, eatin' ganja cake
Tryin' to make my next release date
With Ghost, Street, GZA, great minds relate
You know a brother bond is hard to break
When we perform we cause the Earth to shake
Ain't nothin' change, it's still those same niggas you love to hate
GZA...
(GZA)
I set examples over amplified samples
That's scratched in the club, ducks begin to trample
On those who fell victim, body loss they souls
These beats when I picked 'em, Jones played the role,
Soldiers brave and bold RZA paid the roll,
GZA buries the scrolls then months later it was,
Then years later it was written on loose leaf,
That old formula, that was stolen by new thieves
The journalist watched it, critics couldn't knock it
A piece of history, that they carried in they pocket
With the time factor, speed was the order of the day
What a delay, they were able to, what he would say
Why waste the slot time, of the ridiculous rhyme
That's only excused by a generous mind
I kept 'em stored in the shelters like the goods in cans
Till I turned rap villes into harvested lands"
61,Skit #1,1999,Beneath the Surface (1999),Hip Hop,GZA,"You no longer have to stand in front of me to feel my presence, to reach out and touch me,
To offer not only words of support but a comforting hand.
Live my experiences from one thousand miles away.
Feel sand pour out of your hands on the beach in Hawai'i from a subway station in New York.
Share my pain, my joy, my triumphs, and failures.
You don't have to be there to be here.
The Seven Senses advanced cellular phone network will connect you in every way: verbally, mentally, spiritually and physically."
62,Skit #2,1999,Beneath the Surface (1999),Hip Hop,GZA,"Today's feature story:
The New York Police Department now has the authority to enforce a shoot to kill policy, that will allow officers to utilize the probable cause statement previously applied to not so random searches. Leaders from the African American and Latino communities are outraged at this new policy, stating that the police department has consistently targeted minorities, using the ambiguous probable cause statement as their rational. Protestors are in the middle of organizing an emergency rally to overturn this decision. Our investigative reporters are on the scene to bring you new developments as they occur..."
63,Skit #3,1999,Beneath the Surface (1999),Hip Hop,GZA,"""I'm tired of watching people around me get all the good jobs at record labels while I go on interview after interview only to be passed over for someone less qualified but better connected.""
""At the Institute of the Music Industry we can teach you all you need to know about how to get a full-time job in the music industry, whether it's A&R, publicity, promotions or marketing, IMI can hook you up with the valuable contacts you need.""
""So what do I need to do to enroll at IMI?""
""All you need is a high school diploma and you have the background necessary to be the next CEO at any top record label. Jazz, country western, R&B and Top 10. We know people everywhere. So what are you waiting for? Pick up the phone and call us to receive your application. The sooner you call, the faster you can start a more exciting future.""
**Application and processing fees apply. Paid positions not guaranteed.**"
64,Skit #4,1999,Beneath the Surface (1999),Hip Hop,GZA,"A gun is made in America every 6 seconds. 
30% of families with children keep loaded guns in the home. 
In the United States more than ten children are killed by handguns every day. 
Guns are weapons. Don't destroy our children's lifes!"
