,song,year,album,genre,artist,lyric
34,I Gotcha Back,1995,Liquid Swords (1995),Hip Hop,GZA,"Chorus: GZA and RZA
I gotcha back, but you best to watch your front
'Cause it's the niggaz that front, they be pullin stunts
I gotcha back, but you best to watch your front
'Cause it's the niggaz who front (they be pullin stunts)
Lyrics:
I was always taught my do's and don'ts
For do's I did, and for don'ts, I said I won't
I'm from Brooklyn, a place where stars are born
Streets are shot up, apartment buildings are torn
And ripped up, stripped up, shacked up and backed up
From fiends, cause the bosses on the scene, they got it cracked up
Kids are slingin in my lobby
Little Steve and Bobby
Gettin' paid but it's a life-threatening hobby
Yeah, they still play hide and seek
The fiends seek for the crack, and they hide and let the cops peep
Grown folks say they should be out on their own
Before the gangs come and blow up their mom's home
Because they lifestyle is hectic, so fuckin' hectic
Blaow! Blaow! Blaow! Bullets are ejected
My lifestyle was so far from well
Coulda wrote a book with a title ""Age 12 and Goin' through Hell""
Then I realized the plan
I'm trapped in a deadly video game, with just one man
So I don't only watch my back, I watch my front
'Cause it's the niggaz who front, they be pullin stunts
Back on the Ave of Lavonia and Bristol with a pistol
Stickin up Pamela and Crystal
You know your town is dangerous when you see the strangest
Kid come home from doin' the bid and nothin' changes
What is the meaning of CRIME (what?)
Is it Criminals Robbin Innocent Motherfuckers Everytime?
Little shorties take walks to the schoolyard
Tryin' to solve the puzzles to why is life so hard
Then as soon as they reached the playground, blaow!
Shots ring off and now one of them lay down
It's so hard to escape the gunfire
I wish I could rule it out like an umpire
But it's an everlasting game, and it never cease to exist
Only the players change, so...
RZA - I gotcha back (8X)
I gotcha back so you best to watch your front
'Cause it's the niggaz who front, that be pullin stunts
I gotcha back but you best to watch your front
It's the niggaz who front, that be pullin stunts
Outro: (LP version only)
*Old man*
Your, tech, nique, is, mag-ni-ficent
When cut across the neck
A sound like wailing winter winds is heard, they say
I'd always hoped to cut someone like that someday
To hear that sound
But to have it happen to my own neck is... ridiculous
*Man gasps for air*"
35,Illusory Protection,2005,Grandmasters (2005),Hip Hop,GZA,"(Intro: movie sample)
When I request my flashing sword
And my hand take hold on judgment
I will take vengeance upon my enemies
And I will repay those that hazed me
(Chorus: GZA)
When you got bass all in your face
Sub woofers pumpin' all throughout the place
A fake rap nigga tryna plead his case
It's about to be, a catastrophe
And if you got beehive's, right before your eyes
About to start shit that'll attract the flies
And then you hear lies, followed by some cries
It's about to be, a catastrophe
(GZA)
Half of these rap lyrics ain't thoughts prevoked
Just alotta beef, till they get caught in smoke
But the problem is never cured, on top of that
Most of them be swingin' wild and then drop the bat
Many curious spectators, watch the human drama
This rap cat was all in the street without his armor
A homicidal attempt, that had failed
He flew off the roof, on the fence, got impaled
He talked a good one, but it was make believe
Much too low, for the human ear to perceive
He confused science fiction with science facts
He couldn't separate the block, from the recorded tracks
Need a rhyme or the tactic, gotta work your magic
Detailed and graphic, but the outcome is tragic
Something built to a complex network
With a panoramic vision, designed by experts
I be the ice breaker, for you unskilled skaters
I increase the heat significantly, just on paper
(GZA)
No matter what, I'm throwin' an iller dart
I can lay a verse, that'll soften a killer's heart
As fire as a five alarm blaze, that's too hot to be holding
You feel the heat, once the flame pumps lace your clothing
What some talk about, had little or no bearing
Could the next be some real shit, that's far from comparing
Materialistic M.C.'s, come off boring
Meanwhile, I be sketching up, deposit drawings
Through the years, a countless, number of victories
Changing the era, we swarm unpredictably
A rhyme book is not, difficult to manage
I leave a mic in a bandage, from catastrophic damage
Rap niggaz on a trip, gotta steal your sandwich
So I creeped, division reports was left on canvas
I made it through the worst extremes of cold weather
Scuffed up, but remained durable as old leather
But I hold the pen, you feel the whiff of Polo wind
Something like Jesus, when he civilize older men
The math that shed light, all across the borders
If our wisdom was the vast expands of fresh waters
(Outro: GZA (chess sample))
We call it a sword style, because, we are lyrical assassins
And we aware that the tongue is symbolic to the sword
The lyrical assassins... the lyrical assassins... a sword style...
(The procedure is, check with the knight
Move the knight away to deliver a discovered check from the queen
Then, sacrifice the queen to force the rook next to the king
Then mate with the knight)"
36,Intro (Beneath the Surface),1999,Beneath the Surface (1999),Hip Hop,GZA,"As untold truths threaten our existence and reality is cloaked with images of corruption,
In the depths of the cavern of the mind comes another jewel
From the man who brought you ""Liquid Swords""
The director of ""Shadowboxin'"", ""4th Chamber"" and ""Cold World""
He now takes you... Beneath The Surface"
37,Intro (Legend of the Liquid Sword),2002,Legend of the Liquid Sword (2002),Hip Hop,GZA,"(GZAs son Young Justice)
It was the summer of '77.
New York was just recovering from the raves due to the blackout.
Hip Hop was young and growing rapidly. It was during that time when my father would oftent make journeys across the waters. From Shaolin on his way to the place where many say this art form started. The ferry, or the boat, as most called it, was a floatin' forum, for talent especially MC's, who would often battle while in route to the city. It was on the boat, where he would sharpen his sword on neighborhood MC's, preparing for the battles that were soon to come..."
38,Investigative Reports,1995,Liquid Swords (1995),Hip Hop,GZA,"Intro/outro: u-god
(Here we go, come on)
(A, a battle was fought, in brooklyn...)
(Hessian soldiers killed 3,000 men; much of the fighting
Took place in what is now prospect park in greenwood cemetery,
As well as the park slope and gowanas neighborhoods.)
(This was the first battle, of America.)
Rugged rhymsters, crooked crimesters
Dime droppers, twenty-five-to-lifers
Backstabbers, low blowers
Illegal... cocaine growers
Starvation, profanity
Anxiety, brothers tryin' me
Gun slingers, dead ringers
Verse one: raekwon the chef
Yo, my slang's out of this world
Mix collaboration man, little man and his girl
Way of life got me thinkin', plus I'm analyzing young
Youths on roofs, you know, three time felony brutes
Roll together, tropical trees puff, whatever
Yo, we could go run up on kids for leathers
What drug? faculties bubble keys for g's
Cream flow like seven seas, hit chicks guayanese
Word up, hold your head before you fall out
The morgue route, the devil want that
Let's get my niggaz locked all out
Change for better, that be my only vendetta
In life, feed your seed right, it's breathin indeed right
Chef, remarkable, sparkable, raps and tackable gats
Never get jacked, see ya then move, black
Paradise trife, plush with much ice
Gettin' nice, layin back, sleep all my life
Word up!
Chorus: u-god
(The battle of brooklyn depicted was the bloodiest
Clash of the American revolution. soldiers killed
3,000 men, much of the fighting took place in what is now...)
Crack patients, dime smokers
Vial carriers, mocha tokers
Burnt buildings, brothers building
Save yo' children, investigative reports!
Verse two: gza
Callin all cars, callin all cars! ghetto
Psychos, armed and dangerous, leavin' mad scars on those
Who are found bound, gagged and shot when they blast the spot
Victims took off like astronauts
Get with this, even your best can't
Come on down, you're the next contestant!
Get your pockets dug from all your chemical bank-ins
Caught him at the red light - on putnam avenue and franklin
They used to heat up the cipher with a shot that was hyper
Than your average jfk sniper
He just came home to spark it
Rolling like kaufman, and lay that ass out like carpet
Stop the stuttering boy, save the planes for the five-oh
Then praise the God - chk-a-chk pow!
They be lick shots and premeditate to grab...
...And then they jet back to the lab
And then remain in shaolin
An endangered island
Shorties lose blood by the gallon
(Have integrate a number of corrupt cops, judges...
...Into high-level positions, to insure the continued
Success of the drug smuggling and money laundering operations)
Verse three: ghost face killer
Yo, I grab the pen for revenge and let loose, see
Like muslims, standing on the block, rocking a khufi
The hundred-dollar kick rockin' kid's back for more
Startin gold wars, with black reeboks and velours
Jungle royal life, livin' villain
Packed with visions, copywritten
Throwin' bread to pigeons, Christ has risen, king elegant
Slang-master jackets, expensive noodle hats
In sixty-nine, old times was time that brothers shot craps
The baggy blue guess jeans, pull strings off of callin springs
I'm locked in the thing, rocky ring labelled rap king
The corner emperor - the golden thieves play the benches
Rednecks be hanging big niggaz down in memphis
Back in now-y, hit the bull's eye with loaded nines
Life is like tarzan, swingin' from a thin vine
Shatter dreams, then mirrors don't need a press spirals
Aim at the white shadows with big barrels
Of moet-ahs, the bald headers, milk and amarett-ahs
Who fear none, question all personal vendettas, yo
They use guns, while we angrily shot arrows
You better keep your eye on the sparrow!
Intro/outro
(Have integrated a number of corrupt cops, judges and lawyers
Into high-level positions -- to insure the continued success
Of the drug smuggling and money laundering opertaions.)"
39,"Knock, Knock",2002,Legend of the Liquid Sword (2002),Hip Hop,GZA,"(Verse 1 - GZA)
I'm the obscene slang kicker with no parental sticker
Advisin' y'all that wise words is much slicker
Under circumstances label advances
Ample opportunity, infinite chances
The rhyme, the unrelated beef I don't stress
I seen many killed for inifinte-e-less
Ya raps need a clips that packed with lies
Cowardlessly ya shot up those innocently wise
In extra long verses hundred bars the lim'
The percentage of the truth in the rhyme is one tenth
A solid mass of minerals, easily broke down
Hard rock MC's ya nothin' but compound
Sparked by the endless greed of CEO's
In the videos with those questionable flows
Take it twenty-six, cut it down to four bars, make it a hook
If it's not I'm sure to send a book
(Chorus - Ghostface Killah)
Knock Knock - Who the fuck is bangin' at my door?
Is it abstract commercial or hardcore?
Better know who the fuck they lookin' for
'Cause they don't want more
Yo Knock Knock - Who the fuck is bangin' at my door?
Is it abstract commercial or hardcore?
Better know who the fuck they lookin' for
They don't want more
(Verse 2 - GZA)
The CREAM of the crop we run circles that remain symmetrical
With lightnin victories that's highly electrical
My microphone is just too hot to handle
Plus I don't fill ya ears with the, Pennister's scandal
I gift wrap the sawed-off, the DeeJay pump it
March to the sounds of Armstrong's trumpet
Great things satisfied great minds
You want me to paint scenes describe it in eight lines
Check it - Conceptional breakthrough, incomprehensible
Rap that make you, convinced it's invincible
Lease up my words, powerful hazardous
The most dedicated research the data; this
Info tempo is gatherin momentum
A thousand rounds of ammo one of them was spent in
Applied science to vocals we flyin through
Victorious always because I am who?
(Chorus - Ghostface Killah)
Knock Knock - Who the fuck is bangin' at my door?
Is it abstract commercial or hardcore?
Better know who the fuck they lookin' for
'Cause they don't want more
Yo Knock Knock - Who the fuck is bangin' at my door?
Is it abstract commercial or hardcore?
Better know who the fuck they lookin' for
They don't want more
(Verse 3 - GZA)
I wrote this rhyme with a Sharpie You see this dark the
Ignition's for those with keys who wanna start me up
That's where nature and nightmare come merge
Put ya hole in so much inside ya gotta splurge
On these snakes with the things that, poke through your denim
When ya move it accelerates the action of the venom
But the purity and sacrifice gettin' stung twice
From those who know dikes to cars that deep right
'Cause rhyme travelers are light years beyond
The Clan had a bomb that made the world respond
Considering my own future, I'm used ta
Damaging MC's then pollyin with producers
Whose main makin' cereal from two tracks of stereo
Hold that song's playin' weak ass material
We all peak at a singular point in time
Till you see the sign, nigga, resign
(Chorus - Ghostface Killah)
Knock Knock - Who the fuck is bangin' at my door?
Is it abstract commercial or hardcore?
Better know who the fuck they lookin' for
'Cause they don't want more
Yo Knock Knock - Who the fuck is bangin' at my door?
Is it abstract commercial or hardcore?
Better know who the fuck they lookin' for
They don't want more"
40,Labels,1995,Liquid Swords (1995),Hip Hop,GZA,"Intro: rza
Lot of people, you know what I'm sayin', they be gettin' misinformed
Thinkin' everything is everything, that you could just get yourself
A little deal, whatever, youknowhati'msayin you gonna get on you
Gonna get rich. and all these labels be trying to lure us in like
Spiders, into the web, knowhati'msaying. so sometimes people gotta
Come out and speak up, and let people understand, that you know you
Gotta read the label you gotta read the label if you don't read the
Label you might get poisoned...
Lyrics: genius
Tommy ain't my motherfuckin' boy
When he fake moves on a nigga you employ
Well I'll emirge off ya set, now ya know God damn
I show livin' large niggaz how to flip a def jam
And ruff up the motherfuckin' house
'Cause I smother you cold chillin' mother fuckers are still warner brothers
I'm ruthless my clan don't have to act wild
That shit is jive, an old sleeping bag/profile
This soft comedian rap shit ain't the rough witty
On the reel to reel it wasn't from a tuff city
Niggas be game, thinking that they lyrical surgeons
They know their mics are formed at virgin
And if you ain't boned a mic you couldn't hurt a bee
That's like going to Venus driving a mercury
The capitol of this rugged slang, is wu-tang
Witty unpredictable talent and natural game
I death row an MC with mic cables
The epic is at a rush associated labels
From eastwest to atco, I bring it to a next plateau
But I keep it phat though
Yo, I'm hittin' batters up with the wild pitch style
I even show an uptown/mca style
Who thought he saw me on 4th and broadway
But I was out on the island, bombing MC's all day
My priority is that I'm first priority
I bone the secret out a bitch in a sorority
So look out for a&m, the abbot and the master
Breakin' down your pendulum
As I fiend MC's out with a blow that'll numb the
A-ppendix, I'm holdin' more more weight than columbia
Index interscope, we rca. clan
That's comin' with a plan to free a
Slave of a mental death MC don't panic
Throw that a&r nigga off the boat in the atlantic
Now who's the bad boy character, not from arista
But firin' weapons released on geffen
So duck as I struck with the soul of motown
While central broadcasting systems are slowed down
You're dirty, like that bastard
It's gettin' drastic
Read the label and say it loud
Another wu banger
Thirty-six chambers, to your area
Yeah, the rza, phat tracks on a disc
Rza razor rza razor sharp
Another wu-tang production kid, comin' at ya"
41,Legend of the Liquid Sword,2002,Legend of the Liquid Sword (2002),Hip Hop,GZA,"(Verse 1: GZA)
Who won the covenant role, based on a nationwide poll?
For the grip tells told and rap scrolls
Perfect pitch for language that's built within
Where half the rap ink couldn't hold my pen
Meanin' When Emcees Came, To Live Out The Name
They signed the documents with the, blood of the slain
Far removed from this hip hop life off course
But the confidence and resilience was never lost
In the think tank and research labs I laid tracks
Seen work rule my life but it never broke my back
Destiny forever shake from the events to come
From the (?) and the chemical contents of the sun
A solid gold figure with a verse that glitters
Until the platinum beat comes increasingly bitter
They joined in a likely alliance with the rest
Schemin' with unsuccessful in a zealous Quest
We all see, with a degree of certainty
Who the fake, cowardly cats behind the curtains be,
(Yeah, yeah...)
They hunt, for the skin, flesh, the blood, and bones
In front, want to impress with studdes stones
(Chorus: Anthony Allen)
Now who's the man who brought you the Legend of the Liquid Sword?
Rap critics say ""Damn"" you're sick with your's
4th Chamber and the Shadowboxin' too
That Nigga be the GZA from Wu
And if you odn't know
About the piroclastic flow
Hotter than the spark that made it blow
You better recognize, recognize...
(Verse Two: GZA)
Why U-N-I-verse run like clock works forever?
Words pulled together, sudden change in the weather
The nature and the scale of events don't make sense
A story with no warnin' you're drawn in, environments
Gravity that's gone mad, clouds of dust and debree
Moving at colossal speeds, they crush an emcee
Since this rap region is heavily packed with stars
Internal mirror in the telescope, noticed the Czar
From far away, they blink as the lightnin' strolled
Great distance of space between precise globes
That travel in a circle of order
Like the tape in your cassette recorder filled with cult for slaughter
(Yeah, yeah...)
Meaning the con-tracts manifestly work
The hitman for hire, weapon in his hand he lurks
Inspite of the strange appearance he laid a clearance
On his target through a crowded market
No interference
The microphone left on the scene without a serial
Evidence consistent with organic material (Well)
Surprisingly, as we marched lively with great size and degree
Till it spread widely"
42,Life Is a Movie,2007,Pro Tools (2007),Hip Hop,GZA,"I got scientist killas that'll jam your cell phone
Send a text message, kill you off with a ringtone
High pitched noise on your brain, it's heavy
Autopsy report that he jumped off a train
It started when the dearly departed tried to escape max
Then cut into the general's income like state tax
One call to seal the deal with feel
Doctor on the payroll cost a quarter mill
The mailman's late with the cheque
I'm in the flood with a bunch of bills that's about up to my neck
Plus my rent's not paid and the light's about to go off
Car got stolen by a thief who likes to show off
I can't even get a job, givin' out fliers
I'm a handyman with a pair of broke pliers
The fridge is theirs, Mother Hubbard's cupboard
I'm so down and out, I can only go upward
I form rhymes in alphabet soups
From the rhythm of the spoon, I transform the loop
From the steam of the bowl, I'm make the special effects
Add a dash of spice only God can detect
Had a word to make a bear return to his cub
A word that make a girl come home from the club
A word that make a demon return back to God
And the word that help Dorothy get home from Oz
Thirty frames per second, these films we be perfectin'
Scenes of light put through all projection
Electricity, perfectivity
Audio and visually, physically and mentally
I got a smile that'll make the mirror crack
And I seem to stay under clouds that's pitch black
So when it rains it pours, and when it pours I'm soaked
I contracted lung cancer from third hand smoke
And uh, I'm like the frog that's dyin' to be a prince
The boy who cried wolf and no one was convinced
The man who hit lotto and lost his ticket
In a rainstorm, and struck by lightnin' tryin' to get it
And sometimes I feel like my life's a movie
I don't like to film, I don't like to film
And sometimes I feel like my life's a movie
I don't like to film, I don't like to film
Play it all back, play it all back
Lights, camera, action, let the tape roll
Some scripts get ripped, canned or even sold
Director's vision, producer's decision
And raised the budget, because the chase had collisions
Stunt double risks his life just for the thrill
DP checks the gate before the scene gets sealed
Gaffer slapped with a slate for being late
Craft service got nervous and dropped a hundred plates
Leadin' actor bangin' an extra in the trailer
Screamin', hittin' high notes like Mahalia
Box office hit and a blockbuster smash
Two hundred mil' budget and still recouped the cash
And sometimes I feel like my life's a movie
I don't like to film, I don't like to film
And sometimes I feel like my life's a movie
I don't like to film, I don't like to film
Play it all back, play it all back"
43,Life of a Drug Dealer,1991,Words From the Genius (1991),Hip Hop,GZA,"There's a rumor that an old lady heard a
Kingpin hiring a hitman to murder
A federal prosecuting drug-dealing witness
But that's how it is in the business
And I'm in it, physically gaining power
Constantly counting up cash by the hour
And it feels good to be paid
Regardless of how many victims get slayed
Accomplices of mine drop like flies
But in this everyday a homeboy dies
Whether shot in the body or cyanide in ya Bacardi
'Cause it's a cutthroat party
Now it's up to me to retaliate
And if I score, I'll increase the murder rate
I move on ones who double-cross
Set them up, now they suffer the loss
Of he or she who's ever on the agenda
Most likely a family member
Informants, rattle-tattle-telling snakes
Get shot up, brutalized and thrown in lakes
The parts of a body is found days later
The other half was done by an amputator
I'm undefeated in plenty fights
My enemies are beaten with many stripes
I'll shoot up funerals, firebomb wakes
Vehicular homicides, whatever it takes
Just to keep control of my empire
I'll set ya own mother on fire
'Cause when it comes down just to me and my money
Ain't a fucking thing funny
All those who pose a threat I'll stick them
Ya friends, ya family and innocent victims
Get caught in the midst when I'm busting of nines
But they was in the wrong place, the wrong time
Decapitated bodies found in lots
While I'm still cooking up kilos in pots
The kilos becomes bricks and the bricks becomes rocks
Then retailed on the blocks
I drive around in expensive cars
And get women who fuck like porno stars
I get them high, you know, like powder they nose
Then put 'em in the streets as my high-class hoes
I'm wild, living foul and I'm ruthless
I leave muthafuckers toothless
I had a worker who stepped on the scene lively
Then started selling my customers Ivory
Soap, counterfeit vials of cracks
I stuck 'em to death with a thousand thumbtacks
You've seen my resume, that's just the half
I'm a bad muthafucker, just like Shaft
A character played by who? Richard Roundtree
The only difference, my guns are sound-free
Silencers ring off then wisp by
Then all you hear is a last minute cry
Of those who triedto control my territory
Not the West Side but the Bed-Stuy story
Police be giving me eye-to-eye contact
But I smile 'cause I'm putting out contracts
Now a G-note is placed upon ya head
You say picture that all right, bang ya dead
This is the life of a drug dealer"
