,song,year,album,genre,artist,lyric
60,Dope Fiend Beat,1987,Born to Mack (1987),Hip Hop,Too $hort,"Bitch, funky fresh from oakland, California...
Dangerous music and it don't stop to the beat, baby...
Bitches on my mind
I can't hold back, now's the time
All you loud-mouth bitches talk too much
And you dick teasin' bitches never fuck
I seen long-hair bitches, workin in stitches
Her hair ain't really but two inches
All you bald-head hoes in the oakland world
Runnin' around town with jheri curls
Nappy head niggas like myself
Get a bald-head and say: 'go to hell!'
But you's a snake, you's the one
You bald-head bitch, you need a perm
So much game when the homies tough
I make a bitch go who never sucks
It really ain't life but I just met her
Now I'm sayin': 'bitch, suck better!'
Fuck you, stupid hoe, tell me just what you know
I came to the party and turned it up
You say: 'ouh, he's got a dirty mouth!'
But, bitch, I kept talkin' shit
Mothafuck you, damn shit-head bitch
I wanna blowjob and I'm not kiddin'
Work it in your mouth till your head starts spinnin'
I'm that nigga you'll answer to
If I say: 'bitch, jump!', that's what you do
I'm a fast talkin' conman blowin' your mind
Breakin' you and your cousin at the same time
With a dirty rap comin' out my mouth
And you know damn well what I'm talkin' about
I'm the too $hort, baby, way too cold
So mothafuck you, bitch, goddamn ass hoe
The dope fiend beat...
For all you junkies to just ride...
H-e-a-d, I need a doctor just for me
To suck my dick like a vet
To give me head until I sweat
She gotta suck dick
So I can tell all my homies just what she did
She sucked and sucked and she's a bitch to the beat
I'm too $hort, I said my name is too $hort and it don't stop
I love you bitches for the blowjobs
I just laugh over and over
When the bitch drinks sperm like it's soda
I straight start aimin', would I miss?
Get back bitch, I wouldn't never kiss
I say she looks so good and she's so big
But, man oh man, that bitch can wimp
If I wanna I could rock her
But I can't fuck no-head doctor
Bitches don't know that's too $hort's tip
You might get geed if you don't suck dick
But I'm so fresh, I'm so down
I tell you bitches the other way around
If you do me first then I do you
So the game jumps up when the bitch is true
Soon as I come all in her mouth
I smooth get dressed and roll out
I'm too $hort, baby, fresh fresh again
One MC, one bitch broken
I tell you, baby, playin' just like that
I'm the best of the players to the ice cold vet
And, bitch, you just a bitch
You work fastfood and you think you rich
You see, my game don't stop when it's on the one
I love to see you when you work that thang
Gettin' real busy at the back of the car
Rollin' down the skyline boulevard
I say: 'bitch, what are you smokin'? '
A big fat dick in the big east oakland
I see my homie, he needs to quit
She was walkin' down the street
With a big fat bitch, maybe I'm wrong
He might get every two weeks that welfare check
Oakland, California, is the city of snakes
Pimps, pussies, players and fakes
The big oaktown, the city of liars
Fresh storewires and voltaires
A strip, bitches, nasty freaks
My raps, homeboy, with tremendous beats...
She's a bitch to the dope fiend beat...
All you junkies just ride...
Bitches on my mind
I can't hold back, now it's the time
To bust a left nut, right nut, in her jaw
Opened eyes and guess what I saw
Bitches on my mind
Grabbed the microphone and then I started to rhyme
What would life be if it wasn't too $hort
It be nothin' but rappers from old new york
But that's not likely and there's no doubt
Bitches like me 'cause I'm turnin' it out
I'm here, there, everywhere
Sportin' fat gold rope, I'm a mothafuckin' player
Recognize game when it's on your face
As you dip to the beat and you feel the bass
Crook it up loud, would be doin' fine
Pose like a pimp and check my rhyme
Some young tender doesn't like this beat
But a bitch ain't nothin' but a word to me
I can check her, wreck her, or just get paid
Cut to the house and freak my maid
You see, she doesn't speak English but we don't talk
I call her lucy and she's juicy, makes your eye balls walk
We never hesitate to make good love
She clean up my house and then clean me up
So check it out, you bitches
I tell you a story of rags to riches
So check it out, freak nasty
I know you're fine but you look like lassie
Bitch, not a long ago I used to hang at the mall
Top floor, baby, all the freaks I called
And if they didn't wanna come that ain't shit
I just drop a few lines and then call her bitch...
Bitch!"
61,Dum Ditty Dum,2007,Get Off The Stage (2007),Hip Hop,Too $hort,"Dats how we do it where I'm from-fr-fr-from from
And in da bay dats where my niggas get laced
Niggas dat wanna step up come on its face ta face
My niggas we go dumb we ain't wit dat dance
Don't wear nikes, forces, we just wear vans
I ain't wit dat romance I wear baggy pants
But not too baggy I be cuffin' my pants
Nigga its time to go dum ditty dum dum (ey!) dum ditty dum (ey!)
We go dum ditty dum dum all tha way I said dum ditty dum dum in tha bay we
Go dum ditty dum dum every day I said dum ditty dum okay (okay.) we go dum
Ditty dum dum all tha way I said dum ditty dum dum in tha bay we go dum ditty dum
Dum everyday dum ditty dum okay (okay).
(Verse 2: young l)
I'm finna go dumb wit my goddamn vans on
Me and my squad we get are grown man on
In da bay dats where we get crunk
I ain't from da ""a"" but I do get crunk
Its young l in his mothafuckin' zone
We in da bay so you know its goin' on
People in ""a"" like,""what is goin' on?""
Nigga you no where I'm from
I'm from ""b""town where we go dum dum!
We go dum ditty dum dum all tha way I said dum ditty dum dum in tha bay we
Go dum ditty dum dum every day I said dum ditty dum okay (okay.) we go dum
Ditty dum dum all tha way I said dum ditty dum dum in tha bay we go dum ditty dum
Dum everyday dum ditty dum okay (okay).
(Verse 3: uno)
Its uno at tha mike so you know I'm finna blow
I stack all money you be like oh my (whoa!}
Tha pack is raw and we stack alotta dough
Y'all commin' at tha bay why dey doin' dat fo'?
Cause dey know we commin' and we finna hit low
I'm commin' fa ya money dude I'm at cho do'
And we rockin' vans dats a skateboard shoe
Nigga dis is real talk nigga you already know
I said dis is real dis ain't no show
Fake ya out homeboy you don't know where I'll come
But chu know I'm finna go dum dum dum
We go dum ditty dum dum all tha way I said dum ditty dum dum in tha bay we
Go dum ditty dum dum every day I said dum ditty dum okay (okay.) we go dum
Ditty dum dum all tha way I said dum ditty dum dum in tha bay we go dum ditty dum
Dum everyday dum ditty dum okay (okay).
(Verse 4: dope boy)
When you play dope boy all dem girls goin' chase me
When I'm real dum all dem girls go crazy
Dope boy ain't goin' I real ass nigga
Catch me at da club (uh..) about 6 figures
Dis a real dum song so nigga go dum
You know where nigga you know where I'm from
I said I gotta about... I said I gotta about...
Damn I can't even think how many girls I got
I can't think about how many vans I copped
I can think about many albums flopped
I ain't talkin' bout ours I can't wait till ours dropp
And stopp sayin' you kin ta me
When our album dropp its goin' sale about infinity
We go dum ditty dum dum all tha way I said dum ditty dum dum in tha bay we
Go dum ditty dum dum every day I said dum ditty dum okay (okay.) we go dum
Ditty dum dum all tha way I said dum ditty dum dum in tha bay we go dum ditty dum
Dum everyday dum ditty dum okay (okay).
(Verse 5:too $hort)
It's too $hort my nigga its about da bay
If you from da bay tho' ya hands up (ey!)
I'm wit my niggas da pack dis niggas crazy
Ask dem niggas dey'll say,""he pays me.""
Me and da pack we finna go nuts
See us in da club it's all about umm us!
Dey don't wanna play us man fuck m.TV
Fuck y'all man dis b.e.t
Off dat subject nigga lets go dum
I'm from da bay you know where I'm from..(ey!)
We go dum ditty dum dum all tha way I said dum ditty dum dum in tha bay we
Go dum ditty dum dum every day I said dum ditty dum okay (okay.) we go dum
Ditty dum dum all tha way I said dum ditty dum dum in tha bay we go dum ditty dum
Dum everyday dum ditty dum okay (okay)."
62,Every Time,1983,"Greatest Hits, Volume 1: The Player Years 1983-1988 (1993)",Hip Hop,Too $hort,"From the day we met up until we met right now
If I wanted that girl I always knew how
To fight her get her and tear her apart
Getting everything I wanted all I want
Everytime I see her its time to toss
I walking in the door taking everything off
'Cause I know I'll get it call her in a minute
Short oh boy and I'm a tone cold playa
She was mine and more but more came more
She was giving that funk to the homeboy short
Wanting money but maybe it was just the fact
The life I live made me the man of the rap
Everytime I see her you know I take her
Straight to her house then I braker
If I don't see break she'll give me a call
Same ol' freak show having a ball
Breakdown
She's a tender a star and Angel in white
My wildest dream on a Saturday night
My freak of the week but girl of the day
If I like it like that it will be that way
Now every time I see her she be doing it slow
Like ninety on shorty in a big time room
She's the one I can't resist
Everytime I see her I tell her like this
Breakdown
She be coming around the mountain around ten till eight
Hook me up on a late night date
I be right there homie opening the door
Singing baby oh baby are you ready for more
Everytime I see her you know what I mean
Had her in the back doing sexual things
Same ol' freak show all them moves
Call me short homeboy and I just can't loose
Tone cold freak dressed in lace
The hottest young tender in the whole dang place
Hottie so hot I keep telling myself
I want the young tender if you read this
At lyrics dot astraweb dot com that means
This was bitten didn't waste one second
To take a chance
I walked up to her and asked to dance
Baby said yes we hit the spot
My rap came hard and the freak got hot"
63,Everytime,1985,Players (1985),Hip Hop,Too $hort,"($Hort)
From the day we met up until we met right now
If I wanted that girl I always knew how
To fight her get her and tear her apart
Getting everything I wanted all I want
Everytime I see her its time to toss
I walking in the door taking everything off
'Cause I know I'll get it call her in a minute
Short oh boy and I'm a tone cold playa
She was mine and more but more came more
She was giving that funk to the homeboy short
Wanting money but maybe it was just the fact
The life I live made me the man of the rap
Everytime I see her you know I take her
Straight to her house then I braker
If I don't see break she'll give me a call
Same ol' freak show having a ball
Breakdown
She's a tender a star and Angel in white
My wildest dream on a Saturday night
My freak of the week but girl of the day
If I like it like that it will be that way
Now every time I see her she be doing it slow
Like ninety on shorty in a big time room
She's the one I can't resist
Everytime I see her I tell her like this
Breakdown
She be coming around the mountain around ten till eight
Hook me up on a late night date
I be right there homie opening the door
Singing baby oh baby are you ready for more
Everytime I see her you know what I mean
Had her in the back doing sexual things
Same ol' freak show all them moves
Call me short homeboy and I just can't loose
Tone cold freak dressed in lace
The hottest young tender in the whole dang place
Hottie so hot I keep telling myself
I want the young tender if you read this
At lyrics dot astraweb dot com that means
This was bitten didn't waste one second
To take a chance
I walked up to her and asked to dance
Baby said yes we hit the spot
My rap came hard and the freak got hot"
64,F.U.C.K. Y.O.U.,2007,Get Off The Stage (2007),Hip Hop,Too $hort,"(Fuck you) Nigga fuck you too
(Fuck you) Nigga fuck you too
(Fuck you) Nigga fuck you too
Nigga F.U.C.K. Y.O.U.
(Too $hort)
You finna get yo' ass whooped bitch
You bout to get yo' ass whooped bitch
We finna whoop yo' ass bitch
You bout to get yo' ass whooped bitch
(Mistah F.A.B.)
On my mama yo' hood ain't shit
Nigga on my mama yo' hood ain't shit
On my mama yo' hood ain't shit
Yo' hood ain't shit, hood ain't shit
(Too $hort (Mistah F.A.B.))
Man fuck yo' mama that punk ass bitch
(Nigga what you say?) She ain't nothin' but a bitch
Nigga fuck yo' mama that punk ass bitch
(Nigga what you say?) Yo' mama ain't shit
(Mistah F.A.B.)
Fuck that shit nigga what you wanna do?
Nigga fuck that shit nigga what you wanna do?
Nigga fuck that shit nigga what you wanna do?
Nigga what you wanna do? What you wanna do?
(Fuck you) Nigga fuck you too
(Fuck you) Nigga fuck you too
(Fuck you) Nigga fuck you too
Nigga F.U.C.K. Y.O.U.
(Too $hort)
Hit that nigga with a champagne bottle
Hit him with a champagne bottle
Man hit that bitch with a champagne bottle
Hit him in the head with the bottle
(Mistah F.A.B.)
While you bumpin' yo' gums I'ma bust yo' shit
Keep bumpin' yo' gums I'ma bust yo' shit
Bumpin' yo' gums I'ma bust yo' shit
I'ma bust yo' head and bust yo' lip
(Too $hort)
One of y'all niggaz gon' die tonight
You gon' die tonight
Nigga one of y'all niggaz gon' die tonight
Somebody gon' die
(Mistah F.A.B.)
Nigga fuck yo' turf, I'ma put you on a shirt
Nigga fuck yo' turf, I'ma put you on a shirt
Nigga fuck yo' turf, I'ma put you on a shirt
Everybody on your turf gon' have your picture on a shirt
(Fuck you) Nigga fuck you too
(Fuck you) Nigga fuck you too
(Fuck you) Nigga fuck you too
Nigga F.U.C.K. Y.O.U.
(Ms. Hollywood)
Broke hoe talkin' all that shit
You and your best friend got matchin' outfits
Punk ass bitch, tryin' to look cute
If I pull that weave out then what you gon' do?
Bitch fuck you, I know where you stay
Think you prettier than me, I'll cut yo' face
Don't call yo' nigga, what he gon' say?
Keep fuckin' with me, you bout to get sprayed
(Ginger)
Silly hoe, who you think you fuckin' with?
You and that pussy nigga ain't got shit
You dykin' ass hoe, want a dykin' ass bitch
Just mad 'cause I won't let ya lick my clit
You wanna cut my face 'cause I'm prettier than you?
If I looked like you I'd wanna cut mine too
You nappy headed bitch, I don't need no weave
I would take your man but he ain't got no cheese, so fuck you
(Fuck you) Nigga fuck you too
(Fuck you) Nigga fuck you too
(Fuck you) Nigga fuck you too
Nigga F.U.C.K. Y.O.U.
(Fuck you)"
65,Fed Up,2010,Still Blowin' (2010),Hip Hop,Too $hort,"(Intro/Chorus)
When a player's pissed
There ain't nuttin she can do about it
If I'm runnin' out of love
The bitches who need to talk about it
(Too $hort)
It's over - bitch I ain't fuckin' wit'chu
Don't call me, 'cause we ain't got nothin' to do
You on your own now, find a new manager
My bitch is on cruise control - I can't handle her
You so complicated, tellin' lies and stuff
Too emotional for me, and you cry too much
I roll on these hoes when they test my game
They wanna be spoiled buyin extra thangs
We supposed to be a team, real players winnin' shit
We hustle every day, and we share the benefits
It used to feel good but now I'm barely feelin' it
Cause now, I don't really care if we end the shit
Bitch! You gon' change on me?
You better take a good look, cause you ain't gon' see
My face... ever again
I'll find a better hoe and you can get a better pimp
Beotch!
(Too $hort - over Chorus)
It's over baby!
Nothin'
(Too $hort)
Now when I'm through wit'chu - ain't no gettin' back
I don't want money from you, and I don't care who's hittin that
Don't speak when you see me and don't call a player
You can fuck a dog, for all I care bitch!
It ain't the same on your own
I know you miss me, that's why you playin' games on the phone
I'm like Pimp C, I'm just not willing and able
To keep a bitch like you in my stable
You're nothin' but trouble, you never could be on my level
You was turned off first time I said hello
You a freak and you fine but you weak in the mind
And worst of all, you're cheap wit'cha grind
You don't earn enough, got me burnin up
Cause you ain't even willin', to learn new stuff
Get the fuck out my face cause right now I will
Whup your motherfuckin ass, bitch you know how I feel
(Too $hort - over Chorus)
What bitch?
I ain't tryin' to hear that shit baby
Time's up
It's too late
Get the fuck out my face bitch!
It's over baby, nuttin to talk about
I fucks wit'chu no mo'
It's too late baby, ain't nuttin you can say
I'm outta here"
66,Female Funk,1983,Don't Stop Rappin' (1983),Hip Hop,Too $hort,"($Hort)
Short there baby what's that axe
I never saw a girl that could finish that
I said you look so high and your hair so long
When I see you baby I'm gonna sing this song
Crawl [scratch] I gotta get that funk
Female funk
I tell you about a freak that I met
Short got heat when the funk got wet
She's the one I won't forget
Got to get that funk like it ain't no sweat
Like a seven eleven on a non stop street
The first young tender was a true the freak
'Cause the funk won't let quit they don't tell me shit
Crawl [scratch] I gotta get that funk
Female funk
The second gender that I had
Talk about Friday that girl was bad
But young tender and sir too short
Gotta get that funk everyday at fo
'Cause a brother like me pay to in out
Funk that jump bitch there's just no way out
Once was yours but now she's mine
But now I get that funk I sing this rhyme
Crawl [scratch] I gotta get that funk
Female funk
The dirt young tender that I put
Couldn't understand that torched the but
Big time rapper that's what I am
But in that funk I'm superman
The dirt young tender she's the one
After two whole dates she had me sprung
Working that funk like I know I should
This and sour when I know that funk is good
Crawl [scratch] I gotta get that funk
Female funk
The next young tender was the fourth
So much love for sir too short
The fourth young tender that I'll regret
The girl got scared when the funk got wet
Without that funk what's to play
Sleep, and eat, and work all day
Give me that funk and I might just shout
Sir too short just turned you out
Crawl [scratch] I gotta get that funk
Female funk
Too s.h.o.r.t. female funk is all I see
Baby and short all night long
Give me that funk and sing that song
Crawl [scratch] I gotta get that funk
Female funk
Hey young female there female funk is what I said
Funk, funk, give me some more
You get a lot of funk when your name too short
Give me that funk give me a lot
That funk won't stop give me that funk don't be
Everywhere I go they sing this song
Crawl [scratch] I gotta get that funk
Female funk
I gotta get more gotta get mail
Told my hoe by the fifth young tail
Call me up on the telephone
And said sir too short I'm all alone
I said there's no need to say anymore
Getting real funky is up to too short
The two emcee is who I be
Working that funk to the video
Crawl [scratch] I gotta get that funk
Female funk
Thirty eight twenty four thrity seven
All about tennies all extra thick
Work that funk if you dare
'Cause all my young tenders got funk to spare
Watch your step you just might slip
Sewed up too short on a tender tip
Got to get that funk with that G
When it get's that high just send to me
Funk [scratch] gotta get that funk
Female funk
The next young tender down the line
Is just a fan who loves the rhymes
She saw me rolling so so hot
Recognized pain in the start
There's no time so the story goes
I rolled that freak like a two hoe
'Cause I'm a vet not a punk
So let too short just rock that funk
Funk [scratch] gotta get that funk
Female funk
Female funk seven day all two times
Smooth the ocean around the clock
Saw too short just watch that cock
Funk [scratch] gotta get that funk
Female funk"
67,Female Funk,1983,"Greatest Hits, Volume 1: The Player Years 1983-1988 (1993)",Hip Hop,Too $hort,"($Hort)
Short there baby what's that axe
I never saw a girl that could finish that
I said you look so high and your hair so long
When I see you baby I'm gonna sing this song
Crawl [scratch] I gotta get that funk
Female funk
I tell you about a freak that I met
Short got heat when the funk got wet
She's the one I won't forget
Got to get that funk like it ain't no sweat
Like a seven eleven on a non stop street
The first young tender was a true the freak
'Cause the funk won't let quit they don't tell me shit
Crawl [scratch] I gotta get that funk
Female funk
The second gender that I had
Talk about Friday that girl was bad
But young tender and sir too short
Gotta get that funk everyday at fo
'Cause a brother like me pay to in out
Funk that jump bitch there's just no way out
Once was yours but now she's mine
But now I get that funk I sing this rhyme
Crawl [scratch] I gotta get that funk
Female funk
The dirt young tender that I put
Couldn't understand that torched the but
Big time rapper that's what I am
But in that funk I'm superman
The dirt young tender she's the one
After two whole dates she had me sprung
Working that funk like I know I should
This and sour when I know that funk is good
Crawl [scratch] I gotta get that funk
Female funk
The next young tender was the fourth
So much love for sir too short
The fourth young tender that I'll regret
The girl got scared when the funk got wet
Without that funk what's to play
Sleep, and eat, and work all day
Give me that funk and I might just shout
Sir too short just turned you out
Crawl [scratch] I gotta get that funk
Female funk
Too s.h.o.r.t. female funk is all I see
Baby and short all night long
Give me that funk and sing that song
Crawl [scratch] I gotta get that funk
Female funk
Hey young female there female funk is what I said
Funk, funk, give me some more
You get a lot of funk when your name too short
Give me that funk give me a lot
That funk won't stop give me that funk don't be
Everywhere I go they sing this song
Crawl [scratch] I gotta get that funk
Female funk
I gotta get more gotta get mail
Told my hoe by the fifth young tail
Call me up on the telephone
And said sir too short I'm all alone
I said there's no need to say anymore
Getting real funky is up to too short
The two emcee is who I be
Working that funk to the video
Crawl [scratch] I gotta get that funk
Female funk
Thirty eight twenty four thrity seven
All about tennies all extra thick
Work that funk if you dare
'Cause all my young tenders got funk to spare
Watch your step you just might slip
Sewed up too short on a tender tip
Got to get that funk with that G
When it get's that high just send to me
Funk [scratch] gotta get that funk
Female funk
The next young tender down the line
Is just a fan who loves the rhymes
She saw me rolling so so hot
Recognized pain in the start
There's no time so the story goes
I rolled that freak like a two hoe
'Cause I'm a vet not a punk
So let too short just rock that funk
Funk [scratch] gotta get that funk
Female funk
Female funk seven day all two times
Smooth the ocean around the clock
Saw too short just watch that cock
Funk [scratch] gotta get that funk
Female funk"
68,Female Players,2002,What's My Favorite Word? (2002),Hip Hop,Too $hort,"(Woman) Only fuck with these silly-ass boys for fun
(Woman) Get 'em all alone, and a thug is hung
Screamin aiy-yah, aiy-yah
(Woman) Only fuck with these silly-ass boys for fun
(Woman) Get 'em all alone, and a thug is hung
Screamin aiy-yah, aiy-yah
(Too $hort)
I like them wild girls, the way they throw that
When the music ghetto, and she don't hold back
I wanna see her wiggle, when I stick it in her
Call me the champ, cause my dick's the winner
Bitch! It's internationally known
I picture in my mind, you look nasty in thongs
You probably do it just like you dance (player)
You bout to bust out your pants
You got... too much ass in your jeans
Throw it my way, I'm not passin a thing
Are you a pleaser, or a teaser?
R&B diva or a skeezer?
To me, it's the same difference
I do my thang in the game, pimpin'
Don't worry 'bout me, 'cause I'ma do mine (damn)
Damn this bitch is too fine
(Chorus: Too $hort) + woman
(Woman) Only fuck with these silly-ass boys for fun
($Hort) I like female players
(Woman) Get 'em all alone, and a thug is hung
Screamin aiy-yah, aiy-yah
(Woman) Only fuck with these silly-ass boys for fun
($Hort) I don't like them squares
(Woman) Get 'em all alone, and a thug is hung
Screamin aiy-yah, aiy-yah
(Too $hort)
Yeah she got dough, she get her hustle on
You can't buy that girl out, fool what you want?
She get her own table, buy her own bottles
Look in her purse, she got long dollars
Now you wonder why she hangin' with me
You curious how my game could be
Playin' broads ain't a thang to me
It must be a sign up but you can't see (player)
It's right there in your face
Throw the peace sign up all the players in the place
Look around, it's time to go to work
I'm tryin' to flirt with little momma in the shortest skirt
I think she with it, but I don't wanna just hit it
I wanna get explicit
And if she kiss it, it's bound to get good
Tomorrow mornin I'll be cruisin round the bitch hood
(Chorus) w/ minor variations
(Too $hort)
All my female players, gather around
It's a roller coaster baby you at Magic Mountain
Six Flags on a holiday
You wanna ride again girl you ain't gotta wait
You never have to stand in line for the ride
Just take a few hits 'cause I'm tryin' to get you high
I can't tell you to loosen up
But I can say I love the way you move your butt
Let's make it happen, you wanna go home with me?
So I don't wake up in the mornin all lonely?
We can't compromise, I won't promise you lies
But I will make you feel it till the sun rise
And if you wanna know what it's like
Ask all the top notches in the club tonight
They'll tell ya, I ain't tryin' to find a wife
But if you fuck with Short Dawg you'll have the time of your life
(Chorus) w/ minor variations
(Too $hort) I like female players"
