,song,year,album,genre,artist,lyric
120,It's All Good,1993,Get In Where You Fit In (1993),Hip Hop,Too $hort,"Man, this bitch blowin' my beeper up.
Ready to put a hole up in one of these bitches, man.
Sup? Guess you wondered where I was at
When you beeped me last night & I didn't call back
Supposed to be there, meet you at the house at 9
You made a candlelight dinner just to wine and dine
And I didn't even show up
You beeped me 20 million times, made my beeper blow up
Thought you shot me to the left 'cause I'm a D O G
But you called so I guess it's still cool for me
To get freaky, you know I got that git back
I come right when I hit that
And if you tell me right now it's cool today
As soon as I'm through I be on my way.
Do I look like the type of lady
That'll talk to a brother that's shady, hell no
But you can wine and dine me
Spend a little time with me, It's All Good
'Cause I love the way you take me
Oh boy you shake me, when we lay down
Got my head spinnin' around.
I need a woman that's down for me
Always on my side, not my enemy
We could be gangsta's, lovers, parents, or friends
But whatever we do, do it straight to the end
We'll make love like professionals
You and me baby, fuck the rest of them hoes
You know how much we like bein' together
Seems like every second, it's gettin' wetter
So good I wish it'd last forever
'Cause it would never get no better than this
I know you feel the same
Moanin' so loud all the neighbors complained
And all the people tried to tell you I was phony
Talkin' all that junk and don't even know me
Last night I was chillin' at the club
Chillin' with my partners when your friends rolled up
Flirtin' with your nigga behind your back
They called you on the phone and told you where I was at
Your girlfriends tryin' to run your world
You'd better stop listenin' to them other girls.
Never cared about those other girls
It's something about the way you rock my world
Even though you make me cry
I still wait alone for you at night, but It's All Good.
I couldn't come home last night 'cause I was out makin' money
But I'll come home tonight if you want me
'Cause you sure lookin' good today
I take you to your house and let you have it your way.
Ooh boy, oh, It's All Good, It's All Good to me, baby.
I just keep on fuckin' you all night long
Me and you baby got it goin' on
You ain't trippin' every time you see me
You get loose and you get so freaky
I never meant to break your heart
You gave it all to me & I tore it apart
Talked about love right to the end
But I'm a tell you like it is, I'll never do it again
I'm from east oakland, I'm an ice cold player
Born to mack and got women everywhere
I got one up in E.P.A.
And 2 down in south central L.A.
One in frisco and one in berkeley
Got a few southern girls just to work me.
Is that what you wanted to hear?
That your man is the player of the year?
I need a woman that's down for me
Always on my side, not my enemy
We could be gangsta's, lovers, parents, or friends
But whatever we do, do it straight to the end
I said the very same thing in the beginnin'
We played the game but it's in the 9th innin'
You'd better wake up and smell the dank
It really don't seem to be what you think, bitch
I'm all about gettin' my bank
You be the car & I'll fill your tank
'Cause nothin' don't come for free
Unless your ass don't want to be with me, bitch.
Boy, have you been listening?
I can't let you go since I know what I'm missin'
And can you fell it in my touch
That I want you so much and It's All Good
It's All Good, baby
I'm tryin' to tell you boy, that it's good
It's All Good, It's All Good, baby baby baby
Oh, like that baby, like that
It's All Good, It's All Good
It's All Good, It's All Good."
121,It's Time to Go,2006,Blow The Whistle (2006),Hip Hop,Too $hort,"It's time to go
It's time to go
It's time to go
It's time to go
The lights are on, the club is closed
You don't wanna leave 'cause you love the h***
Somethin' ain't right, you doin' bad tonight
You'll be all alone if you don't have a wife
'Cause these ladies ain't feelin' you
They don't wanna know what you can really do
They just wanna make you disappear
Get the f*** up out a b*** ear
Take that s*** back over there
Go away, she don't wanna know you, player
What you gotta say? Just like this
Loud as you can, say, ""F*** that b***""
Five minutes ago, you was thinkin' would she
Roll out with you and give you some
I don't think that's goin' down
But you don't wanna go home now
(It's time to go)
Get up outta my face
You better get up outta my face
Get up outta my face
You need to get up outta my face
(It's time to go)
Get up outta my face
You better get up outta my face
Get up outta my face
You need to get up outta my face
(It's time to go)
You came to my house with a maxi pad
You goin' home in a taxi cab
No more limos, run the meter
We might need stitches, this one's a bleeder
Grab yo' s***, girl, it's time to go
You look good but you ain't my kind of h***
Another time on another day
We could hook up, make love and play
It really can't happen no other way
Girl, do you hear what a brotha say?
Don't leave anything in my room
I got another freak, she'll be here soon
She might not be as wild you
It's 4 A.M. and right now she'll do
She's not a super freak and she's not a h***
But when she gets here, you gotta go
(It's time to go)
Get up outta my face
You better get up outta my face
Get up outta my face
You need to get up outta my face
(It's time to go)
Get up outta my face
You better get up outta my face
Get up outta my face
You need to get up outta my face
(It's time to go)
We did what we did so let's do what we do
We had fun but now I'm through with you
I gotta run, I'll call you in a few days
I'll be back to get some more
'Cause you do it better than most
At this rate, we'll probably never be close
But that's okay 'cause that's not the mission
You could cheat on your man if you got permission
I'll give it to ya, I'll beat it so well
When we finished, we gotta leave the hotel
That's all, I'm the number one player
You can call or I'll see you somewhere
As long as we make this happen again
Yo' fine a*** sittin' back in the Benz
'Cause yours is the best, I must confess
But right now, it's time to get dressed
(It's time to go)
Get up outta my face
You better get up outta my face
Get up outta my face
You need to get up outta my face
(It's time to go)
Get up outta my face
You better get up outta my face
Get up outta my face
You need to get up outta my face
(It's time to go)
You need to get on up outta my face
You gotta go, it's time to go
You need to get on up outta my face
It's time to go, it's time to go"
122,It's Your Life,1990,Short Dog's in the House (1990),Hip Hop,Too $hort,"(Too $hort)
It's your life, don't be stupid dope...
{P-funk sample}
'Cause when you waste it...
It's your life, don't don't be stupid dope...
{P-funk sample}
'Cause when you waste it...
Nowwwwwwwwwwww I come from, the oakland town
Task force roll and rock, cold cracked down
Young brothers my age makin' dollars so long
Drive a brand new benz with a cellular phone
See his diamonds and gold, call him big bank bob
Got a ring for each finger and he can't get a job
This is not a song I made about crack
It's all about losin what you can't get back
Cause the name of the game is to control yo' life
And all the things you do you must do them right
It's not my life, it's on you baby
What's really goin' on is that cash money
How you make it, it doesn't matter to me
Work at macdonald's or just slang them ki's
Or you can be like me and go straight legit
Drive a brand new benz and they can't say shit
It's your life, don't be stupid dope...
{P-funk sample}
'Cause when you waste it...
It's your life, don't be stupid dope...
{P-funk sample}
'Cause when you waste it...
Partners in your face, ain't even your friend
Probably have to blast him if you see him again
And if you don't blast him you'll get shot in the head
Seven days later you'll be buried and dead
I can't be like that, the only thing you fear
Homeboy you can't see it but you know it's there
It's called tomorrow, whatcha gonna do with that
Cut school, sell a few dopefiends crack?
It's not a one-way street, it's more like a dead-end
So if you take it, you better turn back my friend
I know a lot of young brothers don't think things through
They really don't know what they wanna do
When you lag, you lose, you start payin' your dues
You can't kick back and let your bankroll stack
You'll be stuck on stupid, for smokin' a friend
Ten years from now you'll still be in the pen
It's your life, don't be stupid dope...
{P-funk sample}
'Cause when you waste it...
It's your life, don't be stupid dope...
{P-funk sample}
'Cause when you waste it...
I got my eighteens pumpin, ridin' the five
People lookin' at me like I stole the ride
Am I a gangster, player, makin' them g's
Cocaine dealer with the z's and v's
Can't tell 'em nothin', so I say, whassup?
They get mad, I don't give a fuck
I keep ridin', sidin, whippin and dippin
Look at all my homeboys trippin'
They'll knock you out, one punch like the champ
Goin' to jail is like summer camp
We shake hands one day, kill each other the next
And if you don't like it it's just like that
'Cause I come from, the city of dope
It couldn't be saved by john the pope
But since I have the chance, I'll say in the rhyme:
We have to stop the killin' sometime (soon)
It's your life, don't be stupid dope...
{P-funk sample}
'Cause when you waste it...
It's your life, don't be stupid dope...
{P-funk sample}
'Cause when you waste it...
It's your life, don't be stupid dope...
{P-funk sample}
'Cause when you waste it...
It's your life, don't be stupid dope...
{P-funk sample}
'Cause when you waste it..."
123,Just Another Day,1993,Get In Where You Fit In (1993),Hip Hop,Too $hort,"I woke up one day in Vacaville
Round the corner from the pen
Fat house on the hill
All the homies in the pen straight locked down
But I gotta get dressed & hit the oaktown
I called Randy ??Olson?? on the telephone
Early in the mornin' but he still ain't home
So I called Ant Banks to see what's up
He said meet me at the studio at 2:00
I got dressed, smokin' on some serious dank
Grabbed my keys off the table & a big ol' bank
I hit interstate 80 & I'm rollin'
Joint's still burnin' & I'm smokin'
I was on my way to San Jose
To the stereo shop to make my music play
'Cause one amp shut down & the bass ain't playin'
Didn't take long, for Joel & Janks to have me slumpin'
So I called Apu: what's up nigga? What you about to do?
He said, just kickin' back waitin' on the fellas
About to go eat at Della's
I said it sure sounds good to me
I can't go though, gotta hit Myrtle Street
Passed the acorns on my way, bitch. It's Just Another Day.
Big Banks came through & started mixin'
Sittin' in the studio kick back listenin'
To some funky ass shit from the Dangerous Crew
Debbie D came through, with FM Blue
Shorty B rolled up smokin' fat ones
Pee-Wee had a crew in the back room
Goldie had the tramps givin' head breakin' off
Rappin' Ron /Ant diddley-dog
Twin 1 & 2 is tellin' stories
About beatin' down niggas for the glory
Had to catch a plane that night & roll out of town
Everybody gettin' high tryin' hard to clown
I had to go shop fo' it's time to leave
I dipped to the mall, flipped me some jeans
Rolled on out like a player
Hot ass day, bitches everywhere
I'm leanin' hard to the left like a big shot
Checkin' out the hoes seein' who'll get knocked
'Cause when you fuck with $hort you get fucked quick
I run some drama on yo' ass & make you suck dick
Ride through the ??old?? scene ??beamin' it?? slow
Talkin' that shit 'about' niggas on the fo'
Drive crazy, tryin' to tear up shit
It's Just Another Day in Oakland bitch.
It was me, Jaque, ??Beamin'?? & ??T-Lo?
??Boo-kicke?? slow motion & ??P-O??
Spud, Ju-Ju, Frog & Big E
Gettin' high on our street
Bug, Joe-A, Ce-Ce & Mark,
Rollin' 4 deep from SobranI Park
Howard came through from the B-Town
Muthafuckers gettin' high it's goin' down
It's the same everyday everyday it's the same
But that night we hit the hoop game
Who was playin': Seattle versus Golden State
Hollered at the homeboy Gary Payton
After the game, we went to his house
NBA Jams, tripped us out
Niggas talkin' 'about slammin' bones
Any kinda way to get your gamble on
Bet, all you kept hearin' was bet
Dice game on the pool table fuck that shit
I ain't goin' outta town broke
I gotta have a bank get some dank to smoke.
Think I'm gamblin'? You must be insane
It started gettin' late I had to catch that plane
So I cut to the airport
Just Another Day for Too $hort.
I was high as fuck on the airplane
Thinkin' to myself about a street gang
How a black man'll do you in a minute
Walk around the corner see some shit & get in it
How the police always tryin' to catch us
Fell asleep & woke up in Houston Texas
Gangsta ass niggas from the 5th & the 3rd
Check yo' ass there nigga fuck what ya heard
Next night we did a show, in New Orleans
Same gangsta's same old scene
Yellin' at 7th that 9th ward
I see my homies from the 3rd & the 4th
It was me Big Dog & the EL Guarde posse
Havin' fun & you just can't stop me
I did a show in Birmingham Alabama
Then caught a plane Atlanta
I heard about the muthafuckin' freaknick
Popped that pussy hoe fuck that weak shit
You should've seen all the bitches on the street
Niggas from Detroit was deep
All my partners from the Oak flew up
& they was slangin' that danky stuff
Gettin' high with some brothers from MiamI & Cleveland
Kickin' back talkin' about we ain't leavin'.
Bitch. We ain't goin' nowhere you know what I'm sayin'? 
It's Just Another Day. 
Aww you know
Kick it wit the Cadillac Club 
F R O G ????
Too Kleen in the house bitch
Droppin' some of that '93 old school shit.
You know?"
124,Just Like Dope,2000,You Nasty (2000),Hip Hop,Too $hort,"(Too $hort)
It's that high
The pussy's just like dope
It's that dope
Even, if, you don't, want no mo'
Even if you don't want no mo'
The pussy's just like dope
First time you got a shot, you was hooked
When she walked into your life, you never shoulda looked
Ain't no rehab for pussy, it won't hurt me
You just like cigarettes and goin' cold turkey
That's all you ever think about
Nasty ass hoes'll give you stank mouth
First thing in the morning, she's on your mind
Twenty minute kisses, all the time
Bomb ass head, hit it from the back
She be ridin' yo' dick like a horse bareback
You ever wonder where she learned that?
The bitch'll pull a pimp's perm back
Special handlin, dick's the package
It's mine - you gon' let me have it back bitch?
Good pussy make you fall in love
You better say no to drugs
Chorus: Too $hort
It's like heroin (heroin, heroin)
The pussy's just like dope
Even, if, you don't, want no mo'
The pussy's just like dope
(Too $hort)
I chose to say no to drugs
Pussy throw them thangs beat yo' ass like thugs
Have you whipped, creamin in yo' hand and shit
Call her every day and can't stand the bitch
You old pussy ass sucker niggaz
Still love hoes that fuck other niggaz
Can't tell you nothin', you need counselin
Fuck that shit, keep poundin it
I'm talkin' bout some stay wet,
Bustin' big nuts in her face shit
Dick thrustin like a spaceship
Red snapper's what I call that pussy
Why you askin stupid questions like would she
Suck yo' dick -- you ain't know?
It was passed down to her from her kinfolks
Momma and her aunties was freaks
Kryptonite pussy got you weak
(E-40)
Uh-huh... Ooh!
Some of these bitches is garden tools, and I don't mean shovels
I mean hoes HOES experts at workin they pussy muscles
Literally (??) over these hoes, niggaz'll fight and scrap for
But see I don't play that shit, I beat a bootch down with a belt buckle
The first thing you wanna do is go down on a botch, and eat her crabby
KNOWIN' that there botch still got lead in her ass from yesterday
I'm on your botch -- size 44D bodacious breasts
But the bitch got mo' miles on her THAN SOUTHWEST
Don't, you, get it dis-com-bob-u-la-ted (discombobulated)
She used to have a 70's bush - until I shaved it (until I shaved it)
Beatch, beatch!
Now you all in front of her momma's house, blowin' your horn
(Blowin' your horn) All in front of her momma's house, blowin' your horn
Suicide, dial that girl for help? (help?)
Shot up her fam' BAM, returned to grind on yourself"
125,Keep Bouncin' (Street),2006,Blow The Whistle (2006),Hip Hop,Too $hort,"Keep, keep, keep, keep, keep bouncin'
Keep, keep bouncin'
Keep, keep, keep, keep, keep bouncin'
Keep, keep, keep, keep, keep bouncin'
$Hort, $hort Dawg in the house
Will.I.Am in the house
Snoop Dogg's in the house
West Coast, make 'em bounce
I'ma bounce wit'cha though, yo
We gon' bounce everywhere we go
Make a, make a wanna bounce
Get loose, get 'round, now get set
Yeah, it's the anthem, anthem
You can get crunk, get hyphy, get fit
You can bounce like you're hoppin' over
You're hoppin' over a fence
If you in the whip, ghost ride the ***
Slip into the liquor sto', sippin' on a fifth
Yeah, bring in the bag
Gangbang on you mother mothers claimin' the flag
West Coast, Coast, I'm a real go-getter
40 ounce sipper, the Blackjack tripper
20 Cripper, 10 to 1, I flip her
Got the hook-up on the birds an' the muh*** zippers
Go to the club with my thugs, sell ***
An' I might get a girl but I ain't gon' tip
Get malt liquor, spit, mo' slicker
Put y'all hands in the air, ***, it's a stick up
Naw, eat a ***
Say you a pimp but you in love with a stripper
Just bounce to the beat an' don't pay me no attention
Just bounce to the beat, bounce, bounce to the beat
It, it makes me wanna bounce to the beat
It makes me wanna bounce to the beat
It makes me wanna bounce, bounce, bounce to the beat
I'm all up in the club
E'rybody, body, body, wanna, wanna mean mug
Make a, make a wanna bounce, bounce
Make a, make a wanna bounce, bounce
Doggy Dogg, turn it out, bounce
$Hort, $hort Dawg in the house
Yeah, make a, make a wanna bounce, bounce
Make a, make a wanna bounce, bounce
Doggy Dogg turn it out, bounce
$Hort, $hort, $hort Dawg in the house
I told the DJ, play her song
Watch her choose up, put a player on
Put her in the wifey zone
She could be my girlfriend all night long
Keep bouncin', the floor is sweatin'
I'm all on her booty, I know I'm gettin' it
We from the West Coast, we live fun lives
Freak these, these till the sunrise
What time is it? Late night
Send her back home when it's daylight
Her *** at the house with a cake like
Captain Save-a, Save-a but she ain't right
She like to play 'Hard To Get'
She don't wanna dance, she wants some hard ***
Well, give her what she wants
Stick it in the *** an' watch her go dumb
Make a, make a wanna bounce, bounce
$Hort Dawg, turn 'em out, bounce
Don't you, don't you wanna bounce? Bounce
Snoop, Snoop Dogg in the house
Make a, make a wanna bounce, bounce
$Hort Dawg, turn 'em out, bounce
Don't you, don't you wanna bounce? Bounce
Will.I., Will.I., Will.I.Am in the house
I'm in the house an' I ain't movin' out
The girls keep more of my name in they mouth
I like *** best when they poppin' out
So girl, bring 'em out, bring 'em out, I make 'em bounce
Keep, keep bouncin', yeah, just keep them bouncin'
Open up your mind an' accept what I'm announcin'
If we have a President's Day an' a Veteran's Day
Let's have a *** Holiday
An' *** everyday through the weekend
I like *** like fish like sippin'
Watchin' boobies bounce is my favorite tradition
When I'm up in the club just sittin' an' wishin'
Them boobies was bouncin' on my head, my head
Them boobies was bouncin' on my head, my head
Bouncin', bouncin' on my head, my head
I want them boobies bouncin' on my head, my head
Okay, now let me change the subject
I usually don't be gettin' mannish up in public
But that's aight 'cause I'm chillin' with my folks
From the West Coast, $hort Dawg's in the house
Snoop Dogg's in the house, in the house
Too, Too $hort's in the house, in the house
Will.I.Am's in the house, in the house
West Coast make 'em bounce
It, it makes me wanna bounce to the beat
It makes me wanna bounce to the beat
It makes me wanna bounce to the beat
It makes me wanna
It, it makes me wanna bounce to the beat
It makes me wanna bounce
It makes me wanna bounce
We gon' bounce everywhere we go
Keep, keep bouncin'
Bounce, bounce, bounce to the beat
Keep bouncin', bounce, bounce, bounce to the beat
Keep bouncin', bounce, bounce, bounce to the beat
Keep bouncin', keep, keep bouncin'"
126,Keep Fuckin' Me,2001,Chase the Cat (2001),Hip Hop,Too $hort,"Yeah bitch you know how real players do this shit, beitch!
Man look at her, baby look good
The way she dancin, maybe I should
Step up to her, and run this game
I wanna FUCK - I don't wanna know her name
I play the role though, act like I'm interested
By the end of the night, she done been molested
And she loves it, that's how I do it
You tried to get with her too but you blew it
I told her I ain't had no woman, I got three
And you ain't leavin' this club without me
'Cause I'll be - your breakfast in the mornin
See the sun rise while you're nake and you're moanin
And when I get up, talkin' like a pimp
That's when reality, starts to sink in
You want me to fuck yo' pussy till it hurts
And I wanna put yo' fine ass to work, bitch
Bitches always tellin' me
You're a player (a real player)
I don't care about these other hoes
Just keep fuckin' me (keep it up in you, way up)
I can look in yo' eyes and see I got you
You so fine girl I had to knock you
We left the bar, we in the car
I'm treatin this bitch like a movie star
It's all game, I just wanna hit it quick
Try to turn a bitch out so I can hit a lick
And it's a trip, she's such a good bitch
Mama told you bout niggaz that look slick
You knew about the hoes when you met me
I'll add you to my stable if you let me
So you can get me, what I need so quickly
I want G's bitch, about a hundred fifty
All these hoes, know my style
I'll put you to work but don't go too wild
'Cause we'll get this cash, just take our time
Choose or leave, you better make up yo' mind
Bitches always tellin' me (what dem hoes say?)
You're a player (that's right, I'm a fuckin' player bitch)
I don't care about these other hoes (na nah)
Just keep fuckin' me
You said put it all up in you, keep on fuckin' you
Knew what time it was and I knew just what to do
Bitch I get at you, have you stuck like a statue
Use nothin' but words and I have you
I give a fuck if you think I'm too rich
I ain't gon' cash you out like these new tricks
She wanna eat, drink and fuck good
That won't make you get my cash, but what would?
If I turned you on to this player life
Quit fuckin' rich niggaz tryin' to be a wife
I can show you how to put this game to work
Don't do it, unless you put some change in yo' purse
Bitch you know whassup wit me
I'm from the O, I roll in luxury
I mack broads, and smoke big buds of weed
Can't be a ho when you always fuck for free, beitch!
Bitches always tellin' me (tellin' you what?)
You're a player (.. that ain't no lie)
I don't care about these other hoes
Just keep fuckin' me (just keep gettin' that cash girl)
Bitches always tellin' me... you're a player
I don't care about these other hoes; just keep fuckin' me"
