,song,year,album,genre,artist,lyric
75,Outroduction,2013,B.O.A.T.S. II: Me Time (2013),,2 Chainz,"I'm blessed, some might say I'm lucky
I'm blessed, some might say I'm lucky
Every cents huffy, pockets on husky
Shawty don't trust me, I break hearts often
If you look at my pockets you a weight watcher
From a dishwasher to a kingpin
Remember how the scene end and how this thing is
Drugs backed in 'em mean them things in
Now it's duffle bags full of green men
I swear I ain't lying if my daddy hadn't died
He'd tell ya I had em' hooked like Kareem did
Two kids later, I mature like fine wine in the basement
Vino, different kind of pinot
Tried to stack c-note after c-note
I'm tryna make it count like a free throw after free throw
Line, it's a thin one between
Getting high and committing crimes
Let a nigga live
I've been locked up more rapping than I did tryna get a brick
(Fuck this shit)
I remember when I believed in me
What am I supposed to do?
Uh, now when the ones that didn't see me
They want a verse or two
Shit, what am I supposed to do?
Put 'em in a fucking hearse or two
I'm the illest, I wrote that shit in cursive too
And I smoke just to ease the pain
So hungry I used to try to eat the rain
Well at least until the pizza came
Or at least until polices came
Undercovers outside my momma yard
And all the guns is in Kesha's name
In Jesus's name I pray
I say that a couple times a day
When it's time to eat, when it's time to lay
And when it's daytime it ain't my time of day, uh
I heard my little big cousin mad at me
I call him little big 'cause he younger than me
But he big, he was the high school team captain
Didn't graduate but sometimes things happen
And whatever happen that was the worst day
And who know what was going on in the first place
I love and helped raise my nigga
This year forgot to call him on his birthday
It's hard to explain my new lifestyle
A partner lockdown, got a phone and an iPod
He called to tell me happy new years
I had to tell him nigga, it's March
We had similar stars
But I ain't figured his part
They had dough and we didn't
How did it dissolve, alka-seltzer
This is the outroduction
Niggas stab you in your back like acupuncture"
76,Poor Fool,2017,Pretty Girls Like Trap Music (2017),,2 Chainz,"Poor fool, streets don't love you like I do
(My mama always said)
I said close your mouth and eat
You make some paper, then you make your own rules
(My mama always said, ay, damn)
Poor fool, streets don't love you like I do
I said close your mouth and eat
You make some paper, then you make your own rules
I'm from the hood and it's evident
Used to sell drugs out my residence
Stayed in section 8 with relatives
Opportunity knockin', I let 'em in
I done put Forgis on everything
I left the mall like Ginobili
And if I'm not successful, ain't nobody gon' come console me
I pray my mama quit smokin'
When my dad died, I got focused
I gotta table full of Ace of Spades
I don't fuck around with you jokers (ooh)
Ain't heard a word from my old friends
Heard they wanna kick my doors in
I done loaded up the 2-2-3
I'm so high they might call a goaltend, yeah
Lord knows, stashed work in the console
So many autos in my garage, I can't open my car door
Bond on me like the sun on me
Gettin' this bread she say, ""You dropped crumbs on me""
Walked in the club and got ones only
Need a tat on my stomach that say prawns only
Raised by single parent Black woman
They call me Tity Boi 'cause she used to spoil me
She always told me
Poor fool, streets don't love you like I do
(My mama always said)
I said close your mouth and eat
You make some paper, then you make your own rules
(My mama always said, ay, damn)
Poor fool, streets don't love you like I do
I said close your mouth and eat
You make some paper, then you make your own rules
Smoking on a yacht, call me Ricky Steamboat
Bags full of gas, used to serve them through the screen door
Tryna flip a brick, Shaq at the free throw
Taught by Scarface, Brad Jordan, Al Pacino, woo
No rules, most of my partnas homeschooled
Most of my partnas got charges
And I ain't talking about no mothafuckin' dodges
Trappin' up outta the college
I'm addicted to the rice at Benihana
Raised by a single parent Black woman
They call me Tity Boi 'cause she used to spoil me
She always told me
Poor fool, streets don't love you like I do
(Yeah)
I said close your mouth and eat
You make some paper, then you make your own rules
(My mama always said, ay, damn)
Poor fool, streets don't love you like I do
I said close your mouth and eat
You make some paper, then you make your own rules"
77,Realize,2017,Pretty Girls Like Trap Music (2017),,2 Chainz,"I'm gonna cause pandemonium
Pick up the paper, custodian
This how Prince met Apollonia
Tryna fill up California kings
Hydrocodeine with the Visine
Master bedroom on the right wing
This a Philippe not a Breitling
Fuck her to sleep, she had pipe dreams
Yeah, this is the king of the trap
Yeah, I pull it straight out the hat
Yeah, everyone better take cover
Yeah, got rappers under attack
Uh, my daughters inherit arrogance
And they intelligent, that's a fact
Bought me a car February 1st
You already know it was black on black
I cover my scars with the tats on tats
You better back back, rat-tat-tat-tat-tat
I pass you a joint, better pass it back
I went to Montgomery, with packs on back
Sent her to the store for some plastic bags
Sent her to the store for some rubber bands
I started pitching so easy
I throw the work to you underhand
Underworld, underground, underline
I'm underdog and you under mine
This here ain't no once upon a time
This really happened for real
Can't even trust our own government
Aw man fuck all that humble shit
Mumbling
Man fuck all that mumble shit
Realize
A lot of these niggas tell real lies
They not about shit in real life
And that's something that I had to realize (Realize)
I had to reco-reco-recogni-i-ize it
(Reco-reco-recogni-i-ize)
They see me winning and now they don't liiike it
(Yeah, I know they don't like it)
Act like the love me, but hate me in pri-i-vate
I had to reco-reco-recogni-i-ize it
Yo
I went and copped a ring
I call this rock, Dwayne
Johnson, stop the playin'
Man, I cannot complain
I left my shades in Atlanta so I told my pilot to stop the plane
He bust a U in the air
She say she doin' it, where?
She wanna sit in my chair
But she could never be my heir
Checks, clear, Bible, swear
They ain't buggin', I go off
Asahd Khaled with the cloth
Dwayne Carter of the north
Dwayne Wade in the fourth
New dream house for mommy
Keep 'Caiah in Armani
Putting my nieces through college
This for Kellise and Imani
Look at these niggas I put on
All of these niggas I'm good on
My own two, what I stood on
That's why their necks what I'm keepin' my foot on
I've been winning 8 years consistently, at least respect it
Papoose wrote a Ether record
But I broke Aretha record
See this is chess, not checkers
You can not check the checkers
Did Nas clear that ""Ether"" record?
Nah, but I broke Aretha record
Realize
A lot of these niggas tell real lies
They not about shit in real life
And that's something that I had to realize (Realize)
I had to reco-reco-recogni-i-ize it
(Reco-reco-recogn-i-ize)
They see me winning and now they don't liiike it
(Yeah, I know they don't like it)
Act like the love me, but hate me in pri-i-vate
I had to reco-reco-recogn-i-ize it"
78,Riot,2011,T.R.U. Realigion (2011),,2 Chainz,"Damn right I got it, damn right I got it
Damn right I got it, damn right I got it
Damn right I got it, damn right I got it
Damn right I got it, damn right I got it
I say lame niggas be quiet, lame niggas be quiet,
Lame niggas be quiet You in the presence of a real nigga
I say lame niggas be quiet, lame niggas be quiet,
Lame niggas be quiet You in the real nigga's presence
I eat your girl up for breakfast, won't save you no extras
Say she fuck with me cause a real nigga is her preference
Drinking like I'm from Texas, and you know I stay flexin
And if you don't know I go by tity two necklace
Damn right I got it, damn right I'm 'bout it
Click full of killers, please don't get us excited
Yeah I'm smoking loud so lame niggas be quiet
If you fuck with us, we gonna start up a riot
I'mma start a riot, I'mma start a riot
I'mma start a riot, I'mma start a riot
I'mma start a riot, I'mma start a riot
I'mma start a riot, I'mma start a riot
I ain't stunnin dese niggas, I ain't stunnin dese bitches
2 cigar rellos, look like extension
Yeah I'm from the south side, her mouth wide
My pack loud, My gat loud I back out, And click clack pow pow
Court dates Still Trial, My rep is a reptile
Now later, alligators, I step on a work like a step child
Pimp up, hoes down, make your girl pull her clothes down
Her hair down and I'm down
Her phone off so don't dial
Dis right here is dat no style, I don't know how I do the shit
I'm true to this
T.R.U. religion, they takin' swag with no permission
All year it's Gucci season, Gs on my belt buckle
Cocaine on my left knuckle, Kill and bury what's left of you
Damn right I got it, damn right I'm 'bout it
Click full of killers, please don't get us excited
Yeah I'm smokin' loud so lame niggas be quiet
If you fuck with us, we gonna start up a riot
I'mma start a riot, I'mma start a riot
I'mma start a riot, I'mma start a riot
I'mma start a riot, I'mma start a riot
I'mma start a riot, I'mma start a riot"
79,Riot,2012,Based on a T.R.U. Story (2012),,2 Chainz,"Damn right I got it, damn right I got it
Damn right I got it, damn right I got it
Damn right I got it, damn right I got it
Damn right I got it, damn right I got it
I say lame niggas be quiet, lame niggas be quiet,
Lame niggas be quiet You in the presence of a real nigga
I say lame niggas be quiet, lame niggas be quiet,
Lame niggas be quiet You in the real nigga's presence
I eat your girl up for breakfast, won't save you no extras
Say she fuck with me cause a real nigga is her preference
Drinking like I'm from Texas, and you know I stay flexin
And if you don't know I go by tity two necklace
Damn right I got it, damn right I'm 'bout it
Click full of killers, please don't get us excited
Yeah I'm smoking loud so lame niggas be quiet
If you fuck with us, we gonna start up a riot
I'mma start a riot, I'mma start a riot
I'mma start a riot, I'mma start a riot
I'mma start a riot, I'mma start a riot
I'mma start a riot, I'mma start a riot
I ain't stunnin dese niggas, I ain't stunnin dese bitches
2 cigar rellos, look like extension
Yeah I'm from the south side, her mouth wide
My pack loud, My gat loud I back out, And click clack pow pow
Court dates Still Trial, My rep is a reptile
Now later, alligators, I step on a work like a step child
Pimp up, hoes down, make your girl pull her clothes down
Her hair down and I'm down
Her phone off so don't dial
Dis right here is dat no style, I don't know how I do the shit
I'm true to this
T.R.U. religion, they takin' swag with no permission
All year it's Gucci season, Gs on my belt buckle
Cocaine on my left knuckle, Kill and bury what's left of you
Damn right I got it, damn right I'm 'bout it
Click full of killers, please don't get us excited
Yeah I'm smokin' loud so lame niggas be quiet
If you fuck with us, we gonna start up a riot
I'mma start a riot, I'mma start a riot
I'mma start a riot, I'mma start a riot
I'mma start a riot, I'mma start a riot
I'mma start a riot, I'mma start a riot"
80,Riverdale Rd,2017,Pretty Girls Like Trap Music (2017),,2 Chainz,"Yeah, turn that maafaka up NOLAN. Whoa, know what I'm saying, I wanna feel like I was in some muthafakin' danger. I got my mothafuckin' pistol in my pocket, ya dig? Yeah, in the booth, on some 5540 old national shit, you know what it is, nigga. We in the back, nigga, way in the back, nigga, serving sacks, nigga and serving Act. Mane, c'mon with the Kap, bruh. Ah!
Riverdale, he was there, she was there, you wasn't there
I was the same ol' nigga
Yeah that trap had raised a nigga
How could you blame a nigga?
Gold everywhere, gold over there, Trinidad James you niggas
Came on the set with hundreds to bet
But I still changed you niggas, yeah
My first foreign car, it was a Bimmer
My second foreign car, it was a Bimmer
My third foreign car, it was a Porsche
My fourth foreign car you can't afford
My pocket pregnant, don't want no abortion
My draws got them horses, my car got them horses
Rocking some Pradas like they was Air Forces
We had no choices
Riverdale, he was there, she was there, you wasn't there
I was the same ol' nigga
Yeah that trap had raised a nigga
How could you blame a nigga?
Gold everywhere, gold over there, Trinidad James you niggas
Came on the set with hundreds to bet
But I still changed you niggas, yeah
You wasn't there when mama was struggling
You wasn't there when mama was fussing
Told 'em ketchup, you too far in the mustard
I had a Chevelle and wanted a Cutlass
I went to work and I made an abundance
Gucci flip flops with the corns and bunions
Counting blue hundreds and smoking an onion
And she got an onion and I wanna rub it
We hanging off the Nat, see that's where my office at
We dressed all in black
We got 'em calling back, just went to the mall and back
When you was the quarterback, I had the quarter sacks
Riverdale, Riverdale, Riverdale, Riverdale, Riverdale
Riverdale Rd., nigga
He was there, he was there, you weren't there
He was there, she was there
Riverdale Rd., nigga
Abracadabra, I turned myself into a millionaire
I wore some Gucci to your mama house just to leave it there
Riverdale, he was there, she was there, you wasn't there
I was the same ol' nigga
Yeah that trap had raised a nigga
How could you blame a nigga?
Gold everywhere, gold over there, Trinidad James you niggas
Came on the set with hundreds to bet
But I still changed you niggas, yeah
I know something you don't know
I'm gonna get some bands, yeah
I know something you don't know, yeah
I'm gonna get some bands
Okay, from grams to Grammys
Okay, from fans to family
I went from trips we tryna plan
To cribs in South Miami
They got my vision fancy
My tigger finger antsy
I told the bitch she got to sit down
Just to understand me
They asking, ""What's the plan, B?""
I don't have a Plan B
I told 'em this shit got to work
It's just like candy to me
I mean it's hard but it's sweet
I'm Drench God in the streets
I break the law in the sheets
I make her cum on repeat
I know something you don't know
I'm gonna get some bands, oh yeah
I know something you don't know, yeah
I'm gonna get some bands
Riverdale, Riverdale!"
81,Rolls Royce Bitch,2017,Pretty Girls Like Trap Music (2017),,2 Chainz,"Alright, yeah, yeah, yeah
Yeah believe in yourself, who else gon' believe in you
Who else gon' believe in you? Who else gon' believe in you?
Believe in yourself, who else gon' believe in you?
Who else gon' believe in you, who else gon' believe in you?
Believe in yourself, health is wealth
Gotta get mine, faster than a step
I can make a hundred thousand just sitting by the steps
I can count a hundred thousand with my feet in the chair
I can pull the baddest broad in here
With my hand pulled behind my back
One hand on the steering wheel
2 Chainz with the ponytail, got the bodyguard concealed
Ill meaning of sickness, I use the pharmacy as a witness
I mean anything around me that's against us, they can't be
I got God on my side, that's all I need to ride
See that's all I need to vibe, asking what I do tonight
That's really none of your business, unless you wanna get in this
Rolls Royce, bitch, yeah the doors go dat way
The doors go dat way, the doors go dat way
Rolls Royce, bitch, yeah the doors go dat way
The doors go dat way, the doors go dat way
Rolls Royce, bitch, yeah my doors go dat way
Mydoors go dat way, doors go dat way
Rolls Royce, bitch, yeah my doors go dat way
My doors, Wraith, my doors, uh
I'm good, I'm good like Ye
I'm good like Sean and Push
I'm good, I'm good, okay
Good, sold yay, good 4 way
Oh man, look at me now
Used to have a killer crossover
Now I think I done crossed over
White fans at my rap shows
So many chains on I give you the cold shoulder
So many chains on, I tell 'em move over
Big shit over here, boy
100 acres on my property, man I might hit a deer, boy
I got felonies that's older than y'all niggas
Family time at the mall, nigga
6'5"", I never been small, nigga
Your swag like RuPaul, I'm appalled, nigga
Yeah, three calls to call food
I want some Nobu, met her at Whole Foods
I just ate Pro Tools, I am the go-to
Rolls Royce, bitch, yeah the doors go dat way
The doors go dat way, the doors go dat way
Rolls Royce, bitch, yeah the doors go dat way
The doors go dat way, the doors go dat way
Rolls Royce, bitch, yeah my doors go dat way
Mydoors go dat way, doors go dat way
Rolls Royce, bitch, yeah my doors go dat way
My doors, Wraith, my doors, uh
Felonies that's older than y'all niggas
Family time at the mall, nigga
6'5"", I never been small, nigga
Your swag like RuPaul, I'm appalled, nigga
Yeah, three calls to call food
I want some Nobu, met her at Whole Foods
I just ate Pro Tools, I am the go-to
I am the go-to, I am the go-to
Trap shit, I'm the go to
Trap nigga with a gold tooth
Believe in yourself, who else gon' believe in you?
Who else gon' believe in you?
Believe in yourself
Who else gon' believe in you?
Who else gon' believe in you?"
82,Rolls Royce Weather Everyday,2016,ColleGrove (2016),,2 Chainz,"I sip drank with my dinner, smoke some gas before breakfast
Bitches know my name and I don't have to wear a necklace (2 Chainz)
Bought a Wraith for Winter and a vert for the Summer
'Member twelfth grade I sold some work to undercover
Mama only child we stayed in a one bedroom (tru)
Used to ride Marta 'cause it had more leg room
I'm a ghetto boy, I came up on Brad Jordan
First lick I made, I bought five pairs of Jordans
Make it so bad, two pair were the same
I see the old me in new cats in the game
Drop some loose change on some clothes I can't pronounce
Gun so muhfuckin' big you gotta crouch
I like pretty girls with some business about theyself
Bring your best friend, you don't need nobody else
All about that mula, Netflix, and the Moscato
In my sex drive, I ride over potholes
I do me, I get high, I get fly, I get paid
I do me, I get high, I get fly everyday
I do me, I get high, I get fly, I get paid
I do me, I get high, I get fly everyday
I just got a text message from wifey, nigga
I scroll down, the next message from Nike, nigga
I'm just doing it too big on these tiny niggas
I been lost my fuckin' mind, I never mind these niggas
Pockets deep and I'mma get in depth like like Johnny nigga
Acting like they on the edge, I'm a step behind these niggas
Outthink, outshine these niggas
Eyes chink like Chinese niggas
Fast lane, fast life, you blink you probably miss us
You thinking 'bout your missus
I'm thinking about my missions
We think you outchea snitching, that's why we 'round here whispering
I think my palms are itching, I think my bomb is ticking
I keep that Maggie on me, I think I'm Homer Simpson
Money over bitches, should be a Bible scripture
Bitches, hoes, and women, I don't know the difference
All I know is this shit, I don't owe them bitches
I do me and love it, Lord I done overdid it
I do me, I get high, I get fly, I get paid
I do me, I get high, I get fly everyday
I do me, I get high, I get fly, I get paid
I do me, I get high, I get fly everyday
All I know is this shit, I don't owe them bitches
I do me and love it, I done overdid it
I don't owe them niggas, I don't owe them niggas
I do me and love it, I done overdid it"
83,Saturday Night,2017,Pretty Girls Like Trap Music (2017),,2 Chainz,"Y'all niggas lame for that, y'all niggas lame for that
Shoot a man in his back, should be ashamed of that
Young niggas banging back, young nigga banging back
Then we gon' fade to black then we gon' fade to black
I left the crib walking, drove a Mercedes back
You wasn't blessed with ambition so who you gon blame for that
Tried to get off the Act, still didn't know how to act
Still pull up in the back, sit my ass right in the back
Tell my driver when he open my door to take off his hat
Double saran everything so that you know it's a wrap
Double salute anybody that made it out the trap
Some of y'all probably still owe me from back
In the back in the back in the back in the back
I had that work right in front of me fuck all you niggas you wannabes
Most of you niggas is under mes, I'ma give ya ass some to see
My car don't have car keys, my crib got palm trees
Pussy smell like sardine you, need to get up of my lawn please
This a real nigga conversation, real nigga demonstration real niggas
No crystal or hilfigers, a bunch of ignorant lil' niggas
A bunch of red young tenders, dark skin queens, Puerto Rican princess's
Scratch my hand my palms itching, hit the dope start twitching
This a new kinda kitchen, marble countertops, see through fridge
3 thousand for the microwave, touchscreen stove lil biiiiitch!
Please don't make me relapse, make me start back trappin
Everybody in the city, saying that boy Tity done started back snapping
I hit the trap today, I'm gon' hit the club tonight, yeah
I hit the trap today, I'm gon' hit the club tonight, yeah
I hit the trap today, I'm gon' hit the club tonight, yeah
Tell her let's go have a bite, tell her let's go have a bite
I hit the trap today, I'm gon' hit the club tonight, yeah
I hit the trap today, I'm gon' hit the club tonight, yeah
I hit the trap today, I'm gon' hit the club tonight, yeah
Treat every night like it's Saturday night, like it's Saturday night, yeah
I sat in the trap no one cooked at night, I treat my third stripe like its Kryptonite
I stopped serving sacks over qualified, have you ever seen a homicide?
Have you ever seen ya partna die? Have you ever been traumatized
Even at graduation I had a bookbag full of yams, tryna multiply
Enough of the negative actions, I got my paycheck off passion
I'm wearing 4 bracelets for fashion, don't think it's a race when I pass you
Stop talking that mafia shit, you never met Meech, J-bo or Illz
Luda charged me just to dip, was there when Chaka was swung on by Tip
I'm like oh shit we goon tear up this bitch, pull out a stick when you put up your fist
I'm like these niggas done fucked up my fit, funny how heaven and hell co exist
Funny how life can put you in the mix, I sold the pounds and go hustle the bricks
I booked studio with the trap money, Lil Wayne used to come get the bags from me
You still asking niggas for gas money, I look at these rappers like crash dummies
I look at these bitches that fuck with these rappers like bitch you just fucked with my last homie
Kesha can come get the last from me, Heaven can come get the last from me
Harmony can come get the last from me, Halo can come get the last from me MAMA!
I hit the trap today, I'm gon' hit the club tonight, yeah
I hit the trap today, I'm gon' hit the club tonight, yeah
I hit the trap today, I'm gon' hit the club tonight, yeah
Tell her let's go have a bite, tell her let's go have a bite
I hit the trap today, I'm gon' hit the club tonight, yeah
I hit the trap today, I'm gon' hit the club tonight, yeah
I hit the trap today, I'm gon' hit the club tonight, yeah
Treat every night like it's Saturday night, like it's Saturday night, yeah"
