,song,year,album,genre,artist,lyric
56,Kitchen,2010,Trap-a-Velli 2: (The Residue) (2010),,2 Chainz,"I go hard in the mother fucking kitchen,
Whole thang half thang, nigga I'm pitching!
Hit him with the soda make a nigga start whiffing.
Hit you with a choppa make a nigga start flipping!
I go hard in the mother fucking kitchen,
Whole thang half thang, nigga I'm pitching!
Hit him with the soda make a nigga start whipping.
Hit you with a choppa make a nigga start flipping!
I go hard in the mother fucker kitchen using baby bottles for the lean
Wifey says I'm tripping, plus I got maybelline smeared right bellow my zipper,
I'm a Kama Sutra reader and a conjure drinker.
Hot on the stove, smoking like reefer
This work ain't bout shit, that's why it's cheaper.
This ho ain't bout shit, that's why she's cheaper,
All we blow is strong, that's why you weaker!
Wait up, yo status change when you wait up,
Waiting on the meal, I already put my plate up!
Nigga fall back up, already put my rake up,
Every time I leave the booth they put yellow tape up.
Hair weave killa, messing up her make-up,
Pyrex vision and I'm about to cook a cake up.
Get a 4, add a lil water,
Get her in a track, and ride her like a motor!
I go hard in the mother fucking kitchen,
Whole thang half thang, nigga I'm pitching!
Hit him with the soda make a nigga start whiffing.
Hit you with a choppa make a nigga start flipping!
I go hard in the mother fucking kitchen,
Whole thang half thang, nigga I'm pitching!
Hit him with the soda make a nigga start whipping.
Hit you with a choppa make a nigga start flipping!
It's just a three watches, asshole!
One platinum, one white, one rose gold
Drive a solid gold Rolls to the Rose Bowl.
Rose in the club for my rose home!
Man fuck these niggas I got blow goals,
I count money all night, I need some no-doze,
Here to try, I want it easy, I need a bankroll
All the money I the trunk, bitch the bank roll
I go hard in the mother fucking kitchen, nigga,
Got me standing at that water like I'm fishing, nigga!
Never know about me, I pull a bass out
Drop a 250 in and pull a half out
Had to do it for the town and the trap niggas
Me and 2 chains, it's over for you rap niggas!
And nothin' says butter like parkay
And nothin' make them J's stutter like hard yay
I go hard in the mother fucking kitchen,
Whole thang half thang, nigga I'm pitching!
Hit him with the soda make a nigga start whiffing.
Hit you with a choppa make a nigga start flipping!
I go hard in the mother fucking kitchen,
Whole thang half thang, nigga I'm pitching!
Hit him with the soda make a nigga start whipping.
Hit you with a choppa make a nigga start flipping!
It started in the kitchen, king of the whipping,
Denzel in glory, tear drop was missing!
Just like the roof is riding in that Chris Brown,
Two seater deuces, peeling like I skip town!
Pocket full of brick money, neck full of black gold,
Black diamonds got the Jesus piece like [?]
That's 2 chainz. I'm [?] I'm for everyone I cook I make [?].
Mary Kate and Ashley, Tia and Tamara, 2 in the 4 like the Porsche Panamara
Look in the mirror, look in the mirror, vision clouded by the coke
Ain't makin' it clearer!
I make it look easy, I rap it up greezy
Bandana around the brick, I make him look jeezy,
But I push the ton of it get the name right,
Who else could fly and then land on the same flight? Pushhh
I go hard in the mother fucking kitchen,
Whole thang half thang, nigga I'm pitching!
Hit him with the soda make a nigga start whiffing.
Hit you with a choppa make a nigga start flipping!
I go hard in the mother fucking kitchen,
Whole thang half thang, nigga I'm pitching!
Hit him with the soda make a nigga start whipping.
Hit you with a choppa make a nigga start flipping!"
57,Lapdance In The Trap House,2015,TrapAvelli Tre (2015),,2 Chainz,"Honorable
Honorable
Honorable C-Note
2 Chainz!
I ain't never been a minute man
Pour a deuce in a minute maid
Trap house filled with ceilling fans
Weed louder than a hearing aid
This ain't (?)
We don't got to rent a renegade
And I (?) on a hunna
The only thing I might get is (?)
Tryna take another nigga's (?)
You a fuck nigga and I know it
See I could wear black in the summertime
And I could wear white when its snowin'
I could show you where to go like a local
Order 20 bags out of (?)
I might buy me a motorcycle
And use your girl for a chauffeur
I'm the realest nigga and the illest nigga
Fuck you lil nigga and your lil sister
Try to use a nigga when it's beneficial
Free all my niggas out the penitentiary
Louis V all on my leggings
Bitch better get on my level
Put a half a milli in a MCM bag
Had that motherfucker looking pregnant
Lapdance in the trap house
Get a lapdance off in the trap house
Lapdance in the trap house
Get a lapdance off in the trap house
Lapdance in the trap house
Get a lapdance off in the trap house
Lapdance in the trap house
Get a lapdance off in the trap house
Get a lapdance in the kitchen
Y'all sucka niggas pay attention
See I could make her ass bend over
At the same time make her do the dishes
Oh oh oh double middle finger to the picture
Handgun got a (?) like Pippen
Girls come through they want to smoke
'Fore they leave this bitch they start strippin'
900 dollars for the tennis shoes
Get a lap dance in the living room
She about to (?)
Cause the trap house don't got a swimming pool
Money piled up on the counter
Got a hundred round drum in the (?)
Got Ziploc bags and a digital scale and rubberbands all by the (?)
Got raid spray you know how the bugs be
Got a fan in the window by the (?)
And I know it was slow at work tonight
So bitch you better act like you love me
Lapdance in the trap house
Get a lapdance off in the trap house
Lapdance in the trap house
Get a lapdance off in the trap house
Lapdance in the trap house
Get a lapdance off in the trap house
Lapdance in the trap house
Get a lapdance off in the trap house"
58,Letter To Da Rap Game,2011,T.R.U. Realigion (2011),,2 Chainz,"This my letter to the rap game
Hip hop, I'm a product of the trap mane
Crack came, I didn't know how to act mane
I did what I had to do when the pack came
This is my letter to the rap game
Hip hop, I'm a product of the trap mane
Crack came, I didn't know how to act mane
I did what I had to do when the pack came
Wu-Tang Clan, they ain't nothin' to fuck, wait
2 Chainz ain't nothing to fuck with
Need search warrants cause these niggaz is suspects
All I talk is money so Chainz is the subject
This my letter to the rap game
Hip hop, I'm a product of the trap mane
Crack came, I didn't know how to act mane
I did what I had to do when the pack came
This is my letter to the rap game
Hip hop, I'm a product of the trap mane
Crack came, I didn't know how to act mane
I did what I had to do when the pack came
Came in this motherfucker hundred grand strong
To be exact, grinding the kush pact
Ride with the roof back, live with a suit act
Killing em, so I am dying my suit black
Dear rap game, you are ill homie
Havin' me thinking we were gon' make some real money
Came from the streets, I'm a beast, capiche?
Lock my dick in the mail by the bills held
And hey rap game, the real comin'
The way I'm murking these niggaz hope your will comin'
And when you're numb, it's kind of hard to feel somethin'
I'm the type to get rich and still hustle, yeah
And before I leave let me say this, play this
Have my niggaz dead or in jail like Asic
Face it, back to the basics
2 Chainz on them bitches, looking like Vegas, the greatest
This my letter to the rap game
Hip hop, I'm a product of the trap mane
Crack came, I didn't know how to act mane
I did what I had to do when the pack came
This is my letter to the rap game
Hip hop, I'm a product of the trap mane
Crack came, I didn't know how to act mane
I did what I had to do when the pack came
My worlds coming to an end, speaking philosophical
Six's on the coupe, when they said it was impossible
Got the type of guns to make the city feel uncomfortable
And we breaking bricks down, till the last molecule
Cherish the horizon, sun blessed party, hey
Thinking 'bout this business, and it's time that I gave away
Trying to make a plan today, niggaz on there way
Locked in confinement, gotta learn to levitate
And on the inside, my instinct, I survive
All I got left is pride, touchdown, I'mma ride
I was raised as a boss
Damn, I let a nigga take me off
And let him tell Josh that his pops was soft
Mothafucker
This my letter to the rap game
Hip hop, I'm a product of the trap mane
Crack came, I didn't know how to act mane
I did what I had to do when the pack came
This is my letter to the rap game
Hip hop, I'm a product of the trap mane
Crack came, I didn't know how to act mane
I did what I had to do when the pack came
Rocking blood diamonds, cooling in the hood with the goons
Came on this, Cam is trying to buy us some Guccis
It's a movie made, regardless, my crooks is the hardest
Buying crazy pots and pans, stay in apartments
Bank roll was all we ever needed
While niggaz was weeded, playing space, and pumping crack in the ceiling
Just fly young with heart, I sift in the park
Made sales, blazed a few shells, yeah who cares who you are
I'm honest, I make you cry like onions
Stay in your lane, beat the name and we done
I was legend yet, now my papar stretching, yeah, that's it
Go ask the Rocky Glass, ""I class act?""
Villas, moving-making guerrillas, the willas
The guest-star gun fights, squeeze on the squealers
Don't come near me, nigga
If you don't got no money, fear me
Matter fact, move it, ya hear me?"
59,Like Me,2012,Based on a T.R.U. Story (2012),,2 Chainz,"Girl, I'm just another bird
Don't make me make you fall in love
Don't make me make you fall in love with a nigga like me, like me
I swear I'm just a bird
Don't make me make you fall in love with a nigga like me, like me
They ain't never seen a nigga like me uh
She ain't never seen a nigga like me uh
Chance of that is unlikely
2 Chainz in my white tee
I wipe her down and I pipe her down
I give my girl money to go out of town
You give your girl money to go to Niketown
And I one-night her, you must like her
Kill niggas with one-liners, all I need is one lighter
Counting so much money, I got arthritis
So cold I frostbite 'em, no Pig Latin but I hog-tied 'em
If she gets this business then I (make her fall in love)
With a nigga like me I'm killing this beat
Skeet skeet skeet skeet, skeet on my sheets
On top, from the back, I thundercat like (HOE!)
My girl got a big purse with a purse in it
And her pussy so clean I can go to church in it!
Oh Lord, O-M-G, I am the O-N-E
How ya like me now, it's cool but she want more D
Moet by the fireplace, this is how desire taste
And I'm 'bout to buy a case (leggo)
Girl, I'm just another bird
Don't make me make you fall in love
Don't make me make you fall in love with a nigga like me, like me
I swear I'm just a bird
Don't make me make you fall in love with a nigga like me, like me
Tell 'em... yeah
Album coming this summer
Def Jam... TRUUUU!"
60,Live and Learn (It Will),2013,B.O.A.T.S. II: Me Time (2013),,2 Chainz,"So many watches, I need a time capsule
Combine all my thoughts, make my mind travel
Graduated from the streets, that's beyond tassel
In my muscle car, maybe we should arm wrestle
I'm raw, using all caps
I got A on my ballcaps
No, I didn't do it but I thought about it
If I would have did it, it would have chalk around
Yellow tape, never hesitate
2 Chainz derived from Section 8
Meditate, that's my stress relief
I've been stylin' on 'em, since a lease, preach
Live long enough, it'll happen to you
Live long
It will, it will
It will, it will
Live long enough, it'll happen to you
Live long
It will, it will
It will, it will
My pop' told me men don't cry
Then he turned around and died on me
So I didn't know what else to do
But motherfuckin' cry, homie
Oh yeah, I'm God's son
Tell Nas he got more than one
And me, I got more to see, more to be
Order three, started with a quarter ki'
I'm so ill I need penicill'
Rockin' ice cubes, talkin' kill at will
And these days you can't tell who is really real
Ridin' on some Emmitt Smith's, long way from Emmett Till
Live long enough, it'll happen to you
Live long
It will, it will
It will, it will
Live long enough, it'll happen to you
Live long
It will, it will
It will, it will
Streets love a nigga, got a D-boy membership
We do it from the heart, I hope the aunt will remember this
Coke on all sinisters, cold but no fridge in this
No to all witnesses, lie or die infamous
My style is so infamous, my style, it needs censorship
Dealer what's the business? Don't call, I'm busy bitch
Unless you 'bout your business, I'm tryna get some benjamins
Niggas say a lie on their way to the top
But you know you're too hot when they kidnap your pops
I guess that's sayin' a lot
But we ain't sayin' much, we just sendin' them shots, nigga
Death over dynasty, I'm talkin' major, not the minor league
And you the last of a dyin' breed
Follow caine like a menace to society
The richest nigga in the city cosignin' me
My shampoo days done showed me the way
As I pray, lord willin' but the killer's still vague
How can there be closure when the shooter's still in questionin'
Your niggas got rich, but when you died them niggas owed you
And everything I see is adding up to what you told me
I'm ramblin', tryna keep it to myself
I'm scramblin', still hard to hold the tears back
Never saw what I became, can't get them years back
Death before dishonor
Live long enough, it'll happen to you
Live long
It will, it will
It will, it will
Live long enough, it'll happen to you
Live long
It will, it will
It will, it will"
61,Livin,2013,B.O.A.T.S. II: Me Time (2013),,2 Chainz,"Good head get your rent paid,
Then I cut a corner like a switch blade
Bitch made nigga talking shit about her
Got a red car so I bought a red bottom
Chillin' at the game sitting courtside
You're looking at the flyest nigga on the boat ride
Low life I'm a multi nigga fo' life
Oh my, had it up to here like a bow tie,
Cut it out sold drugs out my mommas house
So for mothers day, I bought my mom a house
Chillin' in the club standing on the couch
Nigga fuck yo couch, nigga nigga fuck yo couch!
Shoes cost more than that shit anyway
Any day, when the semi spray, better penetrate
(Brrraaatt) Better duck nigga!
Got a lake in my yard filled with ducks nigga!
I'm just livin' baby, and you got that right
I'm just livin' baby, and my Jordans nice
I'm just livin' baby, I'm just livin'
I'm just livin' baby, I'm just livin'
Motherfuck the other side (Motherfuck the other side)
Motherfuck the other side (Motherfuck the other side)
Everything's official my pistol's just missin' missles
As far as running game my nigga I need a whistle
My nigga I need your sister, oops, I don't think that came out
Still fuck a girl with my chain out
Still do my thing with my thing out
Long ass clip, I could shoot you without aiming
My life, your motherfucking entertainment
Dangerous, leave you with the angels,
Shoot yo' ass from all types of angles, explain this
The way I lived with a just bunch of niggas and then just me
They came close and eat yo' skeet
They tried to run and I said come back
If you think you're alone then they're about to Womack
Hold that, ridin' that Phantom down on there
Nigga said what up pimp, where the hoes at?
I'm just livin' baby, and you got that right
I'm just livin' baby, and my Jordans nice
I'm just livin' baby, I'm just livin'
I'm just livin' baby, I'm just livin'
Ride around on my side of town, you might fuck around and get peeled
I rock Mookie, rock Y3, got Bathing Apes on my heels
Nigga this ain't a game there ain't no competition
I knew he was a fake I got good intuition
23 and I'm still livin',
Been all around the world and it's still Richmond
Because I'm loyal to my soil, good to my hood like oil,
Got me in that water, let it boil
Bitch I'm a boy, beat the beat up like Roy
Consider your bitch my employ'
Real to the core, straight up I never been fraud,
And I put that on my lord
Y'all rap 'bout clothes that you cannot afford
Where's the Versace and where's the Tom Ford?
Everything we rap 'bout that shit be ours
This bitch a freak she should get the award
I'm just livin' baby, and you got that right
I'm just livin' baby, and my Jordans nice
I'm just livin' baby, I'm just livin'
I'm just livin' baby, I'm just livin'"
62,MF'N Right,2016,Felt Like Cappin (2016),,2 Chainz,"Now that's crazy
Now that's hard Mike WiLL, that's hard
See I ain't see it like that, that's hard
You hard bruh
That's why, that's why we been friends for so long bruh
That's why I used to sneak you in the club bruh
Just for that reason right there bruh
Aight bruh, let me just freestyle some more, cause this shit
I'm smoking the LSD
And god dang, I got a little drink downstairs
I don't need it though, let's go
Let me just fuck with this shit
Told a bitch you motherfucking right
Told a bitch you motherfucking right
Told a bitch you motherfucking right
Told a bitch you motherfucking right
Mike told me this gon' be your favorite song
Ooh, wear that red one, that my favorite thong
Put 'em on, I said baby put 'em on
I said what you gonna do when you go home?
Kiss your man after you sucked on my woo!
She called my phone, I told her I was at the store
Last name Chainz, first name 2
Pull up on me, shawty you know what to do
Told a bitch you motherfucking right
Told a bitch you motherfucking right
Told a bitch you motherfucking right
Told a bitch you motherfucking right
I bought some gold chains with my drug money
Then wore it on the stage just to stunt on 'em
That's how we do it on the south side
Might buy an AK using all 5's
Pittsburgh, zone 6, zone trey
Zone 1, do this shit like every day
Old nat, copy roll, camera roll
24's got the Wraith pigeon toed
Told a bitch you motherfucking right
Told a bitch you motherfucking right
Told a bitch you motherfucking right
Told a bitch you motherfucking right
Gas station, re-up on the petrol
Hit the trap and re-up on the petrol
Shit, by the time you get it it's a retro
Shit, used to have a job outside of Citgo
Shit, by the time you get it I'll be peww nigga
Yeah I been a player since the womb nigga
OG Kush is my perfume nigga
Ice on my wrist, I got my mind right
Riding down the street with the Klon-dykes
Two black hoes, white one in the middle
I'm getting to the S with two lines in the middle
Got a bankroll that'll make it whip
Told a bitch you motherfucking right
Told a bitch you motherfucking right
Told a bitch you motherfucking right
Told a bitch you motherfucking right"
63,MFN Right,2016,ColleGrove (2016),,2 Chainz,"Now that's crazy
Now that's hard Mike WiLL, that's hard
See I ain't see it like that, that's hard
You hard bruh
That's why, that's why we been friends for so long bruh
That's why I used to sneak you in the club bruh
Just for that reason right there bruh
Aight bruh, let me just freestyle some more, cause this shit
I'm smoking the LSD
And god dang, I got a little drink downstairs
I don't need it though, let's go
Let me just fuck with this shit
Told a bitch you motherfucking right
Told a bitch you motherfucking right
Told a bitch you motherfucking right
Told a bitch you motherfucking right
Mike told me this gon' be your favorite song
Ooh, wear that red one, that my favorite thong
Put 'em on, I said baby put 'em on
I said what you gonna do when you go home?
Kiss your man after you sucked on my woo!
She called my phone, I told her I was at the store
Last name Chainz, first name 2
Pull up on me, shawty you know what to do
Told a bitch you motherfucking right
Told a bitch you motherfucking right
Told a bitch you motherfucking right
Told a bitch you motherfucking right
I bought some gold chains with my drug money
Then wore it on the stage just to stunt on 'em
That's how we do it on the south side
Might buy an AK using all 5's
Pittsburgh, zone 6, zone trey
Zone 1, do this shit like every day
Old nat, copy roll, camera roll
24's got the Wraith pigeon toed
Told a bitch you motherfucking right
Told a bitch you motherfucking right
Told a bitch you motherfucking right
Told a bitch you motherfucking right
Gas station, re-up on the petrol
Hit the trap and re-up on the petrol
Shit, by the time you get it it's a retro
Shit, used to have a job outside of Citgo
Shit, by the time you get it I'll be peww nigga
Yeah I been a player since the womb nigga
OG Kush is my perfume nigga
Ice on my wrist, I got my mind right
Riding down the street with the Klon-dykes
Two black hoes, white one in the middle
I'm getting to the S with two lines in the middle
Got a bankroll that'll make it whip
Told a bitch you motherfucking right
Told a bitch you motherfucking right
Told a bitch you motherfucking right
Told a bitch you motherfucking right"
64,Mainstream Ratchet,2013,B.O.A.T.S. II: Me Time (2013),,2 Chainz,"Last night I bought the supermodel
Got head on the way home
She left her other friends at the club
Got home, and I fucked her with my chains on
And that's ratchet huh?
Her ass so big it look like she trying to walk backwards bruh
(Whoa bring it back)
Take your bitch like I'm the dog catcher
Take your ass to the mall after
Spa day, shawty
Kill that pussy, pallbearer
You from that RuPaul era
I'm from that hell nah era
Real niggas say true
Real niggas ain't you
I ride around with that yapper on me
Gun clad with my Glock up on me
Surround your ass with so many shots
You'll be claustrophobic
Crib so big a dinosaur can run through that shit
I'm a shark, and you a tuna fish
My paper up, got your girl with her ankles up
Gangster boy
She got her T-shirt and her panties on
She trying to smell my cologne
I can fuck her anywhere I want
I even fuck her on the floor
And that's ratchet huh?
Her ass so big it look like she trying to walk backwards bruh
(Whoa bring it back)
I'm on top like a toupe
You on the side like a toothache
Box your ass, suitcase
I'm real, you ain't
Calamari, crab cakes
My closet the size of your damn place
You lookin' at a star
I wish that they could add space
I'm getting money, fast pace
My hoes gave my cash straight
He can't ball, castrate
She the opposite of last place
Do it, bust it open, slow it down, Robitussin
My girl got a big ass
Your girl got back pockets touching
I want a dollar, I want everything
Balls out, I let her hang
Went shopping for a wedding ring
Went on a double date with Molly and Mary Jane
And that's ratchet huh?
Her ass so big it look like she trying to walk backwards bruh
If you patch a weed that's ratchet
My last album was classic
Shawty on my dica
Backwards spells acid
She pop a P like a zany
She'll use no hands and no panties
She rock like nose candy
You fuck with me, ain't no plan B
I'm a D boy with a degree
I sold dope in my momma's home
My girl pussy deep (deep)
So right there is my comfort zone
Born alone, die alone
Mud in my styrofoam
She got on top of me like a stage,
I said use my dick as a microphone"
65,Mindin My Business,2016,Felt Like Cappin (2016),,2 Chainz,"Resident Evil around these parts
Peanut got killed in his front yard
They say ""catch up"", but I'm a star
If, and if, I body guards
My whole squad vs. your whole squad
357, I play the odds
College park, I got the ink
Kill't the game, I wore like a mink
I said ""fuck these niggas, and fuck these hoes""
Fuck these niggas, and fuck these hoes
I said ""I fuck these niggas, and fuck these hoes""
I mind my business, I get pepto
I said ""I fuck these niggas, and fuck these hoes""
Fuck these niggas, and fuck these hoes
I said ""I fuck these niggas, and fuck these hoes""
I mind my business, and get this dough
Woke up this mornin', I look like this
Yellow pinky ring, it look like piss
I smell like gas, with a hint of bun
Don Perignon and Saint Lauren
Ferragamo friends, I kick my dab
Might sell a bag, 'cause I miss my dad
RIP to a real OG
Only thing I smoke is real OG
Only thing I trust in the world is bank
Jus' went to jail with my partner, never drug related
Walk in the buildin', get a hunnid stabs
My 'partment buildin, had a hunnid stabs
Puerto Rican journey, had a hunnid squares
Had weed killa, I am out on bail
Bought a pair of Jordan's just to trap in, nigga
Bought a pair of Yeezy's just to rap in, nigga
Bought me a mansion, I deserve that shit
Bought a Maybach, cause Jay Z did
Bought me a Sprinter, 'cause I seen TI's
Bought me a Cuggi 'cause I seen BI's
Triple zero bags, from the store up the street
Use the same scale, for the coke and the weed
Sour for the home, coconuts in the trees
Before all the Gucci, I was rockin' with G's
It ain't a drive by, if you walkin' away
So much money, you could walk in my safe
I can't see me no'l, like Florida State
By the time you get that, I'll be on the way
I said ""fuck these niggas, and fuck these hoes""
Fuck these niggas, and fuck these hoes
I said ""I fuck these niggas, and fuck these hoes""
I mind my business, I get pepto
I said ""I fuck these niggas, and fuck these hoes""
Fuck these niggas, and fuck these hoes
I said ""I fuck these niggas, and fuck these hoes""
I mind my business, and get this dough"
