,song,year,album,genre,artist,lyric
25,Door Swangin,2017,Pretty Girls Like Trap Music (2017),,2 Chainz,"I wouldn't even...
I wouldn't even be here without that mothafuckin' door
We doing numbers, holmes
5540, we doing numbers, holmes
You can look that shit up, you can research that shit
Another day we gotta get it, 'notha day we gotta get it
I say 'notha day we gotta get it, 'notha day we gotta get it
Can't forget how I fucking had the door swinging
Can't forget how I fucking had the door swinging
No doorbell, we had the cameras included
No hibachi, all we had is some tuna fish
Moved up a level, then I stepped up my grind
Got to the top, ain't nobody around
When I look down, all I see is some sucka shit
And I'ma run shit, I put that on my bucket list
Adidas streetball, all the foreigns with the straps
Before the dreadlocks, I had the cornrows to the back
Used to sit on a broke down Camaro with packs
Told her, ""Turn around,"" even though she had his name tatted
That's the way that it was, had a way with the girls
Had a felony before you knew what a felony was
You was taking the shots, you was feeling the buzz
Got so much in the stash spot, I could fill up a bus
Got gorillas with us, got chinchillas with us
No pretenders with us, got the winners with us, yeah
Another day we gotta get it, 'notha day we gotta get it
I say 'notha day we gotta get it, 'notha day we gotta get it
Can't forget how I fucking had the door swinging
Can't forget how I fucking had the door swinging
Another day we gotta get it, 'notha day we gotta get it
I say 'notha day we gotta get it, 'notha day we gotta get it
Can't forget how I fucking had the door swinging
Can't forget how I fucking had the door swinging
Somebody watching the front door
Yeah I went to college and sold dope
Sold narcotics, a boat load
And all us felons and can't vote
Yeah I'm from the cut, I'm cutthroat
All up in the crowd, Frank Lucas fur coat
Yeah, sipping muddy like a mothafuckin' Merlot
Under the influence, I stayed on the first floor, first floor
Wait, first 48, hard to see my face, diamonds in the way
This is MMA, I just beat the case
In and out the nail salon, she got her nails polished
Turn up in tennis shoes, turn up in red bottoms
Turn up in red bottoms, turn up, turn up in red bottoms
She turn up in red bottoms, yeah what?
A nigga a hustler, now the feds got him
You bring the rubber bands, I bring the money counter
Another day we gotta get it, 'notha day we gotta get it
I say 'notha day we gotta get it, 'notha day we gotta get it
Can't forget how I fucking had the door swinging
Can't forget how I fucking had the door swinging
Another day we gotta get it, 'notha day we gotta get it
I say 'notha day we gotta get it, 'notha day we gotta get it
Can't forget how I fucking had the door swinging
Can't forget how I fucking had the door swinging"
26,Dope Peddler,2012,Based on a T.R.U. Story (2012),,2 Chainz,"Every evening you will find him
Around our neighborhood.
It's the old dope peddler
That we know by doing good
Started off with a OZ
End up riding fo' deep
Pull up to that club like
Mothafucka ho you don't know me
I said I pull up to that club like
Mothafucka ho you don't know me
Started off with a OZ
End up riding fo' deep
Started off with a OZ
End up riding fo' deep
Pull up to that club like
Mothafucka ho you don't know me
I said I pull up to that club like
Mothafucka ho you don't know me
Most of my niggas got gold teeth
Most of my bitches got tattoos
Most of my niggas think cash rules
And I mess up hair dos like it's a pair of shoes
And I need a parachute when I'm up there
I'm in the trap 'cause I work there
Started off with a OZ
End up riding fo' deep
Pull up to that club like
Mothafucka ho you don't know me
I said I pull up to that club like
Mothafucka ho you don't know me
Started off with a OZ
End up riding fo' deep
Started off with a OZ
End up riding fo' deep
Pull up to that club like
Mothafucka ho you don't know me
I said I pull up to that club like
Mothafucka ho you don't know me
When the shades of night are falling,
Comes a fellow everyone knows,
It's the old dope peddler,
Spreading joy wherever he goes
See what these bitches looking like
Stick it in all crooked like
Louie V is my kyrptonite
Take ya bitch and I give her back
Give her this and I give her that
Fine wine and lobster tail
Candlelight and Chrisette Michele
Look at the pussy and play kiss and tell
Fix her hair then fix her nails
Even pay a few bills
Way I'm running shit man I should have a shoe deal
And my whole crew ill
Pockets on fat burger
Going so hard you'd think I mixed the Viagra with the Soda
Staying focused
Black and white ice, polar bear
You hold her hand and I hold her hair
I pull her close and I put it there
Started off with a OZ
End up riding fo' deep
Pull up to that club like
Mothafucka ho you don't know me
I said I pull up to that club like
Mothafucka ho you don't know me
Started off with a OZ
End up riding fo' deep
Started off with a OZ
End up riding fo' deep
Pull up to that club like
Mothafucka ho you don't know me
I said I pull up to that club like
Mothafucka ho you don't know me
When the shades of night are falling,
Comes a fellow everyone knows,
It's the old dope peddler,
Spreading joy wherever he goes"
27,El Chapo Jr,2015,TrapAvelli Tre (2015),,2 Chainz,"I'm the king of the trap, El Chapo Jr
I'm the king of the trap, El Chapo Jr
El Chapo Jr, El Chapo Jr, El Chapo Jr, El Chapo Jr
I'm the king of the trap, El Chapo Jr
Anywhere on the map, I bring it to you
El Chapo Jr, El Chapo Jr, El Chapo Jr, I'ma bring it to ya
I wear Versace like it's Nike, you don't like it do you
I bet you feel this bankroll if I bump into you, oh yeah
Chopper bullets flying errywhere, got them chopper bullets flying errywhere
.223 chopper clip as long as Stacey Augmon., in the restaurant I order 2 fried lobsters
Napkin on my Balmains, smokin' with lil mama
Like fuck your baby daddy, his daddy should've worn a condom
All these grams on me, all these bands on me
Make her want to dance on me and put her hands on me
Sprinter van on me, I got them Zans on me
Driveway so damn long by the time I leave I'm damn asleep
I'm the king of the trap, El Chapo Jr
I'm the king of the trap, El Chapo Jr
El Chapo Jr, El Chapo Jr, El Chapo Jr, El Chapo Jr
I'm the king of the trap, El Chapo Jr
Anywhere on the map, I bring it to you
El Chapo Jr, El Chapo Jr, El Chapo Jr, I'ma bring it to ya
I done put so many on I can't fall off, trying to see how much the West End Mall costs
I might buy a Maybach and paint it all gold, buy a crib fill the rooms up with all stoves
I feel like I just paid off the plug, drop the top off the whip, hell I receive
High life nights so I woke up this evening, can't pimp me so don't you tip me
Rims on the car make it six feet, so I can park the car wherever the blimps be
I want a bird for my birthday, I drink syrup with no pancakes
Yeah, bitches round my pool, I make them hoe look like my landscape
Yeah, El Chapo J R R, multicolor A.R. rules
Looking like I play ball, tell 'em keep they day jobs
I'm the king of the trap, El Chapo Jr
I'm the king of the trap, El Chapo Jr
El Chapo Jr, El Chapo Jr, El Chapo Jr, El Chapo Jr
I'm the king of the trap, El Chapo Jr
Anywhere on the map, I bring it to you
El Chapo Jr, El Chapo Jr, El Chapo Jr, I'ma bring it to ya"
28,Employee of the Month,2013,B.O.A.T.S. II: Me Time (2013),,2 Chainz,"Yeah, yeah
2 Chainz
If I ain't at the party
Then it ain't started
This is trend setting
You niggas is trend following
I don't care if she's modelling
As long as she's swallowing
Bitches all around my crib
I got hoes all on my ottoman
Yeah I love these girls
Bitches on my dick
Been around the world
Ain't seen shit like this
Ain't seen shit
Ain't seen shit
Ain't seen shit like this
Ain't seen shit
Ain't seen shit
Ain't seen shit like this
From the back, to the front
She the employee of the month
She shook her back then front
She the employee of the month
Back, front
I'm back, to frontin'
I did what I said I would anyway
I do this shit, like anyday
Nigga want to play around like a playground
Nigga laydown, look at that trigger plate
Southside, lean with the my MI-WI
Started from the inside, drag his ass outside
Chain so big you can see that shit from the blind side
At their neck like a bow tie, I'mma be a multi
Opposite of broke
You can't go where I go
Mop their ass, they got a motherfucking dry floor
And I walk on a tight rope
I got balance and them Balenciagas
And I woke up, whole enchilada
I got a bitch beside, I got a bitch beside
Yeah I love these girls
Bitches on my dick
Been around the world
Ain't seen shit like this
Ain't seen shit
Ain't seen shit
Ain't seen shit like this
Ain't seen shit
Ain't seen shit
Ain't seen shit like this
From the back, to the front
She the employee of the month
She shook her back then front
She the employee of the month
Back, front
I'm back, to frontin'
Cause everybody needs love
We never seem to get enough
I'll show you what it's made of
Just need you to lift me up
(Lift me up, lift me up)
Yeah I love these girls
Bitches on my dick
Been around the world
Ain't seen shit like this
Ain't seen shit
Ain't seen shit
Ain't seen shit like this
Ain't seen shit
Ain't seen shit
Ain't seen shit like this
From the back, to the front
She the employee of the month
She shook her back then front
She the employee of the month
Back, front
I'm back, to frontin'"
29,Everything I Know,2015,TrapAvelli Tre (2015),,2 Chainz,"Everything I know
Everything I know
The streets have taught me everything I know
The streets have taught me everything I know
The streets have taught me everything I know
The streets have taught me everything I know
The streets have taught me everything I know
The streets have taught me everything I know
The streets have taught me everything I know
The streets have taught me everything (I know)
With my back against the wall ain't no pressure
When the defense really on, ain't no test
Pull up real slow in a taxi
Gunshots turn 'em into athletes
I was hungry for a mil I gotta have it
Drove a couple couple cars up the mansion (Nah foreal at one time)
Smoked a whole seven sitting in the traffic
And niggas couldn't beat me if they practiced
Used to use my safe for a mattress
Used to use my mattress for a safe
See I could count a hundred thousand backwards (99, 98, 97.)
And I'm just tryna get it every day
They feigning for the trappers and the rappers
They feigning for the trappers and the rappers
They feigning for the trappers and the rappers
And now your mall on that, shawty what's happenin'
The streets have taught me everything I know
The streets have taught me everything I know
The streets have taught me everything I know
The streets have taught me everything I know
The streets have taught me everything I know
The streets have taught me everything I know
The streets have taught me everything I know
The streets have taught me everything
Everything I know
Used to hustle at the store
Used to get it with my bros
Used to bet on tenfold
Now I'm all around the coast
I be all up on the pole
I be smokin' on that gas
It might make them bitches choke
Old school with the rallies
Used to meet them up at rallies
So it's fuck your P
The streets have taught me how to get it (get it)
The streets have taught me everything I know
The streets have taught me everything I know
The streets have taught me everything I know
The streets have taught me everything I know
The streets have taught me everything I know
The streets have taught me everything I know
The streets have taught me everything I know
The streets have taught me everything (I know)
Everything I know"
30,Extra,2013,B.O.A.T.S. II: Me Time (2013),,2 Chainz,"I got extra
I got extra
I got money
I got work, far as hoes
I got a plethora
I get money
12 gauge shotty
I don't like nothing but hoes and tattoos on my body
I got extra, you want some
Fucked your girl on accident, that's a hit and run
Heaven's sake, it's been a hell of a day
I pray for all my niggas with a federal case
Okay, Southside I gotta own this, snakeskin on my hat, albino
I'm rich, like Lionel, I get head like Rhino
I'm riding on my rivals, survival, bible
Rifle, bullets, for y'all niggas?
I got extra
I got extra
I got money
I got work, far as hoes
I got a plethora
I just put on the run, 100 piece for a show
I just had a threesome for three weeks in a row (yeah)
Last name Chainz, first name Two
I'm TRU 2, you know I do it, I get head 'fore I screw it, first thing I do
Yeah you know I'm stuntin, 'cause I'm gettin' to the money
Put it in her tummy, put it in her tummy
Hit her with the morning dick, ooh, I ain't pissed yet
Yeah I rep the A, the only thing I fail is a piss test
Okay, Southside I gotta own this, snakeskin on my hat, albino
I'm rich, like Lionel, I get head like Rhino
I'm riding on my rivals, survival, bible
Rifle, bullets, for y'all niggas?
I got extra
I got extra
I got money
I got work, far as hoes
I got a plethora
I'm Rich, like Homie
I got yo bitch, from my homie, (2 Chainz what it do?)
That living room, full of that paper
Used to have a little room that's a house and an acre
Call her in the kitchen room, and she fucking with the bacon
Chopper lift ya to the moon, fuck y'all thinking?
If I get her in the room she gon' suck my babies
Tryna work her moves, she tryna move the baby
If you owe me money real soon, then you better pay me
Me and 2 Chainz, get it like shoe strings, strapped like laces
And I'm too clean, riding in a car A
RichHomie, no new team, boy I'm a star like Macy's
Boy I thank god I made it, got a couple broads in the Decatur
I'm in the fast lane driving in the car going crazy
And I got your main dame, yeah the one you call you lady
First million dollars, the most important thing: saving
And if you wanna book me here my agent
I got eight pounds in an old car on old Nat from the skate town on the
Okay, Southside I gotta own this, snakeskin on my hat, albino
I'm rich, like Lionel, I get head like Rhino
I'm riding on my rivals, survival, bible
Rifle, bullets, for y'all niggas?
I got extra
I got extra
I got money
I got work, far as hoes
I got a plethora"
31,Extremely Blessed,2012,Based on a T.R.U. Story (2012),,2 Chainz,"Baby let's roll away
Get lost in the day
I love that you love what you do
And just like any other girl, baby I'll love you the same
I know you gotta go, the DJ is calling you to the stage
Go ahead baby, do your thing
Honey complexion
Body of a goddess
22s on the Lexus, named Alexis
By the way of Texas
Big face Rolexes
While she's undressing, man I'm stressing
She's extremely blessed, extremely blessed
Extremely blessed, extremely blessed
Extremely blessed, extremely blessed
She's extremely blessed, extremely blessed
Give us this day our daily bread
If you a chicken head, go somewhere and lay some eggs
I make you, make your bed, take that head
I got a move that'll break your leg, know what I'm talking about
Known to kill pussy, nigga chalk it out
Our first date was the Waffle House
Different day, different escapades
If they don't like it they opinion like Escalade's
Everybody got one
Honey complexion
Body of a goddess
22s on the Lexus, named Alexis
By the way of Texas
Big face Rolexes
While she's undressing, man I'm stressing
She's extremely blessed, extremely blessed
Extremely blessed, extremely blessed
Yeah
She slow grinded the whole time
I told her have a seat, you sitting on a gold mine
Big ass, long hair, thick thighs
Eat lobster tail like French fries
I'm the type to buy you a car for the fifth time
This skinny nigga doing big time
Oh wait, dinner dates I demonstrate how to penetrate
If you ain't wit' it, then it's elimi-date
Honey complexion
Body of a goddess
22s on the Lexus, named Alexis
By the way of Texas
Big face Rolexes
While she's undressing, man I'm stressing
She's extremely blessed, extremely blessed
Extremely blessed, extremely blessed
Extremely blessed, extremely blessed
She's extremely blessed, extremely blessed
Baby let's roll away
Get lost in this day
Say it's okay
Come to me
Extremely blessed, extremely blessed
Extremely blessed, extremely blessed"
32,FREEBASE,2014,FreeBase (2014),,2 Chainz,"What is it?
Freebase
What's free about it?
I thought about it, I said, listen
Should I talk about freebase and what if, or somethin'
People say well no, everybody goes and then people will start goin'...
No. Let me... I gotta talk about what happened to me
See where we're from, it's all or nothing
But we take penitentiary chances like it's nothing
We came from nothing, Freebase from top of the oven
Get money my type of discussion
Yaw can do this shit for free a nigga like me gone be hustlin'
Freebase, freebase, freebase, freebase
Freebase, freebase, freebase, freebase
I came from nothing, me and my niggas we came from nothing
Sold that 'caine like it's nothing, told you from the introduction
I came from the pain and suffering
Two pit bulls and a TEC-9
TEC-9 use to Jam up on me all the time
Swear to God if you come up in my momma yard
I'm a shoot that mutherfucker till it get tired
Big dually truck got six tires, big ties wanna rhyme mixtapes
And I keep shitting on the competition, I'm a bout to put up me out a shit tape
Just went playin' by no rules; every night I freestyle on Pro Tools
Tell Flex come to the A we'll carjack him by one of them raggedy ass old school
I don't respect my elders, these right here Maison Margiela
I cannot get no earrings, it'll make my Rolex jealous
I been a fellon since 15, my expedition had a big screen
Half you niggas was constipated, half you niggas was Shit deep
Zone one all the way to zone 6, fuck y'all I'll buy own shit
Fuck y'all I'll buy my own whip, fuck y'all I'll buy my own brick
Tell them pussy niggas ain't pay shit, better be ready to let the gat loose
I've done a song by everybody from Jermaine Dupri down to Papoose
I came from nothing (Skrr, skrr)
I came from nothing (Skrr, skrr, skrr)
I came from nothing, I came from nothing (Skrr, skrr)
I came from nothing, I came from nothing
Work hard play hard work hard again
My bankroll had twins can you comprehend
Seafood lover I don't eat pork
Used to hit them J's like a 3-point
My partner mascot is a pitchfork
And you already know what this for, me too
Rent due, doggin' these hoes like a Shih Tzu
So cold I record it in a igloo
Nigga ask me why I don't drink
Man let me tell you what the wine do
My partner came in said that my girl
I had to tell that motherfucker mine too
Court dates in the summertime
Might pull up in a vert
No matter what the charges is
I'm a pull up with a smirk
This right here for Old Nt
This right here for Godby Rd
This right here for Riverdale
Trappin' at the Stop-N-Go
Trappin' at the Texaco
It was Amaco before it was BP
My plug from Mexico he fell out when he see me on TV
Sold drugs to my love ones and it's hard for me to admit it
The first time I've seen a crack pipe was in my parents kitchen
I came from nothing (Skrr, skrr)
I came from nothing (Skrr, skrr, skrr)
I came from nothing, I came from nothing (Skrr, skrr)
I came from nothing, I came from nothing"
33,Feds Watching,2013,B.O.A.T.S. II: Me Time (2013),,2 Chainz,"Tomorrow, tomorrow
Tomorrow, tomorrow
Ain't no such thing as tomorrow
The way we living today
Dreads hang on the side
Now everything Mr. Comme des Garons, Mr. Alexander Wang
Mr. Chain, pinky ring, flow insane, ho insane
Man, these shoes I got on these are hardest I've done seen
It look clean where you pour I remix it make it dirty
If she got good head and text me I text back and tell her ""hurry""
It's that category 5 when I walk up in the strip club
Throw it high, make you and George Washington head butt
OG's never fed us, now young niggas fed up
Ballin' so hard I deserve a and one
Baking Soda marketing, I'm getting it ain't I? Obviously.
You a bitch, you a ho, that's just my philosophy
And I'm known to kick it like the captain of a soccer team
Billie Jean red leather same color red lobster
And she brain wash ya 
I be fresh as hell if the Feds watching
I'mma be fresh as hell if the Feds watching
I'mma be fresh as hell if the Feds watching
I'mma be fresh as hell if the Feds watching
Drop top, head bobbing
I'mma be fresh as hell if the Feds watching
I'mma be fresh as hell if the Feds watching
I'mma be fresh as hell if the Feds watching
Drop top, head bobbing
Grams to Grammy's, two guns Yosemite
Niggas put their Glock on your ass, fuck that Heather B
Pumping that amphetamine, all this D I'm peddling
I be somewhere settling, somewhere that you have never been
To the top you never been, you might need a respirator
Money on the rise like I'm counting on a elevator
You gon' need a detonator swimming with them barracudas
Put the rocket on that ma'fucka prosecutor
This Armani, this Givenchy, I parachute you
I'm so fly I jumped out the Air Wang Gucci (Tell 'em!)
I'm raw, talking California Rolls
Smoking California weed with California hoes (Truu!)
Sending flicks to my partners in the state pen
I just got some pants made out off snake skin
See them shades you got on call Ray-Bans
And the shade I got on cost eight bands
I'mma be fresh as hell if the Feds watching
I'mma be fresh as hell if the Feds watching
I'mma be fresh as hell if the Feds watching
Drop top, head bobbing"
34,Felt Like Cappin,2016,Felt Like Cappin (2016),,2 Chainz,"Felt like cappin'
I felt like cappin'
I felt like cappin'
I felt like cappin'
In heaven, it (?)
Presidential Rolex, I declare
I don't care what they doing over there
Rubber dreads and a ponytail
I thumb through the cash right in front of folks
AK on the yacht, that's my banana boat
South Florida for the winter, I got sunburn
Half you niggas was some suckers in the lunchroom
I don't care about the tats on your face
Them bitches cost 15 dollars
I don't care about the pills that you take
Them bitches cost 15 dollars
I'm a rich nigga, I take rich drugs
Smoking gas and drinking lean in the strip club
Got too many kids to play with you niggas
I'm lost for words, nothing to say to you niggas
I got a Maybach, a Chev (?) pedal, Wraith, an Audi Infinity
Got a tour bus that's long as a fucking centipede
Got a Panamera, (?) and a sling
Cappin', I'm cappin', I'm cappin', I'm cappin'
I put it in your face like a motherfucking napkin
Got me a Sprinter just to play the fucking game in
At night time I turn that bitch to the fucking Days Inn
(?) Cross the zone and they looking like ""ay man""
They looking at me like I'm paid man
It's nothing much that I can say man
'Cause my actions speak louder than my fragrance
Felt like cappin'
I felt like cappin'
I felt like cappin'
I felt like cappin'
I felt like cappin'
I felt like cappin'
I felt like cappin'
Felt like cappin'"
35,Flexin On My Baby Mama,2014,FreeBase (2014),,2 Chainz,"I said I take care of my kids but I'm flexin' on my baby mama
I'm like, ""Damn, I shoulda wore a condom!""
Boom, boom, boom
My shoes sold out in one day
Pull out the blueprint, bumpin' dat Gunplay
In a Maybach, pockets stay fat
So fly, I could parallel park on a fucking runway
Going down a one way the wrong way, shoot barrel long range
Swag like pro ball, gave her a ring, phone call
Money talk, pole vault, walked in, drove off
So comfortable at the dealership, I don't take my robe off
I wake up and I get to it, breakfast time I might sea food it
Lunch time I might lamb chop it
And you do is talk shit like you was eatin' booty
Southside in my bloodstream, smokin' on that propane
I could tell ya ass one thing, I like gettin' head wearing both chains
All white with no stains, I been trappin' fore the Grammy nods
I been countin' money so long I'mma need a damn hand massage
So many cars, I can barely park
So many cars, I need another damn garage
I'm famous with my fam around, damn I wish I had my dad around
Gave a nigga a Lamborghini, so that's a motherfuckin' lamb-me-down
Watch how I'mma kill 'em for the summer
(Watch how I kill 'em)
Watch how I'mma kill 'em for the summer
(Watch how I kill 'em)
I'm just flexin' on my baby mama
(I'm just flexin')
I'm just flexin' on my baby mama
(I'm just flexin')
Watch how I'mma kill 'em for the summer
(Watch how I kill 'em)
Watch how I'mma kill 'em for the summer
(Watch how I kill 'em)
I'm just flexin' on my baby mama
(I'm just flexin')
I'm just flexin' on my baby mama
(I'm just flexin')
Aye, European style my dresscode, gunshots in the club echo
Walk around with a .36 with six shots in my .38 Special
Black car, black Timbs, Bank of America back then
She tryna tell me her life story and all I want is a lap dance
Good times, smokin' J's, rockin' J's, I'm the rap Ernie Barnes
If I paint a canvas it'd be melee, firearms
Viacom, maricn, if she bad I invite her home
Buying chains like I'm buyin' homes
Rims taller than Kevin Hart, Ride Along
Them rhinestones, you ain't shinin', nigga
I ain't hidin' so you ain't gotta find me, nigga
All my clothes are designer, nigga
And my back seat recliner nigga
Came in rockin' all gold and I'm fuckin' all y'all hoes
Smokin' on that Lee Haney, sippin' on that hard boiled
This that get back - click clack, get back
Smokin' on Raw paper, this ain't zig zags
Snakeskin wallpaper, rose gold chandelier
I'm lookin' for a baby eater, can I get a volunteer?
Watch how I'mma kill 'em for the summer
(Watch how I kill 'em)
Watch how I'mma kill 'em for the summer
(Watch how I kill 'em)
I'm just flexin' on my baby mama
(I'm just flexin')
I'm just flexin' on my baby mama
(I'm just flexin')
I said I take care of my kids but I'm flexin' on my baby mama
I'm like ""Damn, I shoulda wore a condom!""
Boom, boom, boom"
